subreddit,year,month,text,created_utc
gaming,2025,7,What game has the weirdest story of how it was made?,2025-07-05 17:13:30
gaming,2025,7,That moment when you find a rare game,2025-07-05 15:18:40
gaming,2025,7,Elden Ring painting - Eternal City,2025-07-05 15:09:15
gaming,2025,7,"Guys, don’t sleep on Full Metal Furies",2025-07-05 14:38:53
gaming,2025,7,[Wild Assault] Finally a game where you can play as a skunk,2025-07-05 14:38:27
gaming,2025,7,how hard is it for a game dev to keep it a secret towards their family/friends?,2025-07-05 14:16:10
gaming,2025,7,Dune Awakening is great,2025-07-05 13:46:54
gaming,2025,7,[OC] Consequences of questioning high command (from helldivers 2),2025-07-05 13:46:38
gaming,2025,7,"Replaying Far Cry 5, downloaded optional 30GB HD textures. I can now see the text on signs and papers instead of being a blurry mess. The problem? They didn't bother writing any actual words.",2025-07-05 12:25:58
gaming,2025,7,No idea when I’ll play all this 😭,2025-07-05 11:57:34
gaming,2025,7,Bottom Up ranking ruins any competitive mode.,2025-07-05 11:55:44
gaming,2025,7,"Just days after joining Game Pass, the Xbox PC edition of Call of Duty: WW2 is taken offline for ""an issue""",2025-07-05 11:18:54
gaming,2025,7,The don't you care about peoples jobs argument.,2025-07-05 10:24:29
gaming,2025,7,Self Promotion Saturday! Small streamer? Just getting started? Tell us about it here!,2025-07-05 06:00:02
gaming,2025,7,"The Communist Manifesto – A Visual Novel review: No better than reading the book, but at least it lets you platinum Karl Marx",2025-07-05 05:52:59
gaming,2025,7,Anything else like Blue Prince and Lorelei and the Laser Eyes?,2025-07-05 04:56:37
gaming,2025,7,These Tomb Raider games are pretty good,2025-07-05 04:00:13
gaming,2025,7,Why is arachnophobia mode such a common setting in games all of a sudden?,2025-07-05 03:22:51
gaming,2025,7,What game has the best Free Fall/Skydiving feature? Ones that makes you wanna do it again and again.,2025-07-05 03:09:50
gaming,2025,7,Would you play a game that has a one in billions chance to complete.,2025-07-05 02:38:42
gaming,2025,7,I heard BF2 was making a comeback?,2025-07-05 01:00:14
gaming,2025,7,I think the combination of rougelike and souls like games is impacting sales in a COVIDworld.,2025-07-05 00:54:47
gaming,2025,7,What single player game makes it feel like you have friends?,2025-07-05 00:28:52
gaming,2025,7,"Playing N64 games directly on my projector on 83"" was a nice little adventure today",2025-07-05 00:14:54
gaming,2025,7,"Joanna Dark actor asks fans to call for Perfect Dark to be saved, as Adam Jensen's actor details financial loss due to cancellation",2025-07-05 00:10:47
gaming,2025,7,Cyberpunk: Edgerunners II Poster,2025-07-04 22:35:38
gaming,2025,7,Mio and Mayu from Fatal Frame II: Crimson Butterfly—the greatest horror game I have ever played.,2025-07-04 22:26:41
gaming,2025,7,Cyberpunk Edgerunners Sequel Officially Announced,2025-07-04 22:21:21
gaming,2025,7,Looking for a game that was basically a clone of Scrap Mechanic,2025-07-04 21:09:34
gaming,2025,7,What are some totally legit gameplay options/mechanics that made you furious if someone used them?,2025-07-04 21:08:42
gaming,2025,7,"What's a game from your childhood that you remember playing, but don't remember the name of?",2025-07-04 20:34:04
gaming,2025,7,"A 'little educational game for middle-schoolers' left DayZ's creators obsessed, inspired, and embroiled in a contentious presidential campaign: 'It's 4.5 years later, and I'm still talking about this story'",2025-07-04 20:23:43
gaming,2025,7,Now you're on fire! - NBA Jam 🇺🇸🏀,2025-07-04 19:11:57
gaming,2025,7,"Say what you will about modern gaming, but I do like that backwards compatibility has become a 100% expected feature of consoles now",2025-07-04 17:44:39
gaming,2025,7,COD: Black Ops & Modern Warfare! 🇺🇸🎮,2025-07-04 16:14:52
gaming,2025,7,You should be grateful Xbox is falling apart and here is why,2025-07-04 16:01:46
gaming,2025,7,“Definitely Not”: Helldivers 2 Devs Confirm It Won’t Ever Come To Xbox Game Pass,2025-07-04 15:49:01
gaming,2025,7,"If survival horror games were made the way they used to be, could they look photo-realistic?",2025-07-04 15:01:28
gaming,2025,7,It’s Now or Never for Banjo Threeie,2025-07-04 14:51:45
gaming,2025,7,Pc game suggestions for a 12yo,2025-07-04 14:45:05
gaming,2025,7,Official Release Date for Wildwood Down,2025-07-04 14:37:26
gaming,2025,7,Is it even going to be possible to avoid AI in gaming going forward?,2025-07-04 14:30:56
gaming,2025,7,no connection - no games,2025-07-04 14:07:43
gaming,2025,7,Exploring Death Stranding 2 unconnected feels like a survival game,2025-07-04 14:02:51
gaming,2025,7,20 foolproof ways to get laid off in the videogame industry,2025-07-04 13:52:45
gaming,2025,7,"Next Game Suggestions: Arkham Series, God of War, or Metal Gear Solid V",2025-07-04 13:47:47
gaming,2025,7,How Much Of Kojima's Games Are Actually Cutscenes? We Did the Maths - IGN,2025-07-04 13:04:05
gaming,2025,7,Spooky enforcer (from helldivers 2),2025-07-04 12:57:25
gaming,2025,7,"After Microsoft laid off 9000 employees, Xbox producer Matt Turnbull suggested affected workers use AI to “reduce the emotional and cognitive load that comes with job loss”",2025-07-04 12:13:51
gaming,2025,7,Forza Motorsport Series Is Reportedly Cancelled After Xbox Laid Off 50% Of Studio,2025-07-04 11:40:26
gaming,2025,7,MindsEye Dev's UK Workforce of Around 300 Receive At-Risk Emails as Former GTA Lead Leslie Benzies Finally Addresses Staff,2025-07-04 11:27:26
gaming,2025,7,"GTA 6 might be able to release in banned regions ""without push back"" as GTA 5 finally gets approved after 12 years",2025-07-04 10:23:01
gaming,2025,7,No sweeter words have ever appeared on my screen.,2025-07-04 10:01:29
gaming,2025,7,What’s the first thing that makes you want to try a game?,2025-07-04 08:18:36
gaming,2025,7,Sacred parchment,2025-07-04 08:10:32
gaming,2025,7,Go to place to track games?,2025-07-04 07:58:51
gaming,2025,7,Free Talk Friday!,2025-07-04 06:00:35
gaming,2025,7,Time Crisis II 🕹️🎮,2025-07-04 05:16:48
gaming,2025,7,Is The Callisto Protocol worth my time?,2025-07-04 00:56:12
gaming,2025,7,looking for a braindead rig on switch,2025-07-03 23:25:59
gaming,2025,7,Perfect Dark: Zero,2025-07-03 23:20:00
gaming,2025,7,First person feels like death?,2025-07-03 22:31:30
gaming,2025,7,Epic Games/Fortnite Settlement Checki,2025-07-03 22:24:36
gaming,2025,7,I got my wad of rupees. I’m ready to plow.,2025-07-03 22:00:03
gaming,2025,7,Microsoft And Xbox Invites Developers To Roundtable On AI Tools For Game Development At Gamescom 2025 A Day After Laying Off Thousands,2025-07-03 20:34:27
gaming,2025,7,I found my Stronghold maps from 17-20 years ago on Stronghold Heaven and made giant screenshots of them,2025-07-03 19:26:13
gaming,2025,7,These are the top rated Roguelike Deckbuilders on Steam right now,2025-07-03 19:14:21
gaming,2025,7,"RIP to Michael Madsen, who voiced Toni Cipriani in Grand Theft Auto III",2025-07-03 19:06:15
gaming,2025,7,"Microsoft has never been good at running game studios, which is a problem when it owns them all",2025-07-03 18:51:33
gaming,2025,7,HALO Library so far 🇺🇸🎮,2025-07-03 18:21:51
gaming,2025,7,"Done by the same same developers as Xenoblade, Baten Kaitos feels like a game that went under the radar because of it being a GameCube exclusive and even the remastered version didn't get the attention it deserves. It really is a unique game in terms of both story-telling and gameplay.",2025-07-03 18:19:24
gaming,2025,7,Should I get Game pass?,2025-07-03 18:03:12
gaming,2025,7,Anthem's servers are shutting down in January 2026,2025-07-03 17:39:25
gaming,2025,7,What to get buy 2 get 1,2025-07-03 17:25:10
gaming,2025,7,Post from unknown worlds regarding subnautica 2 leadership change,2025-07-03 17:00:09
gaming,2025,7,Lilith 3D Print,2025-07-03 16:27:16
gaming,2025,7,Switch 2 being Gen X,2025-07-03 16:18:40
gaming,2025,7,Street Fighter II Turbo - ストリートファイターIIターボ,2025-07-03 15:49:51
gaming,2025,7,"August 26, 2025 - Armistice of the Console War.",2025-07-03 15:28:46
gaming,2025,7,EA expects the next Battlefield to reach 100m players,2025-07-03 15:22:22
gaming,2025,7,Xbox & PlayStation Helldivers Meeting,2025-07-03 14:48:22
gaming,2025,7,"Three Former Ubisoft Executives Found Guilty Of Sexual And Psychological Harassment Between 2012 and 2020; Described By Former Staff Members As A ""Boys' Club Above The Law"" | Ubisoft had been made aware of unsavoury behaviour within the studio, but failed to address these concerns.",2025-07-03 14:17:33
gaming,2025,7,The Video Game Industry as We Knew It Is Over. Something Unsavory Is Taking Its Place.,2025-07-03 14:03:38
gaming,2025,7,Capcom's financials show that embracing Steam has paid off handsomely: It now accounts for a third of all the publisher's revenue,2025-07-03 13:56:34
gaming,2025,7,Helldivers 2 is coming to Xbox as PlayStation's first release on its rival console,2025-07-03 13:05:32
gaming,2025,7,Now we now why the xbox layoffs happened,2025-07-03 13:04:02
gaming,2025,7,Loft Surprise,2025-07-03 12:54:59
gaming,2025,7,Explain the most useless fact you know of a game or series of games you love that almost no one knows about.,2025-07-03 12:37:07
gaming,2025,7,"Xbox Has Dropped DOOM Co-Creators Next FPS As The Publisher, Let Go Of The Entire Team And Removed Funding As Part Of Yesterdays Lay Offs",2025-07-03 12:24:21
gaming,2025,7,Pac-Man World 2 (#2),2025-07-03 08:26:31
gaming,2025,7,The most powerful tech known to mankind is mine now! (Goodwill score),2025-07-03 08:09:12
gaming,2025,7,'Nearly complete' prototype of cancelled Animaniacs GBA game surfaces online after nearly two decades,2025-07-03 05:18:03
gaming,2025,7,Blizzard is giving up on its Warcraft mobile game amid layoffs,2025-07-03 03:57:12
gaming,2025,7,"Video games spending by young Americans is dropping sharply, report suggests",2025-07-03 03:20:08
gaming,2025,7,Question about preserving sub account PS5 saves when upgrading PS5 SSD,2025-07-03 03:19:40
gaming,2025,7,We are missing a good mage / wizard game,2025-07-03 02:05:21
gaming,2025,7,Astral Ascent is slept on. It's a banger,2025-07-03 01:59:02
gaming,2025,7,Best games that showcase High Dynamic Range?,2025-07-03 01:37:36
gaming,2025,7,"At the previous TGA event, Larian Studios gave a speech about how getting 2023 GOTY changed everything for them, but, has any nominated studio that haven't win a GOTY said if only the nomination changed things around for them?",2025-07-03 00:46:01
gaming,2025,7,"Ahh, so satisfying",2025-07-03 00:29:32
gaming,2025,7,Final Fantasy 14's queer community and the importance of chosen family,2025-07-03 00:27:13
gaming,2025,7,Some of the most graphically impressive games on the Game Boy Advance.,2025-07-03 00:25:58
gaming,2025,7,Which tropes or mechanics do you think are overdone in the RTS genre? And what's something you'd like to see in an RTS that you don't see much of?,2025-07-03 00:18:38
gaming,2025,7,What are your 3 Desert Island game developers?,2025-07-03 00:02:10
gaming,2025,7,For the Emperor!,2025-07-02 22:56:41
gaming,2025,7,Was Dead Island 2’s mediocre reviews because of expectations or because of the actual content?,2025-07-02 22:37:41
gaming,2025,7,Does somebody else uses RDFG instead of WASD?,2025-07-02 22:34:17
gaming,2025,7,Diablo but a more approachable world?,2025-07-02 21:54:06
gaming,2025,7,Breakdown Of All July 2nd 2025 Xbox Layoffs,2025-07-02 21:45:04
gaming,2025,7,"I just beat Death Stranding 2, and God damn, you can NOT play these and still try to tell me videos games are not art. (No spoilers)",2025-07-02 21:43:01
gaming,2025,7,Blasphemous is better than hollow knight,2025-07-02 21:38:42
gaming,2025,7,What would be your dream game?,2025-07-02 21:28:26
gaming,2025,7,Best games that feels like a journey ?,2025-07-02 21:17:53
gaming,2025,7,"The Counter-Strike 1.6 remake, CS: Legacy, runs into legal troubles with Valve",2025-07-02 20:52:50
gaming,2025,7,Hasbro's Board Game Mobile Game Board Game,2025-07-02 20:46:49
gaming,2025,7,"Microsoft Reportedly Killing Perfect Dark Reboot and Closing studio The Initiative - joining Rare's Everwild, ZeniMax's new MMO, and other unannounced projects",2025-07-02 20:17:39
gaming,2025,7,"The Verge: ""How Nintendo locked down the Switch 2’s USB-C port and broke third-party docking""",2025-07-02 20:13:26
gaming,2025,7,"Why do we not see ""level select"" in game menus anymore?",2025-07-02 19:27:30
gaming,2025,7,Games to play while listening to audiobooks,2025-07-02 19:21:51
gaming,2025,7,Sage advice from Ape Escape 2,2025-07-02 19:18:40
gaming,2025,7,Top Ten Worst Games Ever Made,2025-07-02 19:16:00
gaming,2025,7,Everyone talks about Titanfall 2's time travel mission (Effect and Cause; one of my favorite SP level) but Mission 7 in Dishonored 2 pulled off an equally fun and exciting time travel level that I love. Both games were released in 2016!,2025-07-02 18:38:56
gaming,2025,7,"Banjo-Kazooie and Sea of Thieves director Gregg Mayles, Rare’s most experienced and influential game designer, will leave the company after more than 35 years following the cancellation of Everwild",2025-07-02 18:35:12
gaming,2025,7,Microsoft should sell the Rare legacy IPs back to Nintendo,2025-07-02 18:03:54
gaming,2025,7,10 cosy games for the British Summertime - Radio Times,2025-07-02 18:02:10
gaming,2025,7,Is Game Pass Ultimate enough to keep Xbox as a brand going?,2025-07-02 17:58:43
gaming,2025,7,The Last of Us Creator Neil Druckmann is stepping down from the HBO TV Show,2025-07-02 17:56:19
gaming,2025,7,Question for mass efect fans,2025-07-02 17:46:26
gaming,2025,7,Mass layoffs at Xbox. 50% of Turn 10 laid off. Raven CoD dev hit with huge layoffs,2025-07-02 17:27:10
gaming,2025,7,"Windows Central: Microsoft is closing down Xbox studio The Initiative, with Perfect Dark killed as well — joining Everwild and ZeniMax's IP, and 'several' other projects",2025-07-02 17:04:15
gaming,2025,7,"Rare Everwild and Elder Scroll Online new MMORPG Blackbird cancelled, more projects canceling incoming at its hitting West Coast studios…story developing",2025-07-02 16:54:55
gaming,2025,7,Trying to understand SKG: Why shouldn't a creator of an online game have the right to shut down fully their own creation?,2025-07-02 16:54:12
gaming,2025,7,Splitgate 2 Has Lost Over 80% of Its Steam Players Less Than a Month After Launch,2025-07-02 16:53:03
gaming,2025,7,"Multiple Call of Duty Studios, Including Raven Software and Sledgehammer, Also Hit By Xbox Layoffs",2025-07-02 16:48:12
gaming,2025,7,Why did you never play Destiny 2 or why did you stop?,2025-07-02 16:37:49
gaming,2025,7,"[Schreier] As one illustration of just how sloppy and chaotic today's mass Xbox layoff has been, some employees at Zenimax Online Studios are now watching their Slack accounts abruptly get locked out. No message from HR, no word on whether they still have a job, just an ominous Slack deactivation",2025-07-02 16:14:51
gaming,2025,7,why has there been such a massive amount of misinformation around the switch 2?,2025-07-02 16:09:22
gaming,2025,7,Fallout 4,2025-07-02 15:35:55
gaming,2025,7,"For those who have played RE Village, I have a question?",2025-07-02 15:08:50
gaming,2025,7,Death Stranding 1 & 2 are the closest games to a real journey I've played,2025-07-02 15:04:43
gaming,2025,7,Fighting games with interesting single player?,2025-07-02 14:45:36
gaming,2025,7,Bloomberg 10% of King employees cut. US Xbox to follow by later today,2025-07-02 14:29:42
gaming,2025,7,Sources: Everwild has been cancelled as Xbox layoffs hit Rare,2025-07-02 14:04:08
gaming,2025,7,Microsoft to Lay Off Thousands; Xbox Chief Says Gaming Division Cuts Will Remove ‘Layers of Management’,2025-07-02 13:39:42
gaming,2025,7,Yakuza: Like A Dragon - Amazon Prime Show,2025-07-02 13:21:14
gaming,2025,7,"Sony Still Does Physical Gaming Properly, Death Stranding 2 Fully Playable from Disc",2025-07-02 13:16:29
gaming,2025,7,Microsoft Begins Deep Job Cuts Across Xbox Division,2025-07-02 13:07:51
gaming,2025,7,"Marvel Rivals devs confirm they’re ""licensed"" to turn any character from the past “85 years” of Marvel Comics into a playable hero, and they want to get weird",2025-07-02 13:05:33
gaming,2025,7,One of the best creators on Gaming YouTube made an absolute masterpiece on the death of Halo 2,2025-07-02 12:03:03
gaming,2025,7,Best Open world Story driven RPGs,2025-07-02 06:37:11
gaming,2025,7,"Ok, there's *too* many *stars* in disco *of* elysium",2025-07-02 04:56:30
gaming,2025,7,"Obsidian director Josh Sawyer says it's a 'mistake' for RPGs to sacrifice crunchy 'sweaty boy' systems in favour of a 'one size fits all' game, since easier difficulties aren't too hard to make",2025-07-02 03:27:00
gaming,2025,7,Standardize showing ping as a scorebosrd feature on multi-player FPS,2025-07-02 02:41:30
gaming,2025,7,Any pc “exclusive” recommendations now?,2025-07-01 23:58:47
gaming,2025,7,"WOW, what a year for gaming so far!",2025-07-01 23:53:21
gaming,2025,7,Krafton replaces the leadership of Unknown Worlds (Subnautica 2) with Striking Distance head Steve Papoutsis,2025-07-01 23:05:49
gaming,2025,7,In need of a game that'll mess with my head,2025-07-01 22:45:04
gaming,2025,7,Looking for a game that is like Gears of War,2025-07-01 21:40:29
gaming,2025,7,Found my Game Boy Color with the worm light,2025-07-01 18:33:07
gaming,2025,7,Here we go! Wish me luck,2025-07-01 18:04:05
gaming,2025,7,"Rockstar remembers there’s more to life than GTAO, they just dropped a trailer for a new Red Dead Redemption Online update for the first time in years (and after signaling they were done with the game)",2025-07-01 17:49:23
gaming,2025,7,My recent eBay purchases!!,2025-07-01 16:43:16
gaming,2025,7,Best game that is similar to Starcraft 2’s desert strike or Zealot Wars?,2025-07-01 16:12:18
gaming,2025,7,Best modern game for social gaming?,2025-07-01 15:57:03
gaming,2025,7,Banjo Kazooie is a perfect video game,2025-07-01 15:17:10
gaming,2025,7,Indie Horror Game Phasmophobia Has Sold 25 Million Units,2025-07-01 15:01:18
gaming,2025,7,Looking for a game with a League of Legends feeling (but single player),2025-07-01 14:52:51
gaming,2025,7,Decline in Gaming Technology?,2025-07-01 14:11:50
gaming,2025,7,GTA 6 job listing suggests confidence in release date with huge marketing campaign poised for all over the world,2025-07-01 13:39:05
gaming,2025,7,Stop Killing Games Megathread,2025-07-01 13:09:53
gaming,2025,7,Best of the best that respect your time?,2025-07-01 12:47:40
gaming,2025,7,Nintendo Switch 2 Has Sold 5 Million Units In Its First Month Overtaking The PS4 As The Fastest Selling Console Ever,2025-07-01 12:05:02
gaming,2025,7,Would you be against blocking messages to minors being standard practice in most games where you make an account?,2025-07-01 10:54:29
gaming,2025,7,We need a Robotrek sequel.,2025-07-01 05:33:01
gaming,2025,7,"Vent: Less time I have for gaming, more I buy and analyse my collection",2025-07-01 05:14:22
gaming,2025,7,Is it just me or is Mafia 3’s story incredibly well written,2025-07-01 05:13:07
gaming,2025,7,Expedition 33 is the most overhyped game I’ve ever experienced.,2025-07-01 05:02:02
gaming,2025,7,Capcom is insanely bad about GFWL,2025-07-01 03:24:45
gaming,2025,7,Something occurred to me today about gaming: it is one of the few truly shared cultural experiences left,2025-07-01 03:09:30
gaming,2025,7,Which games did you love but wouldn’t want to replay?,2025-07-01 02:56:22
gaming,2025,7,What Are Your Experiences Trying To Get Non-Gamers Into Gaming?,2025-07-01 01:40:43
gaming,2025,7,What single player game have you beaten 3+ times?,2025-07-01 01:27:32
gaming,2025,7,Older gamers beware....,2025-07-01 00:34:36
gaming,2025,6,How much do cosmetics cost to make?,2025-06-30 22:29:58
gaming,2025,6,What game would you watch a playthrough of but never would play yourself?,2025-06-30 22:24:50
gaming,2025,6,"Based on the games you've played, what are some of the best titles you've ever gotten?",2025-06-30 22:23:08
gaming,2025,6,Looking for an RTS game...,2025-06-30 21:16:35
gaming,2025,6,Ad victoriam! Fallout Love.,2025-06-30 21:15:26
gaming,2025,6,Which games have the best passive reactions/consequences to your character walking around naked?,2025-06-30 20:47:37
gaming,2025,6,'Backyard Baseball 01' remaster releases on Steam July 8th ⚾️ It's bringing back 28 MLB players from the OG game,2025-06-30 20:13:08
gaming,2025,6,looking for suggestion of Kingdom Come Deliverance but in space,2025-06-30 20:11:31
gaming,2025,6,"Hey Nintendo, Game Key Cards Suck.",2025-06-30 19:40:37
gaming,2025,6,Ad victoriam! ThreeZero Falliut figure,2025-06-30 19:29:38
gaming,2025,6,Looking for games with a Tony Hawk's Pro Skater feel (not necessarily skateboarding games),2025-06-30 19:13:39
gaming,2025,6,"""I might never finish this game, so I'm releasing the demo""- After 9 years, A Short Hike dev soft-cancels next game but lets players try a build.",2025-06-30 18:22:16
gaming,2025,6,What Game do you think would thrive under another developer?,2025-06-30 18:20:01
gaming,2025,6,"After revealing he was ordered to destroy his copy of Fallout's source code, OG lead Tim Cain says we're losing game history because companies ""take authority but not responsibility"" for preservation: ""They need to step up and take that responsibility more seriously if they're claiming authority""",2025-06-30 18:15:38
gaming,2025,6,Why Do People HATE Motion Inputs?,2025-06-30 17:57:56
gaming,2025,6,Capcom finally put a bullet in Resident Evil: RE:Verse but haven't entirely given up on Resident Evil online,2025-06-30 17:53:29
gaming,2025,6,"Hypothetically, would it be a positive thing if Xbox stops consoles and focuses only on games?",2025-06-30 17:45:12
gaming,2025,6,What are your predictions for the next Nintendo direct?,2025-06-30 17:43:39
gaming,2025,6,"Utility for control volume, taking screenshots, and recording video using an Xbox gamepad.",2025-06-30 17:37:12
gaming,2025,6,I have a strange obsession with PC gaming on unusual devices.,2025-06-30 17:10:24
gaming,2025,6,Best of both worlds setup is coming along,2025-06-30 17:05:34
gaming,2025,6,Silksong fanart by me. [OC],2025-06-30 16:11:14
gaming,2025,6,procrastination or hesitancy with starting new games?,2025-06-30 15:39:30
gaming,2025,6,The worst part with new releases is that I feel compelled to keep the platinums going,2025-06-30 15:25:40
gaming,2025,6,Outriders 2 Revealed to be One of People Can Fly’s Two Canceled Games (EXCLUSIVE),2025-06-30 15:21:02
gaming,2025,6,Need some help i.d-ing a classic Sega arcade game!,2025-06-30 14:55:34
gaming,2025,6,Has anyone played the new Delta force game?,2025-06-30 14:40:21
gaming,2025,6,Game Save Versioning Manager?,2025-06-30 12:52:08
gaming,2025,6,19 Versions of the same game,2025-06-30 12:51:43
gaming,2025,6,"Sorry, But I think Modern multiplayer gamers are lame.",2025-06-30 11:39:23
gaming,2025,6,"'Xbox Hardware Is Dead,' Says Founding Team Member, 'It Looks Like Xbox Has No Desire — Or Literally Can't — Ship Hardware Anymore' - IGN",2025-06-30 11:19:03
gaming,2025,6,The Witcher 3's No Fetch Quest Policy Will Return For The Witcher 4,2025-06-30 11:06:12
gaming,2025,6,Searching for arcade rail horror shooter from around 1993,2025-06-30 07:38:11
gaming,2025,6,Making Friends Monday! Share your game tags here!,2025-06-30 06:00:23
gaming,2025,6,Power Stone. Gateway game to the 2nd Amendment,2025-06-30 05:27:04
gaming,2025,6,"Maybe I played too many other games and watched too many movies growing up but I never really saw RE as a scary game for any of the entries, especially 4",2025-06-30 05:13:24
gaming,2025,6,"We should totally trust GLaDOS, right?",2025-06-30 05:12:38
gaming,2025,6,The beauty I found in Red Dead Redemption 2,2025-06-30 04:26:04
gaming,2025,6,"Just completed Death Stranding 1 you either love it or hate it, but personally is one of the most beautiful, unique and innovative games I've played in my entire life, an unforgettable journey",2025-06-30 03:59:20
gaming,2025,6,"Those of you who played Need for Speed 3 first (Hot Pursuit), how did you find NFS4 (Road Challenge/High Stakes)?",2025-06-30 02:39:35
gaming,2025,6,Switched from Minecraft Bedrock to Java... I wasn't familiar with Java's game.,2025-06-30 01:12:22
gaming,2025,6,What was the last game you just nopped out of?,2025-06-30 01:09:05
gaming,2025,6,Pockets of Gaming Glory,2025-06-30 00:25:40
gaming,2025,6,One of the most original multiplayer modes I can remember.,2025-06-29 23:54:55
gaming,2025,6,Last Epoch Season 3 - Beneath Ancient Skies - Teaser Trailer,2025-06-29 22:31:34
gaming,2025,6,Recharge | Official Early Access Release Date Trailer,2025-06-29 22:13:00
gaming,2025,6,I wish most shooter games have solo/skirmish mode.,2025-06-29 21:31:05
gaming,2025,6,Which WC3/TFT map genre's deserve more copycats?,2025-06-29 21:18:33
gaming,2025,6,Tell me some really good boss music.,2025-06-29 21:08:11
gaming,2025,6,Can anyone suggest a survival game?,2025-06-29 21:03:46
gaming,2025,6,Any RPGs game recommendation for what I'm looking for?,2025-06-29 20:26:45
gaming,2025,6,"Stains Gate saga at 90% discount, cheap for this masterpiece",2025-06-29 20:22:57
gaming,2025,6,Audio setup for multiplayer games in the same room,2025-06-29 20:12:58
gaming,2025,6,I made a wood art portrait of Ori from the video game Ori and the Blind Forest,2025-06-29 19:29:08
gaming,2025,6,"Wow, Pokémon looks fire on the Switch 2 🔥🔥🔥🔥🔥🔥",2025-06-29 18:32:59
gaming,2025,6,So I had a realization when it comes to Shooters-Valorant-Siege-cs-etc,2025-06-29 18:16:05
gaming,2025,6,Borderlands 4 roadmap theories,2025-06-29 16:54:04
gaming,2025,6,Have you ever been to a LAN party because you preferred gaming in-person vs online gaming?,2025-06-29 15:49:21
