subreddit,year,month,text,created_utc
gaming,2025,7,Under a Rock - First Look At Combat Gameplay,2025-07-13 05:18:34
gaming,2025,7,"Any city builder game that's actually difficult, and not just complex?",2025-07-13 04:03:08
gaming,2025,7,Mother Brain in Zero Mission. What an absolute ball buster.,2025-07-13 03:53:29
gaming,2025,7,The Hardest Achievement,2025-07-13 02:19:11
gaming,2025,7,A game where it's a benefit to the main story to play the side modes?,2025-07-13 02:00:07
gaming,2025,7,Are there any games where the shooting is actually realistic? Like taking people down in 1 or 2 shots?,2025-07-13 01:37:50
gaming,2025,7,Happy Saturday! Enjoying some Sly 2 on the PS Vita.,2025-07-13 00:32:33
gaming,2025,7,Does Batman The Telltale series have blood?,2025-07-12 23:49:22
gaming,2025,7,"Warhammer 40,000: Boltgun (NoSoloBits)",2025-07-12 23:10:08
gaming,2025,7,this game introduced me to the geto boys and actually had incredibly fun online multiplayer (especially for its time),2025-07-12 22:51:42
gaming,2025,7,"Don’t let the changes deter you. As a long time Proskater 4 fan, I’m having so much fun.",2025-07-12 22:12:03
gaming,2025,7,Something I've been thinking about recently. Has there ever been a T rated game where blood stains environments during combat?,2025-07-12 22:05:14
gaming,2025,7,Which indie game blew your mind and why?,2025-07-12 20:39:32
gaming,2025,7,The Morrowind overhaul 'Morrowind Rebirth' has been updated to v 7.0,2025-07-12 20:03:33
gaming,2025,7,Is there a game like a potion simulator that is realistically about herbalism?,2025-07-12 19:24:57
gaming,2025,7,"Really wish the Switch 2 would have had more color options, but I like the custom Joy-Con set I got as the next best option 😍",2025-07-12 19:01:57
gaming,2025,7,How much input delay is acceptable for you?,2025-07-12 18:42:43
gaming,2025,7,No brainer mechanics that somehow haven't been implemented.,2025-07-12 18:10:08
gaming,2025,7,Eden's Zero vs Zenless Zone Zero vs Genshin Impact,2025-07-12 18:01:08
gaming,2025,7,Need for Speed Franchise May Have Been Shelved by Electronic Arts,2025-07-12 11:57:02
gaming,2025,7,When you plan to play a game fro sales ?,2025-07-12 09:46:28
gaming,2025,7,Menu Music You Just Don't Skip.,2025-07-12 09:38:30
gaming,2025,7,Mortal Kombat - so real it hurts!,2025-07-12 09:23:49
gaming,2025,7,The Commodore 64 is officially back for the first time since discontinued in 1994. No for real.,2025-07-12 08:40:37
gaming,2025,7,PC gaming on TV,2025-07-12 07:02:36
gaming,2025,7,Self Promotion Saturday! Small streamer? Just getting started? Tell us about it here!,2025-07-12 06:00:31
gaming,2025,7,Question for people who also have decision paralysis when choosing games and struggle to ever complete a game how long has this been going on for you? When was the last time you completed a game? What was it? I just recently completed 2 games after 6 months to a year of not completing anything.,2025-07-12 05:26:25
gaming,2025,7,Did you ever make friends while playing online games? Which game was it?,2025-07-12 05:02:36
gaming,2025,7,Ghost of Yotei State of play,2025-07-12 03:52:22
gaming,2025,7,THPS was a huge part of my childhood. I love that a new generation gets to experience what I did back in the day,2025-07-12 00:24:11
gaming,2025,7,Games to keep me occupied after death of a loved one,2025-07-12 00:23:54
gaming,2025,7,"Natural Selection 2 made by Unknown Worlds, creators of Subnautica, is making a come back!",2025-07-11 23:58:41
gaming,2025,7,Looking for turn based story games that have no overworld for PC,2025-07-11 23:20:32
gaming,2025,7,The co-op climing game PEAK has sold 5 million copies in just under a month on Steam,2025-07-11 22:38:12
gaming,2025,7,Finally decided to try out NES World Championships and missed the S Rank but 0.01 seconds,2025-07-11 22:23:25
gaming,2025,7,The Blood Of Dawnwalker will be showcased at Gamescom,2025-07-11 22:16:41
gaming,2025,7,Brickadia Early Access is out now!,2025-07-11 21:46:36
gaming,2025,7,Best out of context patch notes?,2025-07-11 21:37:29
gaming,2025,7,Every Video Game Canceled in 2025 - IGN,2025-07-11 20:40:20
gaming,2025,7,Are there any games that adopt a reverse power fantasy?,2025-07-11 20:36:26
gaming,2025,7,Best game communities?,2025-07-11 20:22:18
gaming,2025,7,What are some truly special games that you’ll never forget?,2025-07-11 20:20:19
gaming,2025,7,What steam game has the funniest reviews?,2025-07-11 19:07:47
gaming,2025,7,"Inside the Ambitious Japanese Video Game That Almost Bankrupted Its Makers-Jason Schrier interviews Kazutaka Kodaka, maker of Danganronpa and The Hundred Line: Last Defense Academy.",2025-07-11 19:06:02
gaming,2025,7,Gamer boy,2025-07-11 18:43:09
gaming,2025,7,Trenches VR - Coming 2025 | PS VR2 Games,2025-07-11 18:25:15
gaming,2025,7,Best point and click games on Xbox?,2025-07-11 16:59:19
gaming,2025,7,BATTLEFIELD LABS - THE CLASS SYSTEM - PART TWO,2025-07-11 16:44:24
gaming,2025,7,Zombie logic. Video Game versus Movie.,2025-07-11 16:38:33
gaming,2025,7,"Main Theme | Warhammer 40,000: Dark Heresy",2025-07-11 15:50:08
gaming,2025,7,What're your 3 favorite genres/types of games?? I'll go first,2025-07-11 15:34:11
gaming,2025,7,"EA’s latest The Sims 4 patch is making everyone pregnant, including the men and the chaste",2025-07-11 15:28:51
gaming,2025,7,Been playing dragon quest lately,2025-07-11 14:45:47
gaming,2025,7,Kissing boths be like (from helldivers 2),2025-07-11 14:40:01
gaming,2025,7,Who is paying tens of thousands of dollars for knives in counter strike?,2025-07-11 14:18:56
gaming,2025,7,I’m genuinely confused about discourse when it comes to game sequels,2025-07-11 14:05:18
gaming,2025,7,"What gaming fact, hot take, opinion, etc about you surprises people?",2025-07-11 14:03:52
gaming,2025,7,Final Fantasy producer YoshiP acknowledges Expedition 33s success but says there’s “no clear-cut answer” on if future games will return to turn-based as its all about the “kind of game the creators want” to make,2025-07-11 13:16:18
gaming,2025,7,Almost Half Of This Year's Top-Performing Steam Games Have Come From Double-A Or Indie Studios. Players Are Supporting Indies And Smaller Studios In The Process,2025-07-11 11:45:49
gaming,2025,7,I would give anything for a modern remake of this game,2025-07-11 09:49:10
gaming,2025,7,Did you ever get stuck when replaying a game you COMPLETED?,2025-07-11 07:54:23
gaming,2025,7,Funniest names given to games?,2025-07-11 06:49:15
gaming,2025,7,Free Talk Friday!,2025-07-11 06:00:24
gaming,2025,7,Resident Evil Village is a Masterpiece,2025-07-11 05:56:05
gaming,2025,7,What’s the best control system you’ve experienced in a game?,2025-07-11 04:00:13
gaming,2025,7,Dave Mirra Nostalgia!,2025-07-11 02:31:04
gaming,2025,7,"Could a Warzone mode (pvpve) like in Halo 5 exist and succeed as its own game, and would an established IP have to be tied to it for it to happen?",2025-07-11 01:25:57
gaming,2025,7,"Mecha Break's $47 skin packs and gameplay-boosting auction house drag user reviews down to ""mixed"" even as the shooter's concurrent player count hits 132k on Steam",2025-07-10 23:13:49
gaming,2025,7,What games broke most friendships?,2025-07-10 21:33:42
gaming,2025,7,"Every single game I've played that has ""this game is best played with a controller"" on its intro screen has been way better with keyboard and mouse so far.",2025-07-10 21:29:56
gaming,2025,7,Games that are better going in conpletely blind.,2025-07-10 20:58:09
gaming,2025,7,Retail display,2025-07-10 20:54:11
gaming,2025,7,What are some great DLCs in otherwise bad games?,2025-07-10 20:31:03
gaming,2025,7,There are three games free to claim on Steam right now until July 17th,2025-07-10 20:19:19
gaming,2025,7,Field of Glory II: Medieval is free to keep on Steam if claimed,2025-07-10 19:06:17
gaming,2025,7,"Anyone else here been a lifelong call of duty fan who just gave up at some point? If so, which game was it for you?",2025-07-10 19:00:16
gaming,2025,7,KRAFTON responds,2025-07-10 18:57:40
gaming,2025,7,"You have $700 million dollars and 5 years to make your dream game, tell me all about it.",2025-07-10 18:14:38
gaming,2025,7,I support menu narration options…,2025-07-10 18:10:18
gaming,2025,7,Nintendo ending the game voucher program for Switch 1 on January 30 2026,2025-07-10 17:55:10
gaming,2025,7,"Expedition 33 sold another 240 K copies on PS5 in June, bringing its total sold on PlayStation to 1.3 million, on top of its 2.2 million on Steam. It's selling twice as fast as Metaphor ReFantazio on PS5",2025-07-10 16:38:46
gaming,2025,7,Getting old. Might put gaming down.,2025-07-10 16:36:30
gaming,2025,7,"James Carter Cathcart, 'Pokémon' voice actor of Professor Oak, Gary Oak and Team Rocket's James & Meowth, has passed away at 71",2025-07-10 16:13:04
gaming,2025,7,"Almost 35 Years On, A Battletoads Mystery Appears To Have Been Solved",2025-07-10 15:41:05
gaming,2025,7,"My Silent Hill 2 pillow arrived today, possibly the strangest piece of gaming merchandise I own…",2025-07-10 15:32:26
gaming,2025,7,Unknown World Devs could still get Bonus from previous title revenue.,2025-07-10 14:54:23
gaming,2025,7,"4 out of the top 5 latest best selling games are from Microsoft, and 7 out of 10 are on Game Pass. Doesn't this refute the idea that Game Pass is ""bad/harming"" the industry?",2025-07-10 13:59:34
gaming,2025,7,"My brother lent me Silent Hill 1, 2, 3, and 4.",2025-07-10 13:35:08
gaming,2025,7,What’s a game that changed how you see storytelling in video games?,2025-07-10 13:08:35
gaming,2025,7,"Is there a game or series that logically you SHOULD love, but just doesn’t click for you for some reason?",2025-07-10 12:46:25
gaming,2025,7,Time loop games that you can beat in one loop,2025-07-10 12:29:26
gaming,2025,7,What’s a game you think is amazing but totally underrated and not enough people talk about?,2025-07-10 11:56:50
gaming,2025,7,May 2025 Worldwide Console Sales: PS5 732k Nintendo Switch 335k Xbox Series X|S 137.3k,2025-07-10 11:42:14
gaming,2025,7,Games in which you can actually use your vast resources/power to help people; which aren't just pure-city-builders?,2025-07-10 11:41:53
gaming,2025,7,"BioShock creator Ken Levine praises Baldur’s Gate 3 and Clair Obscur, says gamers will “reward” games that avoid “the kind of monetisation” found in most AAA releases",2025-07-10 11:32:15
gaming,2025,7,I made Winterfell in Far Cry 5!,2025-07-10 11:27:12
gaming,2025,7,Started playing the DLC for Still wakes the deep and am impressed by the rope physics on the tether,2025-07-10 10:17:59
gaming,2025,7,Why are you fully animating a band performing in your games but not playing their music,2025-07-10 07:51:20
gaming,2025,7,"In a few decades, it will be complete normal for 70-80 year olds to play games",2025-07-10 07:42:09
gaming,2025,7,Escape From Tarkov blindsides players with immediately controversial 'Hardcore Wipe' that removes quests and disables most maps,2025-07-10 07:24:19
gaming,2025,7,A rivalry that transcends the ESRB,2025-07-10 05:31:42
gaming,2025,7,Looking for name of a game.,2025-07-10 01:40:25
gaming,2025,7,Borderlands movie,2025-07-09 23:03:17
gaming,2025,7,Are there any games which are critically not well received but are a 10/10 game for personal reasons?,2025-07-09 23:02:07
gaming,2025,7,Even video game characters hate games released in a crappy state.,2025-07-09 22:37:19
gaming,2025,7,My Death Stranding motivational poster (By Me),2025-07-09 22:33:55
gaming,2025,7,Audiences reward games without other monetization,2025-07-09 22:04:47
gaming,2025,7,Peak went from a canceled game that couldn’t get funding to selling millions on Steam,2025-07-09 20:28:35
gaming,2025,7,Subnautica 2 reportedly delayed into 2026 just months before Krafton was due to pay a $250 million bonus to developer Unknown Worlds,2025-07-09 20:16:40
gaming,2025,7,Honestly those remakes just shows how some games age so well that the only update required is the graphics. Yes I am also aware that updating the graphics and charging more money is a scummy move but I do admire how some games are literally timeless.,2025-07-09 19:56:30
gaming,2025,7,"What's a game that you initially disliked, but came back to years later and fell in love with?",2025-07-09 19:46:31
gaming,2025,7,"What's a 9.9/10 game to you, almost perfect with one minor gripe?",2025-07-09 19:21:00
gaming,2025,7,GameStop Is Auctioning Off The Stapler--And The Staple--That Damaged A Nintendo Switch 2 On Launch Day for Charity. Proceeds benefit Children’s Miracle Network Hospitals,2025-07-09 19:06:55
gaming,2025,7,This is HQ to any available units...,2025-07-09 18:47:45
gaming,2025,7,This INSANE Minecraft Mod just got better...,2025-07-09 18:31:09
gaming,2025,7,"What game did you used to love as a kid, you question as an adult?",2025-07-09 18:30:28
gaming,2025,7,Dragon Age: The Veilguard Snags Game of the Year Award,2025-07-09 18:22:19
gaming,2025,7,Krafton Delays ‘Subnautica 2’ Game Ahead of $250 Million Payout,2025-07-09 18:21:02
gaming,2025,7,Patapon 1+2 Replay - Official Launch Trailer,2025-07-09 18:07:13
gaming,2025,7,"Ever played a game so Fucked up you went ""damn, are the writers okay?"" If not, what game do you think would fit this scenario best?",2025-07-09 18:02:07
gaming,2025,7,"Digital Foundry: Switch 2 vs Steamdeck, Cyberpunk 2077",2025-07-09 17:36:38
gaming,2025,7,ape escape ps1 intro.,2025-07-09 17:00:44
gaming,2025,7,Look what I got early today (tony hawks pro skater 3+4),2025-07-09 16:52:02
gaming,2025,7,PS Plus July Game Catalog - Cyberpunk 2077,2025-07-09 16:14:43
gaming,2025,7,Twisted Metal Season 2 | Official Trailer | July 31 on Peacock,2025-07-09 15:55:08
gaming,2025,7,Which Pokémon game for a “new” player?,2025-07-09 15:02:41
gaming,2025,7,"[self] Me as Joseph Seed, Far Cry 5",2025-07-09 14:58:35
gaming,2025,7,Why does gaming feel like work now?,2025-07-09 14:28:33
gaming,2025,7,Gaming news,2025-07-09 13:42:05
gaming,2025,7,'Only Some' option clears sign spam & structure bloat in DS2,2025-07-09 13:15:54
gaming,2025,7,And that's why I don't play sniper,2025-07-09 12:58:42
gaming,2025,7,Games you wouldn’t touch even if they were given to you for free?,2025-07-09 12:04:19
gaming,2025,7,Need help with what could be a big decision,2025-07-09 11:27:35
gaming,2025,7,"Stardew Valley just became the highest-rated Steam game of all time 9 years after release, and it deserves it",2025-07-09 11:07:27
gaming,2025,7,FANTASY LIFE i: The Girl Who Steals Time sales top 1.2 million; Switch 2 physical edition launches August 7,2025-07-09 10:43:15
gaming,2025,7,For those that are multi platform. Playtracker is a great way to track all your achievements across platforms.,2025-07-09 10:32:16
gaming,2025,7,What was the first DLC you ever got for a game?,2025-07-09 10:24:38
gaming,2025,7,I tried making Minas Tirith in Far Cry 5!,2025-07-09 10:05:59
gaming,2025,7,Wonderful Little Easter Egg in Doom: The Dark Ages,2025-07-09 06:35:16
gaming,2025,7,What's one video game that pisses you off but you still play it anyway?,2025-07-09 06:17:55
gaming,2025,7,Whats the Best Character Select Screen You've Seen?,2025-07-09 04:22:56
gaming,2025,7,What’s been the best individual mission/area/dungeon in gaming in the last ten years in your opinion?,2025-07-09 03:22:28
gaming,2025,7,"Why do games become less magical when you become older (this is not a ""gaming is dead"" post)",2025-07-09 03:05:36
gaming,2025,7,Gaming as Work Project,2025-07-09 01:18:30
gaming,2025,7,Léa Seydoux in Death Stranding 2: On the Beach,2025-07-09 01:13:11
gaming,2025,7,Jurassic World Evolution 3 | Lokiceratops | Dinosaur Showcase,2025-07-09 00:14:43
gaming,2025,7,Here is my little GameCube/Wii game collection.,2025-07-08 23:05:16
gaming,2025,7,Xbox layoffs,2025-07-08 21:12:56
gaming,2025,7,"""That's Some Real Coward S***"" - Hideki Kamiya Discusses The Fallout From The Bayonetta 3 Voiceover Controversy",2025-07-08 20:54:18
gaming,2025,7,List of Games Whose EULA Ask to Destroy All Your Copies of Them,2025-07-08 20:37:01
gaming,2025,7,Role play (DnD) games,2025-07-08 19:21:05
gaming,2025,7,"We need more games with official VR support like No Man's Sky. I'd love to see GTA, Dune, Ark, RDR2 with mod support",2025-07-08 16:37:45
gaming,2025,7,Game Pass is Reportedly Profitable Even if Taking Costs for First-Party Games Into Account,2025-07-08 14:46:10
gaming,2025,7,"Valve ""cracked the problem that Netflix was struggling with"" using diehard gamers and their backlogs, Steam expert says: ""You get access to a bunch of drunken sailors who spend money irresponsibly. The amazing thing about Steam and its player base is that they buy games they aren’t going to play""",2025-07-08 14:18:43
gaming,2025,7,"Subnautica 2 is ""ready"" for early access says co-founder ousted from studio, but the publishers seem to disagree",2025-07-08 14:17:35
gaming,2025,7,"Ghost of Yōtei State of Play gameplay deep dive announced for July 10 - 2 PM PT - features nearly 20 minutes of Ghost of Yōtei gameplay hosted by Sucker Punch’s Creative Directors, Jason Connell and Nate Fox",2025-07-08 14:08:58
gaming,2025,7,Subnautica on Mobile is out now!,2025-07-08 14:02:01
gaming,2025,7,"Bethesda is allegedly working on ‘multiple Fallout games’, including Fallout 3 Remastered, teases report",2025-07-08 13:33:37
gaming,2025,7,My first handheld next to my most recent. 26 years between the two,2025-07-08 13:29:43
gaming,2025,7,Xbox's absent landord execs are only part of a much bigger problem,2025-07-08 13:09:42
gaming,2025,7,Why do games cost so much to make?,2025-07-08 13:08:14
gaming,2025,7,Can sports games ever evolve from what they are today?,2025-07-08 11:59:23
gaming,2025,7,"Goat Simulator devs reflect on how they “accidentally ragdolled into gaming history” with the rise of meme games, and they’re not done “milking goat sim” for all its worth",2025-07-08 11:34:36
gaming,2025,7,I tried making the Cloud Giant's Castle from The Witcher 3 in Far Cry 5!,2025-07-08 11:07:48
gaming,2025,7,Does there exist a game with this specific gameplay loop?,2025-07-08 10:25:31
gaming,2025,7,I spent the past few weeks binging Oblivion and now I want to make a scrolls-like set in Feudal Japan. Would you play this?,2025-07-08 10:14:02
gaming,2025,7,I made a Hollow Knight themed controller stand!,2025-07-08 09:53:24
gaming,2025,7,Help with a GOG game - Gabriel Knight 3,2025-07-08 08:07:07
gaming,2025,7,Question...,2025-07-08 07:42:29
gaming,2025,7,Best exploration game Ps5,2025-07-08 05:48:03
gaming,2025,7,Games where taking a life feels weighty?,2025-07-08 04:52:03
gaming,2025,7,Comix Zone (Sega Genesis) Still Hold Up? Let’s Settle This.,2025-07-08 04:44:00
gaming,2025,7,Which roguelike game has challenged you the most?,2025-07-08 02:36:46
gaming,2025,7,Which game had the biggest redemption story: No Man's Sky or Cyberpunk 2077?,2025-07-08 01:49:22
gaming,2025,7,Game Recommendations,2025-07-08 01:41:58
gaming,2025,7,Destiny:Rising a NetEase mobile spinoff,2025-07-08 00:05:14
gaming,2025,7,"Continuing my retro gaming week, hold my chai, I'm going back to Raccoon City...",2025-07-07 23:39:00
gaming,2025,7,Kleks Academy New Gameplay Demo (TBA) 4K,2025-07-07 22:49:11
gaming,2025,7,"""Buy"" tabs should be ""Rent"" tabs",2025-07-07 22:09:11
gaming,2025,7,What’s a flash game that genuinely holds up to this day?,2025-07-07 22:06:27
gaming,2025,7,"Larian's Head Of Publishing Says That Not All Games Need To Be Free, They Just Need To Be Good",2025-07-07 19:59:41
gaming,2025,7,Modest proposal for the age of digital gaming: legal rights of game owners,2025-07-07 19:37:21
gaming,2025,7,Could we also get some huge initiative about games being released in a poor state?,2025-07-07 19:14:26
gaming,2025,7,Games where you can feel your character grow in power,2025-07-07 18:53:26
gaming,2025,7,"Christopher Dring - I asked for clarification on the “Game Pass is profitable” claim, and was told no first-party costs are included.",2025-07-07 18:46:54
gaming,2025,7,"I finally finished my pixel art video game character mural, tens of thousands of hand-placed beads for my favorite video game (Or video game related) characters of all time.",2025-07-07 18:32:51
gaming,2025,7,This is still the best Spider-Man game,2025-07-07 18:22:02
gaming,2025,7,What to buy? Steam summer sale,2025-07-07 18:01:28
gaming,2025,7,Screw console wars. LEGO is for everybody,2025-07-07 17:59:19
gaming,2025,7,Am I the only one that doesn't care about in-game cosmetics?,2025-07-07 17:54:08
gaming,2025,7,I’m sad that we will never see the “Nemesis System” mechanic in a game for a long time.,2025-07-07 17:14:33
gaming,2025,7,Ubisoft Wants Gamers To Destroy All Copies of A Game Once It Goes Offline,2025-07-07 15:16:18
gaming,2025,7,Mafia: The Old Country – 9 Minutes of Exclusive Gameplay,2025-07-07 14:20:23
gaming,2025,7,"Look what I found. A blast from the past, a very different era in gaming for many different reasons.",2025-07-07 13:56:03
gaming,2025,7,"At the request of South Korea, Valve pulled a mod from Steam that glorified the country's military dictatorship, marking the first time the company has removed a game or mod from Steam worldwide over a government's objection to its content",2025-07-07 13:48:27
gaming,2025,7,Another goodwill score for this weekend!,2025-07-07 12:52:37
gaming,2025,7,Ex-PlayStation boss reveals AAA publishers aren't signing as many games as the jump from PS4 to PS5 doubled the price of development for very little improvement,2025-07-07 12:51:36
gaming,2025,7,Need help finding a PVP sword fighting game from the early 2010’s,2025-07-07 12:04:30
gaming,2025,7,I tried making Dragonstone Castle from Game of Thrones in Far Cry 5!,2025-07-07 10:00:29
gaming,2025,7,Cancel your Game Pass! We should not accept Microsoft's shitty behavior.,2025-07-07 08:03:34
gaming,2025,7,What's the most out of the box roguelike you've ever played?,2025-07-07 07:07:17
gaming,2025,7,what's the name of these sort of games/card games like in the clip from Adventure Time?,2025-07-07 07:00:54
gaming,2025,7,Making Friends Monday! Share your game tags here!,2025-07-07 06:00:37
gaming,2025,7,What’s a gaming myth/urban legend you still believe in to this day?,2025-07-07 03:43:43
gaming,2025,7,Dead or Alive 4 xbox 360 commercial.,2025-07-07 02:56:02
gaming,2025,7,"Waiting on a flight home from Japan, and saw one of the Pokémon planes. My inner kid is very happy!",2025-07-07 02:26:06
gaming,2025,7,What are your top 10 games of all time?,2025-07-06 23:47:12
gaming,2025,7,Rouge likes-lites with the best boss battles,2025-07-06 23:02:48
gaming,2025,7,Whats gonna be the next big  Gaming Genre?,2025-07-06 22:18:16
gaming,2025,7,Got a new system after 10 years. Recommendations?,2025-07-06 21:31:18
gaming,2025,7,Oblivion ran so well I decided to try something more demanding,2025-07-06 21:23:20
gaming,2025,7,Any news about REPLACED??,2025-07-06 20:27:00
gaming,2025,7,Romero games met with Microsoft a day before their funding was pulled after the layoff fiasco. They made no mention that anything was going to happen and the studio had to shut down due to the cancellation.,2025-07-06 20:24:11
gaming,2025,7,Only Nintendo would be in a format war with itself,2025-07-06 18:48:25
gaming,2025,7,"Mecha Break. Can we PLEASE get an anime inspired, fast paced, single player only mecha game and not live service, battle royale, multiplayer only slop?",2025-07-06 18:44:27
gaming,2025,7,Can’t help it,2025-07-06 18:33:45
gaming,2025,7,Finally got through Portal 2 - what a rush!,2025-07-06 17:32:40
gaming,2025,7,Idk why but I love game stories that cause sheer dreadfulness,2025-07-06 17:07:36
gaming,2025,7,What mistakes do indie game devs commonly make?,2025-07-06 16:49:52
gaming,2025,7,[Death Stranding]Just hanging :P,2025-07-06 16:30:51
gaming,2025,7,Ballin Roguelikes,2025-07-06 15:52:14
gaming,2025,7,"Clearing my backlog, I may be some time.",2025-07-06 15:45:51
gaming,2025,7,Disney should make Aladdin 3D game with GTA aesthetics,2025-07-06 15:43:38
gaming,2025,7,Playing the Toy Story 2 Remake in Unreal Engine 5 | Developer Commentary & Lets Play,2025-07-06 15:00:35
gaming,2025,7,Prolific port studio says any 60fps Xbox Series S game will ‘easily port’ to Nintendo Switch 2,2025-07-06 14:29:07
gaming,2025,7,Does anyone know of active VGM orchestras that travel often?,2025-07-06 14:28:30
gaming,2025,7,The state of black ops 6,2025-07-06 13:30:51
gaming,2025,7,Does anyone know and or remember Yugioh Capsule Monster Coliseum? I am looking for similar games to play today,2025-07-06 07:24:54
gaming,2025,7,Our Mass Effect group at Japan Expo,2025-07-06 06:49:25
gaming,2025,7,Simple Questions Sunday!,2025-07-06 06:00:30
gaming,2025,7,AC Valhalla really grows on you,2025-07-06 04:42:02
gaming,2025,7,Dune 2: I had almost forgotten how much I like this golden oldie,2025-07-06 04:27:58
gaming,2025,7,Recent layoffs & Avowed.,2025-07-06 01:03:52
gaming,2025,7,I may or may not have bought a big box,2025-07-05 23:40:58
gaming,2025,7,"Tony Hawk’s Pro Skater 3 + 4 preload guide: release date, file size, and more",2025-07-05 23:04:08
gaming,2025,7,PEGI-rated games are uncut ?,2025-07-05 22:52:05
gaming,2025,7,"European game publisher group responds to Stop Killing Games, claims ""These proposals would curtail developer choice""",2025-07-05 22:43:49
gaming,2025,7,Need a Game - Xbox or Switch,2025-07-05 22:09:52
gaming,2025,7,"If we are in the middle of the ""AI Revolution"", Why Does AI in video games still suck?",2025-07-05 20:12:45
gaming,2025,7,Cyberpunk: Edgerunners 2 | Official Teaser | Netflix,2025-07-05 19:49:12
gaming,2025,7,Vintage Story is working on a Fantasy Adventure gamemode with former Hytale Developers,2025-07-05 18:58:45
gaming,2025,7,"Founder of Arkane Studios: ""I think Gamepass is an unsustainable model that has been increasingly damaging the industry for a decade""; impacts sales",2025-07-05 18:51:08
gaming,2025,7,Best video game soundtrack. Send it.,2025-07-05 17:24:12
