subreddit,year,month,text,created_utc
gaming,2025,6,"Fans slam The Alters after discovering evidence of undisclosed gen AI in images, text, and translation",2025-06-29 15:32:43
gaming,2025,6,I can see why those who didnt like Death Stranding 1 like DS2.,2025-06-29 15:18:03
gaming,2025,6,What franchise would you bring back to life and why is it Time Splitters?,2025-06-29 15:09:00
gaming,2025,6,What are some good slow paced dungeon crawlers?,2025-06-29 14:12:10
gaming,2025,6,'Hero of Law' release trailer - 'The Legend of Zelda: Ocarina of Time' x 'Ace Attorney' crossover mod,2025-06-29 14:10:38
gaming,2025,6,"""Liminal"" Sci-fi landscapes in 90's early 2000 video games",2025-06-29 13:11:51
gaming,2025,6,Is Skyrim *the* fantasy RPG?,2025-06-29 12:54:30
gaming,2025,6,Power Stone (1-2) Dreamcast,2025-06-29 12:28:51
gaming,2025,6,Will it be possible in the future for players from different countries all over the world to play together in the same lobbies without latency issue?,2025-06-29 11:37:24
pcgaming,2025,7,"Tech Support and Basic Questions Thread - July 13, 2025",2025-07-13 05:00:46
pcgaming,2025,7,Ghosts of Tsushima runs ?,2025-07-13 04:42:28
pcgaming,2025,7,Dragon Quest VII Remake Reportedly in the Works,2025-07-13 04:41:10
pcgaming,2025,7,I need to see a civil war reenactor play through Darkest of Days RP’ing the main character(union soldier in ww2 with a sci-fi gun),2025-07-13 04:28:28
pcgaming,2025,7,Rumor: EA May Have Shelved Need for Speed,2025-07-13 01:36:50
pcgaming,2025,7,RC Crash Course - Fun in the mud!,2025-07-12 23:09:25
pcgaming,2025,7,You have to do your day job using only skills from the last video game you played. How successful are you?,2025-07-12 22:53:45
pcgaming,2025,7,Who is your fav video game character?,2025-07-12 22:48:24
pcgaming,2025,7,Sector Unknown Launches July 16th (Early Access),2025-07-12 16:07:33
pcgaming,2025,7,"Deep Rock Galactic: Survivor to exit early access on September 17th.  A new Gear system will be added for the launch, complete with loadouts.",2025-07-12 15:50:37
pcgaming,2025,7,Limbo and Inside will be removed from GOG on July 17th.,2025-07-12 15:40:29
pcgaming,2025,7,"Halo CE Remake Will Only Feature a Campaign Mode, It’s Claimed",2025-07-12 15:01:12
pcgaming,2025,7,"Weekend PC Game Deals: Final Fantasy for cheap, bundled Borderlands, and free strategy games",2025-07-12 09:32:22
pcgaming,2025,7,Lockdown protocol,2025-07-12 03:33:18
pcgaming,2025,7,"The Fact Sims 4 and all its DLC is currently $1,484.02 is absolutely wild.",2025-07-12 03:20:33
pcgaming,2025,7,"I’m genuinely curious,(because I don’t know anything about them) why do people hate kernel level anti cheats?",2025-07-12 03:16:29
pcgaming,2025,7,Peak has reached 5 million copies sold,2025-07-12 03:02:34
pcgaming,2025,7,Hundreds of Fans Sign Petition to Save Anthem,2025-07-11 21:56:46
pcgaming,2025,7,Brickadia is available now on Steam,2025-07-11 21:45:51
pcgaming,2025,7,DualShockers: Funcom Is Reimbursing Vehicles and Items For Dune Awakening Players,2025-07-11 19:59:42
pcgaming,2025,7,Inside the Ambitious Japanese Video Game That Almost Bankrupted Its Makers,2025-07-11 19:30:41
pcgaming,2025,7,I am creating my first VR horror game called 'Trenches VR' where you are a soldier lost in WW1 and monsters can hear your voice! Here is the trailer for PCVR!,2025-07-11 18:39:58
pcgaming,2025,7,"Against the Storm DLC, Nightwatchers, launch date announcement (31st of July)",2025-07-11 18:33:27
pcgaming,2025,7,She's Leaving - Dalton's Demo,2025-07-11 16:04:09
pcgaming,2025,7,The state of PC gaming today,2025-07-11 15:53:06
pcgaming,2025,7,"""Not a clear-cut answer"" whether Final Fantasy 17 will be turn-based, says Naoki Yoshida, following Clair Obscur's success",2025-07-11 14:27:40
pcgaming,2025,7,RimWorld - Odyssey is available now on Steam,2025-07-11 13:57:17
pcgaming,2025,7,Tony Hawk's Pro Skater 3 + 4 is now available on Steam,2025-07-11 12:52:02
pcgaming,2025,7,Subnautica - Lawsuit (a community update from Charlie),2025-07-11 12:03:39
pcgaming,2025,7,"Latitude 76: Land of the Onkilons is a story of an expedition paid for with lives, driven by the elusive dream of making history. Based on true events of a lost polar expedition, the game has just launched its demo version.",2025-07-11 11:10:03
pcgaming,2025,7,PATAPON 1+2 REPLAY is available now on Steam,2025-07-11 04:03:33
pcgaming,2025,7,"Weekly Game Suggestions Thread - July 11, 2025",2025-07-11 04:00:58
pcgaming,2025,7,Watch Dogs Reborn - How Modders Fixed A Broken Promise - Whitelight,2025-07-11 03:33:52
pcgaming,2025,7,Steam: Of Ash and Steel Closed Playtest Has Begun,2025-07-11 02:27:14
pcgaming,2025,7,Streets of Rogue - Version 99 + Sequel Update,2025-07-11 02:19:01
pcgaming,2025,7,Sims an RPG? why or why not?,2025-07-11 00:44:47
pcgaming,2025,7,Just in: Unknown Worlds founders Charlie Cleveland and Max McGuire along with former CEO Ted Gill are filing a lawsuit against Krafton.,2025-07-11 00:40:32
pcgaming,2025,7,Viture's real time 3D conversion. Lets you play every game in 3D on a 5090.,2025-07-11 00:04:57
pcgaming,2025,7,Why Do Modern Games Look So Awful With AA Turned Off?,2025-07-10 23:45:36
pcgaming,2025,7,Krafton Responds - Blaming Subnautica Leadership for being Negligent. (pop-up on Krafton home page),2025-07-10 21:56:50
pcgaming,2025,7,Krafton slams ex-Subnautica 2 execs and claims it’ll give developers their ‘promised’ reward,2025-07-10 21:44:37
pcgaming,2025,7,Fantasy General II is free to keep on Steam if claimed,2025-07-10 20:23:01
pcgaming,2025,7,Field of Glory II: Medieval is free to keep on Steam if claimed,2025-07-10 19:07:32
pcgaming,2025,7,System Shock 2: 25th Anniversary Remaster - Launch Trailer | Nightdive Studios,2025-07-10 18:49:07
pcgaming,2025,7,"Warhammer 40,000: Rogue Trader - Massive post-release update 1.4.1 is live!",2025-07-10 18:38:31
pcgaming,2025,7,Trade Rivals - Goblin Age on Steam,2025-07-10 18:26:41
pcgaming,2025,7,"I built Point Atlas—a totally free, community-powered tool so anyone can make and share interactive maps for any game",2025-07-10 18:09:32
pcgaming,2025,7,Star Citizen | Behind The Ships: RSI Meteor,2025-07-10 17:56:17
pcgaming,2025,7,Ubisoft connect is a disgrace,2025-07-10 17:07:15
pcgaming,2025,7,"Sea of Thieves Developer Rare Says It's Been 'On the Back Foot' With Ensuring Game's Quality and Health, Doubles Down on Years of Future Content — Including Subscription-Funded Custom Servers - IGN",2025-07-10 17:01:42
pcgaming,2025,7,"Xbox Game Pass deals ranged from ""$50,000 to $50,000,000"" — offering a glimpse at how much Microsoft drops on content",2025-07-10 15:45:25
pcgaming,2025,7,Games that took you a few tries to enjoy?,2025-07-10 15:34:04
pcgaming,2025,7,Subnautica 2 Boycott Started by Community After Krafton Layoffs,2025-07-10 14:58:26
pcgaming,2025,7,Total War: WARHAMMER III - Tides of Torment - Release Update,2025-07-10 14:51:02
pcgaming,2025,7,Real Stagnation: 6 Years Of GeForce RTX 60 Class GPUs,2025-07-10 12:11:22
pcgaming,2025,7,To all Kart racers: The Karters 2 Release,2025-07-10 09:23:24
pcgaming,2025,7,"Tech Support and Basic Questions Thread - July 10, 2025",2025-07-10 05:00:52
pcgaming,2025,7,New Empire Total War,2025-07-10 04:06:50
pcgaming,2025,7,Nexon is deliberately breaking Steams rules around using inducements for reviews and Steam are ignoring it / aren't doing anything about it.,2025-07-10 01:01:01
pcgaming,2025,7,Old School Rally | Full Release Announcement Trailer,2025-07-09 23:04:01
pcgaming,2025,7,"BioShock creator says ""audiences reward"" single-player games that don't have ""other methods of monetization,"" like Baldur's Gate 3, Kingdom Come: Deliverance 2, and Clair Obscur: Expedition 33",2025-07-09 22:17:20
pcgaming,2025,7,"Hey! I'm a solo dev getting ready to launch my first indie game, ALARIC. It's a mix of boomer shooters and Metroidvanias with old-school visuals and a heavy metal soundtrack. Would love if you checked out the Steam page and maybe wishlisted it. Let me know what you think!",2025-07-09 21:31:42
pcgaming,2025,7,Unknown Worlds / An Update On Subnautica 2 Early Access,2025-07-09 21:31:02
pcgaming,2025,7,Peak went from a canceled game that couldn’t get funding to selling millions on Steam,2025-07-09 20:27:50
pcgaming,2025,7,"RimWorld - Odyssey preview #4: Quests, the mechhive endgame, drones, and more",2025-07-09 20:24:00
pcgaming,2025,7,Look Up… It’s A One-Of-A-Kind Superman GeForce RTX 5090! And You Could Win It! | GeForce News | NVIDIA,2025-07-09 18:14:11
pcgaming,2025,7,Krafton Delays ‘Subnautica 2’ Game Ahead of $250 Million Payout,2025-07-09 17:59:16
pcgaming,2025,7,Stardew Valley surpasses Portal 2 to became the highest rated game,2025-07-09 17:22:30
pcgaming,2025,7,Ground of Aces - Early Access Releases Tomorrow,2025-07-09 17:05:16
pcgaming,2025,7,FLAKE the Legend of Snowblind giveaway results,2025-07-09 17:02:49
pcgaming,2025,7,I've been working on Magic Forge Tycoon for a year now! And I'm excited to share the reveal trailer! The release is planned for January on PC and Steam Deck. What do you think?,2025-07-09 15:39:43
pcgaming,2025,7,"EA Japan GM Speaks Out on Microsoft Layoffs and Cancellation of Games Like Everwild and Perfect Dark: ‘If a Game Was in Development for 7~10 Years, Canceling Feels Like the Worst Move’",2025-07-09 15:39:22
pcgaming,2025,7,Oblivion Remastered Update 1.2 (Steam Beta),2025-07-09 15:30:34
pcgaming,2025,7,Irbet Tong game about melting permafrost in Yakutia (coming July 28),2025-07-09 13:41:12
pcgaming,2025,7,"May 2025 U.S. Video Game Market Highlights from Circana - Elden Ring: Nightrein was the best-selling game of the month and the 11th best-selling game of 2025 year-to-date. It was the best-selling title across each of the PlayStation, Xbox and aggregated PC storefront platforms.",2025-07-09 13:13:02
pcgaming,2025,7,Linux Gaming vs Windows Gaming,2025-07-09 12:13:33
pcgaming,2025,7,"AMD Ryzen 9 9950X3D drops to $666, all 9000X3D SKUs now below MSRP",2025-07-09 11:37:38
pcgaming,2025,7,Steel Hunters Sunsetting,2025-07-09 10:52:53
pcgaming,2025,7,Xbox Game Pass actually *is* profitable and isn't quite the albatross you've heard it is - as rumors swirl about Microsoft's gaming business' health,2025-07-09 08:40:46
pcgaming,2025,7,Special K developers deletes his 20 year old Steam Account,2025-07-09 06:45:26
pcgaming,2025,7,Opinions on Crosshair Overlays in multiplayer FPS/TPS games?,2025-07-09 02:18:23
pcgaming,2025,7,Graphics quality vs Image quality,2025-07-09 01:53:39
pcgaming,2025,7,HARD VOID - Lovecraftian 4X game - Demo available,2025-07-09 01:23:38
pcgaming,2025,7,Jurassic World Evolution 3 | Lokiceratops | Dinosaur Showcase,2025-07-09 00:11:35
pcgaming,2025,7,"'Knowing Steam players are hoarders explains why you give Valve that 30%,' analyst tells devs: 'You get access to a bunch of drunken sailors who spend money irresponsibly'",2025-07-08 23:54:15
pcgaming,2025,7,Endzone 2 - Release Date Announcement Trailer,2025-07-08 22:58:01
pcgaming,2025,7,Chasm - Patch 1.096 Released,2025-07-08 22:17:31
pcgaming,2025,7,"Deserter: Prologue – Free Standalone Chapter of a New Stealth RPG Coming This August. Use stealth, cunning, and thieving skills to escape from a military camp in the heart of a dystopian war.",2025-07-08 20:10:48
pcgaming,2025,7,"Mega Pirate Pandemonium – My First Game Ever, Free to Play on Steam in 3 Days!",2025-07-08 18:09:36
pcgaming,2025,7,Why is it I'm rarely seeing anti-aliasing options in games anymore?,2025-07-08 17:32:08
pcgaming,2025,7,"Multiple Fallout Projects Are In Development, It’s Claimed",2025-07-08 17:07:40
pcgaming,2025,7,The Greatest Opening !!,2025-07-08 15:16:02
pcgaming,2025,7,"Introducing The Last of Us Part II Remastered Chronological Experience, out today",2025-07-08 15:07:05
pcgaming,2025,7,"From College Project to Full Game, Finally Ready for Release - Run Like Hell",2025-07-08 14:16:51
pcgaming,2025,7,Have you guys ever played medieval dynasty [kcd2],2025-07-08 13:46:10
pcgaming,2025,7,"Update: Valve only blocked a creepy fascist Mount and Blade: Warband mod in South Korea, not worldwide, and the mod's own author took it down entirely",2025-07-08 13:03:50
pcgaming,2025,7,Not every member of VideoGames Europe lobby organization is lobbying against Stop Killing Games,2025-07-08 09:58:46
pcgaming,2025,7,"After 6 years of passionate development, we’re excited to finally launch Let Them Trade on July 24 – a cozy city builder where you build and design your towns, and they trade on their own. No micromanagement, no stress – just building, relaxing, and watching your world evolve.",2025-07-08 07:56:44
pcgaming,2025,7,Tony Hawk's Pro Skater 3 + 4 Review,2025-07-08 07:56:37
pcgaming,2025,7,STAR WARS REBELLION GOG GIVEAWAY,2025-07-08 04:20:14
pcgaming,2025,7,5 Minutes Until Self-Destruction | Announcement | July 23rd 2025,2025-07-08 03:34:16
pcgaming,2025,7,"Last Report - Official Release Date Trailer | July 11, 2025",2025-07-08 00:23:52
pcgaming,2025,7,"Ashly Burch on the importance of queer roles, mental health, and authentic representation in gaming",2025-07-08 00:20:24
pcgaming,2025,7,Romero Games clarifies they have not closed and is in contact with other publishers to bring their game to the finish line.,2025-07-07 23:24:28
pcgaming,2025,7,Aniimo Review & Closed Beta First Impressions - It's NOT What We Thought?,2025-07-07 18:25:26
pcgaming,2025,7,007 First Light - PC Gaming Show 2025 Interview,2025-07-07 17:31:27
pcgaming,2025,7,"Call of Duty: WW2 pulled from PC following reports of remote code exploit trolling players with 'Notepad pop-ups, PC shutdowns' and desktop wallpaper of a lawyer",2025-07-07 16:15:18
pcgaming,2025,7,Does Disco Elysium ever get fun?,2025-07-07 16:06:50
pcgaming,2025,7,Codemasters in EA Sports,2025-07-07 16:06:23
pcgaming,2025,7,"Monster Hunter Wilds' poor post-launch reception bubbles up to the surface in shareholder meetings, though Capcom says it's 'committed' to fixing performance and content woes",2025-07-07 15:29:37
pcgaming,2025,7,Capcom cancels lecture about Monster Hunter Wilds’ optimization as devs face threats and harassment,2025-07-07 14:59:56
pcgaming,2025,7,Croc Legend of the Gobbos is coming to Steam,2025-07-07 14:43:49
pcgaming,2025,7,Snail Mail - Demo Release Trailer,2025-07-07 14:28:43
pcgaming,2025,7,Mafia: The Old Country – 9 Minutes of Exclusive Gameplay | IGN First,2025-07-07 14:05:28
pcgaming,2025,7,If you liked crossout give Age of Water a try.,2025-07-07 13:12:12
pcgaming,2025,7,"Crosschecking Hardware Unboxed's ""RX 9070 XT is Now Faster, AMD Finewine"" Benchmarks",2025-07-07 12:56:06
pcgaming,2025,7,Warren Spector was so desperate to make Deus Ex that it almost became a Command & Conquer RPG,2025-07-07 12:51:53
pcgaming,2025,7,THE HOUSE OF THE DEAD 2: Remake || Release Date Announcement Trailer,2025-07-07 12:14:41
pcgaming,2025,7,Nvidia Did It Again…. RTX 5050 Review,2025-07-07 11:40:22
pcgaming,2025,7,Borderlands 4 bust or not?,2025-07-07 11:14:10
pcgaming,2025,7,Anyone play Zebco pro fishing 3D on pc in the 90s?,2025-07-07 10:46:36
pcgaming,2025,7,"Tech Support and Basic Questions Thread - July 07, 2025",2025-07-07 05:02:00
pcgaming,2025,7,"What Are You Playing Thread - July 07, 2025",2025-07-07 04:01:46
pcgaming,2025,7,Facial Animations (Your list),2025-07-07 03:07:54
pcgaming,2025,7,Easy Delivery Co. - Official Reveal Trailer,2025-07-06 23:02:36
pcgaming,2025,7,harold's hills- lost game,2025-07-06 19:58:27
pcgaming,2025,7,Leonardo's Island first trailer is out!,2025-07-06 16:43:24
pcgaming,2025,7,Play of Battle Devlog #1 - Bringing modern era into strategy games,2025-07-06 16:16:37
pcgaming,2025,7,FINAL FANTASY IX 25th Anniversary Special Movie,2025-07-06 16:02:18
pcgaming,2025,7,Where can I find a list of DVD/CD games that have a Steam key in there?,2025-07-06 14:41:06
pcgaming,2025,7,"EA, Ubisoft & Activision Execs ATTACK Stop Killing Games...",2025-07-06 13:19:50
pcgaming,2025,7,THEIF DEADLY SHADOWS GOG GIVEAWAY,2025-07-06 04:23:59
pcgaming,2025,7,"Founder of Arkane Studios: ""I think Gamepass is an unsustainable model that has been increasingly damaging the industry for a decade""; impacts sales",2025-07-06 01:46:24
pcgaming,2025,7,"""Storylines Have Been Cut"": Baldur's Gate 3 Actor Warns That Diversity Is Being Removed From Some Games",2025-07-06 00:46:20
pcgaming,2025,7,Valve cooperates in banning Steam mod for depicting “historical revisionism”,2025-07-05 21:00:53
pcgaming,2025,7,"What happened to the creator of Gunman Chronicles, Valve's forgotten FPS? 'My relationship with Gabe didn't really go that great'",2025-07-05 17:42:42
pcgaming,2025,7,A Solitaire Mystery - Steam Release Trailer,2025-07-05 16:48:09
pcgaming,2025,7,"RimWorld - Odyssey preview #3: Animals, training, and fishing",2025-07-05 16:32:11
pcgaming,2025,7,Krafton fired the heart of Subnautica.,2025-07-05 16:15:47
pcgaming,2025,7,Videogames Europe: Statement on Stop Killing Games,2025-07-05 13:37:08
pcgaming,2025,7,[Hardware Unboxed] What DLSS 4 Mode Should You Use? - Quality vs Balanced vs Performance,2025-07-05 11:22:55
pcgaming,2025,7,Weekend PC Game Deals: Ongoing summer sales and fresh bundles,2025-07-05 10:17:26
pcgaming,2025,7,"Horror-AI Game Concept: Player-driven story like Stephen King’s universe, would this work?",2025-07-05 08:01:20
pcgaming,2025,7,"Just days after joining Game Pass, the Xbox PC edition of Call of Duty: WW2 is taken offline for ""an issue""",2025-07-05 03:05:00
pcgaming,2025,7,ReDrop - Die. Rage. Repeat. - Out Now with Summer Discount!,2025-07-04 23:52:21
pcgaming,2025,7,"Forza Motorsport ""is no more"", claims former Turn 10 employee, following Microsoft cuts. Horizon will continue.",2025-07-04 22:59:52
pcgaming,2025,7,Free steam random Key,2025-07-04 22:37:51
pcgaming,2025,7,My cinematic sci-fi shooter Incident X launches July 24 – here’s the PC gameplay teaser,2025-07-04 21:42:39
pcgaming,2025,7,From Sci-Fi to Horror: Three Isolated Demos || Intermission 01,2025-07-04 19:33:53
pcgaming,2025,7,The Epic Games Store Free Games For July 10 Are the Gift that Keeps on Giving,2025-07-04 16:22:51
pcgaming,2025,7,"A 'little educational game for middle-schoolers' left DayZ's creators obsessed, inspired, and embroiled in a contentious presidential campaign: 'It's 4.5 years later, and I'm still talking about this story'",2025-07-04 16:22:19
pcgaming,2025,7,NVIDIA GeForce RTX 5050 8 GB Review,2025-07-04 15:54:59
pcgaming,2025,7,"Valve's reported profit-per-head from Steam commissions is out there, and at $3.5 million per employee it makes Apple and Facebook look like a lemonade stand",2025-07-04 15:09:16
pcgaming,2025,7,"Microsoft has never been good at running game studios, which is a problem when it owns them all",2025-07-04 14:55:46
pcgaming,2025,7,Am i crazy for being more excited for resident evil 9 and silksong than gta 6,2025-07-04 14:39:04
pcgaming,2025,7,DRAGON BALL Z: KAKAROT HD on Steam – Comparison Trailer,2025-07-04 13:47:59
pcgaming,2025,7,Xbox Producer Recommends Laid Off Workers Should Use AI To ‘Help Reduce The Emotional And Cognitive Load That Comes With Job Loss’,2025-07-04 11:52:42
pcgaming,2025,7,MindsEye Dev's UK Workforce of Around 300 Receive At-Risk Emails as Former GTA Lead Leslie Benzies Finally Addresses Staff,2025-07-04 11:28:22
pcgaming,2025,7,Janitor Simulator Trailer,2025-07-04 11:05:45
pcgaming,2025,7,"Most GPUs in US retail sell well above MSRP, except for unpopular 8GB models",2025-07-04 10:04:52
pcgaming,2025,7,Let’s talk a bit about American McGee’s Alice / Alice: Madness Returns.,2025-07-04 07:22:01
pcgaming,2025,7,Blue Archive on Steam,2025-07-04 06:00:43
pcgaming,2025,7,"Tech Support and Basic Questions Thread - July 04, 2025",2025-07-04 05:00:42
pcgaming,2025,7,"Weekly Game Suggestions Thread - July 04, 2025",2025-07-04 04:01:24
pcgaming,2025,7,RCE Exploit Discovered on CoD: WW2,2025-07-04 02:06:23
pcgaming,2025,7,"Reaper Actual - New MMOFPS by John Smedley, Matt Higby, and Tramell Issac Announced",2025-07-04 00:17:58
pcgaming,2025,7,Meta Quest 3 Stumbles 6.38% On Latest Steam Hardware Survey,2025-07-03 23:28:07
pcgaming,2025,7,Anyone ever feel like they have too many games?,2025-07-03 21:22:39
pcgaming,2025,7,Dungeons & Dragons Neverwinter Nights 2: Enhanced Edition - Gameplay Trailer,2025-07-03 21:09:40
pcgaming,2025,7,Microsoft's Xbox Layoffs Have Perfect Timing: How They Gamed the Tax Code for $100M+ in Instant Savings,2025-07-03 20:32:12
pcgaming,2025,7,'There has to be a better way than this': Game developers call Microsoft's latest layoffs 'a colossal waste of talent' from a publisher that seems like it's in 'a death spiral',2025-07-03 19:56:18
pcgaming,2025,7,Name PAID games that got literally KILLED because were fully online and had no option for players to host their own servers,2025-07-03 18:22:38
pcgaming,2025,7,FLAKE the Legend of Snowblind 10 x Steam keys giveaway,2025-07-03 17:37:09
pcgaming,2025,7,"Anthem Game Update: After careful consideration, we will be sunsetting Anthem on January 12, 2026",2025-07-03 17:35:51
pcgaming,2025,7,Black Desert is free to keep on Steam,2025-07-03 17:04:32
pcgaming,2025,7,Epic Games Faces Patent Lawsuit Over In-Game Chat System,2025-07-03 16:28:05
pcgaming,2025,7,Call of Duty: WWII Game Pass Release Marred by Dangerous RCE Exploit,2025-07-03 16:26:07
pcgaming,2025,7,Unknown Worlds / A Letter To Our Community,2025-07-03 16:06:55
pcgaming,2025,7,MindsEye boss reportedly claims internal and external saboteurs are to blame for the studio’s woes | VGC,2025-07-03 15:56:24
pcgaming,2025,7,The ‘Stop Killing Games’ Petition Achieves 1 Million Signatures Goal,2025-07-03 15:45:24
pcgaming,2025,7,Ready or Not - VOID Interactive Clarification on Content Changes (Nudity and Gore Removal),2025-07-03 14:22:59
pcgaming,2025,7,Manor Lords - Behind the Scenes: Current Work and Upcoming Changes,2025-07-03 14:04:37
pcgaming,2025,7,[BOT.VINNIK Chess Masters Academy] Looking for beta testers – 25–27 July,2025-07-03 13:35:09
pcgaming,2025,7,Bethesda Cancels Funding For Several Unannounced Projects at Multiple Studios,2025-07-03 12:45:47
pcgaming,2025,7,One day you find out that you're NPC in videogame. What genre is your game and what's the player's final goal?,2025-07-03 12:15:34
pcgaming,2025,7,RoboCop: Rogue City - Unfinished Business | Overview Trailer,2025-07-03 11:12:24
pcgaming,2025,7,Gecko Gods - Official Developer AMA 🦎,2025-07-03 08:59:41
pcgaming,2025,7,Steam Hardware & Software Survey: June 2025,2025-07-03 07:26:45
pcgaming,2025,7,Subnautica 2 Developer's Entire Leadership Team Replaced in Shock Move Krafton Said 'Will Bring Renewed Energy and Momentum',2025-07-03 05:51:30
pcgaming,2025,7,Giving away 1x Xbox PC Game Pass (1 Month) key and 1x ExitLag (1 Month) key,2025-07-03 04:00:43
pcgaming,2025,7,What's the first game you remember playing where you could look down and see your character's feet?,2025-07-03 01:48:47
pcgaming,2025,7,Do you mute the game music and play your own tracks instead - especially in FPS games?,2025-07-03 01:44:28
pcgaming,2025,7,Phil Spencer Will Allegedly Retire as CEO After Next-Gen Console Launch,2025-07-02 17:56:27
pcgaming,2025,7,Dying Light developer Techland cancels two upcoming games including its New Fantasy RPG IP,2025-07-02 17:41:07
pcgaming,2025,7,'Instantly lost all desire to even start': Mecha Break's Steam rating lands at an early 'Mixed' as players realize the beta's customization options have been turned into MTX fodder,2025-07-02 17:25:53
pcgaming,2025,7,"Microsoft is closing down Xbox studio The Initiative, with Perfect Dark killed as well",2025-07-02 17:03:46
pcgaming,2025,7,Is it impossible to have a good anti cheat for online gaming nowaday?,2025-07-02 15:32:48
pcgaming,2025,7,What’s wrong with AAA games? The development of the next Battlefield has answers.,2025-07-02 15:28:12
pcgaming,2025,7,French court convicts ex-Ubisoft bosses for workplace harassment,2025-07-02 14:53:50
pcgaming,2025,7,Sources: Everwild has been cancelled as Xbox layoffs hit Rare,2025-07-02 14:00:52
pcgaming,2025,7,Ungate — Action survival horror game now with save slots & completion badges,2025-07-02 13:27:03
pcgaming,2025,7,POSTAL 2 Redux on Steam,2025-07-02 13:22:08
pcgaming,2025,7,"The Radeon RX 9070 XT is Now Faster, AMD FineWine",2025-07-02 13:18:13
pcgaming,2025,7,Microsoft Begins Deep Job Cuts Across Xbox Division,2025-07-02 12:49:56
pcgaming,2025,7,The 'Online Games will have to balanced around Eventually being forced to be offline Single Player' Argument,2025-07-02 11:53:14
pcgaming,2025,7,"Capcom sees 61% surge in revenue from Steam, PlayStation revenue decreases",2025-07-02 11:50:01
pcgaming,2025,7,Dying Light: The Beast - Weapon Dockets Introduction,2025-07-02 09:36:16
pcgaming,2025,7,What happened to “Game Debate” website (projected FPS and Optimisation scores),2025-07-02 09:29:46
pcgaming,2025,7,Wishlist Fractured Balance on Steam Now,2025-07-02 09:20:27
pcgaming,2025,7,"PC Gamer did an interview with the solo developer of Erenshor, the simulated MMO built for singleplayer",2025-07-02 07:06:18
pcgaming,2025,7,"I'm not sure if indie devs, are allowed to share their success stories here, but just wanted to share, that after a very rocky start and a lot of of sleepless weeks, my game's recent reviews have been all positive",2025-07-02 05:37:48
pcgaming,2025,7,The most misunderstood topic in Gaming: Kernel AC,2025-07-02 05:26:00
pcgaming,2025,7,"Dave the Diver director addresses controversial “Best Indie Game” nomination from 2023. “There’s nothing indie about us, we didn’t apply for it”",2025-07-02 03:30:56
pcgaming,2025,7,"Obsidian director Josh Sawyer says it's a 'mistake' for RPGs to sacrifice crunchy 'sweaty boy' systems in favour of a 'one size fits all' game, since easier difficulties aren't too hard to make",2025-07-02 00:44:56
