subreddit,year,month,text,created_utc
pcgaming,2025,7,"Stephen Totilo: ""Krafton says the 3 leaders of Unknown Worlds (Subnautica 2) are out, replaced by Steve Papoutsis, who already runs their studio Striking Distance. Ted Gill, Charlie Cleveland and Max McGuire had some 50 years of combined tenure at Unknown Worlds""",2025-07-01 23:02:00
pcgaming,2025,7,"Coming to Game Pass: Tony Hawk's Pro Skater 3 + 4, Minami Lane, Ultimate Chicken Horse, and More",2025-07-01 21:09:18
pcgaming,2025,7,Honest question: I see SteamOS being constantly praised. Is it viable for Valve to release SteamOS to normal gaming PCs?,2025-07-01 20:46:07
pcgaming,2025,7,PSA - The email address I used for Nexus account is now used to brute-force access to my mail server.,2025-07-01 20:35:49
pcgaming,2025,7,Cladun X3 is getting a western release on Steam,2025-07-01 17:30:28
pcgaming,2025,7,Ampersat free to keep on Steam,2025-07-01 17:05:32
pcgaming,2025,7,Humble Choice July 2025 Games Revealed,2025-07-01 17:00:14
pcgaming,2025,7,"How Warhammer 40,000: Darktide won players back after a lukewarm first year",2025-07-01 16:53:43
pcgaming,2025,7,"Nexus mods will introduce age verification in the near future, for UK and EU users, regarding adult content",2025-07-01 14:48:03
pcgaming,2025,7,Analytics: Three-quarters of game revenue on Steam comes from action and RPGs,2025-07-01 13:27:04
pcgaming,2025,7,Two DLCs. One deeper dive into Anima Flux on Steam,2025-07-01 12:45:08
pcgaming,2025,7,Some of the Best Overlooked Anime Games,2025-07-01 11:28:53
pcgaming,2025,7,"Tech Support and Basic Questions Thread - July 01, 2025",2025-07-01 05:01:42
pcgaming,2025,7,Azeroth Reborn: Curse of the Blood Elves - Release Trailer,2025-07-01 04:23:20
pcgaming,2025,7,Why is there no Star Wars MMO game focused on large ships?,2025-07-01 02:11:34
pcgaming,2025,7,Why do we make game sequels ?,2025-07-01 01:54:51
pcgaming,2025,7,Welcoming PCSX2 2.2.0 and 2.4.0! | PCSX2,2025-07-01 00:58:13
pcgaming,2025,7,I’m Getting Real Tired Of Not Being Able To Trust That A Video Game Doesn’t Have AI Crap In It,2025-07-01 00:17:47
pcgaming,2025,7,Backyard Baseball '01 - Coming to Steam on July 8th!,2025-07-01 00:00:24
pcgaming,2025,6,Banquet for Fools Update 3.0 Showcase,2025-06-30 23:16:29
pcgaming,2025,6,"'They told me to destroy' my backups, Fallout creator Tim Cain says: 'People high up at companies take authority but no responsibility' for game preservation",2025-06-30 23:14:37
pcgaming,2025,6,I cannot recommend Turbo Overkill enough!,2025-06-30 21:57:33
pcgaming,2025,6,Steam News :: Steam In-Game Performance Monitor,2025-06-30 21:50:44
pcgaming,2025,6,"I honestly believe there is ABSOLUTELY a place for utilizing AI in making games. Please hear me out, would love to hear your thoughts.",2025-06-30 21:28:18
pcgaming,2025,6,Our murder-mystery visual novel game Sleuth Saga: Under Starless Skies just got a free update in response to player feedback!,2025-06-30 17:37:52
pcgaming,2025,6,UNGALAND! Adventure game on STEAM,2025-06-30 17:25:51
pcgaming,2025,6,The Tides Could Be Turning For Women in Gaming—In a Good Way,2025-06-30 16:12:06
pcgaming,2025,6,How Video Games Help LGBTQ+ People Cope With an Increasingly Hostile World,2025-06-30 16:06:54
pcgaming,2025,6,"11 Bit Studios: We’ve seen a wide range of accusations regarding the use of AI-generated content in The Alters, and we feel it’s important to clarify our approach and give you more context.",2025-06-30 15:38:40
pcgaming,2025,6,'The censorship is a step too far': Ready or Not is getting review bombed after developers sanitise the game to adhere to stricter console standards,2025-06-30 14:40:19
pcgaming,2025,6,"No plans for Sonic Adventure remakes, as Sonic Team focuses on new games instead",2025-06-30 13:04:44
pcgaming,2025,6,Toby Fox reveals early Deltarune concepts that show how much of the game was already conceived 10 years ago,2025-06-30 11:45:24
pcgaming,2025,6,My open world survival horror game is available for free on itch! [UE5],2025-06-30 11:39:25
pcgaming,2025,6,Roguejack21: If Balatro and Slay The Spire had a baby. Demo now available!,2025-06-30 06:49:27
pcgaming,2025,6,"What Are You Playing Thread - June 30, 2025",2025-06-30 04:02:17
pcgaming,2025,6,Falcon BMS 4.38 Trailer (Falcon 4.0 1998),2025-06-29 21:47:49
pcgaming,2025,6,What's the worst gaming hell/purgatory you would like to end up least,2025-06-29 21:39:55
pcgaming,2025,6,Fullscreen or tabbed gaming?,2025-06-29 19:13:32
pcgaming,2025,6,"Command your fleet from the bridge! A VR space RTS of conquest, trade, and tactical combat. Wishlist BattleGroupVR2 – Launching EA Q4 2025!",2025-06-29 18:26:29
pcgaming,2025,6,"Rimworld Newest DLC, Odyssey, will be released on July 11th.  This and more information on Gravships and Space in Odyssey Preview #2.",2025-06-29 17:43:46
pcgaming,2025,6,"EA Support is completely broken — I’ve been locked out of my own games for two weeks, and they keep giving me false information",2025-06-29 16:11:40
pcgaming,2025,6,I reviewed Pirate Softwares always-online DRM in his single-player game… and got banned from its Steam hub,2025-06-29 15:44:41
pcgaming,2025,6,"Fans slam The Alters after discovering evidence of undisclosed gen AI in images, text, and translation",2025-06-29 14:48:39
pcgaming,2025,6,Red Faction Guerrilla's Multiplayer Hammering in 2025 via SyncFaction Mod Project,2025-06-29 13:58:44
pcgaming,2025,6,"Owlcat is 'redoing everything from scratch' in Dark Heresy, its next Warhammer 40,000 CRPG",2025-06-29 11:18:07
pcgaming,2025,6,Seems that some of the region-locked Sony games on Steam are available now (Baltics),2025-06-29 10:09:02
pcgaming,2025,6,D.O.R.F. RTS - 3D Sprites,2025-06-29 08:52:25
pcgaming,2025,6,Nobody Cares About Your Heroes | Unpacked,2025-06-29 02:09:38
pcgaming,2025,6,Gloomwood - The Research Update Part Two,2025-06-28 18:12:23
pcgaming,2025,6,What is the Highest Skill-Cap FPS game?,2025-06-28 17:58:30
pcgaming,2025,6,"I've created AudioPin, a small utility to ""pin"" Windows default audio devices and stop them from changing.",2025-06-28 15:53:17
pcgaming,2025,6,Brno Transit | Teaser Trailer,2025-06-28 14:55:33
pcgaming,2025,6,"Cyberpunk 2 director says ""mature games"" used to mainly be about killing and sex, but The Witcher 3 was part of a ""broader process"" to change that as devs grew older",2025-06-28 14:08:25
pcgaming,2025,6,I can only buy games at 90%+ off,2025-06-28 13:30:29
pcgaming,2025,6,"Microsoft pushes staff to use internal AI tools more, and may consider this in reviews. 'Using AI is no longer optional.'",2025-06-28 13:20:39
pcgaming,2025,6,"You’ll Own Nothing | Stop Killing Games, ft. Ross of Accursed Farms",2025-06-28 11:26:07
pcgaming,2025,6,Weekend PC Game Deals: Steam Summer Sale 2025 Edition,2025-06-28 09:37:02
pcgaming,2025,6,"Ready or not is getting censored due to console ratings. Stating: ""If a content change was just a texture swap, we were able to apply it to console only while keeping the PC version the same as before. However, if the change involved transforming an entire asset this was less feasible.""",2025-06-28 07:32:32
pcgaming,2025,6,"Simon/Hypixel (Founder, Hypixel Studios) considering a $25 million buy-back of 'Hytale' from Riot Games",2025-06-28 07:19:39
pcgaming,2025,6,Star Citizen’s dynamic weather system is getting surprisingly cinematic,2025-06-28 06:32:19
pcgaming,2025,6,"Warhammer 40,000: Space Marine - Master Crafted Edition – Refunds, Discounts & Patch Plans",2025-06-28 05:00:49
pcgaming,2025,6,"Tech Support and Basic Questions Thread - June 28, 2025",2025-06-28 05:00:39
pcgaming,2025,6,Eternal Strands: ‘PARASITE COSMETICS’ Update,2025-06-27 21:05:40
pcgaming,2025,6,Death Road to Canada PANCREAS Update + Spiritual Sequel Revealed,2025-06-27 21:04:44
pcgaming,2025,6,"God of war ragnarok, mid game?",2025-06-27 20:54:38
pcgaming,2025,6,Sometimes i just wanna have fun after a long day.,2025-06-27 20:34:50
pcgaming,2025,6,EHG just released a teaser trailer for Season 3 of Last Epoch,2025-06-27 17:57:27
pcgaming,2025,6,Die to PLAY. After one year of developing and prototyping! Announce Steam Page Trailer,2025-06-27 17:16:47
pcgaming,2025,6,DF Retro EX: Doom 1993 To Doom The Dark Ages - Celebrating An Icon [Sponsored],2025-06-27 17:06:08
pcgaming,2025,6,Wreckfest 2 | Content Update #2,2025-06-27 16:59:10
pcgaming,2025,6,Steam is dealing with spam. Valve’s platform has been flooded with games stolen from itch.io,2025-06-27 16:23:38
pcgaming,2025,6,Steam automatic regional pricing is outdated - last update in October 2022,2025-06-27 15:37:02
pcgaming,2025,6,Is it just me or do y’all think Arkham Origins is underrated?,2025-06-27 15:30:17
pcgaming,2025,6,Code RAPID | Announcement Trailer,2025-06-27 14:58:22
pcgaming,2025,6,IO Interactive CEO estimates that Hitman 3 only cost a fifth of Hitman 2016's budget because the studio was brave enough to stop making new bathrooms for every game: 'I swore never to do more new toilets',2025-06-27 13:13:27
pcgaming,2025,6,Is Gaming An Addiction?,2025-06-27 04:49:43
pcgaming,2025,6,"Weekly Game Suggestions Thread - June 27, 2025",2025-06-27 04:00:53
pcgaming,2025,6,"Stitched Together, our upcoming turn-based RPG, has a new demo is out now!",2025-06-27 01:34:03
pcgaming,2025,6,Pragmata - Gameplay and Story Overview | Capcom Spotlight 2025,2025-06-26 22:44:39
pcgaming,2025,6,Resident Evil Requiem - Creators' Message - Capcom Spotlight June 2025,2025-06-26 22:32:34
pcgaming,2025,6,Anyone miss the activities / events associated with past Steam Summer Sales? (I.e. games),2025-06-26 20:32:05
pcgaming,2025,6,[Announcement] March to the Heart — Risk-like Deckbuilder set in a dying body on PC and Mac (2026),2025-06-26 19:47:29
pcgaming,2025,6,"Chris Avellone joins former Quantic Dream writer at Republic Games to work on ambitious project inspired by ""golden-age of RPGs""",2025-06-26 19:14:01
pcgaming,2025,6,System Shock 2: 25th Anniversary Remaster - Another Nightdive Studios Triumph,2025-06-26 19:04:11
pcgaming,2025,6,"We just launched our cozy farm & cafe management that sits on the bottom your screen.  ""Not Monday Cafe""",2025-06-26 19:00:37
pcgaming,2025,6,My greatest achievement in gaming-Mafia (2002). What's yours?,2025-06-26 18:58:31
pcgaming,2025,6,"What game did you go into with low expectations, but ended up really getting into?",2025-06-26 18:53:05
pcgaming,2025,6,If you were going to upgrade your monitor...,2025-06-26 18:15:08
pcgaming,2025,6,Forgotten Seas — High Seas Survival — Major Summer Update,2025-06-26 17:49:46
pcgaming,2025,6,Erulean Angel: Fantasy Commander --- upcoming Grand Strategy RPG,2025-06-26 17:13:10
pcgaming,2025,6,Steam Summer Sale 2025: Official Trailer,2025-06-26 17:07:42
pcgaming,2025,6,Why would you prefer PC over a console if you intend to play mainstream multiplayer?,2025-06-26 17:02:49
pcgaming,2025,6,Steam Summer Sale 2025 begins today,2025-06-26 16:59:59
pcgaming,2025,6,Abiotic Factor - Release Date Trailer,2025-06-26 16:45:41
pcgaming,2025,6,Death Trash - The Perished City,2025-06-26 16:43:09
pcgaming,2025,6,"NVIDIA's Exploitation | Waste of Sand RTX ""5050"" for $250",2025-06-26 16:11:21
pcgaming,2025,6,American Truck Simulator - Iowa Video Trailer,2025-06-26 15:56:52
pcgaming,2025,6,What are your unpopular PC gaming opinions?,2025-06-26 15:47:20
pcgaming,2025,6,Power Network Tycoon - Nuclear Endgame Content Out Now - Update Release Trailer,2025-06-26 13:39:49
pcgaming,2025,6,The Rogue Prince of Persia: Our last update before 1.0 is out now! Quality of Life features & reworks!,2025-06-26 13:32:41
pcgaming,2025,6,"Games run faster on SteamOS than Windows 11, Ars testing finds",2025-06-26 13:12:56
pcgaming,2025,6,Chained Echoes - Ashes of Elrant will release 7th of August,2025-06-26 13:00:37
pcgaming,2025,6,Peak has sold 2 million copies in 9 days: THANK YOU + WHAT'S NEXT FOR PEAK,2025-06-26 12:11:15
pcgaming,2025,6,"Warhammer 40,000: Space Marine 2 - Patch Notes 8.0 - Siege Update",2025-06-26 12:10:26
pcgaming,2025,6,System Shock 2: 25th Anniversary Remaster is now available on Steam,2025-06-26 12:02:45
pcgaming,2025,6,Safer gaming is a cornerstone of the digital safety movement. Here's how to achieve it,2025-06-26 11:15:53
pcgaming,2025,6,Banished Stone - Retro-Inspired ARPG that stole two years of my life from me launches today!,2025-06-26 10:56:03
pcgaming,2025,6,Check out this hilarious indie about a robot reporter working for a sci-fi newspaper,2025-06-26 10:11:40
pcgaming,2025,6,25th Anniversary of Deus Ex - Message from Warren Spector,2025-06-26 08:19:59
pcgaming,2025,6,The global version of Persona 5: The Phantom X is now available on Steam,2025-06-26 06:17:55
pcgaming,2025,6,I feel like we need to start a discourse about pcgamer.,2025-06-26 05:45:12
pcgaming,2025,6,Pc gamepass vs steam UI differences,2025-06-26 04:54:33
pcgaming,2025,6,What does “Stop Destroying Videogames” actually look like?,2025-06-26 03:01:46
pcgaming,2025,6,George Broussard: News has reported imminent Xbox layoffs but I'm hearing internal developer stuff where people at most studios are anxious and worried. Word that entire studios may be shuttered. Expectation is 1000-2000 people.,2025-06-26 02:12:18
pcgaming,2025,6,EVERYBODY'S GOLF HOT SHOTS – Overview Trailer,2025-06-26 01:20:50
pcgaming,2025,6,Ten Years Later - Still Going Strong: Dying Light: Retouched Update Releasing June 26,2025-06-26 01:18:37
pcgaming,2025,6,"FTC issues $126 million in Fortnite refunds, gives eligible players an extra 2 weeks to apply for their money back",2025-06-25 22:23:48
pcgaming,2025,6,New Nuclear Throne beta build available now,2025-06-25 22:00:55
pcgaming,2025,6,Humble Choice price increase ($14.99/month or $154.99/year USD),2025-06-25 21:33:17
pcgaming,2025,6,No Rest for the Wicked - The Breach Refined,2025-06-25 20:35:21
pcgaming,2025,6,Runescape 3 is removing microtransactions.,2025-06-25 20:17:57
pcgaming,2025,6,Stalker 2's Modding Tools Require 700 GB Of Space,2025-06-25 17:18:44
pcgaming,2025,6,Devlog #3 - The Abyss Life - The Path Into The Abyss - Argentinian indie game.,2025-06-25 17:10:19
pcgaming,2025,6,"Epic Games to pay $126 million in refunds to Fortnite players, FTC announces",2025-06-25 17:08:38
pcgaming,2025,6,"The Expanse: Osiris Reborn Will Take Cues From Mass Effect, Souls Games and More",2025-06-25 15:59:56
pcgaming,2025,6,DCS Summer Sale 2025,2025-06-25 15:45:46
pcgaming,2025,6,Has community perception changed on frame generation?,2025-06-25 14:01:01
pcgaming,2025,6,Senua’s Saga: Hellblade II Enhanced Arrives August 12,2025-06-25 13:04:01
pcgaming,2025,6,S.T.A.L.K.E.R. 2: Shadow of Chornobyl — Guns & Looting Showcase | Patch 1.5,2025-06-25 11:50:08
pcgaming,2025,6,Square Enix Will Make More Turn-Based Games and Recognize Success of Clair Obscur: Expedition 33,2025-06-25 11:27:57
pcgaming,2025,6,"S.T.A.L.K.E.R. 2: Heart of Chornobyl - Patch 1.5 Guns & Looting is live — new threats, new loot, and more - Steam News",2025-06-25 11:14:09
pcgaming,2025,6,Story Time: Making a game about the notorious Milgram experiment and got a DMCA takedown by his surviving daughter,2025-06-25 07:42:29
pcgaming,2025,6,Delta Force vs. Arena Breakout – Are you still extracting with DF or have you jumped ship like me?,2025-06-25 07:27:44
pcgaming,2025,6,"Tech Support and Basic Questions Thread - June 25, 2025",2025-06-25 05:00:31
pcgaming,2025,6,Helldivers 2 : HEROES Charity Fundraiser & Auction!,2025-06-24 21:30:25
pcgaming,2025,6,GodsTV -  A Fame Show Arena Roguelike,2025-06-24 21:25:22
pcgaming,2025,6,Katanaut - Gameplay Trailer,2025-06-24 21:18:46
pcgaming,2025,6,The Most Profitable Business: Cults,2025-06-24 21:03:44
pcgaming,2025,6,"Video games calm the body after stress, even when players feel on edge - physiological stress indicators decreased while participants were playing the video game A Plague Tale: Requiem, regardless of which part of the game they were playing.",2025-06-24 20:08:42
pcgaming,2025,6,Little Nightmares III | The Carnevale | 10-minute Gameplay Walkthrough,2025-06-24 19:29:16
pcgaming,2025,6,Little Nightmares III – You're in for a Ride,2025-06-24 19:07:45
pcgaming,2025,6,"Steam Updates to Store Page Asset Management: Better localization support, alt text for accessibility, and updated workflow for asset overrides",2025-06-24 19:04:54
pcgaming,2025,6,Little Nightmares Enhanced Edition on Steam,2025-06-24 19:03:45
pcgaming,2025,6,Crosswind - a pirate survival adventure - Alpha test trailer,2025-06-24 18:06:59
pcgaming,2025,6,Peak devs say the hit comedy climber was pitched in a Swedish hot tub and developed in a frantic 4-week Korean game jam: 'We brought our computers to an Airbnb in Hongdae and locked tf in for a month',2025-06-24 16:12:49
pcgaming,2025,6,From studio closure to indie debut - The Shadow Beneath - Announcement,2025-06-24 15:38:53
pcgaming,2025,6,DF Direct Weekly #219: Neural Texture Compression improvements detailed,2025-06-24 15:14:04
pcgaming,2025,6,Jurassic World Evolution 3: We have opted to remove the use of generative AI for scientist portraits within Jurassic World Evolution 3.,2025-06-24 15:02:50
pcgaming,2025,6,What Is Up With Japanese Devs Refusing To Make COOP Gaming Seamless ?,2025-06-24 14:25:06
pcgaming,2025,6,"Lex Imperialis Release Trailer | Warhammer 40,000: Rogue Trader",2025-06-24 14:24:52
pcgaming,2025,6,Police Stories 2 Reveal Trailer,2025-06-24 14:20:24
pcgaming,2025,6,Microsoft Plans Major Job Cuts at Xbox Gaming Division,2025-06-24 13:49:47
pcgaming,2025,6,Chicken Run: Eggstraction | Announce Trailer,2025-06-24 13:22:41
pcgaming,2025,6,Cyberpunk2077 One of the best campaigns.,2025-06-24 13:11:53
pcgaming,2025,6,"The developers for Black Orchestra Worldfront: 37-54, an ambitious free mod for Rising Storm 2 Vietnam that aims to add the Pacific, Western, Mediterranean and Eastern fronts of World War 2 to the game (AND MORE!) have released an update video! The mod is feature complete!",2025-06-24 12:13:17
pcgaming,2025,6,Gaming while female: What's keeping women out of the video game world,2025-06-24 12:01:52
pcgaming,2025,6,Now that layoffs have been confirmed at MindsEye Developer Build A Rocket Boy I hope that some of the devs come out and say why it failed so badly.,2025-06-24 11:55:27
pcgaming,2025,6,"Ok, we need to talk about how Steam purposefully festers toxic discourse on their forums (Jester awards)",2025-06-24 11:51:54
pcgaming,2025,6,Shards of the Realm — a game inspired by XCOM and Mount & Blade — is leaving Early Access soon,2025-06-24 11:24:42
pcgaming,2025,6,My fingers can’t use wasd well,2025-06-24 00:10:17
pcgaming,2025,6,Blue Archive - Notice of Delay in STEAM Client Launch Due to Platform Review Delays,2025-06-23 18:51:17
pcgaming,2025,6,A Difficult Update About Hytale,2025-06-23 18:27:34
pcgaming,2025,6,SteamWorld Dig is free to keep on Steam,2025-06-23 17:06:44
pcgaming,2025,6,GitHub - Avaneesh13/SteamDown: Python based application for auto shutdowns after downloads,2025-06-23 16:58:25
pcgaming,2025,6,NieR: Automata creator Yoko Taro says there are less “weird” people in the gaming industry nowadays,2025-06-23 16:46:24
pcgaming,2025,6,"PC gaming figures fall again in Germany, down to just 13.1 million — marking a 20% decline since 2019",2025-06-23 16:03:28
pcgaming,2025,6,The end of Stop Killing Games,2025-06-23 15:39:35
pcgaming,2025,6,Aggregated Gaming Library is Coming to the Xbox PC app,2025-06-23 15:08:05
pcgaming,2025,6,Some game mechanics surprise you so much they fill you with excitement.,2025-06-23 14:38:58
pcgaming,2025,6,Dune: Awakening Sales Reach 1m as Dev Shares Fun Stats,2025-06-23 14:28:55
pcgaming,2025,6,"Cyberpunk 2077: ""We initially hoped to put Update 2.3 in your hands on June 26. However, we'll need some more time to make sure we're happy with it - we're aiming for a scope similar to Update 2.2. We'll update you further as soon as we can""",2025-06-23 14:08:33
pcgaming,2025,6,Ragnarok Ascended Official Trailer,2025-06-23 14:08:29
pcgaming,2025,6,Playing total conversion mods without playing vanilla game?,2025-06-23 13:19:45
pcgaming,2025,6,Co-op Climbing Game Peak Hits 1m Sales in Less Than a Week,2025-06-23 12:57:07
pcgaming,2025,6,"For the .ini optimizers: Epic finally posted CVARS! I usually have to search through Unreal's source code (ugh), Reddit, forums, or maybe discord, but last night saw this:   https://dev.epicgames.com/documentation/en-us/unreal-engine/unreal-engine-console-variables-reference",2025-06-23 12:52:09
pcgaming,2025,6,"MindsEye Developer Build a Rocket Boy Begins Layoff Process Amid Disastrous Launch, Studio Sources Say",2025-06-23 12:39:30
pcgaming,2025,6,"Lies of P: Overture devs actually rewarded for making a solid DLC in rare industry W: Getting a bonus, 2 weeks vacation, and a free Switch 2",2025-06-23 11:03:44
pcgaming,2025,6,Run Like Hell - 10 Years later my small college project has become a full game,2025-06-23 10:22:19
pcgaming,2025,6,SAINT ROW 2 GOG GIVEAWAY,2025-06-23 08:06:22
pcgaming,2025,6,"""100% completing"" Balatro has developer better ""equipped"" to design the next big update",2025-06-23 04:15:56
pcgaming,2025,6,"What Are You Playing Thread - June 23, 2025",2025-06-23 04:01:32
pcgaming,2025,6,Anyone remember The Ship?,2025-06-23 03:12:48
pcgaming,2025,6,First Image of the Xbox Quest 3S Leaks Online,2025-06-23 01:56:09
pcgaming,2025,6,Suit For Hire is the ultimate shooter game,2025-06-23 00:25:16
pcgaming,2025,6,Games look better than ever. Next step is to make them feel alive and our character able to interact with more assets.,2025-06-22 23:38:58
pcgaming,2025,6,"If any of you are looking for a 3D platformer that really holds up, Tomb Raider Anniversary is a gem.",2025-06-22 19:46:30
pcgaming,2025,6,WOTD Early access and AMA,2025-06-22 15:29:53
pcgaming,2025,6,“Not every game is for every single person. Sometimes you have to pick a lane” - The Outer Worlds 2’s director on meaningful role-playing consequence and banning respec,2025-06-22 11:21:40
pcgaming,2025,6,What party game do you wish existed? (or had more players),2025-06-22 10:30:34
pcgaming,2025,6,Nexus FPV Carnage - Drone with a Railgun - Demo out now. A new kind of movement shooter with ‘Very Positive’ reviews,2025-06-22 09:38:34
pcgaming,2025,6,"Number Machine - Official Trailer, stylish factory automation game for nerds with numbers and math mechanics inspired by Opus Magnum",2025-06-22 06:26:18
pcgaming,2025,6,Here’s some steam keys I don’t need,2025-06-22 06:12:21
pcgaming,2025,6,"Tech Support and Basic Questions Thread - June 22, 2025",2025-06-22 05:00:47
pcgaming,2025,6,What kind of Steam achievements do you actually enjoy?,2025-06-22 03:29:10
pcgaming,2025,6,Sonic Racing: CrossWorlds - Kids' Choice Awards Trailer,2025-06-22 02:04:59
pcgaming,2025,6,The Blood of Dawnwalker - Official Gameplay Deep Dive Overview,2025-06-21 21:15:08
pcgaming,2025,6,Skill Based Match Making,2025-06-21 18:14:00
pcgaming,2025,6,Stellar Blade is a prime example of how PC ports should be done – ultrawide compatibility and stable performance are a must,2025-06-21 17:01:11
pcgaming,2025,6,Who's considered moving to console gaming?,2025-06-21 15:09:11
pcgaming,2025,6,What would it take to get Tremulous back?,2025-06-21 13:54:22
pcgaming,2025,6,Banquet for Fools - 3.0 Now available on the main branch!,2025-06-21 12:54:28
pcgaming,2025,6,The impossible (true) stories behind the making of Clair Obscur Expedition 33,2025-06-21 10:21:38
pcgaming,2025,6,"Weekend PC Game Deals: Rhythm bundles, fishing festivals, and DRM-free summer sales",2025-06-21 09:31:37
pcgaming,2025,6,"Anime dating sim that can prepare your taxes was removed from Steam but its developers say they want to disrupt corporations, not steal your social security number",2025-06-21 08:29:20
pcgaming,2025,6,Little Fighter 2 Remastered trailer (19 July launch on Steam),2025-06-21 07:45:52
pcgaming,2025,6,3dSen leaves Early Access after 5 years,2025-06-21 03:57:44
pcgaming,2025,6,"ARK ascended introduces new building blueprint and skill tree systems into game, locks them behind paid season pass",2025-06-21 03:21:16
pcgaming,2025,6,"An honest ""review"" of Escape from Tarkov, as someone with a job",2025-06-21 02:23:45
pcgaming,2025,6,Mario Kart 64 unofficial PC port is now available,2025-06-21 00:40:21
pcgaming,2025,6,Fangs of Asterkarn Development Update - June 2025 - Development Updates,2025-06-20 22:29:18
pcgaming,2025,6,Hypnospace Outlaw follow up has been cancelled,2025-06-20 22:26:28
pcgaming,2025,6,Metaphor: ReFantazio Surpasses Two Million Units Sold Worldwide,2025-06-20 21:54:50
pcgaming,2025,6,[BOT.VINNIK Chess Masters Academy] We spent 3 years turning a simple idea into an immersive retro-futuristic chess puzzle game. Trailer and Steam page now live!,2025-06-20 20:52:44
pcgaming,2025,6,Suit for Hire has left Early Access on Steam,2025-06-20 18:14:12
pcgaming,2025,6,Comfy Girl: Lofi Companion Is Bringing a Warm Hug to Steam,2025-06-20 17:59:34
pcgaming,2025,6,FBC: Firebreak - Launch Week Update,2025-06-20 16:38:16
pcgaming,2025,6,"Monster Hunter Wilds game reviews hit ""Overwhelmingly Negative"" on Steam - lack of substantial end-game content, optimization on PC remains poor after several months",2025-06-20 15:57:33
pcgaming,2025,6,Still Wakes The Deep developer The Chinese Room has seemingly made a small number of layoffs,2025-06-20 14:40:20
pcgaming,2025,6,"Wildaria Update: New Lighting, Water & 7 new Pets!",2025-06-20 14:14:03
pcgaming,2025,6,"Over 1,500 Minecraft Players Infected by Java Malware Disguised as Mods on GitHub",2025-06-20 13:28:35
pcgaming,2025,6,Gaming hasn’t been hitting the same in the last couple of years…,2025-06-20 13:22:12
pcgaming,2025,6,"GOG says it won't repeat its ill-fated Daggerfall GOG Cut with its new one-click modding program, not least because it can send more than one message a day to modders now",2025-06-20 12:58:40
pcgaming,2025,6,"Proton 10.0-2 gets a Release Candidate for gaming on Linux, SteamOS and Steam Deck",2025-06-20 12:50:18
