subreddit,year,month,text,created_utc
leagueoflegends,2025,7,PBE account,2025-07-10 21:01:39
leagueoflegends,2025,7,Low framerate since new map (Summoners Rift and ARAM),2025-07-10 21:01:01
leagueoflegends,2025,7,Winning top without jungler,2025-07-10 20:57:26
leagueoflegends,2025,7,LTA North Split 3 Primer,2025-07-10 20:56:47
leagueoflegends,2025,7,Could Pro Play consider pick / side selection next season,2025-07-10 20:15:44
leagueoflegends,2025,7,Emerald-Diamond Support main switching to ADC,2025-07-10 19:52:23
leagueoflegends,2025,7,"CloudTemplar's T1vGENG MSI review ""This is why we love League""",2025-07-10 19:52:08
leagueoflegends,2025,7,Beginner friendly?,2025-07-10 19:52:07
leagueoflegends,2025,7,Pinging stats in chat,2025-07-10 19:39:07
leagueoflegends,2025,7,LP Refund for trolls on your team,2025-07-10 18:55:24
leagueoflegends,2025,7,Just dropped a new insane trist video its fire,2025-07-10 18:53:29
leagueoflegends,2025,7,Is there gonna be an MSI finals watch party in Los Angeles?,2025-07-10 18:41:34
leagueoflegends,2025,7,Esports vertical stream elements for regular stream,2025-07-10 18:20:03
leagueoflegends,2025,7,How to move on from bot games?,2025-07-10 18:11:20
leagueoflegends,2025,7,In game 5 between GEN and T1 two team fight decisions created a gold swing of 5k in just over 2 minutes,2025-07-10 18:00:04
leagueoflegends,2025,7,I really miss old Rakan,2025-07-10 17:59:19
leagueoflegends,2025,7,Low Orange Essence in Battle Pass,2025-07-10 17:57:12
leagueoflegends,2025,7,Blossom & Blade - EMEA ARAM Challenge,2025-07-10 17:55:36
leagueoflegends,2025,7,MSI champ select game 5 bgm,2025-07-10 17:51:00
leagueoflegends,2025,7,Question about T1 / MSI placements (spoilers for results).,2025-07-10 17:43:55
leagueoflegends,2025,7,When will WASD movement release,2025-07-10 17:32:48
leagueoflegends,2025,7,Azir can spot invisible champ,2025-07-10 17:32:32
leagueoflegends,2025,7,Genuine Question: Has the community gotten better?,2025-07-10 17:25:21
leagueoflegends,2025,7,"Looking for friends to play Clash, Ranked, ARAM - EUW",2025-07-10 17:24:35
leagueoflegends,2025,7,How bad is Vayne right now?,2025-07-10 17:19:35
leagueoflegends,2025,7,MSI 2025 Signature,2025-07-10 17:00:43
leagueoflegends,2025,7,Aram guess the rank )),2025-07-10 16:57:37
leagueoflegends,2025,7,"BLG Bin: ""Even if none of them believe in us, we should trust ourselves. Back in 2023, many people underestimated BLG, but we were still able to make it to finals. We did it then, so why couldn’t we do it again this time? [...] I have confidence that I can win any given game against any opponent""",2025-07-10 16:54:31
leagueoflegends,2025,7,my teammates are always bots,2025-07-10 16:41:35
leagueoflegends,2025,7,How to fix the gatcha system,2025-07-10 16:37:12
leagueoflegends,2025,7,Smurfs should be hated more.,2025-07-10 16:03:23
leagueoflegends,2025,7,Never Seen This Border Before,2025-07-10 15:58:48
leagueoflegends,2025,7,Sources: Ghost set to come out of retirement and join Estral Esports in Liga Regional Norte,2025-07-10 15:40:27
leagueoflegends,2025,7,Fizz ARENA peak gameplay,2025-07-10 15:39:21
leagueoflegends,2025,7,How life is going lately (I'm the Zac),2025-07-10 15:30:25
leagueoflegends,2025,7,Would you use AI coaching + matchmaking for LoL? (Working on a new tool – feedback wanted!),2025-07-10 15:29:55
leagueoflegends,2025,7,Who are your favorite 10 champions and honorabke mention? Give reasoning for the #1 and the  honorable mention,2025-07-10 15:28:29
leagueoflegends,2025,7,"AL Shanks: ""My past hasn’t been great, but to succeed, you have to go through failure. I’ve taken many hits in my career, but right now, I have only one goal: make it to finals"" [...] It's hard not to like Faker as a pro. He’s the greatest in all of esports. I just wanna be myself when I face him""",2025-07-10 15:01:17
leagueoflegends,2025,7,"Little reminder that if you bought chromas during Essence Emporium, you can buy the bundle to get the Ruby chroma at the same price as a regular chroma",2025-07-10 14:56:19
leagueoflegends,2025,7,Pick Me Up League Meme !?,2025-07-10 14:48:38
leagueoflegends,2025,7,Lost media - League of legend card game on android,2025-07-10 14:42:18
leagueoflegends,2025,7,The bounty system has a major flaw,2025-07-10 14:36:14
leagueoflegends,2025,7,[ENGSUB] Chovy catching up with Quad,2025-07-10 14:33:53
leagueoflegends,2025,7,What should I do?,2025-07-10 14:15:02
leagueoflegends,2025,7,Why isn’t Azir played as a Bot Lane Carry?,2025-07-10 14:11:00
leagueoflegends,2025,7,What do you think of finishers?,2025-07-10 14:05:14
leagueoflegends,2025,7,most popular mouse used by pros in 2025,2025-07-10 13:45:25
leagueoflegends,2025,7,End of year icon (ranked),2025-07-10 13:41:41
leagueoflegends,2025,7,Has anyone genuinely tried flipping the roles?,2025-07-10 13:36:53
leagueoflegends,2025,7,Champion Pool Low Elo,2025-07-10 12:39:41
leagueoflegends,2025,7,Would 1 day of full unrestricted toxicity reduce toxicity?,2025-07-10 12:23:15
leagueoflegends,2025,7,Looking for help,2025-07-10 12:12:07
leagueoflegends,2025,7,Why Did Faker Go Grasp Viktor Instead of Burst?,2025-07-10 11:45:27
leagueoflegends,2025,7,League characters inspired by LOTR ?,2025-07-10 11:18:48
leagueoflegends,2025,7,More Rune pages,2025-07-10 11:12:16
leagueoflegends,2025,7,New Player Looking for champions,2025-07-10 11:09:36
leagueoflegends,2025,7,"Peaked Emerald, now hardstuck Silver — what happened to me?",2025-07-10 10:53:07
leagueoflegends,2025,7,Do you get more exp by playing non-ranked games?,2025-07-10 10:38:21
leagueoflegends,2025,7,Opinion on tanks,2025-07-10 10:23:33
leagueoflegends,2025,7,Gen.G vs T1 Hupu Rating & Comments - MSI 2025 - Upper Bracket Finals,2025-07-10 09:48:40
leagueoflegends,2025,7,Ally champions can now body block enemy auto attacks. Whos WR is going up/down or would nothing change?,2025-07-10 09:37:32
leagueoflegends,2025,7,A question about bounties,2025-07-10 08:47:03
leagueoflegends,2025,7,"MSI is in North America, double elim format is great, the time zone is perfect for the US, the series have been amazing and FlyQuest showed up huge. If this doesn't re-ignite the player base numbers in NA, nothing ever will.",2025-07-10 08:25:31
leagueoflegends,2025,7,Why does league not encourage playing with friends?,2025-07-10 07:37:13
leagueoflegends,2025,7,Hextech chests have been treating me good this year.,2025-07-10 07:20:33
leagueoflegends,2025,7,Caedrel interviews Chovy,2025-07-10 07:05:14
leagueoflegends,2025,7,[PBE datamine] 2025 July 9: patch preview and Guardian,2025-07-10 07:03:56
leagueoflegends,2025,7,The best way to deal with pure int (joke),2025-07-10 06:26:22
leagueoflegends,2025,7,Mythic Shop Selection,2025-07-10 05:53:14
leagueoflegends,2025,7,What’s your all-time Western LoL team?,2025-07-10 05:23:20
leagueoflegends,2025,7,MSI tailgate,2025-07-10 05:08:01
leagueoflegends,2025,7,Gen.G vs. T1 / MSI 2025 - Upper Bracket Finals / Post-Match Discussion,2025-07-10 04:32:32
leagueoflegends,2025,7,"Mid has an AD problem, and Yone has a frustration and a reliability problem",2025-07-10 04:09:39
leagueoflegends,2025,7,Absolute Clutch teamfight out of the 5 man pit,2025-07-10 03:27:18
leagueoflegends,2025,7,My new teemo skin (tattoo),2025-07-10 02:59:40
leagueoflegends,2025,7,FLY vs BLG: all first clear jungle paths,2025-07-10 02:57:49
leagueoflegends,2025,7,SSG is the only team to ever eliminate T1 from worlds and win their next pro match.,2025-07-10 02:37:15
leagueoflegends,2025,7,MSI Aurora Emote Drop,2025-07-10 02:30:27
leagueoflegends,2025,7,Any way to get reminders to do pickems?,2025-07-10 01:44:20
leagueoflegends,2025,7,Inspired Game 4 v BLG,2025-07-10 01:37:19
leagueoflegends,2025,7,Champions with a traditional ult that is not their strongest ability,2025-07-10 01:31:12
leagueoflegends,2025,7,"NAmen | FLY Massu: ""When we scrimmed [GEN, T1, and AL], all of us were doing pretty well. We were doing well individually, and we were doing well as a team. We had no reason to think [we couldn’t] beat anyone — because we were beating everyone as much as they were beating us in scrims.""",2025-07-10 00:34:46
leagueoflegends,2025,7,New player - Is this really the battle pass system here?,2025-07-10 00:13:24
leagueoflegends,2025,7,League needs to push balance more towards individual agency again,2025-07-10 00:10:15
leagueoflegends,2025,7,Nexus finishers,2025-07-09 23:37:14
leagueoflegends,2025,7,What are some adjustments to the current fearless format that you'd like to see?,2025-07-09 23:28:21
leagueoflegends,2025,7,Fearless drafting regarding BLG vs FLY Game 5,2025-07-09 23:23:58
leagueoflegends,2025,7,When urf 2025,2025-07-09 23:21:03
leagueoflegends,2025,7,Swiftplay Tactic/Abuse,2025-07-09 23:07:06
leagueoflegends,2025,7,2025 Mid Season Invitational / Bracket Stage / Upper Bracket Finals / Live Discussion,2025-07-09 23:00:37
leagueoflegends,2025,7,Whoever wins today should …,2025-07-09 22:45:30
leagueoflegends,2025,7,What happened here?,2025-07-09 22:42:09
leagueoflegends,2025,7,Nautilus Q everyone,2025-07-09 22:33:16
leagueoflegends,2025,7,Should I quit if I can't improve?,2025-07-09 22:05:23
leagueoflegends,2025,7,Losers queue,2025-07-09 22:03:20
leagueoflegends,2025,7,Is Udyr this good or just bot lobby?,2025-07-09 20:58:57
leagueoflegends,2025,7,Poro on head in ARAM?,2025-07-09 20:47:17
leagueoflegends,2025,7,fix the game not showing up after champ select,2025-07-09 20:41:34
leagueoflegends,2025,7,"Enchanter Only Players, When Smurfing What Do Your Win Rates Look Like?",2025-07-09 20:33:56
leagueoflegends,2025,7,Technical Issue: Cant cancel my quick cast with indicator,2025-07-09 20:12:31
leagueoflegends,2025,7,Quad admits the Zilean pick — also predicts Gen.G win,2025-07-09 19:55:44
leagueoflegends,2025,7,Why tf does Diana keep getting buffed for jungle?,2025-07-09 19:47:28
leagueoflegends,2025,7,League does not concern themselves with reports anymore?,2025-07-09 19:46:09
leagueoflegends,2025,7,Hello! Any Discord Channels here for Beginners like me getting into the game? Trying to find people to queue together,2025-07-09 19:25:20
leagueoflegends,2025,7,Help a noob,2025-07-09 19:18:48
leagueoflegends,2025,7,"Ruler: 'This is my second experience playing NA solo queue, it's really bad. I cannot find any motive or drive to play solo queue, but when I'm playing I can tell everyone is trying really hard and they never forfeit, which also makes it a struggle. They're always doing their best.'",2025-07-09 19:15:18
leagueoflegends,2025,7,"It’s not pretty but a penta is a penta, right?",2025-07-09 18:56:47
leagueoflegends,2025,7,Riven/teemo clip?,2025-07-09 18:46:03
leagueoflegends,2025,7,Could Lux be good as jungle?,2025-07-09 18:26:25
leagueoflegends,2025,7,Notification won‘t disappear,2025-07-09 18:22:18
leagueoflegends,2025,7,MSI 10 July,2025-07-09 18:21:15
leagueoflegends,2025,7,How to report an account that messaged you?,2025-07-09 18:12:30
leagueoflegends,2025,7,Rankup - LoL Discord bot,2025-07-09 18:09:15
leagueoflegends,2025,7,"GEN Chovy: ""When I was young, I couldn’t have imagined myself being this successful [...] AL are the most likely to make it to finals. They’re the ones we’re watching out for the most [...] When it’s I'm playing officials, I have to be locked in and serious. And when it’s not, I can have more fun""",2025-07-09 18:00:07
leagueoflegends,2025,7,Jungle invade help,2025-07-09 17:54:06
leagueoflegends,2025,7,why is league soo bad at matchmaking?,2025-07-09 17:52:07
leagueoflegends,2025,7,Primetime Draven voicelines wont play,2025-07-09 17:22:21
leagueoflegends,2025,7,shitty morde q,2025-07-09 17:19:42
leagueoflegends,2025,7,Why don’t we see ADCs played mid more often?,2025-07-09 17:16:10
leagueoflegends,2025,7,Most Optimal Way to Use Knights Vow,2025-07-09 17:01:22
leagueoflegends,2025,7,The Collector is unhealthy,2025-07-09 16:59:16
leagueoflegends,2025,7,Spirit Blossom Morgana Unfinished And Underdeveloped? An In-Depth Look,2025-07-09 16:52:14
leagueoflegends,2025,7,Why dodging system is so dumb,2025-07-09 16:51:09
leagueoflegends,2025,7,NIP announces: -Aki -Shanji -ppgod +Naiyou +Niket,2025-07-09 16:30:13
leagueoflegends,2025,7,"League of Legends Manual for Beginners and Beyond (Spanish Only, Sorry!) / Manual de League of Legends para principiantes y no tan principiantes (¡Solo en español, perdon!)",2025-07-09 16:24:46
leagueoflegends,2025,7,When to buy tier 3 boots,2025-07-09 16:19:05
leagueoflegends,2025,7,"Sources: Oscarinin remains with Fnatic, Wunder declined offer to join a six-man roster",2025-07-09 15:39:37
leagueoflegends,2025,7,What time do people usually arrive at MSI?,2025-07-09 15:28:16
leagueoflegends,2025,7,"CFO Driver: ""When I was backstage, I felt even more nervous. I was honestly praying to God that we would win [...] I’ve done so many dances, I’m starting to run out of ideas [...] I feel terrible when fans critique my singing. I'll do my best to improve, and hopefully soon, you'll hear me sing""",2025-07-09 14:56:04
leagueoflegends,2025,7,How is Yone? Broken or balanced?,2025-07-09 14:54:12
leagueoflegends,2025,7,Quitters and LP,2025-07-09 14:53:56
leagueoflegends,2025,7,ARAM Senna builds — which one are you running these days?,2025-07-09 14:52:17
leagueoflegends,2025,7,I might just be 60 years old playing LoL — old man hands is definitely a thing (I’m 22 btw),2025-07-09 14:38:42
leagueoflegends,2025,7,Open Amateur Esports Recruitment,2025-07-09 14:29:54
leagueoflegends,2025,7,2 bronze 4 players in my gold lobby?,2025-07-09 14:17:20
leagueoflegends,2025,7,Is banning 5 champs vs one player a sign of respect or disrespect?,2025-07-09 14:15:03
leagueoflegends,2025,7,Fastest way to earn BE?,2025-07-09 14:13:57
leagueoflegends,2025,7,[NA] PING150 Calling All Summoners Interested in Competitive & Organized Play!!,2025-07-09 14:13:56
leagueoflegends,2025,7,Diabolical ACE,2025-07-09 13:43:52
leagueoflegends,2025,7,"18,000 people still have perfect Pick'Ems with 4 series left",2025-07-09 13:33:07
leagueoflegends,2025,7,which dota 2 hero would be the most broken if transported into league?,2025-07-09 12:54:35
leagueoflegends,2025,7,Pentakill Timer until Respawn changed?,2025-07-09 12:50:21
leagueoflegends,2025,7,So LCK will POTENTIALLY have 6 teams in Worlds 2025 or am i just dumb?,2025-07-09 12:27:15
leagueoflegends,2025,7,Why it would be beneficial for Riot Games to implement Engagement Optimized Match Making ( EOMM ),2025-07-09 12:22:54
leagueoflegends,2025,7,"if the balance team want to nerf melee supports for pro, they should start by buffing tenacity",2025-07-09 12:00:57
leagueoflegends,2025,7,I dont see how winrate is a good indicator of how strong a champion is,2025-07-09 11:43:22
leagueoflegends,2025,7,Clutch PUSH. Nexus turret is literally finishing it's respawn animation,2025-07-09 11:37:00
leagueoflegends,2025,7,How much damage does unsealed spellbook smite actually do? And when do you have to smit together with your jungler?,2025-07-09 11:25:57
leagueoflegends,2025,7,Me and my friends tried to cook up a comp based on what we play,2025-07-09 11:20:46
leagueoflegends,2025,7,I miss OGN productions,2025-07-09 11:19:45
leagueoflegends,2025,7,Fastest Way to Get Lv.30 Guide (2025 Update),2025-07-09 11:19:07
leagueoflegends,2025,7,LoL feels more about solo picks than teamfights lately — is this just the current meta?,2025-07-09 11:03:01
leagueoflegends,2025,7,"Guys, I think I wanna see an Arcane Music Concert",2025-07-09 10:17:13
leagueoflegends,2025,7,Are there bots when you play with a champion for the first time?,2025-07-09 09:56:15
leagueoflegends,2025,7,Enhanced pointer persicion,2025-07-09 09:47:47
leagueoflegends,2025,7,Question for those of you who have attended this MSI,2025-07-09 09:29:59
leagueoflegends,2025,7,Why is emerald so depressing,2025-07-09 09:28:11
leagueoflegends,2025,7,Caliste's opinion of EU player's laziness (EN subtitles),2025-07-09 09:22:09
leagueoflegends,2025,7,Finally gold after being iron 4,2025-07-09 08:59:21
leagueoflegends,2025,7,Why does climbing ranks take so long?,2025-07-09 08:58:18
leagueoflegends,2025,7,How do you deal with throwing players / people who intentionally feed?,2025-07-09 08:57:12
leagueoflegends,2025,7,What is the point of Yuumi?,2025-07-09 08:34:48
leagueoflegends,2025,7,In hope of seeing GP against Galio in MSI,2025-07-09 08:06:07
leagueoflegends,2025,7,Genuine question: Why is the duo lane not in the middle of the map?,2025-07-09 07:53:41
leagueoflegends,2025,7,How often do you get your revenge?,2025-07-09 07:24:49
leagueoflegends,2025,7,Was this player a smurf?,2025-07-09 07:08:57
leagueoflegends,2025,7,Thoughts as a returning player after 10 year hiatus.,2025-07-09 07:07:37
leagueoflegends,2025,7,Is league going against you ?,2025-07-09 06:44:16
leagueoflegends,2025,7,Any tips for a new player?,2025-07-09 06:39:01
leagueoflegends,2025,7,FLY vs BLG HUPU Ratings & Comments - MSI 2025 - Lower Bracket Round 2,2025-07-09 06:22:28
leagueoflegends,2025,7,25.14 Full Patch Preview,2025-07-09 06:13:38
leagueoflegends,2025,7,MSI Vancouver Watchparties,2025-07-09 05:47:16
leagueoflegends,2025,7,Bwipo SETT GAMING,2025-07-09 05:18:56
leagueoflegends,2025,7,BLG vs. FLY Game 3 was an Absolute Cinema,2025-07-09 05:18:24
leagueoflegends,2025,7,Ban Phase Trick for Arena,2025-07-09 04:46:46
leagueoflegends,2025,7,Jeweled gauntlet arena,2025-07-09 04:39:49
leagueoflegends,2025,7,FlyQuest vs. Bilibili Gaming / MSI 2025 - Lower Bracket Round 2 / Post-Match Discussion,2025-07-09 04:34:48
leagueoflegends,2025,7,Esports icons?,2025-07-09 04:29:10
leagueoflegends,2025,7,First time at a tournament,2025-07-09 04:20:01
leagueoflegends,2025,7,Is there a good location to find flex queue teammates with Comms? The game just isnt fun in solo queue anymore,2025-07-09 03:36:01
leagueoflegends,2025,7,Yorick and other stat checkers shouldn't be allowed in pro play,2025-07-09 03:24:53
leagueoflegends,2025,7,Can't play ranked - EU maintenance?,2025-07-09 03:21:55
leagueoflegends,2025,7,This is what happens if no one votes in Arena,2025-07-09 02:45:14
leagueoflegends,2025,7,Who are meta objective-based jugglers? I play Viego and prioritise objectives and I'm always down CS.,2025-07-09 02:07:15
leagueoflegends,2025,7,Which animal is on this rock??,2025-07-09 01:41:50
leagueoflegends,2025,7,Unpopular View: Low elo games are very deterministic instead of being coinflips,2025-07-09 01:16:58
leagueoflegends,2025,7,So why are people locking in ADC Senna?,2025-07-09 00:39:45
leagueoflegends,2025,7,Maple possibly returning to professional play? Rumours abound in the LCP.,2025-07-09 00:39:20
leagueoflegends,2025,7,Cloudtemplar on western LOL (excerpt from recent MSI review),2025-07-09 00:24:55
leagueoflegends,2025,7,3D printed Jinx grenade.,2025-07-08 23:20:15
leagueoflegends,2025,7,2025 Mid Season Invitational / Bracket Stage / Round 2 Day 4 / Live Discussion,2025-07-08 23:01:02
leagueoflegends,2025,7,Disconnect Minute 2? - Every Game,2025-07-08 22:53:18
leagueoflegends,2025,7,is there a setting or something for riven Q to cast in direction of your cursor????,2025-07-08 22:28:32
leagueoflegends,2025,7,No more refunds for player sabotaging team feedback?,2025-07-08 22:07:23
leagueoflegends,2025,7,Does sylas ult apply malignance to enemy ult cooldown?,2025-07-08 21:33:28
leagueoflegends,2025,7,"For as long as I can remember, this river wall on SR has either been missing polygons, or they've just been transparent. So what gives? Is the absolute spandex tight, clearance level 5, art budget at Rye-bread so strict that rendering these textures will just collapse the office into a black hole?",2025-07-08 21:25:36
leagueoflegends,2025,7,"People in Montreal, what ping do you get?",2025-07-08 21:16:56
leagueoflegends,2025,7,The new chests you get from battlepass suck ass,2025-07-08 21:15:05
leagueoflegends,2025,7,Recently I can't spectate games my friends are playing.,2025-07-08 20:10:17
leagueoflegends,2025,7,"Dopa's take on ""rigged matchmaking""",2025-07-08 20:06:16
leagueoflegends,2025,7,[AL vs CFO] Galio ult bug?,2025-07-08 20:00:01
leagueoflegends,2025,7,Is this a rare skin?,2025-07-08 19:46:05
leagueoflegends,2025,7,"[PBE datamine] 2025 July 8: Braum, Fizz, Lee Sin, and more Arena changes",2025-07-08 19:42:37
leagueoflegends,2025,7,Token with an A?,2025-07-08 18:50:59
leagueoflegends,2025,7,Should I have clutched this double kill?,2025-07-08 18:27:34
leagueoflegends,2025,7,Opinion: Recieving both a dragon and Atakahn after winning a teamfight makes the game feel coinflippy,2025-07-08 18:22:09
leagueoflegends,2025,7,Wtf is this matchmaking ?,2025-07-08 18:19:49
leagueoflegends,2025,7,LOL me obligar a jugar un rol,2025-07-08 17:29:31
leagueoflegends,2025,7,What champion/first item combination is broken?,2025-07-08 17:24:11
leagueoflegends,2025,7,"FLY Bwipo: ""I joked about how in scrims, you play once, get fucked by an Asian team, and then the second block is stress relief, except you get fucked again [...] In Fearless, you can give Asian teams a broken-ass comp and lose in peace. You get fisted in 25 minutes and don't have to worry anymore""",2025-07-08 16:57:31
leagueoflegends,2025,7,All Girls League of Legends discord server,2025-07-08 16:51:39
leagueoflegends,2025,7,I made a subreddit for Arcane Vi!,2025-07-08 16:40:50
leagueoflegends,2025,7,Nemesis On  BrokenBlade's Olaf VS  Bin's  Renekton,2025-07-08 16:14:47
leagueoflegends,2025,7,"Why do people play bot lane solo, only to flame whomever their adc or sup?",2025-07-08 15:54:45
leagueoflegends,2025,7,"Thinking going to MSI on July 11 before the final, but will be late about 1 hour due to work",2025-07-08 15:46:13
leagueoflegends,2025,7,enemy bard knew exactly where I warded no matter how out of vision I was in this game.,2025-07-08 15:29:59
leagueoflegends,2025,7,Why am I getting full teams of fresh account smurfs in solo q games?,2025-07-08 15:22:24
leagueoflegends,2025,7,The matchmaking doesn’t “force” a 50% winrate,2025-07-08 15:20:37
leagueoflegends,2025,7,Somehow nobody cares that ranked has been ruined since the end of S13,2025-07-08 14:40:07
leagueoflegends,2025,7,"Idea for a ""high skill"" reaction speed based tank champion",2025-07-08 14:29:07
leagueoflegends,2025,7,The only Mel Video You Need to Watch,2025-07-08 13:38:19
leagueoflegends,2025,7,AL vs CFO - MSI 2025 - Lower Bracket Round 2,2025-07-08 13:25:57
leagueoflegends,2025,7,Caedrel's post match interview with Tabe,2025-07-08 13:23:57
leagueoflegends,2025,7,Ghoul jumps on Yorick E need to be moved to his Q,2025-07-08 13:17:07
leagueoflegends,2025,7,MSI caster speak too fast and often make no sense.,2025-07-08 13:15:19
leagueoflegends,2025,7,full AP builds on enchanter supports,2025-07-08 12:54:00
leagueoflegends,2025,7,Prime day RP?,2025-07-08 12:40:11
leagueoflegends,2025,7,Azir OTP as Iron/Bronze,2025-07-08 12:35:58
leagueoflegends,2025,7,I think Fearless is bad for the meta.,2025-07-08 12:03:51
leagueoflegends,2025,7,[Translation] CloudTemplar and Wadid's comments on the lackluster performance of the LEC: The value of learning to lane against the best and coaching staff's relationship to the players,2025-07-08 11:58:42
leagueoflegends,2025,7,Some Galio wall bumps I found,2025-07-08 11:54:23
leagueoflegends,2025,7,Maybe to OP,2025-07-08 11:02:32
leagueoflegends,2025,7,Faker turns 30 next year and is still Smurfing. Age means absolutely nothing if you're dedicated enough.,2025-07-08 10:58:04
summonerschool,2025,7,Wrong runes,2025-07-13 01:54:25
summonerschool,2025,7,Is there a quick guide anywhere on items?,2025-07-13 01:11:55
summonerschool,2025,7,Does top tower not one shot you any more when lane swapping?,2025-07-13 01:09:01
summonerschool,2025,7,Help with sidelaning as some mages.,2025-07-12 22:37:59
summonerschool,2025,7,akshan is underrated in arena,2025-07-12 20:59:35
summonerschool,2025,7,How to play trundle?,2025-07-12 18:10:24
summonerschool,2025,7,"Loading screen shows 35 ms and in game it goes to 60, need help.",2025-07-12 16:27:49
summonerschool,2025,7,Tips for playing lillia from behind?,2025-07-12 16:03:27
summonerschool,2025,7,How do you communicate (with your team) in solo queue?,2025-07-12 15:34:22
summonerschool,2025,7,VOD Review Request - Jax versus Poppy,2025-07-12 15:22:07
summonerschool,2025,7,How to remain loyal to one role,2025-07-12 13:33:34
summonerschool,2025,7,What does a mage with ignite like Zoe do after the landing phase?,2025-07-12 12:41:07
summonerschool,2025,7,"Regressing from Silver I to Bronze I, I need help",2025-07-12 12:37:56
summonerschool,2025,7,I keep getting invaded early and my laners don’t help — what should I do?,2025-07-12 12:31:50
summonerschool,2025,7,Why did Doran take Grasp on Gwen?,2025-07-12 12:28:49
summonerschool,2025,7,Corki vs Ezreal question,2025-07-12 09:30:21
summonerschool,2025,7,The difference between high elo jungle and low elo?,2025-07-12 09:24:37
summonerschool,2025,7,Learning to jungle is my hero pick hurting my learning,2025-07-12 08:39:52
summonerschool,2025,7,"Might not seem like a lot to everyone here, but after 203 games, I'm finally out of Iron!",2025-07-12 07:08:07
summonerschool,2025,7,How do I lane against a caitlyn?,2025-07-12 04:07:31
summonerschool,2025,7,Is locked camera really that bad? I sometimes get even dizzy from it,2025-07-12 03:03:04
summonerschool,2025,7,I am only good at one role,2025-07-12 03:02:09
summonerschool,2025,7,Learning items- are these good as neeko support?,2025-07-12 02:36:29
summonerschool,2025,7,Scaling champ Laning advice,2025-07-12 00:24:15
summonerschool,2025,7,What are the differences in thought process between low and high elos?,2025-07-11 17:57:21
summonerschool,2025,7,Winning lane makes me lose,2025-07-11 17:22:25
summonerschool,2025,7,Are boots that necessary for mage supports in low elo?,2025-07-11 15:31:01
summonerschool,2025,7,What to do when I can’t even contest the mid wave as adc?,2025-07-11 14:36:57
summonerschool,2025,7,How and when to proxy toplane?,2025-07-11 14:25:02
