subreddit,year,month,text,created_utc
summonerschool,2025,7,Buying Dark Seal in Mid,2025-07-11 11:01:31
summonerschool,2025,7,Any advice on my performance,2025-07-11 08:02:42
summonerschool,2025,7,really really need help at climbing,2025-07-11 03:41:37
summonerschool,2025,7,Advice for climbing out of bronze,2025-07-10 23:51:49
summonerschool,2025,7,What type of comps are there and how do you identify them?,2025-07-10 18:34:54
summonerschool,2025,7,Popularity of Mained Roles in Different Ranks,2025-07-10 16:24:45
summonerschool,2025,7,Laning with ranged supports vs engage,2025-07-10 14:22:31
summonerschool,2025,7,Question about Lux builds,2025-07-10 13:51:16
summonerschool,2025,7,Why do pro players pick kalista?,2025-07-10 05:19:13
summonerschool,2025,7,Don't ward against Pyke? Confused about interaction today,2025-07-10 04:41:54
summonerschool,2025,7,My biggest problem with mechanics,2025-07-10 04:38:58
summonerschool,2025,7,Is it normal to use attack move click as mb1,2025-07-09 23:34:51
summonerschool,2025,7,Game Plan for botlane mages,2025-07-09 15:37:00
summonerschool,2025,7,"Advice for a Iron mid player, playing Akali, Ahri and Orianna",2025-07-09 12:56:39
summonerschool,2025,7,Lethality builds,2025-07-09 10:23:49
summonerschool,2025,7,"Hardstuck Iron 4 Jungle, what are the fundamentals I am missing and need in order to rank up.",2025-07-09 04:47:19
summonerschool,2025,7,Attempting to learn Flash Timing.,2025-07-09 03:35:19
summonerschool,2025,7,Completely new to the game,2025-07-08 22:27:53
summonerschool,2025,7,What do I do as a Jungler when I am getting constantly invaded?,2025-07-08 22:06:39
summonerschool,2025,7,I need some help with sweeper/Teemo shroom question.,2025-07-08 20:52:44
summonerschool,2025,7,Coming back to Lol and Jungle,2025-07-08 16:56:14
summonerschool,2025,7,"Newer to the Game, Need Help With Reviewing",2025-07-08 16:40:37
summonerschool,2025,7,What DPI and Sensitivity do LoL players use?,2025-07-08 16:01:13
summonerschool,2025,7,Malphite Support?,2025-07-08 14:59:22
summonerschool,2025,7,What is the reason ADCs are bad junglers?,2025-07-08 12:38:03
summonerschool,2025,7,Organized 5v5 and Solo queue: What’s the difference?,2025-07-08 09:18:08
summonerschool,2025,7,I have seen in league different types of damages how many are there and which is their difference??,2025-07-08 08:27:53
summonerschool,2025,7,What's the difference between lethality and armor penetration??,2025-07-08 08:08:25
summonerschool,2025,7,When can I go roaming as support?,2025-07-08 03:34:38
summonerschool,2025,7,How to not move the camera back to base when recalling?,2025-07-08 02:43:27
summonerschool,2025,7,Can somebody please explain damage types and resistances to me,2025-07-08 02:30:42
summonerschool,2025,7,How do YOU deal with toxicity in ranked?,2025-07-08 02:16:00
summonerschool,2025,7,catch wave or join a play as midlane viktor?,2025-07-08 00:19:00
summonerschool,2025,7,What is the correct way to play a 2v2 bot to win the race to lvl 2?,2025-07-07 23:01:50
summonerschool,2025,7,Atakhan == win?,2025-07-07 20:03:49
summonerschool,2025,7,How can I avoid ranked restrictions as a new player trying his best but can't hold his tongue,2025-07-07 19:27:48
summonerschool,2025,7,whats the correct way to avoid face checking bushes?,2025-07-07 19:22:21
summonerschool,2025,7,What does explain the discrepancy between the ad of base values + Items and the actual values in the game?,2025-07-07 17:44:25
summonerschool,2025,7,Why are multiple ap comps bad?,2025-07-07 17:10:41
summonerschool,2025,7,Who is individually tankier? 40 minute Ornn or 40 minute Sion?,2025-07-07 15:08:08
summonerschool,2025,7,First Strike value and reference points,2025-07-07 14:19:25
summonerschool,2025,7,Off meta-picks?,2025-07-07 04:25:56
summonerschool,2025,7,Why are ranged junglers so rare?,2025-07-07 02:24:16
summonerschool,2025,7,Why does it seem like CS is so much lower across the board than it used to be?,2025-07-07 01:24:28
summonerschool,2025,7,Alternatives to ryze?,2025-07-06 21:52:36
summonerschool,2025,7,What to do in this situation? Dive or not?,2025-07-06 21:45:49
summonerschool,2025,7,How is Viktor For Solo Queue?,2025-07-06 21:16:09
summonerschool,2025,7,"As a jhin, how do I play into a soraka support?",2025-07-06 20:41:10
summonerschool,2025,7,how to start league over as a jungle player,2025-07-06 20:10:49
summonerschool,2025,7,The splitpush question,2025-07-06 18:40:35
summonerschool,2025,7,How can I have a fair game as a complete beginner ?,2025-07-06 16:06:26
summonerschool,2025,7,Swiftplay questions,2025-07-06 15:54:44
summonerschool,2025,7,Roaming always feels like a loss — how do you evaluate whether it was worth?,2025-07-06 13:29:03
summonerschool,2025,7,How to farm against Gwen or Mordekaiser when playing melee champion?,2025-07-06 12:36:51
summonerschool,2025,7,What do you guys look for in a VOD?,2025-07-06 10:20:34
summonerschool,2025,7,How to counter sylas?,2025-07-06 09:26:50
summonerschool,2025,7,Hey guys I'm a Twisted Fate onetrick and while I plan on onetricking Twisted Fate for a long time I had some ideas for different champions I could learn later down the line that could seemingly be easier to transfer some skills for a champion pool so I wanted some help on how to navigate my thoughts,2025-07-06 05:09:13
summonerschool,2025,7,Bad internet connection. What can I do to (effectively) practice until it’s fixed?,2025-07-06 04:48:29
summonerschool,2025,7,On hit question,2025-07-06 00:42:26
summonerschool,2025,7,Macro in low elo,2025-07-05 22:36:24
summonerschool,2025,7,How to actually improve on your secondary roles?,2025-07-05 22:14:44
summonerschool,2025,7,First Dragon Prioritization?,2025-07-05 21:13:31
summonerschool,2025,7,How do I beat Ekko as Vex?,2025-07-05 20:26:36
summonerschool,2025,7,i need some help with my league settings please read the body text!,2025-07-05 09:36:19
summonerschool,2025,7,How to actually deal with backdoor/split pusher?????,2025-07-05 03:35:19
summonerschool,2025,7,Why do we max skills rather than spread skill ups?,2025-07-04 20:59:31
summonerschool,2025,7,"I run a lot into a scenario as a toplaner that I win lane, spread my lead helping behind team to find my enemy top that afk farmed in a sidelane very strong and becomes a problem, what am I doing wrong?",2025-07-04 18:47:07
summonerschool,2025,7,Is it a crooked thought that i think i could cheat my way out of iron with support role?,2025-07-04 15:32:57
summonerschool,2025,7,Wave management: When should I freeze vs shove,2025-07-04 13:33:49
summonerschool,2025,7,I suck at league. need help 🙏🙏,2025-07-04 12:41:14
summonerschool,2025,7,How do you pick 2 roles?,2025-07-04 09:32:38
summonerschool,2025,7,"New Player Here, AND I AM STUMPED. IDK what im doing wrong.",2025-07-04 08:20:21
summonerschool,2025,7,Why am I having success with mid laners in the top lane and top laners in the mid lane?,2025-07-04 08:17:01
summonerschool,2025,7,I don’t understand how I’m winning,2025-07-04 06:26:31
summonerschool,2025,7,What to do in this exact scenario (Wave management)?,2025-07-04 06:19:25
summonerschool,2025,7,How to practice clone control?,2025-07-04 05:01:21
summonerschool,2025,7,I have a mental block against Ambessa,2025-07-04 04:56:32
summonerschool,2025,7,ADC Movement speed way to slow,2025-07-03 22:21:20
summonerschool,2025,7,"Ignite, the only good anti heal?",2025-07-03 22:08:15
summonerschool,2025,7,Why is Leona so hard to play in mid to high Elo?,2025-07-03 20:18:08
summonerschool,2025,7,What to do when playing against enemies who vastly outclass you?,2025-07-03 20:14:19
summonerschool,2025,7,"""Safest"" mid lane blind pick?",2025-07-03 15:36:01
summonerschool,2025,7,Trading deaths for farm,2025-07-03 14:42:13
summonerschool,2025,7,Use case for a bruiser midlane?,2025-07-03 10:55:23
summonerschool,2025,7,How do I get to the point where I stop following build guides?,2025-07-03 08:20:49
summonerschool,2025,7,Why is Irelia not an acceptable counter to Yorick in pro?,2025-07-03 03:42:32
summonerschool,2025,7,What does it mean to fall off?,2025-07-03 02:48:11
summonerschool,2025,7,Carry JG when our comp has no frontline,2025-07-03 02:20:40
summonerschool,2025,7,How Do You Stay Useful as ADC When Solo Laners Get Fed?,2025-07-03 01:12:01
summonerschool,2025,7,Strange bot lane combos,2025-07-03 00:00:26
summonerschool,2025,7,"(""Guide"") If you can´t improve your mechanics, you may be approaching it wrong",2025-07-02 23:30:04
summonerschool,2025,7,Hardstuck iron after 500 games played,2025-07-02 20:58:17
summonerschool,2025,7,(adc) what is the difference between average 7.2 cs/min and 8.7 cs/min?,2025-07-02 18:59:45
summonerschool,2025,7,Help me learn things while climbing -,2025-07-02 18:24:52
summonerschool,2025,7,First full item (kraken vs bork vs collector vs yuntal vs essence reaver). ADC context,2025-07-02 17:22:04
summonerschool,2025,7,General tips to handle chaotic games better?,2025-07-02 13:35:38
summonerschool,2025,7,ARAM player trying to learn line stage,2025-07-02 07:45:56
summonerschool,2025,7,"Why does Gangplank's Q count as ranged attack, but Poppy's passive count as melee attack, while Samira's entire kit is ranged despite her having melee attack animations?",2025-07-02 06:09:37
summonerschool,2025,7,Am I going to get steamrolled in ranked?,2025-07-02 01:54:33
summonerschool,2025,7,What’s with all the troll picks in Gold?,2025-07-02 00:57:37
summonerschool,2025,7,"I feel like top lane is 70+ % about matchup knowledge, how can I get better without just knowing every single matchup?",2025-07-01 23:02:24
summonerschool,2025,7,What happens when i take a stack of dark harvest exactly?,2025-07-01 20:29:09
summonerschool,2025,7,Who is a better late game scaler cho'gath or tank?,2025-07-01 20:00:50
summonerschool,2025,7,Someone explain the difference between AP and AD like I'm a child,2025-07-01 18:55:41
summonerschool,2025,7,How to win against Yorick,2025-07-01 17:28:36
summonerschool,2025,7,"Is ""S-Tier"" champions actually the best?",2025-07-01 17:17:05
summonerschool,2025,7,Question about anti heal,2025-07-01 10:17:47
summonerschool,2025,7,"I have 0 impact when playing ""correctly""",2025-07-01 08:40:03
summonerschool,2025,7,How do you know if a champ is AD or AP?,2025-07-01 07:10:37
summonerschool,2025,7,How to Improve as Lux,2025-07-01 05:28:13
summonerschool,2025,7,Is sundered sky just an outright weak item?,2025-07-01 04:38:36
summonerschool,2025,7,Why build bruiser items on Nocturne,2025-07-01 03:22:12
summonerschool,2025,6,How do you keep your mouse hand and arm while playing?,2025-06-30 20:36:46
summonerschool,2025,6,"""You need to bait their X before you can fight""",2025-06-30 17:33:25
summonerschool,2025,6,Selling boots late game,2025-06-30 15:48:55
summonerschool,2025,6,No progress after 70 games,2025-06-30 15:05:30
summonerschool,2025,6,Having a hard time stacking conqueror,2025-06-30 14:26:07
summonerschool,2025,6,Playing when behind and losing lane.,2025-06-30 14:00:38
summonerschool,2025,6,"How to prevent throws and end quickly, when very ahead?",2025-06-30 06:30:40
summonerschool,2025,6,Are there any website that show aggregated data for longer periods (1+ year)?,2025-06-30 05:12:40
summonerschool,2025,6,Need help with ranked,2025-06-30 03:45:34
summonerschool,2025,6,Learning Unlocked Cam,2025-06-30 02:42:19
summonerschool,2025,6,"Last serious game was 7 years ago, last played game was 3 years ago, planning to go back as a jungler (main role) what's the new meta and what do I need to know?",2025-06-30 02:10:33
summonerschool,2025,6,How do I deal with being stat checked the entire laning phase?,2025-06-29 21:46:48
summonerschool,2025,6,What shall i do when i'm playing mages and the enemy team has so many shields?,2025-06-29 20:25:25
summonerschool,2025,6,Bronze to Diamond 2 in 6 months,2025-06-29 20:22:38
summonerschool,2025,6,Wtf do I do into assassins?,2025-06-29 17:58:43
summonerschool,2025,6,"""Loses when behind"" macro tips",2025-06-29 15:11:21
summonerschool,2025,6,Ionian boots,2025-06-29 14:56:11
summonerschool,2025,6,Why do higher elo players delay/not finish their first item early on?,2025-06-29 14:19:21
summonerschool,2025,6,Best clash team comps? How to,2025-06-29 04:27:54
summonerschool,2025,6,Is apologizing to a tilted teammate worth it to save a ranked game?,2025-06-28 21:09:17
summonerschool,2025,6,I just made it gold with zero communications and no pings,2025-06-28 19:24:44
summonerschool,2025,6,Question regarding adc in team fight,2025-06-28 14:46:37
summonerschool,2025,6,Mechanics od healing potions and biscuits,2025-06-28 09:46:45
summonerschool,2025,6,"One of the most fun, unexpected, effective off-meta builds I've ever played (Tank Karthus Build).",2025-06-28 07:32:35
summonerschool,2025,6,How to climb out of plat/emerald?,2025-06-28 06:29:50
summonerschool,2025,6,Why low elo players don't buy anti heal?,2025-06-28 05:46:30
summonerschool,2025,6,Clash and Scrims champ pool,2025-06-27 23:05:46
summonerschool,2025,6,Can the passive healing from rod of ages be increased past the cap by using certain items and runes?,2025-06-27 19:17:20
summonerschool,2025,6,Teamplay on Top-lane,2025-06-27 17:55:52
summonerschool,2025,6,How exactly do you slow/fast push and freeze? And when do we do those things respectively?,2025-06-27 06:35:42
summonerschool,2025,6,What Elixir On Enchanters?,2025-06-26 16:32:59
summonerschool,2025,6,How to beat vayne (ADC)?,2025-06-26 12:28:18
summonerschool,2025,6,If I completely stomp lane should I stay top or should I roam?,2025-06-26 06:25:05
summonerschool,2025,6,What do I do in this situation?,2025-06-25 23:45:03
summonerschool,2025,6,"What is better, to win lane or fit your your team comp?",2025-06-25 22:24:18
summonerschool,2025,6,Few questions about csing and waves,2025-06-25 19:40:11
summonerschool,2025,6,Veteran player trying to hit Master from Support – should I 2-trick or stay flexible?,2025-06-25 15:22:29
summonerschool,2025,6,Control Wards? In general and as ADC,2025-06-25 06:09:34
summonerschool,2025,6,Kraken + BORK synergy,2025-06-25 04:53:59
summonerschool,2025,6,How to carry in low elo?,2025-06-25 01:58:33
summonerschool,2025,6,Need some help climbing with Yone and Yasuo.,2025-06-25 01:39:29
summonerschool,2025,6,Fed Kyle,2025-06-24 23:19:13
summonerschool,2025,6,Why/When would you run TP as an ADC?,2025-06-24 21:37:52
summonerschool,2025,6,"Were my macro decisions wrong? (baron over mid push, baron over elder fight)",2025-06-24 19:46:38
summonerschool,2025,6,How to actually learn how to itemize and judge certain builds?,2025-06-24 18:54:46
summonerschool,2025,6,When to take SF Top Lane?,2025-06-24 17:45:23
summonerschool,2025,6,Why is kaisa the number 1 picked adc in diamond to challenger,2025-06-24 14:19:51
summonerschool,2025,6,What to do if getting perma zoned off of cs to the point your enemy laner has twice as much cs by minute 15?,2025-06-24 12:37:15
summonerschool,2025,6,Should I attack laners as a jungler?,2025-06-24 11:40:16
summonerschool,2025,6,How to end games?,2025-06-24 10:43:54
summonerschool,2025,6,How to punish scaling champs at top lane?,2025-06-24 08:53:47
summonerschool,2025,6,how to carry tough games when being the only one ahead ( Jngl ),2025-06-24 01:53:10
summonerschool,2025,6,Why doesnt Mundo have a higher winrate? What keeps the champion balanced?,2025-06-23 23:53:49
summonerschool,2025,6,Setting micro-goals during game for improving,2025-06-23 19:52:34
summonerschool,2025,6,How to play Garen vs Teemo matchup?,2025-06-23 16:23:04
summonerschool,2025,6,"how do you see the difference between top and mid lane in terms of difficulty, decision-making, and impact?",2025-06-23 15:53:31
summonerschool,2025,6,Advice for a duo,2025-06-23 11:55:08
summonerschool,2025,6,Recall timers,2025-06-23 10:03:53
summonerschool,2025,6,What to Do When a Teammate Stops Trying,2025-06-23 09:40:24
summonerschool,2025,6,Do I study high-elo VODs or matches played in my elo?,2025-06-23 09:05:27
summonerschool,2025,6,How do i teamfight with Juggernauts from behind?,2025-06-23 07:28:28
summonerschool,2025,6,Are there any useful resources for a returning (ex) high elo ADC player? Questions included in post.,2025-06-23 02:03:29
summonerschool,2025,6,How do i prevent infighting and promote team cooperation and coordination?,2025-06-23 01:06:57
summonerschool,2025,6,"If a jungler ganks and doesn't take a kill, is it good for him to take the wave of his laner or should all gold go towards the lane he ganked?",2025-06-22 23:32:54
summonerschool,2025,6,I Climbed from Bronze 4 to Emerald 4 this season with a 68% wr on 2 accounts (Thanks to help from this Sub),2025-06-22 22:51:33
summonerschool,2025,6,How to stabilize when behind on voli jgl,2025-06-22 20:25:04
summonerschool,2025,6,How to maximize learning watching challenger vods,2025-06-22 18:37:47
summonerschool,2025,6,5v5 competitive advice,2025-06-22 17:27:56
summonerschool,2025,6,How does turret aggro work for minions?(Last hitting),2025-06-22 13:11:59
summonerschool,2025,6,"Hello everyone, how long did it take you to reach whatever solo queue rank you’ve achieved, and how much of it were you just chilling and how much super tryharding?",2025-06-22 12:16:23
summonerschool,2025,6,Ward deep jungle or ward objective?,2025-06-22 09:41:55
summonerschool,2025,6,Brand jungle too weak?,2025-06-22 04:11:44
summonerschool,2025,6,How do I LEARN how to play the game correctly?,2025-06-22 00:15:36
summonerschool,2025,6,What are the Master+ 'rules of good engagement'?,2025-06-21 23:26:07
summonerschool,2025,6,What Are You Even Supposed To Do Against Fizz?,2025-06-21 22:46:07
summonerschool,2025,6,Looking for a more self-focused role – time to take a break from support,2025-06-21 14:58:10
summonerschool,2025,6,"Higher elo players (Emerald 2 & above), what do you enjoy about the game?",2025-06-21 12:39:29
summonerschool,2025,6,I climbed from Emerald 4 to Diamond 4 in 56 games after swapping to jungle. I was stuck for 450 games.,2025-06-21 03:36:31
summonerschool,2025,6,Do the ranks fit into noticeable skill brackets?,2025-06-21 02:29:33
summonerschool,2025,6,Any app to create custom rune pages for fast import?,2025-06-21 01:54:22
summonerschool,2025,6,Stuck in Iron IV - 0 LP (Support),2025-06-20 22:27:35
summonerschool,2025,6,How do you deal with Ranked Anxiety?,2025-06-20 14:36:43
summonerschool,2025,6,Adc players what do you do if you have a mage support?,2025-06-20 13:56:43
summonerschool,2025,6,Switching from support to mid  looking for tips on what to learn and what to avoid,2025-06-20 10:26:39
summonerschool,2025,6,Promoted to Silver - now what?,2025-06-20 07:32:16
summonerschool,2025,6,New player struggling to learn >:),2025-06-20 05:33:06
summonerschool,2025,6,Darius vs Aatrox matchup,2025-06-20 00:55:49
summonerschool,2025,6,has laneswap detection changed?,2025-06-19 20:52:02
summonerschool,2025,6,"Not afraid to fail, just afraid to play safe what’s the best solo role?",2025-06-19 20:30:48
summonerschool,2025,6,"After 150 games of Swain, I have, apparently, learned very little...",2025-06-19 19:26:42
summonerschool,2025,6,How do you get better at positioning?,2025-06-19 19:25:45
summonerschool,2025,6,Need a top lane macro recipe,2025-06-19 18:38:38
summonerschool,2025,6,What’s the best solo role for a high-risk aggressive playstyle?,2025-06-19 17:14:09
summonerschool,2025,6,Demolish VS Overgrowth,2025-06-19 17:06:04
summonerschool,2025,6,Help with Aatrox vs Sett Matchup Struggling with Early Game,2025-06-19 15:29:36
summonerschool,2025,6,Waveclearing feels slow in League,2025-06-19 15:10:22
summonerschool,2025,6,Stuck bouncing between P1/E4 Toplane,2025-06-19 11:48:52
summonerschool,2025,6,AP Nautilus?,2025-06-19 10:59:50
summonerschool,2025,6,Am I using the World Atlas item wrong when it comes to farming?,2025-06-19 07:30:42
summonerschool,2025,6,Bot lane trading stance,2025-06-19 00:16:18
summonerschool,2025,6,Is it a mistake to take the first tower too early?,2025-06-18 19:37:06
summonerschool,2025,6,What is the most game-changing advice you've ever received/you can give?,2025-06-18 17:25:08
summonerschool,2025,6,How do you play in drafts without frontline/CC?,2025-06-18 09:46:13
summonerschool,2025,6,What do I even do at a certain point?,2025-06-18 06:29:25
summonerschool,2025,6,In-Game goals (Mid),2025-06-18 04:31:07
summonerschool,2025,6,What is the thought process when it comes to using Herald correctly?,2025-06-17 23:24:21
summonerschool,2025,6,How to handle roamind mid opponent,2025-06-17 23:09:52
summonerschool,2025,6,How to Do the Neeko Clone Extension?,2025-06-17 22:27:06
summonerschool,2025,6,How to play Braum and what is the mindset of tank supps,2025-06-17 21:09:19
summonerschool,2025,6,I’m playing worse every day,2025-06-17 19:19:53
summonerschool,2025,6,What Rank to choose when going for Builds online ?,2025-06-17 19:14:32
summonerschool,2025,6,Draft and Coach help!,2025-06-17 16:53:00
summonerschool,2025,6,Could someone enlighten me on what the purpose of mananune/muramana is?,2025-06-17 15:40:06
summonerschool,2025,6,Help fighting against ranged/kiting teams (not laning phase),2025-06-17 14:08:54
summonerschool,2025,6,Release date diff enjoyer here,2025-06-17 14:04:51
summonerschool,2025,6,What’s the best way to optimize long breaks to maximize learning,2025-06-17 13:23:06
summonerschool,2025,6,Midland Low kills high assists,2025-06-17 10:35:08
summonerschool,2025,6,Support main going top - tips?,2025-06-17 09:10:03
summonerschool,2025,6,is it bad that i perma mute all at the start of soloQ game every time ?,2025-06-17 06:33:45
summonerschool,2025,6,When should I swap with Bot as a Mid laner?,2025-06-17 01:01:14
summonerschool,2025,6,How do I get better? I've been playing for a year and I can't keep up.,2025-06-17 00:56:29
summonerschool,2025,6,"So, how to expand lead and carry or 1v9 form top lane?",2025-06-16 22:15:41
summonerschool,2025,6,Game Flow & Mid Lane Questions,2025-06-16 22:04:28
summonerschool,2025,6,Any tips on how to counter malphite as an AD Top Bruiser/Fighter?,2025-06-16 19:27:08
summonerschool,2025,6,"I'm a very binary player, either i feed or i get fed, no in between.",2025-06-16 18:19:41
summonerschool,2025,6,Jhin Question,2025-06-16 15:41:15
summonerschool,2025,6,How are you going to cast spells with the WASD gameplay?,2025-06-16 12:47:54
summonerschool,2025,6,Adc<->Sup roleswap off-meta is coming back? (Discussion),2025-06-16 10:37:56
summonerschool,2025,6,Veigar,2025-06-16 05:49:06
summonerschool,2025,6,Why is Rammus jungle not a more popular pick?,2025-06-16 03:55:53
summonerschool,2025,6,I have a general question.,2025-06-16 01:12:25
summonerschool,2025,6,How did summoners rift change since season 7?,2025-06-15 21:28:05
summonerschool,2025,6,Nasus mid,2025-06-15 16:01:02
summonerschool,2025,6,How to CS better toplane?,2025-06-15 14:15:23
summonerschool,2025,6,"Really struggling to get out of Bronze, please help me improve!!",2025-06-15 12:32:05
summonerschool,2025,6,When to follow roaming midlaners,2025-06-15 12:17:41
summonerschool,2025,6,How to lane/play the damn game as Anivia (or other short ish ranged champions) against Syndra/sort of Xerath/Hwei as well?,2025-06-15 10:10:59
summonerschool,2025,6,Reminder to no believe everything that people claim here,2025-06-15 09:37:02
summonerschool,2025,6,why is ryze jungle not a thing?,2025-06-15 09:02:52
summonerschool,2025,6,Is there an add-on for MAC that gives me jungle timers?,2025-06-15 09:02:49
summonerschool,2025,6,I want to learn Draven what are my first steps?,2025-06-14 23:00:14
summonerschool,2025,6,What do when team won’t come to obj with prio and spam pings,2025-06-14 19:10:52
summonerschool,2025,6,Yorick and Illoai,2025-06-14 13:40:07
summonerschool,2025,6,Are overlays recommended for new players?,2025-06-14 09:56:22
summonerschool,2025,6,Figuring out an AP Sona Build,2025-06-14 07:25:40
summonerschool,2025,6,How to jump into Ranked as an ARAM player?,2025-06-14 07:17:23
summonerschool,2025,6,How do I play into multi tank comps?,2025-06-14 02:37:16
summonerschool,2025,6,What should I do to Improve?,2025-06-13 23:03:42
summonerschool,2025,6,Is there another champ that can cc+flash? (Read for context),2025-06-13 20:10:01
summonerschool,2025,6,As a Malp enjoyer here's how you Malp without AP but still will be a wreaking ball,2025-06-13 20:08:10
summonerschool,2025,6,"New player, all roles seem fun – which one should I stick with?",2025-06-13 18:09:34
summonerschool,2025,6,Tip to dodge certain Stuns and Spells better,2025-06-13 17:48:27
summonerschool,2025,6,Breaking freezes against tanks,2025-06-13 16:02:25
summonerschool,2025,6,In depth TF vs Sylas guide,2025-06-13 16:01:14
summonerschool,2025,6,Mid alternative pick,2025-06-13 14:59:40
summonerschool,2025,6,I put together a Flex team to play each week and we've been improving dramatically.,2025-06-13 13:55:15
summonerschool,2025,6,What are some small AND big mid-game mistakes that people do that could improve on?,2025-06-13 13:52:15
summonerschool,2025,6,"How to play against a very good Zoe/Viego/Bard, as an immobile mage, when your team has no frontline/doesn’t contest fog of war?",2025-06-13 13:10:03
summonerschool,2025,6,How to roam as a toplaner and make more impact for the team?,2025-06-13 09:22:35
summonerschool,2025,6,Bounty system,2025-06-12 19:35:28
summonerschool,2025,6,What would be a good scenario for this outcome?,2025-06-12 18:41:00
summonerschool,2025,6,"Plat 4 0 LP on SEA after climbing from Silver 2 – stuck in a massive losing streak, need mental-game/MMR advice",2025-06-12 16:24:37
summonerschool,2025,6,brand tips,2025-06-12 14:29:57
summonerschool,2025,6,"I want to try smolder, should I pick ADC or mid for the first time?",2025-06-12 13:25:32
summonerschool,2025,6,What can I do against a Varus top?,2025-06-12 00:40:48
summonerschool,2025,6,[Meta] Tags (or rule changes ) for posts with VODs / clips?,2025-06-11 19:47:09
