subreddit,year,month,text,created_utc
summonerschool,2025,6,Best way to learn new champions without tanking the game?,2025-06-11 15:25:16
summonerschool,2025,6,[Jungle] How to properly “bail out” your laners,2025-06-11 13:26:25
summonerschool,2025,6,The couple last games have been an utter disaster,2025-06-11 12:40:33
summonerschool,2025,6,Any advices for learning Lee Sin ?,2025-06-11 12:14:30
summonerschool,2025,6,Jack of All Trades,2025-06-11 07:01:04
summonerschool,2025,6,Double trouble,2025-06-11 05:10:59
summonerschool,2025,6,How Soloq accidentaly fixed my mental health (Story),2025-06-11 00:06:54
summonerschool,2025,6,"""Toplane Fundamentals""",2025-06-10 21:54:42
summonerschool,2025,6,How to catch up to opponent when im falling behind,2025-06-10 18:55:31
summonerschool,2025,6,How to improve split second decision making? I feel like a lot of fights I lose are not because I get caught or am behind in the game..but because I stun or ult the wrong person.,2025-06-10 18:46:28
summonerschool,2025,6,Transitioning from Wild Rift to PC - are these missing features hidden in the settings?,2025-06-10 17:09:06
summonerschool,2025,6,Genuinely how do I end my games faster,2025-06-10 16:44:12
summonerschool,2025,6,Any advice for a Zyra player trying to get out of Gold?,2025-06-10 14:21:38
summonerschool,2025,6,I learn Rengar and Jungle at the same time big mistake.,2025-06-10 10:34:05
summonerschool,2025,6,Death's dance lifesteal interaction,2025-06-10 10:23:41
summonerschool,2025,6,Scenarios for picking Viktor over Syndra,2025-06-10 07:15:28
summonerschool,2025,6,What is the formula for dealing damage?,2025-06-10 01:37:51
summonerschool,2025,6,How to play WITH a permaroaming support as the ADC,2025-06-09 22:56:35
summonerschool,2025,6,How can I play with my friends without having them get smashed?,2025-06-09 17:52:42
summonerschool,2025,6,What to do against perma farm junglers? (Karthus Graves ect),2025-06-09 16:26:14
summonerschool,2025,6,How to get started with jungling?,2025-06-09 09:00:26
summonerschool,2025,6,"Top Lane Urgot - Struggling to Balance CS and Objectives, Looking for Strategies to Improve",2025-06-09 07:48:41
summonerschool,2025,6,"ShortRange ADC player - How do i change to AutoAttackA, and how do I break that habit?",2025-06-09 02:43:19
summonerschool,2025,6,when I should Pick an aggressive jungler?,2025-06-09 01:01:38
summonerschool,2025,6,Ekko Jungle OTP struggling to learn Kha'Zix,2025-06-08 23:38:40
summonerschool,2025,6,How to set vision control around objectives as Zilean and not die in low elo?,2025-06-08 21:47:37
summonerschool,2025,6,Wana try learn jungle,2025-06-08 21:47:27
summonerschool,2025,6,How do I become more aware of when to roam?,2025-06-08 19:37:33
summonerschool,2025,6,Support main forever thinking about going jungle,2025-06-08 18:53:38
summonerschool,2025,6,I kinda suck at teamfighting with anything that isn't a tank or has extremely high range.,2025-06-08 18:41:07
summonerschool,2025,6,Singed Matchup Resource,2025-06-08 14:58:29
summonerschool,2025,6,How to play midgame as a midlane mage?,2025-06-08 14:29:00
summonerschool,2025,6,Silver ADC player struggling to convert leads,2025-06-08 02:10:41
summonerschool,2025,6,What are some actual useful toplaners? (Specifically for teamfights),2025-06-07 21:23:18
summonerschool,2025,6,How to play as an fill player?,2025-06-07 15:57:34
summonerschool,2025,6,How do i teach my friends to play the game?,2025-06-07 09:19:21
summonerschool,2025,6,How do I carry out of bronze as a rengar player,2025-06-07 08:13:53
summonerschool,2025,6,Bot Lane Matchups,2025-06-07 06:03:00
summonerschool,2025,6,Does Dr.Mundo scale as well as most people say? The winrate by game length says otherwise.,2025-06-07 04:31:23
summonerschool,2025,6,What happened to Caitlyn's auto?,2025-06-06 22:39:29
summonerschool,2025,6,Jungle pathing krugs,2025-06-06 20:33:37
summonerschool,2025,6,Ahri aery vs electrocute,2025-06-06 20:21:49
summonerschool,2025,6,best sp/mage to kill late game mundo,2025-06-06 10:14:59
summonerschool,2025,6,Free Coaching Friday - LEC Level Coaching,2025-06-06 09:07:26
summonerschool,2025,6,Not able to carry as bruiser?,2025-06-05 15:39:10
summonerschool,2025,6,When is the ward item box useful?,2025-06-05 14:43:33
summonerschool,2025,6,How to go from diamond to high master?,2025-06-05 14:13:37
summonerschool,2025,6,Bami item worth it late game?,2025-06-05 11:11:07
summonerschool,2025,6,How do I Carry Out of Iron/Bronze as an ADC?,2025-06-05 02:49:40
summonerschool,2025,6,Need team comp suggestions / synergy for $500 tournament,2025-06-05 02:45:16
summonerschool,2025,6,Misclick/button mashing/using flash instead of ignite...,2025-06-04 23:32:31
summonerschool,2025,6,How do I win when  teammates are far behind as adc?,2025-06-04 22:34:52
summonerschool,2025,6,"Is it possible to dodge Blitz's hook purely by reaction after he casts it, or is it just a matter of prediction?",2025-06-04 19:37:51
summonerschool,2025,6,Learning matchups/synergies as an ADC,2025-06-04 19:06:26
summonerschool,2025,6,What makes champion a GOOD blind pick,2025-06-04 16:50:40
summonerschool,2025,6,Need help figuring out how to win matchups top as a new player,2025-06-04 16:05:51
summonerschool,2025,6,How to play as Yasuo vs Akali,2025-06-04 13:58:08
summonerschool,2025,6,Ahri help,2025-06-04 13:44:52
summonerschool,2025,6,Does Cosmic insight lower cd of Unsealed spellbook?,2025-06-04 09:32:31
summonerschool,2025,6,How to splitpush when ahead?,2025-06-04 07:34:23
summonerschool,2025,6,I want to get more familiar with playing bot lane (ADC),2025-06-04 04:37:11
summonerschool,2025,6,Trying to improve as Rakan,2025-06-03 22:44:20
summonerschool,2025,6,How do i prevent enemy team from getting gold lead when my team is already ahead?,2025-06-03 21:38:05
summonerschool,2025,6,Mundo vs Zac in late game?,2025-06-03 19:32:50
summonerschool,2025,6,Following up on my 2:59 Nidalee Raptor Start Clear: Easier version videos & the in-depth guide are finally out,2025-06-03 18:44:41
summonerschool,2025,6,You guys ever notice that minion waves stop right in front of the T2 tower?,2025-06-03 16:51:04
summonerschool,2025,6,"How can I find out a champions identity, strengths, & weaknesses?",2025-06-03 16:16:57
summonerschool,2025,6,Don't recall to join the teamfight. Keep splitpushing.,2025-06-03 04:35:17
summonerschool,2025,6,What to do after a crash?,2025-06-03 02:30:33
summonerschool,2025,6,What guides to follow,2025-06-03 01:32:55
summonerschool,2025,6,Unsealed Spellbook smite questions,2025-06-02 19:21:46
summonerschool,2025,6,Why use Vladimir mid instead of top?,2025-06-02 18:40:35
summonerschool,2025,6,Seriously what are you supposed to draft against this comp?,2025-06-02 12:57:48
summonerschool,2025,6,How to follow the esports side of league,2025-06-02 10:21:23
summonerschool,2025,6,General improvement,2025-06-02 07:39:55
summonerschool,2025,6,Help understanding dragons ect,2025-06-02 07:36:35
summonerschool,2025,6,Mid-lane base timers against waveclear,2025-06-02 04:19:45
summonerschool,2025,6,"Your least favorite Swain player is back with more questions, now from the dizzying heights of Bronze IV...",2025-06-02 01:33:20
summonerschool,2025,6,Laning against Diana mid tips?,2025-06-02 01:32:21
summonerschool,2025,6,Is low Gold equivalent to mid Silver pre-Emerald?,2025-06-01 21:12:05
summonerschool,2025,6,Who am i meant to play against ranged tops?,2025-06-01 19:57:07
summonerschool,2025,6,Why I am ALWAYS behind during lane phase?,2025-06-01 19:53:28
summonerschool,2025,6,Viego vod help.,2025-06-01 17:53:44
summonerschool,2025,6,Low dpi,2025-06-01 16:25:17
summonerschool,2025,6,"I'm legendary (mid) and all my lanes are still losing, next step?",2025-06-01 15:21:18
summonerschool,2025,6,What to teach to a bronze adc friend that asked for coaching?,2025-06-01 13:24:18
summonerschool,2025,6,What do I do against trynd jungle,2025-06-01 13:13:50
summonerschool,2025,6,Is it realistic to make a flowchart of how to pick what champion you should pick?,2025-06-01 10:34:23
summonerschool,2025,6,level up timers and xp amount,2025-06-01 09:13:43
summonerschool,2025,6,How do i get out of Iron playing ADC?,2025-06-01 07:29:00
summonerschool,2025,6,Ambessa vs Renekton matchup,2025-06-01 02:33:00
summonerschool,2025,6,Can you play more than one role at the time?,2025-06-01 01:55:30
summonerschool,2025,6,Beginner role?,2025-06-01 01:30:44
summonerschool,2025,6,Best Junglers for 5v5 Tournament?,2025-06-01 00:52:05
summonerschool,2025,5,How and when do you spread your lead on top?,2025-05-31 20:37:55
summonerschool,2025,5,Confused about the Teemo vs Sett Matchup,2025-05-31 18:44:21
summonerschool,2025,5,Swapping from support to mid – looking for educational streamer/YouTuber/coach,2025-05-31 17:04:41
summonerschool,2025,5,How do i convert a winning lane,2025-05-31 15:12:30
summonerschool,2025,5,What would you do if you wanted to go back to playing lol and started playing Support?,2025-05-31 12:00:49
summonerschool,2025,5,Help with laning as ADC,2025-05-31 11:46:35
summonerschool,2025,5,What difference does kiting make?,2025-05-31 07:47:32
summonerschool,2025,5,Need help countering a strategy,2025-05-30 20:51:01
summonerschool,2025,5,Controlling the camera,2025-05-30 20:15:33
summonerschool,2025,5,How much gold can you wait for t1 boots without losing tempo?,2025-05-30 17:58:10
summonerschool,2025,5,How to jungle vs Nocturne in low elo?,2025-05-30 15:17:46
summonerschool,2025,5,question regarding adc and specifically playing against draven,2025-05-30 14:58:03
summonerschool,2025,5,how to choose between engaging and peeling for your team as a immobile bruiser?,2025-05-29 22:49:12
summonerschool,2025,5,How should I practice champions?,2025-05-29 19:02:38
summonerschool,2025,5,How to not have camps stolen,2025-05-29 16:40:26
summonerschool,2025,5,How to teamfight against hook champions?,2025-05-29 14:44:59
summonerschool,2025,5,what items help you tower dive easily and tank tower shots?,2025-05-29 13:19:03
summonerschool,2025,5,is terminus a bad item and who's supposed to build it?,2025-05-29 11:34:36
summonerschool,2025,5,Theorycrafting a CDR Teemo Top Build. Please Suggest Improvements!,2025-05-29 10:29:50
summonerschool,2025,5,How to get back into league and deal with the new meta and what are the best league streamers/Youtubers that coach and that y'all would recommend?,2025-05-29 03:38:35
summonerschool,2025,5,How can I have more impact in top lane?,2025-05-29 02:11:55
summonerschool,2025,5,Is stealing opponents’ red side jungle (clear 1) in low elo a bait?,2025-05-28 15:38:20
summonerschool,2025,5,Team play is the most difficult part of the game,2025-05-28 13:01:35
summonerschool,2025,5,"Who is the ""Ahri"" of top lane?",2025-05-28 08:45:55
summonerschool,2025,5,why do people say to back on a cannon wave? don't you just lose the cannon cause you can't make it back in time?,2025-05-28 08:25:29
summonerschool,2025,5,Why are blast cones distance variable? How do you tell?,2025-05-28 05:02:54
summonerschool,2025,5,How to improve on my own?,2025-05-28 04:12:58
summonerschool,2025,5,Playing against APC in botlane,2025-05-28 04:10:57
summonerschool,2025,5,bronze Azir vs Lux VOD review request,2025-05-28 02:01:25
summonerschool,2025,5,Struggling In Late Game as a Toplaner,2025-05-27 23:44:10
summonerschool,2025,5,Why do junglers sometimes smite a camp right when they start it rather than to finish it?,2025-05-27 23:33:15
summonerschool,2025,5,Help me understand the shop,2025-05-27 21:33:15
summonerschool,2025,5,Qiyana or Gangplank for SoloQ master+,2025-05-27 17:41:18
summonerschool,2025,5,Drawing Large Number of Ganks,2025-05-27 17:41:12
summonerschool,2025,5,First time playing in a while what are these tower DoTs?,2025-05-27 16:54:11
summonerschool,2025,5,Will there be an Arcane event again?,2025-05-27 15:56:54
summonerschool,2025,5,"Coach here, feel free to ask me anything (AMA approved)",2025-05-27 13:43:11
summonerschool,2025,5,Why do I see so many players going Jack of All Trades when they never pass the 10 stack threshold?,2025-05-27 12:33:35
summonerschool,2025,5,how long would it take to be able to queue with d3+?,2025-05-27 11:29:38
summonerschool,2025,5,Support main trying out mid – where do I start,2025-05-27 10:22:49
summonerschool,2025,5,"Players who got all 5 roles to Master/Grandmaster/Challenger, how did you do it?",2025-05-27 04:23:04
summonerschool,2025,5,Is it possible to climb as a casual player?,2025-05-26 22:32:05
summonerschool,2025,5,Most entertaining educational youtubers?,2025-05-26 21:47:25
summonerschool,2025,5,How to keep up with the early game objectives as Mid,2025-05-26 20:44:48
summonerschool,2025,5,Iron is hard (Iron to Silver),2025-05-26 20:19:53
summonerschool,2025,5,How do you ever win vs Fiddle top?,2025-05-26 19:43:22
summonerschool,2025,5,My friends are way better than me and I want to stop dragging them down,2025-05-26 16:06:29
summonerschool,2025,5,just started and getting absolutely whiffed,2025-05-26 15:55:28
summonerschool,2025,5,Why is HOB not taken on shen and cho?,2025-05-26 10:49:43
summonerschool,2025,5,Top Lane - translating your lead into being usefull for your team.,2025-05-26 09:57:03
summonerschool,2025,5,I got Challenger as a Gnar OTP - Here are my takeaway thoughs,2025-05-26 06:36:49
summonerschool,2025,5,Who to ban as adc?,2025-05-25 23:12:17
summonerschool,2025,5,Can you build different items types on one build?,2025-05-25 22:28:03
summonerschool,2025,5,What did I miss?,2025-05-25 22:22:07
summonerschool,2025,5,Teach me how to approach akshan,2025-05-25 20:26:56
summonerschool,2025,5,What to look for in the minimap?,2025-05-25 15:43:36
summonerschool,2025,5,Has anyone here developed chronic pain/hand issues due to league?,2025-05-25 15:21:28
summonerschool,2025,5,How do I handle my team fighting non stop as an ADC in lower elo?,2025-05-25 15:08:34
summonerschool,2025,5,What is the reasoning behind players maxing E first on Mel?,2025-05-25 11:45:10
summonerschool,2025,5,How to handle Katarina in low elo early to mid games?,2025-05-25 08:55:22
summonerschool,2025,5,I'm level 387 and have 0 mastery 10 champions,2025-05-25 04:46:36
summonerschool,2025,5,What happened to the monthly mentoring threads?,2025-05-25 02:04:44
summonerschool,2025,5,What to do you as an ADC after taking opponents t1 around level 7?,2025-05-24 21:38:48
summonerschool,2025,5,"Low  elo adc here, I need feedbacks  for my 9 deaths so I get better",2025-05-24 19:06:41
summonerschool,2025,5,How do you play against enemy jungler when his support roam with him?,2025-05-24 16:42:04
summonerschool,2025,5,"As a Low ELO ADC, How Do You Lane With A Yuumi Support?",2025-05-24 14:32:19
summonerschool,2025,5,ADC suggestions and overall tips,2025-05-24 13:39:29
summonerschool,2025,5,"why does it feel like Tristana damage is so low? I get the all in potential, I play her and get kills at lvl 2. but I constantly miss her last hits by 1 or 2 hp. but with any other champ I dont have this problem (besides maybe smolder q) but I believe they all have around the same damage",2025-05-24 08:01:43
summonerschool,2025,5,Is not buying boots on yi a bad thing?,2025-05-24 05:44:57
summonerschool,2025,5,"I often have very bad farming (like 5 per minute) because I am so scared that if I don't group, my team die 4v5. What should I do ?",2025-05-23 19:20:01
summonerschool,2025,5,Consistency tips for ADC,2025-05-23 17:24:32
summonerschool,2025,5,Why does nobody use anivia support?,2025-05-23 17:16:24
summonerschool,2025,5,Does TP not land you behind the turret anymore?,2025-05-23 16:47:10
summonerschool,2025,5,I made my first account 5 days ago and my boyfriend hasn't noticed.,2025-05-23 14:20:31
summonerschool,2025,5,From Support Main to... Something New? Looking for a New Role to Call Home,2025-05-23 14:00:59
summonerschool,2025,5,How can I force myself to find joy in other roles?,2025-05-23 07:40:02
summonerschool,2025,5,How to play into Cait as Leona?,2025-05-23 03:32:11
summonerschool,2025,5,How do you beat Riven in high elo?,2025-05-22 23:18:49
summonerschool,2025,5,Which applies first,2025-05-22 18:28:44
summonerschool,2025,5,Amumu Top,2025-05-22 12:48:52
summonerschool,2025,5,Need advice on mid game as ADC (Kai’Sa low elo),2025-05-22 11:02:16
summonerschool,2025,5,What can I do to not go 0/10 once I start dying,2025-05-22 10:48:54
summonerschool,2025,5,Cycling camps together on the first clear,2025-05-22 09:39:39
summonerschool,2025,5,[Feedback Request] Firsts game without locked camera – what should I improve?,2025-05-22 07:25:09
summonerschool,2025,5,Adapting my laning phase and wave management with the gamestate ?,2025-05-22 01:52:23
summonerschool,2025,5,Unsealed spellbook,2025-05-21 21:45:39
summonerschool,2025,5,Help with Beginner Daily Play Rewards,2025-05-21 20:13:22
summonerschool,2025,5,Best picks into Tahm Kench top?,2025-05-21 19:55:05
summonerschool,2025,5,"Despite not having a lot of time to play, I want to improve my Jungle game.",2025-05-21 14:39:22
summonerschool,2025,5,Question about this Teamcomposition,2025-05-21 12:25:39
summonerschool,2025,5,solo queue top lane beginner,2025-05-21 11:50:45
summonerschool,2025,5,Do I absolutely need to solo queue to get better (if my friends are all better than me)?,2025-05-21 10:35:22
summonerschool,2025,5,I am really bad at the game and cant grasp any concepts of how to get any better at top lane.,2025-05-21 07:07:59
summonerschool,2025,5,Tips against physical stress reactions of the body,2025-05-21 03:31:44
