subreddit,year,month,text,created_utc
leagueoflegends,2025,7,How is Duro marking invisible wards?,2025-07-13 04:39:13
leagueoflegends,2025,7,how to check pickems standings,2025-07-13 04:38:13
leagueoflegends,2025,7,4' jungle lv 5 in swiftplay,2025-07-13 04:38:07
leagueoflegends,2025,7,"Fucking Oysters RUINED my perfect pick ems, got only 1 series wrong",2025-07-13 04:35:33
leagueoflegends,2025,7,I got perfect Pick'Ems!,2025-07-13 04:32:07
leagueoflegends,2025,7,Why is the pickems tab closed instantly?,2025-07-13 04:30:30
leagueoflegends,2025,7,I missed play in Pick'ems BUT!,2025-07-13 04:27:56
leagueoflegends,2025,7,EU dissapointing me one last time this MSI,2025-07-13 04:22:59
leagueoflegends,2025,7,Did any one get any of the E sports rewards tonight?,2025-07-13 04:22:02
leagueoflegends,2025,7,Full List of All Skins to be Discounted for each MSI Winner's Role Bundle,2025-07-13 04:16:40
leagueoflegends,2025,7,Gen.G vs. T1 / MSI 2025 - Grand Finals / Post-Match Discussion,2025-07-13 04:15:10
leagueoflegends,2025,7,Top 5 Lec Supports,2025-07-13 03:34:20
leagueoflegends,2025,7,MSI Finals Skin Sale,2025-07-13 03:30:58
leagueoflegends,2025,7,A question for jungle mains.,2025-07-13 03:25:17
leagueoflegends,2025,7,Win streak into loss streak,2025-07-13 03:03:58
leagueoflegends,2025,7,Grasp in Junglers?,2025-07-13 03:03:52
leagueoflegends,2025,7,Region skill differences/Worst regions in your experiences,2025-07-13 02:56:13
leagueoflegends,2025,7,Exalted skins every going to be reavaliable?,2025-07-13 02:37:08
leagueoflegends,2025,7,Anyone have a list of all team compositions this msi?,2025-07-13 02:33:54
leagueoflegends,2025,7,Top 5 LEC adc's,2025-07-13 02:14:20
leagueoflegends,2025,7,Blitz R vs. Sett charged punch,2025-07-13 02:11:57
leagueoflegends,2025,7,Is it possible to use refunds on older stuff that isnt showing if I contact riot?,2025-07-13 02:09:00
leagueoflegends,2025,7,Why are rune pages still limited to 20?,2025-07-13 02:05:07
leagueoflegends,2025,7,Can some get data on Drag Win rate This MSI.,2025-07-13 01:47:18
leagueoflegends,2025,7,Videos where the history of League is covered like the TSM vs CLG rivalry?,2025-07-13 01:38:33
leagueoflegends,2025,7,Mundo in Arena is insane.,2025-07-13 01:14:39
leagueoflegends,2025,7,"Phantom Dancer has more problems than ""it just gives AS and crit"".",2025-07-13 01:01:06
leagueoflegends,2025,7,Busco duo Lan,2025-07-13 00:59:19
leagueoflegends,2025,7,"Lolesports leadership discusses the LTA merger reception, whether double elimination is coming to Worlds, and Game Changers in LoL vs VALORANT | MSI Press roundtable",2025-07-13 00:30:58
leagueoflegends,2025,7,Binding opening shop to 1-7 is a mistake,2025-07-13 00:01:02
leagueoflegends,2025,7,My take on LOL Esports and their viewership,2025-07-12 23:39:54
leagueoflegends,2025,7,Can i Gift the rest of the pass from another account ?,2025-07-12 23:32:00
leagueoflegends,2025,7,2025 Mid Season Invitational / Bracket Stage / Final / Live Discussion,2025-07-12 23:01:26
leagueoflegends,2025,7,Silly Question - In Pro Tournaments Do You Support Your Favorite Team Or The Team That Picks Your Main?,2025-07-12 23:01:10
leagueoflegends,2025,7,ARAM bildgewater Cannon is a joke,2025-07-12 22:39:10
leagueoflegends,2025,7,Ad and Ap scalings,2025-07-12 22:31:43
leagueoflegends,2025,7,Every ARAM map is a bridge,2025-07-12 22:24:10
leagueoflegends,2025,7,Can someone calculate the % chance of this?,2025-07-12 22:07:16
leagueoflegends,2025,7,Need help finding a specific League YT channel that posts high-elo clips with over-the-top transitions,2025-07-12 21:07:02
leagueoflegends,2025,7,Vertical dual monitors for peak League drama watching,2025-07-12 21:03:22
leagueoflegends,2025,7,What will be GENG advantage for coming from the Upper Bracket?,2025-07-12 20:44:28
leagueoflegends,2025,7,akshan is underrated in arena,2025-07-12 20:40:25
leagueoflegends,2025,7,"Sources: Inside Fnatic’s Offseason — Poby’s new contract, Toplane recap, and Dardo’s role change",2025-07-12 20:37:19
leagueoflegends,2025,7,Nidalee can now full clear in 2:59 using conventional Red Start (Patch 25.13),2025-07-12 20:17:24
leagueoflegends,2025,7,what are your thoughts on the current surrender system?,2025-07-12 19:58:05
leagueoflegends,2025,7,"T1 Oner: ""I tend to ignore comments about how the roster has changed, or how our team won’t work without certain components."" - lcsprofiles",2025-07-12 19:31:48
leagueoflegends,2025,7,Prepare for Cinema | GEN vs T1 Finals | MSI 2025,2025-07-12 19:22:54
leagueoflegends,2025,7,Balance of my Last Ranked Game,2025-07-12 19:15:15
leagueoflegends,2025,7,The AL draft in game 3 was so bad.,2025-07-12 18:45:13
leagueoflegends,2025,7,Msi Emotes,2025-07-12 18:19:40
leagueoflegends,2025,7,My Viktor cosplay,2025-07-12 17:46:54
leagueoflegends,2025,7,help with ranked,2025-07-12 17:42:43
leagueoflegends,2025,7,MSI Pick’em prize tiers feel a bit off this year,2025-07-12 17:23:32
leagueoflegends,2025,7,The winner of the loser's bracket should not have a shot at the MSI championship,2025-07-12 17:20:34
leagueoflegends,2025,7,smart/quick casting,2025-07-12 17:15:18
leagueoflegends,2025,7,helpe me i need to read somme masterpiece,2025-07-12 17:06:07
leagueoflegends,2025,7,"T1 Faker: ""I won't force my kids to play League. I've really lived the life of a pro player and I know how difficult it is [...] I always try to keep to myself and be myself, but I really appreciate how players perceive me [to have this aura]"" | Sheep Esports",2025-07-12 17:06:02
leagueoflegends,2025,7,"as a top, should I always ask for last pick?",2025-07-12 16:58:56
leagueoflegends,2025,7,I'm tired of Mundo,2025-07-12 16:57:27
leagueoflegends,2025,7,Dodging mechanic: make it make sense to me,2025-07-12 16:40:23
leagueoflegends,2025,7,Looking for EUW amateur leagues. Are there any good ones?,2025-07-12 16:36:47
leagueoflegends,2025,7,Fearless has to reset for Game 5 of a bo5 series. Every single 5th game of this MSI has been an absolute stomp.,2025-07-12 16:25:59
leagueoflegends,2025,7,In my recent ranked experience 85% of the games are being defined by sup diff,2025-07-12 16:23:33
leagueoflegends,2025,7,The giving up culture in this game is unacceptable,2025-07-12 16:19:18
leagueoflegends,2025,7,What's up with the Match Making System?,2025-07-12 16:13:54
leagueoflegends,2025,7,faker: i can easily beat them 1v2,2025-07-12 15:53:19
leagueoflegends,2025,7,MSI ceremony,2025-07-12 15:51:16
leagueoflegends,2025,7,"The difference in ""Regional Score"" between LCK and LPL is almost the same as the difference between LPL and LTA North now",2025-07-12 15:49:42
leagueoflegends,2025,7,How is your “starting rank” calculated ?,2025-07-12 15:27:12
leagueoflegends,2025,7,Help to download files,2025-07-12 15:19:57
leagueoflegends,2025,7,"I have perfect pick'ems so far, but i did not select a winner for the finals",2025-07-12 14:56:43
leagueoflegends,2025,7,Why do top laners want last pick if their role is the least impactful?,2025-07-12 14:53:12
leagueoflegends,2025,7,Is terminus ranged skewed?,2025-07-12 14:51:01
leagueoflegends,2025,7,Spellbook in supports T1 vs AL,2025-07-12 14:28:57
leagueoflegends,2025,7,"Spirit Blossom Ahri ""Night Blossom Chroma"" never rolling into the Mythic Shop",2025-07-12 14:21:45
leagueoflegends,2025,7,"“It’s not Nunu OR Willump, it’s Nunu AND Willump. They need each other.” G2 Kesha talks what Song of Nunu taught him about friendship, and takes me on the silliest interview of my career, talking the end of Forge games, being G2’s lucky charm, and more. | HotSpawn",2025-07-12 14:16:25
leagueoflegends,2025,7,Arena Idea,2025-07-12 14:05:00
leagueoflegends,2025,7,"Game 5s in fearless draft have been amazing. However, for the pure chaos...",2025-07-12 13:59:03
leagueoflegends,2025,7,How to stop having a bootycheeks KDA,2025-07-12 13:55:02
leagueoflegends,2025,7,Current format of double elimination is still unfair.,2025-07-12 13:39:48
leagueoflegends,2025,7,Gen G VS T1 - Voice comms,2025-07-12 13:38:41
leagueoflegends,2025,7,"By attending my first  League tournament, I now know why League is more popular than Dota 2",2025-07-12 13:34:38
leagueoflegends,2025,7,Arena Survey Missing a Question?,2025-07-12 13:33:44
leagueoflegends,2025,7,e-Sports icons available from the new MSI Capsule are locked from the rest?,2025-07-12 13:14:35
leagueoflegends,2025,7,Any tips to shorten Zed's jungle clear time?,2025-07-12 13:13:07
leagueoflegends,2025,7,The in game worlds cutscene is extremely annoying,2025-07-12 13:08:08
leagueoflegends,2025,7,MSI final watch parties in London?,2025-07-12 13:04:54
leagueoflegends,2025,7,Faker vs Ruler is such a forced rivalry,2025-07-12 13:03:47
leagueoflegends,2025,7,Rank of LEC coach ?,2025-07-12 12:56:57
leagueoflegends,2025,7,casquette league of legends project,2025-07-12 12:51:23
leagueoflegends,2025,7,In Bloom Finisher Feature from Mythic Shop,2025-07-12 12:37:01
leagueoflegends,2025,7,About ADC items and attack speed,2025-07-12 12:35:04
leagueoflegends,2025,7,I keep getting invaded early and my laners don’t help — what should I do?,2025-07-12 12:31:28
leagueoflegends,2025,7,Question about griefing detection,2025-07-12 11:37:22
leagueoflegends,2025,7,Botlane is useless,2025-07-12 11:18:10
leagueoflegends,2025,7,Faker vs Chovy Head-to-Head,2025-07-12 11:05:38
leagueoflegends,2025,7,Why is Sona so high rated?,2025-07-12 10:57:42
leagueoflegends,2025,7,"Ultimate, Mythic Variant, and other higher tier skins used during the MSI finals by the winning team will be replaced with a comparable eligible skin",2025-07-12 10:53:52
leagueoflegends,2025,7,Iron 3 -> Silver 2 -> Bronze 3 -> Started to main Garen,2025-07-12 10:45:57
leagueoflegends,2025,7,Have games become harder to end?,2025-07-12 10:43:38
leagueoflegends,2025,7,Insane twitch escape,2025-07-12 10:43:03
leagueoflegends,2025,7,hextech chests,2025-07-12 10:36:53
leagueoflegends,2025,7,AL vs T1 Hupu Ratings & Comments - MSI 2025 Lower Bracket Final,2025-07-12 10:00:25
leagueoflegends,2025,7,Why is there no option to see who is duoed in game?,2025-07-12 09:19:25
leagueoflegends,2025,7,Are people more dead inside than they used to?,2025-07-12 08:59:15
leagueoflegends,2025,7,Just started playing ranked and it is so fun,2025-07-12 08:52:45
leagueoflegends,2025,7,Azael is such an underrated and underappreciated caster,2025-07-12 08:36:53
leagueoflegends,2025,7,Can I bring a fansign into MSI or do I have to make them in the venue?,2025-07-12 08:08:45
leagueoflegends,2025,7,How are you supposed to climb if your team mates give up every game ?,2025-07-12 07:40:03
leagueoflegends,2025,7,Gumayusi's stats from LCK playoffs (Road to MSI) until now (pre MSI finals),2025-07-12 06:45:29
leagueoflegends,2025,7,AL Shanks streaming platforms?,2025-07-12 06:16:35
leagueoflegends,2025,7,i made an edit of this silly guy,2025-07-12 05:58:54
leagueoflegends,2025,7,MSI 2025 Game 5 Champ Select Music?,2025-07-12 05:28:53
leagueoflegends,2025,7,Does Low prio queue extend past the 15 minute timer?,2025-07-12 05:25:00
leagueoflegends,2025,7,Top 5 lec mid peaks,2025-07-12 05:20:17
leagueoflegends,2025,7,Caedrel Interview with Faker,2025-07-12 05:11:06
leagueoflegends,2025,7,I'd like to see a tournament where the champion is decided in a strictly round robin format.,2025-07-12 04:58:14
leagueoflegends,2025,7,T1 vs AL HUPU Community Player Ratings (All Games Included),2025-07-12 04:56:52
leagueoflegends,2025,7,When is yunara releasing,2025-07-12 04:51:02
leagueoflegends,2025,7,My first ever quadrakill!,2025-07-12 04:45:26
leagueoflegends,2025,7,Mark my words: MSI Pickems for next year are gonna get changed for the worse,2025-07-12 04:39:11
leagueoflegends,2025,7,All non-LCK Koreans leave their respective regions and return to the LCK.,2025-07-12 04:33:27
leagueoflegends,2025,7,Anything to do at MSI venue without ticket?,2025-07-12 04:26:16
leagueoflegends,2025,7,My pickems changed Help,2025-07-12 04:18:26
leagueoflegends,2025,7,how to beat hp stacking as a crit adc?,2025-07-12 04:11:26
leagueoflegends,2025,7,T1 vs. Anyone's Legend / MSI 2025 - Lower Bracket Finals / Post-Match Discussion,2025-07-12 04:05:38
leagueoflegends,2025,7,Why am I suddenly gain no LP,2025-07-12 03:43:36
leagueoflegends,2025,7,Why does duo botlane seem to make everyone else on our team worse?,2025-07-12 03:37:44
leagueoflegends,2025,7,The new restrictions are way better,2025-07-12 03:25:02
leagueoflegends,2025,7,Fearless Draft+ Cooldown bans?,2025-07-12 03:24:46
leagueoflegends,2025,7,My top 5 LEC jglers,2025-07-12 03:16:38
leagueoflegends,2025,7,Shanks Insane Teamfight,2025-07-12 03:09:38
leagueoflegends,2025,7,Battle pass worth the buy?,2025-07-12 02:54:20
leagueoflegends,2025,7,Fearless doesn’t really seem to change much,2025-07-12 02:35:22
leagueoflegends,2025,7,The 2023 MSI Changes Turned It From Mickey Mouse Tournament to the Best Show of the Season,2025-07-12 02:28:39
leagueoflegends,2025,7,Which champion from each role do you feel best encapsulates the fantasy of the role?,2025-07-12 02:10:28
leagueoflegends,2025,7,Yuumi needs to be removed from Ranked,2025-07-12 02:06:28
leagueoflegends,2025,7,MSI Vancouver Final Game: anyone going?,2025-07-12 01:56:43
leagueoflegends,2025,7,"To those who ban your teammates champ when it's valid for the lane, why?",2025-07-12 01:54:46
leagueoflegends,2025,7,is KS still a thing?,2025-07-12 01:35:58
leagueoflegends,2025,7,New Arena Jhin is OP,2025-07-12 01:17:03
leagueoflegends,2025,7,What do people think about sett W,2025-07-12 01:16:03
leagueoflegends,2025,7,What are the skills you should learn for ranked?,2025-07-12 01:07:54
leagueoflegends,2025,7,So the RIOT MMO is dead?,2025-07-12 00:51:34
leagueoflegends,2025,7,My performance as Jinx from Arcane at Anime Friends Brazil last week,2025-07-12 00:49:24
leagueoflegends,2025,7,Cool Arena Augment & Item Interaction,2025-07-12 00:02:07
leagueoflegends,2025,7,"Phreak: ""KRAKEN Slayer is about finishing off SQUISHIER champions""",2025-07-11 23:40:52
leagueoflegends,2025,7,Four Key Elements to Include,2025-07-11 23:38:03
leagueoflegends,2025,7,Syndra guide,2025-07-11 23:37:30
leagueoflegends,2025,7,I met Azael. [Satire],2025-07-11 23:36:58
leagueoflegends,2025,7,Plastic bag on hair = quadrakill mechanics,2025-07-11 23:31:22
leagueoflegends,2025,7,"Smash is a banned phrase in chat during any T1 MSI game, did I miss something, what is going on",2025-07-11 23:21:07
leagueoflegends,2025,7,2025 Mid Season Invitational / Bracket Stage / Losers' Bracket Final / Live Discussion,2025-07-11 23:01:16
leagueoflegends,2025,7,Do we get LP back when people intentionally lose?,2025-07-11 22:50:49
leagueoflegends,2025,7,Why do people think anti heal sucks?,2025-07-11 22:46:22
leagueoflegends,2025,7,Has frustration with the League experience outside of gameplay become normal?,2025-07-11 22:12:18
leagueoflegends,2025,7,Viego Quadrakill!!!!,2025-07-11 22:03:32
leagueoflegends,2025,7,Msi tickets so abundant right now,2025-07-11 21:45:21
leagueoflegends,2025,7,How to watch MSI via korean streamers?,2025-07-11 21:20:13
leagueoflegends,2025,7,Supports on aram,2025-07-11 21:18:00
leagueoflegends,2025,7,T1 vs AL was inevitably from the start.,2025-07-11 21:12:26
leagueoflegends,2025,7,League Buzzfeed quiz,2025-07-11 21:11:23
leagueoflegends,2025,7,Kalista Kalista Kalista. I've always loved her. What are your opinions about her good or bad? I'm all ears.,2025-07-11 21:05:51
leagueoflegends,2025,7,angry crashout Jinx OTP rambles about EUW support players for 7 minutes,2025-07-11 20:47:36
leagueoflegends,2025,7,Returning to play after 2 years,2025-07-11 20:43:44
leagueoflegends,2025,7,NA at 2025 Worlds,2025-07-11 20:34:45
leagueoflegends,2025,7,"If League of Legends had a World Cup, what would your country's national team roster be?",2025-07-11 20:29:28
leagueoflegends,2025,7,"If I wanted to say hi to the casters at MSI, is that possible?",2025-07-11 20:23:58
leagueoflegends,2025,7,Anyone tryna play some ranked tn?,2025-07-11 19:34:45
leagueoflegends,2025,7,How long do i have to auto a control ward once i leave brush?,2025-07-11 19:31:10
leagueoflegends,2025,7,Can some one explain this??,2025-07-11 19:28:47
leagueoflegends,2025,7,ARAM Balance Buff Example Tooltip Suggestion Change,2025-07-11 19:24:56
leagueoflegends,2025,7,"[NA] Calling All Mid, Jungle & Support Players Interested in Competitive Play!",2025-07-11 19:13:43
leagueoflegends,2025,7,This is my hook. There are many like it but this one is mine.,2025-07-11 19:09:20
leagueoflegends,2025,7,"Champ select glitch in the game right now. Forces u to play other champ than selected, happens when u swap in a particular way",2025-07-11 19:08:57
leagueoflegends,2025,7,Challenge your teammates,2025-07-11 19:05:09
leagueoflegends,2025,7,"I have tried my best to find the original, and after about 4 hrs of searching i am asking the internet for help, so please... HELP",2025-07-11 19:03:16
leagueoflegends,2025,7,How to do that little dance/laugh animation thing,2025-07-11 19:02:41
leagueoflegends,2025,7,Question about attending MSI,2025-07-11 18:56:45
leagueoflegends,2025,7,Question about resources for matchups,2025-07-11 18:25:56
leagueoflegends,2025,7,Could you help me in researching the competitive League of Legends scene?,2025-07-11 18:18:54
leagueoflegends,2025,7,"Caedrel: ""LoL will have Ups and Downs, how it develops in the next five years will be interesting..""",2025-07-11 18:18:52
leagueoflegends,2025,7,Counter Pick Jungle - is it real?,2025-07-11 18:17:02
leagueoflegends,2025,7,"Gen.G Ruler on his 2021 vs 2025 season: ""I started to doubt my gameplay, and lost confidence in myself, but now, I feel like I'm someone that can support my teammates.""",2025-07-11 18:16:38
leagueoflegends,2025,7,"Penalty issued for leaving/AFK, while not actually being the case?",2025-07-11 18:04:00
leagueoflegends,2025,7,Clips of Anomalies?,2025-07-11 17:56:12
leagueoflegends,2025,7,EWC Group Stage Draw,2025-07-11 17:39:01
leagueoflegends,2025,7,How early do pro teams arrive at the stadium,2025-07-11 17:13:11
leagueoflegends,2025,7,League vs Dota,2025-07-11 17:12:45
leagueoflegends,2025,7,"Is that working as intended? [Hwei, Ult-Flash]",2025-07-11 17:01:25
leagueoflegends,2025,7,AL possibly going through 3 series in 3 days feels slightly too much,2025-07-11 17:00:51
leagueoflegends,2025,7,Guide me,2025-07-11 16:53:24
leagueoflegends,2025,7,I miss Quick Play,2025-07-11 16:39:24
leagueoflegends,2025,7,Pulsefire Haste 2 Core,2025-07-11 16:38:27
leagueoflegends,2025,7,"AL Flandre on Tabe's interview w/ Caedrel: ""I don’t know how Western teams scrim, but from experience, our way of scrimming feels the most suitable. If we miss just one scrim block, I start to feel worried and doubt myself. Having 3 blocks allows us to train so many strategies, drafts, and ideas""",2025-07-11 16:35:29
leagueoflegends,2025,7,How to find schedules for league games?,2025-07-11 16:30:07
leagueoflegends,2025,7,Is there a Mythic Store bot?,2025-07-11 16:17:27
leagueoflegends,2025,7,Leagues community,2025-07-11 16:13:17
leagueoflegends,2025,7,Smurfing is taking over,2025-07-11 15:57:50
leagueoflegends,2025,7,Question about Penalties?,2025-07-11 15:51:52
leagueoflegends,2025,7,how to get prestige fright night zeri skin?,2025-07-11 15:48:26
leagueoflegends,2025,7,Op.gg may be down,2025-07-11 15:46:39
leagueoflegends,2025,7,I need help remembering a YouTuber,2025-07-11 15:45:32
leagueoflegends,2025,7,Natus Vincere Retains Rogue’s Coaching Staff,2025-07-11 15:42:00
leagueoflegends,2025,7,Someone told me that my face looks like,2025-07-11 15:38:04
leagueoflegends,2025,7,I created a small tool to help with Fearless Drafts - looking for feedback!,2025-07-11 15:30:22
leagueoflegends,2025,7,What champions have the highest win rate in sub 20 minute games?,2025-07-11 15:07:37
leagueoflegends,2025,7,"FLY Busio: ""I made mistakes I already knew about, so I'm very disappointed in myself for that [...] We don’t get punished as much in NA. Sometimes even, you don’t even know it’s a mistake, because the enemy played so badly. What Inspired said about that is absolutely true"" | Sheep Esports",2025-07-11 15:04:17
leagueoflegends,2025,7,Is Rengar trash?,2025-07-11 14:08:56
leagueoflegends,2025,7,Best otp champ (community),2025-07-11 13:54:27
leagueoflegends,2025,7,Phreak Patch 25.14 Preview,2025-07-11 13:48:18
leagueoflegends,2025,7,Ahri One Tricks ?,2025-07-11 13:26:04
leagueoflegends,2025,7,AL v BLG Hupu Ratings & Comments - MSI 2025 Round 3,2025-07-11 12:36:02
leagueoflegends,2025,7,Every champions ultimate resets on takedown like Pyke. Who benefits the most from this?,2025-07-11 12:32:34
leagueoflegends,2025,7,Rakan Spirit Blossom,2025-07-11 12:29:51
leagueoflegends,2025,7,Why is League eSports so popular?,2025-07-11 12:25:12
leagueoflegends,2025,7,a question bout the ranked icon,2025-07-11 12:21:45
leagueoflegends,2025,7,How difficult is building a good report Model?,2025-07-11 12:16:30
leagueoflegends,2025,7,Why Does League Feel So Empty Now?,2025-07-11 11:53:39
leagueoflegends,2025,7,Blue Essence feels pointless once all champs are owned,2025-07-11 11:48:12
leagueoflegends,2025,7,What was that jhin W at the BLG vs AL match,2025-07-11 11:45:52
leagueoflegends,2025,7,Diana build,2025-07-11 11:44:23
leagueoflegends,2025,7,Levei 4 sozinho de Mordekaiser — jogada insana em ranked! [Vídeo curto],2025-07-11 11:29:34
leagueoflegends,2025,7,"What's a champion that best imbodies ""You're playing by my rules now"" or one that just plays by their own rules.",2025-07-11 10:25:50
leagueoflegends,2025,7,League Of Legends RTS,2025-07-11 10:18:21
leagueoflegends,2025,7,LPL 2025 Split 3 Schedule,2025-07-11 10:12:51
leagueoflegends,2025,7,Us soldier in Korea,2025-07-11 09:50:21
leagueoflegends,2025,7,Why is my damage so low as a jungler?,2025-07-11 09:47:24
leagueoflegends,2025,7,My Ahri Immortalized cosplay !,2025-07-11 09:18:14
leagueoflegends,2025,7,Custom-Skins for Qiyana and others?,2025-07-11 09:17:01
leagueoflegends,2025,7,What voice line lives in your head rent free?,2025-07-11 09:03:35
leagueoflegends,2025,7,prestigious triumphant general darius,2025-07-11 08:54:58
leagueoflegends,2025,7,"Help I cant remove a little ""1"" notification on the chest in the loot tab",2025-07-11 07:29:46
leagueoflegends,2025,7,Where to find coaching,2025-07-11 06:34:21
leagueoflegends,2025,7,Ping Settings,2025-07-11 06:13:55
leagueoflegends,2025,7,Any idea when will Worlds 2024 T1 Skins be revealed ??,2025-07-11 06:11:21
leagueoflegends,2025,7,I need some suggestions.,2025-07-11 05:53:00
leagueoflegends,2025,7,What am I doing wrong?,2025-07-11 05:41:57
leagueoflegends,2025,7,"MSI Vancouver, To the 2 people at the accessibility area section 125 for BLG VS AL",2025-07-11 05:22:42
leagueoflegends,2025,7,it sucks seeing champs like fiora become troll picks in pro :(,2025-07-11 04:56:55
leagueoflegends,2025,7,Why do late game champions do so much damage early game?,2025-07-11 04:30:50
leagueoflegends,2025,7,What is League of Legends called in your country?,2025-07-11 04:24:07
leagueoflegends,2025,7,More range jungler please,2025-07-11 04:04:07
leagueoflegends,2025,7,Wouldn't having scaling %HP damage fix the %HP damage problem?,2025-07-11 03:59:37
leagueoflegends,2025,7,Does somebody know the Track of Pick & Ban in Game 5?,2025-07-11 03:54:52
leagueoflegends,2025,7,"The Faker Azir + Ruler Moment. History repeats itself! Anyone remeber T1 vs JDG, they are same#MSI2025",2025-07-11 03:32:14
leagueoflegends,2025,7,Not even close! Shanks' just better,2025-07-11 03:29:55
leagueoflegends,2025,7,AL vs BLG | MSI 2025 | Lower Bracket | PMT,2025-07-11 03:25:22
leagueoflegends,2025,7,Are there any stats on the percentile of an account based on amount of games played?,2025-07-11 02:59:45
leagueoflegends,2025,7,Since when can I only use emotes thrice?,2025-07-11 02:52:11
leagueoflegends,2025,7,I'll never do anything this cool again (OC),2025-07-11 02:22:37
leagueoflegends,2025,7,(OC) Shen is having great time at top lane,2025-07-11 02:07:12
leagueoflegends,2025,7,BLG 5-man ultimates Wombo-Combo but lost the teamfight wtf?!,2025-07-11 01:52:45
leagueoflegends,2025,7,T1 vs GEN: all first clear jungle paths,2025-07-11 01:38:21
leagueoflegends,2025,7,Best Neeko Competitive Skin,2025-07-11 01:26:16
leagueoflegends,2025,7,'hot take' you shouldn't loser lp if a person leaves less than 10 minutes after the game started,2025-07-11 01:21:58
leagueoflegends,2025,7,Has there been ever a champ as cursed as khalista this msi?,2025-07-11 01:07:57
leagueoflegends,2025,7,Feeling like its impossible to climb solo,2025-07-11 01:00:14
leagueoflegends,2025,7,League of Legends Uni Survey,2025-07-11 00:57:48
leagueoflegends,2025,7,CT's T1 v GENG Part 2 (Games 3/4/5),2025-07-11 00:43:36
leagueoflegends,2025,7,Does the korean solo queue bible still exist?,2025-07-11 00:32:44
leagueoflegends,2025,7,"FLY Massu reflects on his journey to pro and makes me feel old - “[When LoL last came to Canada] in 2017, I was in middle school…I used to play a lot of Rocket League. I thought I would go pro at that game.”",2025-07-11 00:19:41
leagueoflegends,2025,7,Rumble vs Illaoi,2025-07-11 00:13:44
leagueoflegends,2025,7,Who’s got your favorite character backstory?,2025-07-11 00:10:08
leagueoflegends,2025,7,Comeback Mechanics Have Turned So Many Games Into 30-Minute Coinflips,2025-07-10 23:54:23
leagueoflegends,2025,7,Why shadowflame doesn’t show damage dealt?,2025-07-10 23:38:49
leagueoflegends,2025,7,New player need general tips,2025-07-10 23:07:33
leagueoflegends,2025,7,League not launching properly after champ select,2025-07-10 23:04:01
leagueoflegends,2025,7,2025 Mid Season Invitational / Bracket Stage / Round 3 - Day 1 / Live Discussion,2025-07-10 23:01:14
leagueoflegends,2025,7,Karmine Corp signs exclusive content partnership with X,2025-07-10 22:52:07
leagueoflegends,2025,7,I really wish to have Green Summoner's Rift back,2025-07-10 22:50:30
leagueoflegends,2025,7,Help for improving,2025-07-10 22:22:26
