game,subreddit,author,created_utc,year,score,original_title,cleaned
GTA,gta,Next-Archer1707,2023-06-05T23:19:37,2023,7,Hello my named is Orion I have a dog whose named is Captain he loves everybody but if you come near him being mean he will bark but he'll still let you pet him because he is a loving dog he just wants to play whenever he does that if you want to see Captain I can put a picture of him right here,hello named orion dog whose named captain loves everybody come near mean bark hell still let pet loving dog wants play whenever want see captain put picture right
GTA,gta,AngeloLunch,2023-06-05T23:26:30,2023,5,"I asked ChatGPT to pick a GTA character, a car, a location, and to help me write a short film. So of course it ended up with Queen Elizabeth II in an attack helicopter chasing Tommy Vercetti through Los Santos.",asked chatgpt pick gta character car location help write short film course ended queen elizabeth ii attack helicopter chasing tommy vercetti los santos
GTA,gta,WIZARDEUS,2023-06-06T00:01:33,2023,1,Invitation to join my Discord server,invitation join discord server
GTA,gta,bigyuse,2023-06-06T01:34:22,2023,1,"Easy GTA 5 Frozen Money Glitch 2023! : Buy Cars, Keep the Cash! 30 Million Every 10 Minutes!",easy gta 5 frozen money glitch 2023 buy cars keep cash 30 million every 10 minutes
GTA,gta,ArkiSponge2000,2023-06-06T01:38:57,2023,19,Epic fails in Mission OG Loc,epic fails mission og loc
GTA,gta,skaldk,2023-06-06T02:01:56,2023,0,You can't enter the LS Car Meet with this vehicle,cant enter ls car meet vehicle
GTA,gta,Zealousideal_Cut5569,2023-06-06T02:05:54,2023,1,Where do I get the flying bike,get flying bike
GTA,gta,Luxray2014,2023-06-06T02:33:23,2023,1,"Here's my head canon for the GTA timeline, that's if the games were all in one universe",heres head canon gta timeline thats games one universe
GTA,gta,ProudestSlut,2023-06-06T03:43:51,2023,0,"Do most of you people love GTA IV because being different than the majority makes you feel ""superior""?",people love gta iv different majority makes feel superior
GTA,gta,ChampionshipHour3139,2023-06-06T04:07:21,2023,0,Which 3d universe game Has the best atmosphere?,3d universe game best atmosphere
GTA,gta,Swordfish-Different,2023-06-06T04:15:10,2023,7,Civilian helps police,civilian helps police
GTA,gta,ayyyyoooh,2023-06-06T04:16:49,2023,11,A beautiful journey across Los Santos(mute volume its only jet noises)filter settings in comments,beautiful journey across los santosmute volume jet noisesfilter settings comments
GTA,gta,Loonatic95,2023-06-06T04:36:45,2023,1,Come follow me on twitch and YouTube,come follow twitch youtube
GTA,gta,XubeLESS,2023-06-06T05:16:57,2023,1,GTA V Cheats for a motorbike,gta v cheats motorbike
GTA,gta,Hot-Canary-4875,2023-06-06T06:29:24,2023,2,Why does Gta Vice city Android Crash?,gta vice city android crash
GTA,gta,aguaj97,2023-06-06T06:46:43,2023,1,CDLS (LOS SANTOS CARTEL) PSN ONLY !!!!!!!!,cdls los santos cartel psn
GTA,gta,Jacky500x,2023-06-06T08:03:04,2023,288,Who wins in a fight?,wins fight
GTA,gta,FunBusy4807,2023-06-06T09:11:48,2023,1,Why can't I buy guns ?,cant buy guns
GTA,gta,vince0000000000,2023-06-06T09:17:43,2023,1,GTA 5 swimming on a boat,gta 5 swimming boat
GTA,gta,Purple-Height4239,2023-06-06T09:30:51,2023,3,"Do we know what the reason was that teapotuberhacker didn't get his hands on even more videos than he did? As in, what has put a stop to him downloading more than the 90 videos he managed to?",know reason teapotuberhacker didnt get hands even videos put stop downloading 90 videos managed
GTA,gta,LostInTheMist920,2023-06-06T10:03:12,2023,1,Does the GTA Trilogy on the R* Store support controllers?,gta trilogy r store support controllers
GTA,gta,6_Ball,2023-06-06T10:42:56,2023,0,GTA Trilogy Edition stops installing,gta trilogy edition stops installing
GTA,gta,LuckyBearFriend,2023-06-06T10:46:24,2023,0,Part of the future update,part future update
GTA,gta,Intelligent_Lime_175,2023-06-06T11:41:59,2023,392,Missions in which city do you like the most and why? GTA SA,missions city like gta sa
GTA,gta,Blumenkohl1,2023-06-06T12:33:10,2023,1,my GTA5 socialclub ingame dont work like it schuld be,gta5 socialclub ingame dont work like schuld
GTA,gta,deformedmobster2,2023-06-06T14:05:34,2023,2,How do you do free aim in vice city ps2,free aim vice city ps2
GTA,gta,Narrow-Spend-4813,2023-06-06T14:49:36,2023,1,GTA Series Videos (@gtaseriesnews) • Instagram photos and videos,gta series videos gtaseriesnews • instagram photos videos
GTA,gta,Welson_Liong,2023-06-06T14:51:21,2023,1,How do I get better mouse sensitivity for GTA San Andreas? Changing mouse sensitivity from in-game settings doesn't make much of a difference.,get better mouse sensitivity gta san andreas changing mouse sensitivity ingame settings doesnt make much difference
GTA,gta,VukeFN,2023-06-06T15:41:04,2023,1,"You may have came across this GTA Mega Ramp minigame, if you have watched some videos on tiktok before. I wanted to know if anyone knows where I can download the ramp part as a 3D object. thanks.",may came across gta mega ramp minigame watched videos tiktok wanted know anyone knows download ramp part 3d object thanks
GTA,gta,Pinche3dwinn,2023-06-06T16:25:31,2023,2,GTA: Criminal Enterprise Starter Pack (on ps4),gta criminal enterprise starter pack ps4
GTA,gta,Hijack607,2023-06-06T16:28:09,2023,16,"In your opinion, what is the most important GTA game ever made?",opinion important gta game ever made
GTA,gta,DefinitelyEnisi,2023-06-06T16:34:23,2023,407,comically long sliding,comically long sliding
GTA,gta,ParkerHudson666,2023-06-06T17:14:22,2023,1184,Found this on YT (Greasy Pickles),found yt greasy pickles
GTA,gta,Spaceahuttle,2023-06-06T17:37:49,2023,3,Is there any information about what's the population of Los Santos in GTA V?,information whats population los santos gta v
GTA,gta,Artistic-Luck-2228,2023-06-06T17:48:54,2023,1,Gran Turismo part II now available,gran turismo part ii available
GTA,gta,_Suumash,2023-06-06T18:41:22,2023,17,i think i need a break from gta,think need break gta
GTA,gta,SnipCheddaBombs,2023-06-06T18:52:15,2023,1,Shameless Plug for my YouTube Channel,shameless plug youtube channel
GTA,gta,gaimin_io,2023-06-06T18:56:15,2023,0,"If you play GTA V and want a piece of the $10,000 Prize pool, watch this! 👀 - Join here: https://www.gaimin.gg/gta-contest",play gta v want piece 10000 prize pool watch join httpswwwgaimingggtacontest
GTA,gta,TheFortWayneTrojan,2023-06-06T19:06:50,2023,1,Rolf roasts Lamar,rolf roasts lamar
GTA,gta,Infamous-Young-2790,2023-06-06T19:25:44,2023,1,Can someone make me a crew emblem from i pic i have ?? (I wanna pay for it),someone make crew emblem pic wanna pay
GTA,gta,yeyoukno,2023-06-06T19:27:34,2023,1,Day 1 Of Playing GTA 4 Since GTA 6 is not out yet...,day 1 playing gta 4 since gta 6 yet
GTA,gta,gerasalu,2023-06-06T20:22:36,2023,1,Surf safely with the best VPN,surf safely best vpn
GTA,gta,DeepEnoughToFlip,2023-06-06T20:44:24,2023,0,Very serious magazine The Economist with deep GTA: SA reference LOL,serious magazine economist deep gta sa reference lol
GTA,gta,Zenvezz,2023-06-06T21:14:07,2023,7,GTA 3 - RTX a graphics mod for the original gta 3,gta 3 rtx graphics mod original gta 3
GTA,gta,mel707gh,2023-06-06T21:35:53,2023,1,Who else has not been able to beat the casino heist because of a glitch?,else able beat casino heist glitch
GTA,gta,No_Rabbit1,2023-06-06T21:54:43,2023,1,Is the 6700 XT good enough for Fivem High Settings?,6700 xt good enough fivem high settings
GTA,gta,Accomplished_Art6426,2023-06-06T22:00:35,2023,0,What is your favorite GTA that you have played?,favorite gta played
GTA,gta,ChrisMahoney,2023-06-06T22:55:21,2023,9,Who put in the Chaos Mode cheat?,put chaos mode cheat
GTA,gta,Domizss,2023-06-06T23:26:49,2023,20,Menace II Society In GTA: San Andreas,menace ii society gta san andreas
GTA,gta,Strange_Hamster_4219,2023-06-07T00:25:07,2023,9,idk if this is a gta problem. I tried it on 2 different tvs and still the same,idk gta problem tried 2 different tvs still
GTA,gta,dtxmichael214,2023-06-07T01:14:49,2023,1,I need help I recently finished gta 3 definitive edition but I’m stuck at 99% is it a bug or something cause I did everything in the game,need help recently finished gta 3 definitive edition i’m stuck 99 bug something cause everything game
GTA,gta,EmergencyAvailable76,2023-06-07T01:27:53,2023,1,How do i play the new missions they release online?,play new missions release online
GTA,gta,Chill7509,2023-06-07T01:38:08,2023,1,Need help in GTA S.A Definitive edition on pc,need help gta sa definitive edition pc
GTA,gta,OGdavey420,2023-06-07T01:54:38,2023,0,What if GTA6 will be called differently?,gta6 called differently
GTA,gta,Beneficial-Tree4211,2023-06-07T02:05:49,2023,573,Beautiful graphics for a 2008 game,beautiful graphics 2008 game
GTA,gta,Justhuman963,2023-06-07T02:23:30,2023,248,This masterpiece came out 10 years ago. How do you think people would react if it actually released in 2023?,masterpiece came 10 years ago think people would react actually released 2023
GTA,gta,Gooddoggo23,2023-06-07T03:03:39,2023,1,Accidentally hung up on Ricky now he won’t call back,accidentally hung ricky won’t call back
GTA,gta,Difficult-Ground5263,2023-06-07T03:15:14,2023,10,Anybody ever notice this because I just noticed that today,anybody ever notice noticed today
GTA,gta,Ripper31189,2023-06-07T03:58:50,2023,1,Which (non-US) cities do you think would be great GTA backdrops?,nonus cities think would great gta backdrops
GTA,gta,Yah_Boi_Chris1,2023-06-07T05:12:13,2023,1,Life RP (for PS4),life rp ps4
GTA,gta,boombam3630,2023-06-07T05:24:49,2023,3,time for my once-a-summer story mode play-through,time onceasummer story mode playthrough
GTA,gta,AaronJustiniano,2023-06-07T05:39:33,2023,0,We might have poker in GTA 6,might poker gta 6
GTA,gta,AccessProfessional37,2023-06-07T06:52:55,2023,0,Ideas for short GTA V movies?,ideas short gta v movies
GTA,gta,BloodpoolTR01,2023-06-07T07:55:48,2023,0,Who knows him(her)?,knows himher
GTA,gta,gamingwithjumbo,2023-06-07T08:56:56,2023,12,GTA San Andreas Fan Remastered | In the beginning... (Part 1),gta san andreas fan remastered beginning part 1
GTA,gta,MaternalExponent,2023-06-07T09:03:30,2023,0,What is you favorite GTA?,favorite gta
GTA,gta,Hirushan790,2023-06-07T09:44:35,2023,1,Wanna see most hottest gta v clip then click here,wanna see hottest gta v clip click
GTA,gta,Charming_Task6445,2023-06-07T09:54:12,2023,1,Why does the worlds on five m become invisible for me I run it on a intel i5 10400f 1660ti how can I run it better please help,worlds five become invisible run intel i5 10400f 1660ti run better please help
GTA,gta,Tobbenbobben,2023-06-07T10:31:25,2023,0,Anybody knows a moneyglitch on pc that you dont get banned for?,anybody knows moneyglitch pc dont get banned
GTA,gta,Tight_Leadership_496,2023-06-07T11:09:03,2023,6,So What's your set expectations of the new jets coming with the GTA Online San Andrea's Mercenaries Update on June 13th?,whats set expectations new jets coming gta online san andreas mercenaries update june 13th
GTA,gta,Lakhib,2023-06-07T11:58:28,2023,2,Roast each other in the comments⬇️,roast comments
GTA,gta,Patient-Priority4293,2023-06-07T12:11:58,2023,1,is the gta 5 online only on ps5 a whole different game then gta or whatever since when i go to switch characters it says manage characters instead of swap characters can someone lmk with why gta online only is different from older gen gta,gta 5 online ps5 whole different game gta whatever since go switch characters says manage characters instead swap characters someone lmk gta online different older gen gta
GTA,gta,Right-Turnover-7970,2023-06-07T16:03:40,2023,0,Can you download samp on a pirated version of gtasa,download samp pirated version gtasa
GTA,gta,dimazzagung48,2023-06-07T17:07:17,2023,5,This reminds me of GTA San Andreas vibes,reminds gta san andreas vibes
GTA,gta,alannabannana,2023-06-07T18:00:22,2023,1,Ps4 game disc on ps5?,ps4 game disc ps5
GTA,gta,MMINIMANN282,2023-06-07T18:04:58,2023,12,"One of my GTA photographs. I’m quite new to the photography world of GTA, I am proud of it despite only having R* editor.",one gta photographs i’m quite new photography world gta proud despite r editor
GTA,gta,Sommet_,2023-06-07T18:09:05,2023,1,Should I Restart My GTAO Character?,restart gtao character
GTA,gta,FrostyHoney69,2023-06-07T18:55:07,2023,2,Look at what someone made in my hometown and they are for sale,look someone made hometown sale
GTA,gta,CenturyHelix,2023-06-07T19:21:04,2023,195,I still do not understand Catalina and CJ’s relationship,still understand catalina cj’s relationship
GTA,gta,Aliammar360,2023-06-07T19:43:34,2023,82,The alarm better not ring this time...,alarm better ring time
GTA,gta,TheSpaceExplorer1,2023-06-07T20:42:11,2023,5,Is it still worth it to get the game now even though GTA 6 will likely come out in the next few years?,still worth get game even though gta 6 likely come next years
GTA,gta,orphantwin,2023-06-07T20:54:57,2023,4,My favorite thing to do in GTA V. Just relaxing with mods.,favorite thing gta v relaxing mods
GTA,gta,cmiller4642,2023-06-07T21:59:40,2023,0,Do you think that GTA 6 can even pass the ESRB if it’s as realistic as RDR2?,think gta 6 even pass esrb it’s realistic rdr2
GTA,gta,qwertybbqlol,2023-06-07T23:15:09,2023,1,is trevor philips straight?,trevor philips straight
GTA,gta,Asshole_Juices,2023-06-07T23:36:13,2023,66,This ain't so bad after all!,aint bad
GTA,gta,BigMan_Sauce_6098,2023-06-08T00:08:58,2023,1,"Hello fellow gta gamers question for ya'll I have an ""ASUS"" LAPTOP would I be able to run gta offline with smooth frame rate? Would I also be able to add mods?",hello fellow gta gamers question yall asus laptop would able run gta offline smooth frame rate would also able add mods
GTA,gta,purple_shawk,2023-06-08T01:43:19,2023,1,Is Rockstar actually paying attention to gameplay?,rockstar actually paying attention gameplay
GTA,gta,Western-Constant2340,2023-06-08T02:41:13,2023,1,The best and worst thing about every mainline gta,best worst thing every mainline gta
GTA,gta,No_Border3502,2023-06-08T03:08:05,2023,0,Follow/Dem me giving free gta accounts out all night got 300 left,followdem giving free gta accounts night got 300 left
GTA,gta,theroxersecer,2023-06-08T03:15:51,2023,2,GTA 5 Sudden frame drop issue on i7 12700H with RTX 3060...,gta 5 sudden frame drop issue i7 12700h rtx 3060
GTA,gta,epic_meme_guy,2023-06-08T04:26:37,2023,22,The dear npc has me nostalgic for the gta 3 era,dear npc nostalgic gta 3 era
GTA,gta,Acrobatic_Energy_750,2023-06-08T04:58:18,2023,5,Which trio is the best?,trio best
GTA,gta,Jut123504,2023-06-08T06:40:48,2023,0,Subscribe to my YouTube channel,subscribe youtube channel
GTA,gta,Weinerboy9000,2023-06-08T07:36:35,2023,1,Has anyone else been having trouble when inviting friends through xbox in gta? When I invite friends and they accept it nothing’s happens,anyone else trouble inviting friends xbox gta invite friends accept nothing’s happens
GTA,gta,furopinionYT,2023-06-08T08:14:22,2023,1,It Was A Good Day | GTA: San Andreas,good day gta san andreas
GTA,gta,george123890yang,2023-06-08T08:31:30,2023,330,Which GTA game do you think had the best music and radio stations?,gta game think best music radio stations
GTA,gta,TommieBuncetti,2023-06-08T09:35:42,2023,1876,Grand Theft Auto: San Andreas (2004),grand theft auto san andreas 2004
GTA,gta,Mythoslav,2023-06-08T10:44:08,2023,1,Looking for an old GTA LCS multiplayer video,looking old gta lcs multiplayer video
GTA,gta,Immediate-Bid-3824,2023-06-08T11:10:22,2023,1,Next mission not appearing,next mission appearing
GTA,gta,Imneedhelpwastaken,2023-06-08T11:25:26,2023,1,Can my freind play with me if I buy story mode separately,freind play buy story mode separately
GTA,gta,oxmat,2023-06-08T11:44:31,2023,1,The Pacific Standard heist 7’55 world record (PS5),pacific standard heist 7’55 world record ps5
GTA,gta,Unique_Friendship438,2023-06-08T13:05:10,2023,1,Hey could i take Michael's money back after Jimmy stole it ?,hey could take michaels money back jimmy stole
GTA,gta,Snoo_61724,2023-06-08T13:06:38,2023,505,Now New York City has became Liberty City with PS3 graphics,new york city became liberty city ps3 graphics
GTA,gta,estevann,2023-06-08T13:23:50,2023,2,AI turns celebrities into gta loading screens,ai turns celebrities gta loading screens
GTA,gta,Stephenosborne01,2023-06-08T14:32:52,2023,0,Opie and Anthony and others in rockstar games,opie anthony others rockstar games
GTA,gta,commerical_jellyfish,2023-06-08T14:38:51,2023,3,ABQ as a potential location?,abq potential location
GTA,gta,ScRaPpY_doz_it,2023-06-08T16:45:01,2023,2,Cayo perico heist b2b,cayo perico heist b2b
GTA,gta,G_W_addict,2023-06-08T19:19:06,2023,2,[GTA4]Escaping 5-star police chase,gta4escaping 5star police chase
GTA,gta,Grand-Answer-6276,2023-06-08T19:29:05,2023,5,They better check their rear view mirror,better check rear view mirror
GTA,gta,Kamikatzenoob,2023-06-08T19:36:29,2023,1,"Help, my Game crashes",help game crashes
GTA,gta,Du1g0,2023-06-08T19:49:23,2023,1,3 ways to play GTA San Andreas in VR,3 ways play gta san andreas vr
GTA,gta,CrownedVanguard,2023-06-08T20:56:55,2023,32,Steve Haines is alive?!,steve haines alive
GTA,gta,senatorpartysocks,2023-06-08T21:13:12,2023,74,Who wants to see?,wants see
GTA,gta,AverageNikoBellic,2023-06-08T21:19:09,2023,1,How to report someone on Xbox,report someone xbox
GTA,gta,No_Needleworker_9544,2023-06-08T22:12:16,2023,1,GTA 5 Online Weekly Update | Drop Zone | How To Play for 2x Bonuses This Week,gta 5 online weekly update drop zone play 2x bonuses week
GTA,gta,caculo,2023-06-08T22:17:07,2023,4,Playing GTA V on my RockstarBoy :-),playing gta v rockstarboy
GTA,gta,Ok_Film8731,2023-06-08T23:45:33,2023,1,Why you should ALWAYS wear a helmet,always wear helmet
GTA,gta,InvertedNoob,2023-06-09T01:14:48,2023,6,I need to know what car this is,need know car
GTA,gta,Lartiose,2023-06-09T01:16:29,2023,37,Public Transportation at its Best,public transportation best
GTA,gta,Scary_Target_8490,2023-06-09T01:22:08,2023,3,Should I get gta trilogy for ios?,get gta trilogy ios
GTA,gta,Rabbid020012,2023-06-09T02:15:44,2023,1,Does anybody know a First-Person mod not to complicated con only works with Cleo 3? I'm using Alien City so to complex mod does not start the game.,anybody know firstperson mod complicated con works cleo 3 im using alien city complex mod start game
GTA,gta,Correct_Rip9713,2023-06-09T03:08:30,2023,1,Please Help My Pc Is Having So Much Trouble Running GTA: RP FiveM and It says it’s a GPU problem but idk how to fix.,please help pc much trouble running gta rp fivem says it’s gpu problem idk fix
GTA,gta,acuppoftee,2023-06-09T05:27:49,2023,4,San andreas original?,san andreas original
GTA,gta,SapphiredX,2023-06-09T06:09:36,2023,2,GTA 3: Unique Stunt (Staunton Island) Not unlocking,gta 3 unique stunt staunton island unlocking
GTA,gta,Best_Calligrapher202,2023-06-09T06:30:21,2023,1,[ Removed by Reddit ],removed reddit
GTA,gta,Financial_Age_3286,2023-06-09T07:31:37,2023,1,GTA online game crashes in loading screen,gta online game crashes loading screen
GTA,gta,SensitiveTemporary16,2023-06-09T07:43:43,2023,0,Why story mode costs money?,story mode costs money
GTA,gta,_P1D3H_,2023-06-09T08:40:02,2023,629,At this moment. Which car do you pick?,moment car pick
GTA,gta,Current_Ad7604,2023-06-09T09:15:12,2023,0,I am done with GTA V and the Rockstar Launcher,done gta v rockstar launcher
GTA,gta,Worth-Rope2812,2023-06-09T09:29:27,2023,3,We need a 90s pop punk or grunge station in future GTA games,need 90s pop punk grunge station future gta games
GTA,gta,Choice_Prompt_8271,2023-06-09T13:23:46,2023,2,Anybody remember playing gta 4 and hearing a kid get spanked over the radio lol,anybody remember playing gta 4 hearing kid get spanked radio lol
GTA,gta,Nihal_muhammed,2023-06-09T13:39:14,2023,2,First time playing and i couldn't even complete it(i played for a week and now I have to delete),first time playing couldnt even complete iti played week delete
GTA,gta,Kickenbless,2023-06-09T16:59:30,2023,6,"San Andreas first time, which version recommended?",san andreas first time version recommended
GTA,gta,Chazza354,2023-06-09T17:08:25,2023,40,"Starting my weekend with the most underrated version of VC - improved graphics, analogue driving controls, custom radio station, faster loading and more stable framerate than PS2. Who else still plays the OG Xbox version of VC?",starting weekend underrated version vc improved graphics analogue driving controls custom radio station faster loading stable framerate ps2 else still plays og xbox version vc
GTA,gta,ClubPenguinMaster22,2023-06-09T17:27:28,2023,251,What Packie McReary should've looked like VS What he ended up looking like in GTA V (photoshopped by meee!),packie mcreary shouldve looked like vs ended looking like gta v photoshopped meee
GTA,gta,ObiWanJedi4Life,2023-06-09T18:42:34,2023,3,"hello there, i am looking for a fan-made modded version of OG gta vice city i used to play as a kid. from what i can remember in this version the game would start off in the airport, and some missions were cut, there was a completely new set of vehicles some of them were; lancia delta, suzuki...",hello looking fanmade modded version og gta vice city used play kid remember version game would start airport missions cut completely new set vehicles lancia delta suzuki
GTA,gta,JewishGoodLad,2023-06-09T19:22:58,2023,690,Why didn't Johnny call Terry or Clay for backup ? Is he stupid ?,didnt johnny call terry clay backup stupid
GTA,gta,d3x4Good,2023-06-09T20:25:35,2023,8,An unlucky way to luse your personal vehicle,unlucky way luse personal vehicle
GTA,gta,No_Signature7371,2023-06-09T21:05:36,2023,1,This mission was not designed for console players,mission designed console players
GTA,gta,MathematicianNo3096,2023-06-09T21:10:26,2023,2,Big con replay b2b,big con replay b2b
GTA,gta,Roll-Cabinet-1662,2023-06-09T21:18:38,2023,1,"I made a GTAV Shortmovie ""The Student""",made gtav shortmovie student
GTA,gta,voluntarilyweedriver,2023-06-09T22:23:03,2023,16,"You have $1500, those you buy will protect you then the rest will come for you...",1500 buy protect rest come
GTA,gta,corduroycats,2023-06-09T22:42:48,2023,2,Does anyone have a GTA IV map for beginners lol,anyone gta iv map beginners lol
GTA,gta,AvaryanMikledet,2023-06-09T22:55:22,2023,2,Crashes while playing GTA v on a new high end pc,crashes playing gta v new high end pc
GTA,gta,Own_Orange5021,2023-06-09T23:19:22,2023,1,The most Grand Theft Auto moment I've ever seen.,grand theft auto moment ive ever seen
GTA,gta,Victor_Arrendajo_96,2023-06-09T23:21:13,2023,3,Would you like to see another GTA game using cel shading like Chinatown Wars?,would like see another gta game using cel shading like chinatown wars
GTA,gta,MrPigeon70,2023-06-10T00:02:19,2023,7,Pov: Michael got his boat back,pov michael got boat back
GTA,gta,No_Box4859,2023-06-10T00:13:32,2023,182,Americans: Canadians are the nicest people on earth! Canadians:,americans canadians nicest people earth canadians
GTA,gta,Oppenheimer45_,2023-06-10T00:14:52,2023,1,Gta Tuners World record (legit),gta tuners world record legit
GTA,gta,Independent_Push_599,2023-06-10T00:51:17,2023,2,Anyone experienced this before!,anyone experienced
GTA,gta,No-Change6959,2023-06-10T01:07:37,2023,2,What would be your ideal size for the GTA 6 map?,would ideal size gta 6 map
GTA,gta,CrazyBOI7,2023-06-10T01:44:50,2023,0,Is there a mod that removes nudity,mod removes nudity
GTA,gta,thiccboi077,2023-06-10T01:52:28,2023,2,Help with sell missions/heist,help sell missionsheist
GTA,gta,Fluid-Squash3573,2023-06-10T02:03:18,2023,1,GTA 5 Help with acc,gta 5 help acc
GTA,gta,Mr_Person567,2023-06-10T02:36:24,2023,1,Should I play the other games for 5,play games 5
GTA,gta,That-Length-6082,2023-06-10T03:03:35,2023,2,Casino heist artwork,casino heist artwork
GTA,gta,Chemical_Newt4907,2023-06-10T03:24:45,2023,3,If GTA characters were rappers,gta characters rappers
GTA,gta,Legitimate_Mood_3914,2023-06-10T04:58:58,2023,8,Honest thoughts about GTA 5 (GET YA DOWNVOTES READDDDDYYYY),honest thoughts gta 5 get ya downvotes readddddyyyy
GTA,gta,EeeeOoAa,2023-06-10T05:14:31,2023,14,Condition This You Geriatric Fuck,condition geriatric fuck
GTA,gta,uniqueusername188,2023-06-10T06:32:45,2023,919,Today I found the ideal carpet,today found ideal carpet
GTA,gta,the_last_pocket,2023-06-10T06:56:17,2023,2,CJ ain't no busta,cj aint busta
GTA,gta,mattriarchal,2023-06-10T07:33:04,2023,2,Looking for a snippet from GTA V radio,looking snippet gta v radio
GTA,gta,Novascotia7069,2023-06-10T09:24:09,2023,154,Why does everyone like the gta4 ragdoll physics? This is a joke,everyone like gta4 ragdoll physics joke
GTA,gta,Tavsolos,2023-06-10T09:48:43,2023,0,GTA 3 is the worst in the series,gta 3 worst series
GTA,gta,JovanThePlatypus456,2023-06-10T10:42:07,2023,2,"Still on xbox 360, how to use wheele bar?",still xbox 360 use wheele bar
GTA,gta,Powerful-Study-1603,2023-06-10T11:24:40,2023,2,tried modding visuals,tried modding visuals
GTA,gta,PlaneBoyMemes,2023-06-10T12:53:44,2023,21,"a freecam shot of lower algonquin, vanilla graphics",freecam shot lower algonquin vanilla graphics
GTA,gta,Certain_Horror_3423,2023-06-10T13:03:19,2023,2,2 insurgent pickup customs simultaneously,2 insurgent pickup customs simultaneously
GTA,gta,GreenPufferFish_14,2023-06-10T13:28:26,2023,6,GTA original trilogy,gta original trilogy
GTA,gta,Madoc_eu,2023-06-10T13:50:06,2023,3,Are AI generated images allowed here?,ai generated images allowed
GTA,gta,Ithinkahead123,2023-06-10T13:51:35,2023,3,Custom License Plate,custom license plate
GTA,gta,Shot_Appearance_876,2023-06-10T13:58:05,2023,214,When you turn on rebel radio and hear this,turn rebel radio hear
GTA,gta,Artista_2O,2023-06-10T14:18:52,2023,228,I didn't know i could do this😂,didnt know could
