game,subreddit,author,created_utc,year,score,original_title,cleaned
GTA,gta,Agreeable-Intern-505,2023-06-23T15:41:18,2023,3,Is it better to do cayo perico solo and wait the really long cool-down or do it in a duo with the small cool down?,better cayo perico solo wait really long cooldown duo small cool
GTA,gta,Horror-Fact5894,2023-06-23T16:08:28,2023,2,"I want these pants, but it says “Unlock this item by completing prep work for the diamond casino heist” but I’ve already done that and they are still locked?",want pants says “unlock item completing prep work diamond casino heist” i’ve already done still locked
GTA,gta,AdFit7825,2023-06-23T16:38:41,2023,2,GTA freezes and crashes on startip,gta freezes crashes startip
GTA,gta,BottleBig3725,2023-06-23T16:50:38,2023,148,The GTA IV Coop Playthrough gets funnier every day,gta iv coop playthrough gets funnier every day
GTA,gta,MilkyKoalaBoi,2023-06-23T17:24:36,2023,2,GTA IV Aspect Ratio Issue?,gta iv aspect ratio issue
GTA,gta,JudgementDali,2023-06-23T17:32:54,2023,3,logging back to ps4 after transferring to ps5,logging back ps4 transferring ps5
GTA,gta,abdel06kim,2023-06-23T17:33:30,2023,1,"This image is an excerpt from the game, I’m not going to lie to you",image excerpt game i’m going lie
GTA,gta,Samuel_Mahmuti,2023-06-23T17:39:57,2023,2,Heya got a question how much fps does gta san andreas run on iphone 13 pro,heya got question much fps gta san andreas run iphone 13 pro
GTA,gta,Pachong45,2023-06-23T18:47:35,2023,2,Hardest mission in the game?,hardest mission game
GTA,gta,TZ24GAMER,2023-06-23T18:50:54,2023,1,Gta 4 and triology,gta 4 triology
GTA,gta,Komman98,2023-06-23T19:12:16,2023,2,GTA Online - Funny Moments #6,gta online funny moments 6
GTA,gta,UncleRayyy,2023-06-23T19:34:59,2023,1,GTA 4 in 2023 but it's only the cursed moments...,gta 4 2023 cursed moments
GTA,gta,seriouslyIamjim,2023-06-23T20:01:50,2023,1,At least this one works...,least one works
GTA,gta,contemporaryTart,2023-06-23T20:39:37,2023,2,making conceptual art in GTA 5 Online,making conceptual art gta 5 online
GTA,gta,DragonfruitSuper963,2023-06-23T21:12:40,2023,1,Gta stacked account level 7982,gta stacked account level 7982
GTA,gta,SeatSeparate1617,2023-06-23T21:53:25,2023,2,GTA 3 Definitive Edition So Far Is Annoying,gta 3 definitive edition far annoying
GTA,gta,Sheftyy,2023-06-23T22:20:23,2023,7,How did i even hit that shot jesus,even hit shot jesus
GTA,gta,International-Job553,2023-06-23T22:54:45,2023,2,How to bookmark a job to a specific platform?,bookmark job specific platform
GTA,gta,eric0225,2023-06-23T23:27:12,2023,3,Can't start hood safari,cant start hood safari
GTA,gta,The_Deprived_99,2023-06-24T00:50:15,2023,50,"If you were to give a voice to Claude Speed, the only GTA Protagonist other than GTA Online Protagonists to be silent. what kind of voice would you give him? Personally, I'd give him a dark, threatening, but calm type of voice given his personality.",give voice claude speed gta protagonist gta online protagonists silent kind voice would give personally id give dark threatening calm type voice given personality
GTA,gta,samotelgordo,2023-06-24T01:51:06,2023,5,I don't want GTA 6 map to be a fricking island,dont want gta 6 map fricking island
GTA,gta,FMAGF,2023-06-24T02:28:58,2023,4,Need help in modding GTA San Andreas,need help modding gta san andreas
GTA,gta,radioactivechicken20,2023-06-24T04:34:10,2023,3,Agent 47 assassinates Andrew Tate (GTA 5 Machinima),agent 47 assassinates andrew tate gta 5 machinima
GTA,gta,Repulsive-Finger-954,2023-06-24T05:30:44,2023,1,"If Claude were to have a voice actor, who do you think would be the best choice?",claude voice actor think would best choice
GTA,gta,Linux_Rulez,2023-06-24T07:32:27,2023,1,Why I don't like the lazer nerf and what could have been done differently?,dont like lazer nerf could done differently
GTA,gta,Useful-Assistance-47,2023-06-24T08:09:36,2023,1,First come first serve $160 ps4,first come first serve 160 ps4
GTA,gta,bigtree2x5,2023-06-24T10:17:09,2023,4,why does this sign say miami? this place isnt even supposed to exist. is rockstar stupid?,sign say miami place isnt even supposed exist rockstar stupid
GTA,gta,WoodpeckerNo9629,2023-06-24T10:19:00,2023,1,GTA online | IAA,gta online iaa
GTA,gta,Excellent-Milk5813,2023-06-24T11:17:33,2023,1,Guess where I am on the map who guesses right gets absolutely nothing from me,guess map guesses right gets absolutely nothing
GTA,gta,___kimmmpossible,2023-06-24T11:52:22,2023,2,GTA ONLINE - San Andreas mercenaries missions,gta online san andreas mercenaries missions
GTA,gta,BLAZE_BLADER_09,2023-06-24T12:34:16,2023,697,I just completed GTA V campaign,completed gta v campaign
GTA,gta,LankySpare,2023-06-24T13:04:22,2023,3,What paranormal Easter eggs are you hoping to find in 6?,paranormal easter eggs hoping find 6
GTA,gta,raydawngames,2023-06-24T13:12:45,2023,37,Trevor makes you play different,trevor makes play different
GTA,gta,SmithSahil779,2023-06-24T13:16:39,2023,1,Want To Download GTA San Andreas For Android,want download gta san andreas android
GTA,gta,Mission-Ad1898,2023-06-24T14:41:36,2023,4,Which game would you prefer gta 6 being like gta 4 or gta 5 and why?,game would prefer gta 6 like gta 4 gta 5
GTA,gta,9tsElvis,2023-06-24T15:12:37,2023,1,GTA V Epic Montage: Conquer the Streets of Los Santos,gta v epic montage conquer streets los santos
GTA,gta,pertyuhm,2023-06-24T15:20:20,2023,5,I can't continue my story.,cant continue story
GTA,gta,frenk65,2023-06-24T16:08:10,2023,2,GTA ps3 infinite loading screen,gta ps3 infinite loading screen
GTA,gta,PsychologicalTask330,2023-06-24T16:14:57,2023,1,Can someone pass me this car,someone pass car
GTA,gta,1997Zeph,2023-06-24T16:25:15,2023,10,"Rockstar’s abandonment of both GTA V’s & RDR2’s single-player campaigns give me 0 hope for GTA 6. Even if the initial experience is great, we have 10 years of evidence to suggest it won’t be a priority after release.",rockstar’s abandonment gta v’s rdr2’s singleplayer campaigns give 0 hope gta 6 even initial experience great 10 years evidence suggest won’t priority release
GTA,gta,Dr_Florp,2023-06-24T16:50:37,2023,4,What is your biggest unpopular opinion/hot take,biggest unpopular opinionhot take
GTA,gta,mouadbelouadi,2023-06-24T16:54:20,2023,130,"Not complaining, Giorgio is a huge indirect influence to me and many others",complaining giorgio huge indirect influence many others
GTA,gta,MythicDragon725,2023-06-24T16:58:34,2023,2,GTA5  is softlocked,gta5 softlocked
GTA,gta,Kindly_Ad_2891,2023-06-24T17:42:29,2023,1,Anyone willing to buy me a copy of GTA online for Xbox series s,anyone willing buy copy gta online xbox series
GTA,gta,Griik555,2023-06-24T18:20:38,2023,2,I need Help with Gta Vice city mobile,need help gta vice city mobile
GTA,gta,SnooSprouts5557,2023-06-24T18:31:21,2023,2,Casino is BUGGED?,casino bugged
GTA,gta,mrmrpppersson_6969,2023-06-24T19:47:38,2023,1,an idea of why gta 6 is taking so long,idea gta 6 taking long
GTA,gta,danno147,2023-06-24T21:18:06,2023,85,GTA: Vice City as a Tiger Handheld Game [OC],gta vice city tiger handheld game oc
GTA,gta,AR-NIGHT,2023-06-24T21:35:10,2023,4,Gta gets to 50% and then the disc ejects,gta gets 50 disc ejects
GTA,gta,AccurateSolution6309,2023-06-24T21:36:45,2023,1,"🚨🚨🚨New GTA PS5 RP🚨🚨🚨 $100,000 Staring Balance",new gta ps5 rp 100000 staring balance
GTA,gta,Breaddude98,2023-06-24T22:11:39,2023,8,Can someone host bogdan replay for me,someone host bogdan replay
GTA,gta,Delicious_win0,2023-06-24T23:05:56,2023,1,can you play gta 5 on pc with an xbox 360 controller as well as you can with a ps4 one?,play gta 5 pc xbox 360 controller well ps4 one
GTA,gta,Boricua_morena,2023-06-24T23:17:39,2023,1,"Italy-bound human smuggling ship capsizes in the Mediterranean. Last time this happened, a surviving Bosnian Serb had to swim for his life, sparking the events of GTA IV.",italybound human smuggling ship capsizes mediterranean last time happened surviving bosnian serb swim life sparking events gta iv
GTA,gta,QuarterFearless5704,2023-06-25T00:02:15,2023,2,When is music added to story mode radio,music added story mode radio
GTA,gta,VoidSeeker77,2023-06-25T00:07:45,2023,1,I got banned from r/gtaonline for asking a simple question,got banned rgtaonline asking simple question
GTA,gta,DullVeterinarian1337,2023-06-25T00:16:10,2023,1,555 - WE -TIP (Tenpenny) Mission x GangWars GTA San andreas Modded - Res...,555 tip tenpenny mission x gangwars gta san andreas modded res
GTA,gta,Marringa,2023-06-25T00:29:38,2023,1,GTA Cops And Robbers Driving Fails ( Watch to the end LOL),gta cops robbers driving fails watch end lol
GTA,gta,DelCruzMike23,2023-06-25T02:09:42,2023,1,Theres a glitch in story mode where whenever i step into a safehouse i hear the tv audio and its super loud im on xbox series x and hopefully someone here finds a fix,theres glitch story mode whenever step safehouse hear tv audio super loud im xbox series x hopefully someone finds fix
GTA,gta,Appropriate-Invite97,2023-06-25T02:21:11,2023,1,GTA 5 has ruined my immersion in tv and movies.,gta 5 ruined immersion tv movies
GTA,gta,tobytron2,2023-06-25T02:28:59,2023,2,Whistleblower mission glitch,whistleblower mission glitch
GTA,gta,RDDAMAN819,2023-06-25T02:46:07,2023,1,GTA V Story Mode lacked gunfights. Agree or disagree?,gta v story mode lacked gunfights agree disagree
GTA,gta,Itsmecupheadfan,2023-06-25T02:51:22,2023,1,In GTA V: What happens when I threaten a stripper that sleeps around with a gun? Am I not able to do a quicky with her no more?):,gta v happens threaten stripper sleeps around gun able quicky
GTA,gta,NanookZappaa,2023-06-25T03:02:19,2023,1,CJ singing Free Bird (AI COVER),cj singing free bird ai cover
GTA,gta,600MrMartian,2023-06-25T04:02:07,2023,1,Impossible Supply Run,impossible supply run
GTA,gta,NoConversation723,2023-06-25T04:11:18,2023,81,"Fun fact: If you look up November Niner Charlie Echo (N9CE) it will show you the exact plane that crashes in the mission ""Caida Libre""",fun fact look november niner charlie echo n9ce show exact plane crashes mission caida libre
GTA,gta,botz107,2023-06-25T04:16:58,2023,1,character transfer,character transfer
GTA,gta,jennaortegaloverr,2023-06-25T04:40:31,2023,1,what’s the best hacks for STORY? (not online),what’s best hacks story online
GTA,gta,tvgjMC,2023-06-25T05:07:01,2023,1,"HELP, my back-to-school mission is broken, when I do it, it keeps repeating the mission all over and over",help backtoschool mission broken keeps repeating mission
GTA,gta,Do-Hickie-Dolan,2023-06-25T06:31:42,2023,1,I cannot for the life of me boot up the game!,cannot life boot game
GTA,gta,Fit_Literature7560,2023-06-25T08:07:57,2023,1,Free gta cheat cheat codes,free gta cheat cheat codes
GTA,gta,Realistic_Sun_369,2023-06-25T10:22:42,2023,1,Watch new GTA 6 leaked video I was shocked,watch new gta 6 leaked video shocked
GTA,gta,Havok1199,2023-06-25T11:30:09,2023,7,Does anyone have this Bentley Azure?,anyone bentley azure
GTA,gta,Ragnar_necessary,2023-06-25T12:10:56,2023,1,GTA V story progress help. Cloud save not working,gta v story progress help cloud save working
GTA,gta,LostIfFound,2023-06-25T12:29:00,2023,1,We need sexual relations with other players in GTAo6,need sexual relations players gtao6
GTA,gta,ExtraordinaryTooth,2023-06-25T13:12:13,2023,1,"[help] booted up GTA 5 for the first time in years (xbox), i'm unable to switch characters in single player. Did they change the controls?",help booted gta 5 first time years xbox im unable switch characters single player change controls
GTA,gta,Boho_Asa,2023-06-25T13:12:39,2023,2,I said this on the r/gta6 server but I’d wanna get your thoughts here (it’s about GTA Chinatown Wars),said rgta6 server i’d wanna get thoughts it’s gta chinatown wars
GTA,gta,epicmemeslayer420,2023-06-25T13:26:08,2023,1,Vice city predicted how dangerous it is to live in Florida nowadays,vice city predicted dangerous live florida nowadays
GTA,gta,DismalBed7098,2023-06-25T13:35:57,2023,3,A crash dirby/ race version of the greenwood . Id love that,crash dirby race version greenwood id love
GTA,gta,FroZe_Sentic,2023-06-25T13:56:20,2023,1,Watch till the end,watch till end
GTA,gta,NJ_Bus_Nut,2023-06-25T13:57:05,2023,20,Average day for a Los Santos bus driver.,average day los santos bus driver
GTA,gta,penaltylake,2023-06-25T14:30:26,2023,3,Is K.D. back in freemode?,kd back freemode
GTA,gta,AkaBaqer,2023-06-25T15:04:03,2023,1,My game keep crashing,game keep crashing
GTA,gta,enumiegod,2023-06-25T15:24:19,2023,3,GTA CHARACTERS TIER LIST [ ACCORDING TO ME ],gta characters tier list according
GTA,gta,_SadFrenchFries_,2023-06-25T15:31:24,2023,1,Stromberg doomsday setup bug,stromberg doomsday setup bug
GTA,gta,SolidZealousideal379,2023-06-25T17:15:09,2023,1,Is the Adrenaline pill from gta 3/VC real? Or atleast something similar,adrenaline pill gta 3vc real atleast something similar
GTA,gta,Ok_Chance_2045,2023-06-25T18:44:06,2023,1,help i get stuck at the gunstore,help get stuck gunstore
GTA,gta,Omega_20012,2023-06-25T18:47:34,2023,1,Can anyone figure out when these comes out??,anyone figure comes
GTA,gta,WockStarr_Capzz,2023-06-25T19:20:36,2023,1,chopper camera glitch on the last mission help me please!! (XBOX SERIES X),chopper camera glitch last mission help please xbox series x
GTA,gta,predator9994,2023-06-25T20:13:49,2023,1,how i can fix that on GTA IV?,fix gta iv
GTA,gta,saketoyoung,2023-06-25T20:39:12,2023,1,Is it possible to transfer my xbox one gta 5 online character account to my Pc?,possible transfer xbox one gta 5 online character account pc
GTA,gta,Significant_Toe_8750,2023-06-25T20:53:32,2023,1,"HELP NEEEDED!!!,Gta 4 won't start",help neeededgta 4 wont start
GTA,gta,Grand-Explanation-75,2023-06-25T21:01:14,2023,169,So this happened when i landed a hydra on the motorbike . noice bug,happened landed hydra motorbike noice bug
GTA,gta,XxDaltAxX,2023-06-25T21:08:24,2023,430,GTA San Andreas Mirror,gta san andreas mirror
GTA,gta,happyapathy22,2023-06-25T21:28:16,2023,1,Question about updates/potential troubleshoot,question updatespotential troubleshoot
GTA,gta,2k23king,2023-06-25T21:39:33,2023,1,Need players for my mc have to be at least rank 10 on ps4 drop your PSN to join,need players mc least rank 10 ps4 drop psn join
GTA,gta,FerranG23,2023-06-25T21:45:37,2023,2,GTA 5 Map Expansion,gta 5 map expansion
GTA,gta,doglover12145,2023-06-25T21:46:12,2023,1,WAR CHANGED US - GTA 5: Funny Moments & Missions,war changed us gta 5 funny moments missions
GTA,gta,Yeahhhhhh_Taee,2023-06-25T21:56:22,2023,1,Selling 2020 account,selling 2020 account
GTA,gta,PlayerM4116,2023-06-25T22:41:06,2023,74,Captured this gem on accident,captured gem accident
GTA,gta,Background_Fun1336,2023-06-25T22:56:32,2023,3,Prison Break In GTA,prison break gta
GTA,gta,Noobmaster877,2023-06-25T23:46:44,2023,12,Years later still listening to this banger,years later still listening banger
GTA,gta,PerfectlyCutBread,2023-06-26T00:24:04,2023,1,What's the name of this vehicle?,whats name vehicle
GTA,gta,TrueFudge7840,2023-06-26T00:45:19,2023,74,The Trailer For GTA Vice City Stories,trailer gta vice city stories
GTA,gta,Gucciloaferss,2023-06-26T01:42:49,2023,1,He took the easy way out lol,took easy way lol
GTA,gta,Dragonshotgod,2023-06-26T02:00:04,2023,1,San Andreas bodybuilding mechanic was kind of bad.,san andreas bodybuilding mechanic kind bad
GTA,gta,Soul_Overflow,2023-06-26T02:11:17,2023,1,I lost all three characters money in stocks. Should I just restart the game?,lost three characters money stocks restart game
GTA,gta,starvin-marvin___,2023-06-26T02:33:48,2023,1,Selling gta account,selling gta account
GTA,gta,That-Sun-7143,2023-06-26T02:53:01,2023,1,Can someone help me?,someone help
GTA,gta,Several_Ground_730,2023-06-26T03:04:53,2023,1,Can I replay heists?,replay heists
GTA,gta,PowerAmore,2023-06-26T03:31:24,2023,17,There he is...the queen of freakin sheba,isthe queen freakin sheba
GTA,gta,DimensionNo9371,2023-06-26T05:55:17,2023,1,What year does Rockstar Games make a GTA Online The Wiggles DLC in the future,year rockstar games make gta online wiggles dlc future
GTA,gta,idkimjustbored3,2023-06-26T06:30:30,2023,2,I completed flight school bit can't start the next part of the misson.,completed flight school bit cant start next part misson
GTA,gta,desktopJM,2023-06-26T09:01:49,2023,1,GTA V running on a Mac!,gta v running mac
GTA,gta,Ser_Nikolaus,2023-06-26T10:07:06,2023,137,GTA Real Life Glitch,gta real life glitch
GTA,gta,Bulky_gamea,2023-06-26T10:19:37,2023,1,Nightclub or Agency Business,nightclub agency business
GTA,gta,hibuddywhatzup,2023-06-26T11:22:53,2023,2,Can I Play GTA V,play gta v
GTA,gta,Blitz_Hectik7849,2023-06-26T12:12:51,2023,2,"has a GTA game ever got you into a music genre? If so, which genres, and what radio stations/songs did it for you",gta game ever got music genre genres radio stationssongs
GTA,gta,Former_Rabbit_1825,2023-06-26T12:42:43,2023,6,salvatore was a shitbag before CJ CJ just made him worse,salvatore shitbag cj cj made worse
GTA,gta,H1r5t_M0V135,2023-06-26T12:43:33,2023,10,when 2 songs that you really like are playing on the radio at the SAME time:,2 songs really like playing radio time
GTA,gta,One-Name-1340,2023-06-26T14:44:52,2023,121,So Excited!! Playing for the first time,excited playing first time
GTA,gta,Mediocre_Spell_9028,2023-06-26T15:42:16,2023,1,What do you think will happen to GTA V after VI comes out?,think happen gta v vi comes
GTA,gta,TURNPlKE,2023-06-26T15:52:29,2023,1,Grand Theft Auto V: QuantV - Realism Overhaul,grand theft auto v quantv realism overhaul
GTA,gta,IndividualStriking91,2023-06-26T15:56:24,2023,2,Is MC Clips death canon?,mc clips death canon
GTA,gta,JackTheAvGeek,2023-06-26T16:30:27,2023,1,F-160 Resale Price really low,f160 resale price really low
GTA,gta,Maxson_method5138,2023-06-26T17:54:54,2023,1,I’m probably going to get this post taken down but I used ai to replicate the stuff saw in the gta 6 stuff that was leaked and I have it make a plot for the game and tbh I could see this actually happening,i’m probably going get post taken used ai replicate stuff saw gta 6 stuff leaked make plot game tbh could see actually happening
GTA,gta,eternetycheat,2023-06-26T18:49:31,2023,1,the best for fivem,best fivem
GTA,gta,mejdia,2023-06-26T19:06:36,2023,1,Found a child using audio from a gta 5 edit,found child using audio gta 5 edit
GTA,gta,Fredster_A,2023-06-26T19:22:57,2023,1,Things I love & hate in each GTA game,things love hate gta game
GTA,gta,JohnNixi,2023-06-26T19:32:40,2023,1,Police over reacted | GTA 5,police reacted gta 5
GTA,gta,mr_fasoura,2023-06-26T19:41:17,2023,1,I am looking for a free gta account (PC),looking free gta account pc
GTA,gta,OkTask1073,2023-06-26T19:42:56,2023,2,"i can’t find the bravado gresly, did they take it out of the game?",can’t find bravado gresly take game
GTA,gta,Crazy_Application473,2023-06-26T20:00:37,2023,1,Who's tryna run diamond casino heist?! and had mic for Xbox old gen Sneaky approach for paintings,whos tryna run diamond casino heist mic xbox old gen sneaky approach paintings
GTA,gta,Midly_Edits,2023-06-26T20:14:54,2023,30,Found this GTA clone with screenshots from GTA 5,found gta clone screenshots gta 5
GTA,gta,Averagestoryplayer,2023-06-26T20:25:55,2023,1,GTA 5 ps3 has better physics,gta 5 ps3 better physics
GTA,gta,Obvious-Course1720,2023-06-26T20:31:18,2023,1,Unpopular opinion but GTA V,unpopular opinion gta v
GTA,gta,csound1,2023-06-26T21:08:39,2023,17,Rockstar's accomplishment,rockstars accomplishment
GTA,gta,Ill_Oven1149,2023-06-26T21:11:09,2023,1,Money glitch my gta v ps5 account,money glitch gta v ps5 account
GTA,gta,Chakluxe,2023-06-26T21:25:42,2023,3,POV: Your loving uncle living the american dream,pov loving uncle living american dream
GTA,gta,Bagel9383,2023-06-26T21:37:05,2023,1,The worst gta online update? (Excluding small updates like LS Summer Special and Weekly update),worst gta online update excluding small updates like ls summer special weekly update
GTA,gta,PCJ_600,2023-06-26T21:51:17,2023,1,Any way to play the ps2 version of the trilogy on PlayStation 4/5?,way play ps2 version trilogy playstation 45
GTA,gta,Minato0276,2023-06-26T22:26:40,2023,1,"Rockstar fix your game, I can’t count the amount of glitches that have happened because of this update.",rockstar fix game can’t count amount glitches happened update
GTA,gta,PamellaJLilian,2023-06-26T22:37:37,2023,682,Straight outta 2082! Finally released a cool reboot of GTA 3 Special Edition. 800FPS and URTX2+ let you enjoy great graphics and play comfortably. Sometimes there are slumps of up to 750-770 FPS,straight outta 2082 finally released cool reboot gta 3 special edition 800fps urtx2 let enjoy great graphics play comfortably sometimes slumps 750770 fps
GTA,gta,Reggotism,2023-06-26T22:48:02,2023,3,Does anyone know how i can fix this? I downloaded mods a long time ago and i have no clue how to completely remove them so i can play online again.,anyone know fix downloaded mods long time ago clue completely remove play online
GTA,gta,OriginalPapaya8,2023-06-26T22:52:50,2023,2,"CJ cantando ""Free Bird"" (AI cover) (K-DST) / CJ singing ""Free Bird"" (AI cover) (K-DST)",cj cantando free bird ai cover kdst cj singing free bird ai cover kdst
GTA,gta,MrBellumgeist,2023-06-26T23:21:04,2023,1,"I have a question, is GTA trilogy fixed, or is it still a mess?",question gta trilogy fixed still mess
GTA,gta,tfhermobwoayway,2023-06-27T01:00:46,2023,1,Can you disable the criminal enterprise starter pack in the premium edition?,disable criminal enterprise starter pack premium edition
GTA,gta,BigBossSnakeTV,2023-06-27T01:12:36,2023,1,GTA Online: San Andreas Mercenaries - Reporting for Duty,gta online san andreas mercenaries reporting duty
GTA,gta,ARES_FPV,2023-06-27T01:17:47,2023,1,Check out our new channel. GTA Online Mini games and Heists.,check new channel gta online mini games heists
GTA,gta,inover4,2023-06-27T01:41:45,2023,1,I found a place where the rain stops.,found place rain stops
GTA,gta,Ajace100,2023-06-27T02:12:02,2023,7,Would've been one of the most perfect things i've ever done in gta,wouldve one perfect things ive ever done gta
GTA,gta,Known_College_9420,2023-06-27T02:42:33,2023,1,Replaying the story mode,replaying story mode
GTA,gta,Big_Second_9793,2023-06-27T03:12:50,2023,1,EIJRP Xbox is looking for new members!,eijrp xbox looking new members
GTA,gta,SU27_flanker,2023-06-27T03:22:27,2023,1,Had the gta 5 online avenger vehicle workshop glitch where your vehicle gets teleport to mount chiliad when you go to fly the avenger?,gta 5 online avenger vehicle workshop glitch vehicle gets teleport mount chiliad go fly avenger
GTA,gta,its_snook,2023-06-27T04:11:12,2023,1,GTA ONLINE ICEBERG,gta online iceberg
GTA,gta,HoennLink2003,2023-06-27T04:13:21,2023,1,Any similar experience with Cluckin’ Bell in GTA V?,similar experience cluckin’ bell gta v
GTA,gta,rpkxnoscope,2023-06-27T04:44:59,2023,1,"chop mission is soft locking, cant skip it it softlocks game completely",chop mission soft locking cant skip softlocks game completely
GTA,gta,WildReputation5965,2023-06-27T04:52:52,2023,1,"What's your favorite bug, easter egg or glitch on the GTA 5 map?",whats favorite bug easter egg glitch gta 5 map
GTA,gta,izzdagoat12,2023-06-27T06:05:20,2023,1,can anyone please give me a download link for gta v x64k.rpf?,anyone please give download link gta v x64krpf
GTA,gta,Seahawk_2023,2023-06-27T06:39:37,2023,1,Why don't park rangers arrest the player like regular cops? They always shoot to kill..,dont park rangers arrest player like regular cops always shoot kill
GTA,gta,21oo_xavier,2023-06-27T07:17:46,2023,1,Act 2 bac to back old gen Xbox 1,act 2 bac back old gen xbox 1
GTA,gta,cps2222,2023-06-27T07:28:28,2023,3,I hope GTA6 online let’s you do missions/heists solo…,hope gta6 online let’s missionsheists solo…
GTA,gta,ventulation,2023-06-27T07:45:27,2023,1,Top 5 fastest cars,top 5 fastest cars
GTA,gta,Humanfly564,2023-06-27T09:29:35,2023,253,What do you guys think about how they killed off johnny klebitz in GTA 5?,guys think killed johnny klebitz gta 5
GTA,gta,BFPhantomProgram,2023-06-27T11:02:24,2023,1,GTA V tested on Surface Laptop 3 (Intel Iris Plus),gta v tested surface laptop 3 intel iris plus
GTA,gta,Intelligent-Prune-94,2023-06-27T11:21:31,2023,1,fuckin whore (in gta four),fuckin whore gta four
GTA,gta,WensternBoah,2023-06-27T11:50:55,2023,1,"Does anybody know the meaning of the song ""The Setup"" ?",anybody know meaning song setup
GTA,gta,CodeBr3ker,2023-06-27T11:57:07,2023,1,Is the Definitive Edition worth buying in 2023?,definitive edition worth buying 2023
GTA,gta,_Atlantiss_,2023-06-27T11:57:19,2023,1,Is a agency worth buying?,agency worth buying
GTA,gta,Other_Gur6964,2023-06-27T16:41:27,2023,2,How do I get out of story mode on Xbox One?,get story mode xbox one
GTA,gta,DarenanVigil,2023-06-27T18:01:00,2023,1,Are there any good people in GTA 5?,good people gta 5
GTA,gta,Ok-Assignment4080,2023-06-27T18:39:22,2023,1,I'M NOT HATING ON GTA 4! [its a joke},im hating gta 4 joke
GTA,gta,didsieiwiiw,2023-06-27T18:54:46,2023,1,GTA MODDED ACCOUNT FOR SALE OR TRADES,gta modded account sale trades
GTA,gta,paddy2344,2023-06-27T19:24:26,2023,1,Just game off steam and it took ages to download but won't let me play it any help would be appreciated,game steam took ages download wont let play help would appreciated
GTA,gta,ClassicArtwork,2023-06-27T19:38:20,2023,158,Fan art of a Ballas Member,fan art ballas member
GTA,gta,Jitterdoomer,2023-06-27T19:47:06,2023,1,Is it me or is TheProfessional really loved GTA IV?,theprofessional really loved gta iv
GTA,gta,PilonSauvage,2023-06-27T20:25:47,2023,1,[PC] BROKEN UPDATE 108 Go,pc broken update 108 go
GTA,gta,TH3darkgem,2023-06-27T20:30:36,2023,1,Where do I download OpenIV from?,download openiv
GTA,gta,Luca_gusmano,2023-06-27T20:57:42,2023,12,Why does it not let me buy the avenger,let buy avenger
