game,subreddit,author,created_utc,year,score,original_title,cleaned
GTA,gta,Anshul086,2023-06-01T00:00:26,2023,4,"This rightfully belongs here. Although the physics are bit unreal, i mean real.",rightfully belongs although physics bit unreal mean real
GTA,gta,AllMyUsernamesAreBad,2023-06-01T00:16:51,2023,0,People really are that salty on GTA Online...,people really salty gta online
GTA,gta,maxsettings99,2023-06-01T00:26:48,2023,7,do you remember this shit?,remember shit
GTA,gta,Leyton115,2023-06-01T00:27:42,2023,1,This is gonna come out after my great grand kids die 💀,gonna come great grand kids die
GTA,gta,Jake2672,2023-06-01T01:05:55,2023,4,What’s your favourite car?,what’s favourite car
GTA,gta,romansapprentice,2023-06-01T01:24:57,2023,1,Can you zoom in the map in GTAV?,zoom map gtav
GTA,gta,Sincity442,2023-06-01T02:14:55,2023,2,Is this unusual?,unusual
GTA,gta,Jazzlike-Ad-3918,2023-06-01T03:17:20,2023,1266,follow the train,follow train
GTA,gta,jack7921,2023-06-01T04:44:20,2023,1,Do anyone one to do the old Heist on Xbox one today just add me,anyone one old heist xbox one today add
GTA,gta,blowinglava1,2023-06-01T04:52:12,2023,8,Gta triology multiplayer,gta triology multiplayer
GTA,gta,stand_up_fkn_tall,2023-06-01T06:40:45,2023,1,Is swapping characters to replay heists cheating?,swapping characters replay heists cheating
GTA,gta,Conscious-Net-7288,2023-06-01T06:58:07,2023,1,GTA account forsale,gta account forsale
GTA,gta,DovahDuck,2023-06-01T07:02:33,2023,0,"What Do People Think About GTA VII Being Set Potentially in Houston and the Surrounding Area, or the Entire Texas Triangle?",people think gta vii set potentially houston surrounding area entire texas triangle
GTA,gta,Adorable-Boss-1884,2023-06-01T07:15:34,2023,2,Lost 43 mil for each character because rockstar can’t fix a stupid glitch,lost 43 mil character rockstar can’t fix stupid glitch
GTA,gta,One-Elderberry-2097,2023-06-01T08:31:55,2023,1,$20 Xbox Account for sale,20 xbox account sale
GTA,gta,kenshinisverycoool,2023-06-01T08:40:36,2023,1,the 2 most under rated games EVER,2 rated games ever
GTA,gta,Lazy_Mouse3803,2023-06-01T09:44:52,2023,15,CJ getting busted compilation,cj getting busted compilation
GTA,gta,Bearded-J,2023-06-01T09:58:14,2023,2,GTA Trilogy - iPhone,gta trilogy iphone
GTA,gta,IscNdn,2023-06-01T10:00:48,2023,696,Everybody roasts Franklin,everybody roasts franklin
GTA,gta,LaQuYAL,2023-06-01T10:48:15,2023,1,I got a degree in GTA San Andreas. Nutty headshot i caught on stream yesterday.,got degree gta san andreas nutty headshot caught stream yesterday
GTA,gta,Fearless-Ad8275,2023-06-01T10:50:51,2023,184,This song always hype's me up when I play,song always hypes play
GTA,gta,davidincu,2023-06-01T13:31:00,2023,1,Can somebody help me with this problem?,somebody help problem
GTA,gta,TraDo_Pak,2023-06-01T13:42:28,2023,2,Gta sa android crashes with mod,gta sa android crashes mod
GTA,gta,Rare_Instruction_222,2023-06-01T14:33:07,2023,3,does anyone know how to fix this its been like this for months now,anyone know fix like months
GTA,gta,LiteratureNo6104,2023-06-01T15:35:04,2023,0,MEME I run away from the NOOB bike,meme run away noob bike
GTA,gta,aleeyameli,2023-06-01T15:43:33,2023,5,"When it comes to all the characters in GTA, who would you say is the most charming?",comes characters gta would say charming
GTA,gta,NValin27,2023-06-01T15:51:25,2023,3,GTA San Andreas 100% Completion (I am stuck at 98.93%),gta san andreas 100 completion stuck 9893
GTA,gta,LennyPenny6969,2023-06-01T16:27:07,2023,1,Heist In Gta Online Goes Wrong But Something Good Ends Up Happening,heist gta online goes wrong something good ends happening
GTA,gta,Engineer_Gaming1231,2023-06-01T17:30:07,2023,2,how can i solve this issue?,solve issue
GTA,gta,The_Franchise_09,2023-06-01T17:52:25,2023,1,Why does Fidelity Mode and Performance RT have this “graininess” to it on PS5?,fidelity mode performance rt “graininess” ps5
GTA,gta,Flash580,2023-06-01T18:45:10,2023,1,I need help trying to install mods!,need help trying install mods
GTA,gta,Diligent-Director303,2023-06-01T18:55:57,2023,2,Can you play gta 4 online on pc?,play gta 4 online pc
GTA,gta,MadeYou_ReadThis,2023-06-01T19:18:33,2023,1,Deveste Eight or Buffalo SXT?,deveste eight buffalo sxt
GTA,gta,Responsible_Local_95,2023-06-01T19:53:19,2023,1,Help me with my Fivem ingame textures please,help fivem ingame textures please
GTA,gta,Hot_Major_555,2023-06-01T20:25:05,2023,1,GTA 5 FAMILIA RP- Dove original Try's To Rob Someone In Courthouse (GETS BAD),gta 5 familia rp dove original trys rob someone courthouse gets bad
GTA,gta,Obliviok_V1,2023-06-01T20:29:40,2023,2,Modded Playthrough: GTA Trilogy OG or GTA Trilogy Definitive,modded playthrough gta trilogy og gta trilogy definitive
GTA,gta,Aintandsmall,2023-06-01T21:29:16,2023,5,NxWorries (Anderson .Paak & Knxwledge) - Daydreaming (Official Music Video),nxworries anderson paak knxwledge daydreaming official music video
GTA,gta,Optimal-Vegetable799,2023-06-01T23:15:03,2023,390,A very bad ifruit phone concept I came up with,bad ifruit phone concept came
GTA,gta,Billy_Mercury85,2023-06-01T23:20:10,2023,26,Picked up a copy of Grand Theft Auto: Vice City,picked copy grand theft auto vice city
GTA,gta,QuackDealer4295,2023-06-02T00:14:23,2023,2,i think i messed up really bad,think messed really bad
GTA,gta,zattrill,2023-06-02T00:15:15,2023,51,Mandela effect in SA??,mandela effect sa
GTA,gta,New-Forever-2908,2023-06-02T00:22:01,2023,5,An short idea for a gta game,short idea gta game
GTA,gta,Evening_Plan_1554,2023-06-02T01:50:49,2023,5,"I have GTA on Xbox series x and my friend has it on the Xbox one. I have the Xbox one version, will we be able to play together if I download the version they have?",gta xbox series x friend xbox one xbox one version able play together download version
GTA,gta,wormword46,2023-06-02T02:07:02,2023,8,The Los Santos Institute of Roastology,los santos institute roastology
GTA,gta,D_Hop_10,2023-06-02T03:22:23,2023,2,Why does my GTA V Story Mode take unfathomably long to load,gta v story mode take unfathomably long load
GTA,gta,VersionSorry1324,2023-06-02T03:50:13,2023,2,Gta online adventures,gta online adventures
GTA,gta,Leothecreativekiller,2023-06-02T04:32:27,2023,0,"Fivem SOS Roleplay server, Come check it out. new city on the rise. 120+ Discord members!!",fivem sos roleplay server come check new city rise 120 discord members
GTA,gta,NightmareOnElmo,2023-06-02T04:41:29,2023,1,Selling a modded account has 16Tril and some outfits Xbox only ( doesn’t have modded cars sadly),selling modded account 16tril outfits xbox doesn’t modded cars sadly
GTA,gta,ElTigreDeSell,2023-06-02T04:57:22,2023,5,Bodyslam with the Oppressor MKII!,bodyslam oppressor mkii
GTA,gta,No-Surround-8767,2023-06-02T07:34:26,2023,89,Tf i found on youtube,tf found youtube
GTA,gta,angelikeoctomber,2023-06-02T07:40:33,2023,3,A character that will surely be in Gta 6,character surely gta 6
GTA,gta,wooooshwith4o,2023-06-02T08:04:46,2023,3,Why doesn't the Scuba Equipment or Gas Mask protects from Tear Gas?,doesnt scuba equipment gas mask protects tear gas
GTA,gta,WackyWackie,2023-06-02T08:30:13,2023,85,"got caught off guard here, didn't know car doors could blow up propane tanks lmfaoo",got caught guard didnt know car doors could blow propane tanks lmfaoo
GTA,gta,InterestingMusic4501,2023-06-02T10:52:17,2023,1,Was there a new update in GTA 5,new update gta 5
GTA,gta,ArtemisSlayer2002,2023-06-02T10:53:58,2023,2,Question about Gta Vice City,question gta vice city
GTA,gta,Over_Objective_3079,2023-06-02T12:34:09,2023,1,Gta car show ps5,gta car show ps5
GTA,gta,BlitzOfDeath,2023-06-02T13:51:01,2023,0,GTA Online Vehicle Warehouses,gta online vehicle warehouses
GTA,gta,GamerExpert19,2023-06-02T15:30:37,2023,1,Gta 3 Definitive Edition Walkthrough Gameplay Part 1 Give Me Liberty,gta 3 definitive edition walkthrough gameplay part 1 give liberty
GTA,gta,EasyMCpeezy,2023-06-02T16:40:25,2023,8,Tribute to ( GTA5 online ) 🔊..🎧..I Hope you like it 4+ hours Edited to a 2 minute video [ beginning to end of hist ],tribute gta5 online hope like 4 hours edited 2 minute video beginning end hist
GTA,gta,beefysam211,2023-06-02T16:44:06,2023,543,This game still holds up even in 2023,game still holds even 2023
GTA,gta,ArthurMorgan_rdr2,2023-06-02T17:08:50,2023,2,I never hear no one talk about,never hear one talk
GTA,gta,DRAGOS5451,2023-06-02T18:12:03,2023,3,What are the worst things committed by GTA characters?,worst things committed gta characters
GTA,gta,Ok-Comment1456,2023-06-02T18:31:57,2023,11,Happened to everyone,happened everyone
GTA,gta,Consistent_Ad_7733,2023-06-02T18:32:18,2023,1,I’m new to gta and need help making money ps4 can anyone help,i’m new gta need help making money ps4 anyone help
GTA,gta,rudolfs420,2023-06-02T19:01:54,2023,1,If i buy gta 4 on steam will i get it as well on the rockstar launcher?,buy gta 4 steam get well rockstar launcher
GTA,gta,Musathepro,2023-06-02T19:58:37,2023,2,What cars do you hope that rockstar adds to the game?,cars hope rockstar adds game
GTA,gta,MrRedd11YT,2023-06-02T20:16:43,2023,1,GTA 5 Playlist Funny Moments | Where is My Jet? | #5,gta 5 playlist funny moments jet 5
GTA,gta,Alex_vL03,2023-06-02T20:34:28,2023,64,There Was A Eastern European In Liberty City...,eastern european liberty city
GTA,gta,Aggravating_Neat4348,2023-06-02T20:56:09,2023,1,Selling modded gta account with everything unlocked and 16 trillion dollars for $250 you can have the whole Xbox account,selling modded gta account everything unlocked 16 trillion dollars 250 whole xbox account
GTA,gta,Teuniiii,2023-06-02T21:17:06,2023,1,Diamond Casino Heist,diamond casino heist
GTA,gta,Major_Splash,2023-06-02T21:55:21,2023,0,AI turned me into a GTA loading screen 😂,ai turned gta loading screen
GTA,gta,head_splitt3r,2023-06-02T22:52:41,2023,5,Countryside Police (SASP) inside Los Santos. Bug gets even better with their driving skills!,countryside police sasp inside los santos bug gets even better driving skills
GTA,gta,StallionA8,2023-06-02T23:05:44,2023,1,Happens only in India,happens india
GTA,gta,7myn96,2023-06-02T23:18:09,2023,2,So apparently this is last gta update from what I hear?,apparently last gta update hear
GTA,gta,housepainterr,2023-06-02T23:30:59,2023,72,Is Claude a simp you guys? Apparently CJ was the smart one when it came to Catalina but Claude had it coming with being a mute.,claude simp guys apparently cj smart one came catalina claude coming mute
GTA,gta,SnooDoubts2153,2023-06-02T23:46:49,2023,18,welcome to gta online.,welcome gta online
GTA,gta,ydipp,2023-06-03T00:37:43,2023,2,I need help with an account switch between epic and steam,need help account switch epic steam
GTA,gta,Scary-Remove-9790,2023-06-03T01:07:52,2023,2,Console switch!!,console switch
GTA,gta,FunConversation6828,2023-06-03T01:43:05,2023,1,State of San Andreas roleplay ps5 only,state san andreas roleplay ps5
GTA,gta,False-Piglet7132,2023-06-03T01:57:52,2023,34,GTA SA mobile Mission How am I supposed to pass this?,gta sa mobile mission supposed pass
GTA,gta,DAC_98,2023-06-03T03:14:02,2023,0,Did Rockstart make some changes for GTA TLaD and TBoGT ?,rockstart make changes gta tlad tbogt
GTA,gta,gtalogy,2023-06-03T03:21:17,2023,7,Game Physics Vice City Stories vs Godfather vs Scarface,game physics vice city stories vs godfather vs scarface
GTA,gta,RyanSzeniawski,2023-06-03T03:47:06,2023,1,Join the Gta Recoveries Discord Server!,join gta recoveries discord server
GTA,gta,Stigs1992,2023-06-03T05:05:08,2023,8,GTA… but with talking trains!!,gta… talking trains
GTA,gta,jack258169,2023-06-03T05:08:00,2023,404,Which GTA protagonist is most likely to survive the zombie apocalypse?,gta protagonist likely survive zombie apocalypse
GTA,gta,Ill-Pen-6422,2023-06-03T05:52:26,2023,1,Who became the new boss of the Leone Mafia after Salvatore's been killed by Claude?,became new boss leone mafia salvatores killed claude
GTA,gta,Fun-Tour9414,2023-06-03T06:31:52,2023,1,help me! infinity loading,help infinity loading
GTA,gta,justryingatlife,2023-06-03T07:11:37,2023,1,Just looking for a buddy,looking buddy
GTA,gta,Mdm_Thomas,2023-06-03T08:04:02,2023,1,Can Rockstar reveal what was behind all the « GTA V Mystery » conspirations ?,rockstar reveal behind « gta v mystery » conspirations
GTA,gta,CelebrationWild7276,2023-06-03T08:22:33,2023,23,Those everyone still got this San andreas cheat codes in notebooks,everyone still got san andreas cheat codes notebooks
GTA,gta,CalculatorOctavius,2023-06-03T08:58:01,2023,844,Gotta love the PS3 version’s car damage physics,gotta love ps3 version’s car damage physics
GTA,gta,ManicVixie,2023-06-03T10:58:47,2023,1,How can I play GTA 4?,play gta 4
GTA,gta,GrantHernando11,2023-06-03T11:33:05,2023,24,I pushed him on the water lol (GTA Online PS4),pushed water lol gta online ps4
GTA,gta,Poopsmasher27,2023-06-03T13:00:08,2023,3,I know something that needs to be on the radio in GTA VI,know something needs radio gta vi
GTA,gta,Chance-Initiative237,2023-06-03T13:20:48,2023,3,"New to GTA, where should I start?",new gta start
GTA,gta,NothingIsHere5947,2023-06-03T13:51:47,2023,454,"After 10 years, Gamers in GTA V sp:",10 years gamers gta v sp
GTA,gta,I_S0E_DARK,2023-06-03T13:55:03,2023,1,What plane is coming to the game?,plane coming game
GTA,gta,R4T4TNY,2023-06-03T14:08:45,2023,1,Cop tried to steal my car??,cop tried steal car
GTA,gta,DirttySlut,2023-06-03T14:10:22,2023,0,A gta movie of gta 5 would be sweet at least give us that till gta 6,gta movie gta 5 would sweet least give us till gta 6
GTA,gta,kevinlamas,2023-06-03T14:31:16,2023,1,Need 3 for Doomsday Heist Act I.,need 3 doomsday heist act
GTA,gta,heel_16,2023-06-03T14:31:58,2023,30,The worst possible place to be stuck on...,worst possible place stuck
GTA,gta,Delicious-Ocelot-878,2023-06-03T15:05:20,2023,1,Chased by online player,chased online player
GTA,gta,VHK_vv_547,2023-06-03T15:21:08,2023,356,When a train demotivates you,train demotivates
GTA,gta,Soft-Awareness-1665,2023-06-03T15:55:34,2023,1,Can't get Gold Medals on The Third Way Mission Replay,cant get gold medals third way mission replay
GTA,gta,jhw6027,2023-06-03T16:03:41,2023,2,What is the first things to buy?,first things buy
GTA,gta,Good_Discussion_4290,2023-06-03T16:38:45,2023,1,Rp but only thugs,rp thugs
GTA,gta,Hublosshiat,2023-06-03T17:53:40,2023,1,We need this in Gta V! McLaren 765lt,need gta v mclaren 765lt
GTA,gta,edwrffdsafadfad,2023-06-03T18:31:55,2023,4,render distance is bad with enb in gta san andreas,render distance bad enb gta san andreas
GTA,gta,slattydadd,2023-06-03T18:46:24,2023,0,I finished gta china town wars and now I’m sad,finished gta china town wars i’m sad
GTA,gta,AbbreviationsSpare59,2023-06-03T20:25:08,2023,131,How much money you think Lester making from us?,much money think lester making us
GTA,gta,unfairgomer,2023-06-03T21:32:00,2023,1,Problems with FPS in GTA V,problems fps gta v
GTA,gta,Direct_Abrocoma_6372,2023-06-03T22:49:55,2023,0,What year does GTA Online Japan DLC take place in,year gta online japan dlc take place
GTA,gta,DHouseLC,2023-06-03T23:50:32,2023,0,Documentary on Liberty City’s notorious Lupisella Crime Family,documentary liberty city’s notorious lupisella crime family
GTA,gta,No_Rich5432,2023-06-04T00:11:21,2023,63,Why are oysters glitched?,oysters glitched
GTA,gta,AzFullySleeved,2023-06-04T00:42:02,2023,5,Finished the game on pc and it still looks and plays good.,finished game pc still looks plays good
GTA,gta,NotAChefJustACook,2023-06-04T01:39:29,2023,0,Any tips to upgrade strength in single player?,tips upgrade strength single player
GTA,gta,NoCrossOver,2023-06-04T02:06:21,2023,1,Driveby Reverse Uno,driveby reverse uno
GTA,gta,Mother-Fox4591,2023-06-04T02:13:47,2023,6,Man GTA V be having some crazy shootouts,man gta v crazy shootouts
GTA,gta,shoolepak,2023-06-04T02:16:25,2023,3,"GTA IV, vegetation overhaul with mods (question)",gta iv vegetation overhaul mods question
GTA,gta,teodorlojewski,2023-06-04T02:25:41,2023,810,Hate it when this happens!,hate happens
GTA,gta,CuillereV2,2023-06-04T03:46:29,2023,89,Game crashed on this exact frame while enjoying singleplayer with graphic mod and I took a screenshot (not edit photo),game crashed exact frame enjoying singleplayer graphic mod took screenshot edit photo
GTA,gta,arrowoodgabriel,2023-06-04T03:52:25,2023,9,What is everyones favorite radio station in GTA?,everyones favorite radio station gta
GTA,gta,igrisgaming2,2023-06-04T04:35:34,2023,0,Budget for GTA 6: Is Grand Theft Auto 6 the priciest video game ever?,budget gta 6 grand theft auto 6 priciest video game ever
GTA,gta,Prof_Weedgenstein,2023-06-04T06:21:47,2023,3,Grand Theft Auto,grand theft auto
GTA,gta,RealArky,2023-06-04T07:15:08,2023,1,If CJ and BIG SMOKE have a FIGHTING GAME,cj big smoke fighting game
GTA,gta,FallenSheepTrain,2023-06-04T07:38:33,2023,485,3D game difficulty,3d game difficulty
GTA,gta,ProMemer7,2023-06-04T08:07:45,2023,15,this banger carried the game tbh!!,banger carried game tbh
GTA,gta,dollsparts,2023-06-04T08:29:17,2023,1,Cheat activated but not working?,cheat activated working
GTA,gta,Ronnieplayersclub,2023-06-04T08:34:02,2023,1,Gta 5 cars long overdue of a update,gta 5 cars long overdue update
GTA,gta,rl_player_fabi,2023-06-04T08:45:41,2023,1,"How to fix this weird post processing ""dots"" (It only render near me on grass and I have every setting max)",fix weird post processing dots render near grass every setting max
GTA,gta,chainreven0n,2023-06-04T09:34:34,2023,2,enjoy your stay trophy,enjoy stay trophy
GTA,gta,Silentl2,2023-06-04T11:00:34,2023,1,Naruto mod gta for free ???,naruto mod gta free
GTA,gta,Bubbly_Enthusiasm443,2023-06-04T11:25:52,2023,1,Looking for friends to play with on PlayStation 18+,looking friends play playstation 18
GTA,gta,Simple12_q,2023-06-04T11:38:51,2023,101,This is me which I completed Demolition Man and Wrong Side of the Tracks in one attempt without watching the walkthroughs back when we don't have internet in early 2010s until now.,completed demolition man wrong side tracks one attempt without watching walkthroughs back dont internet early 2010s
GTA,gta,Kyle-_-Squires,2023-06-04T12:01:58,2023,0,Using this subreddit cause i got perm banned from doing anything in r/gtaonline,using subreddit cause got perm banned anything rgtaonline
GTA,gta,vincent-benjamins,2023-06-04T12:21:22,2023,3,Custom license plate,custom license plate
GTA,gta,Mysticalrp,2023-06-04T12:42:25,2023,1,Good morning/good evening,good morninggood evening
GTA,gta,ragnatheman,2023-06-04T13:55:04,2023,64,POV: you remember the good old times,pov remember good old times
GTA,gta,EverdayWeedLord42069,2023-06-04T14:04:01,2023,5,Da Shooterz Go for a joyride (GTA 1),da shooterz go joyride gta 1
GTA,gta,CrysisFan2007,2023-06-04T14:20:53,2023,0,GTA 6 Leak (8 months later),gta 6 leak 8 months later
GTA,gta,No_Difficulty2713,2023-06-04T14:32:15,2023,2,anyone know this song gta 5,anyone know song gta 5
GTA,gta,Historical_Two-Face,2023-06-04T14:33:00,2023,5,Follow up of our previous post. Here is some gameplay of GTA VI for the DS!,follow previous post gameplay gta vi ds
GTA,gta,r_dominic,2023-06-04T15:31:46,2023,28,What’s been carrying me through the Double Money for the Dr. Dre contracts this week,what’s carrying double money dr dre contracts week
GTA,gta,Impossible_Floor6284,2023-06-04T15:38:09,2023,1,Looking for an active EMS and PD,looking active ems pd
GTA,gta,TheSmallestPlap,2023-06-04T16:16:05,2023,1,I thought I might come back to this game,thought might come back game
GTA,gta,PauPowers,2023-06-04T16:48:35,2023,1,An “Alternate/concept” song list for Non Stop Pop FM (100.7 FM),“alternateconcept” song list non stop pop fm 1007 fm
GTA,gta,Aun_Ralirea,2023-06-04T17:19:33,2023,1,Am I inside Mt Chiliad??,inside mt chiliad
GTA,gta,soviet6844,2023-06-04T18:10:19,2023,465,"Honestly the Definitive Trilogy is not nearly as bad as people think. Considering the original games code is 20+ years old, having modernized controls and a big graphics boost is more than enough to keep my happy",honestly definitive trilogy nearly bad people think considering original games code 20 years old modernized controls big graphics boost enough keep happy
GTA,gta,Booper-dooper-th1st,2023-06-04T19:31:11,2023,2,If you redo the Dax missions in gta do you make less money from them?,redo dax missions gta make less money
GTA,gta,zvbgamer,2023-06-04T20:24:11,2023,1,GTA Vice City Motorcycle glitch,gta vice city motorcycle glitch
GTA,gta,SharikGTA,2023-06-04T21:30:39,2023,1,TRAILER GTA V RP - DONA ERVILHA - A POLICIAL CORRUPTA,trailer gta v rp dona ervilha policial corrupta
GTA,gta,ShnakeGaming,2023-06-04T21:45:57,2023,82,Bounty Hunter: Freefall Snipe,bounty hunter freefall snipe
GTA,gta,JustaNormalpersonig,2023-06-04T21:50:00,2023,0,is the story mode worth it?,story mode worth
GTA,gta,Bezzy_B8,2023-06-04T22:36:31,2023,3,Using the Virtue for time trials is a great idea!,using virtue time trials great idea
GTA,gta,SnooRobots65,2023-06-04T22:38:39,2023,1,What guns/cars you think should be added in GTA 6,gunscars think added gta 6
GTA,gta,Traditional-Camp-157,2023-06-04T22:46:51,2023,2,Is this the new F-35 type jet?,new f35 type jet
GTA,gta,SuitingUncle620,2023-06-04T23:10:57,2023,61,/r/GTA will be going dark from June 12-14 in protest against Reddit’s API changes which will kill 3rd party apps.,rgta going dark june 1214 protest reddit’s api changes kill 3rd party apps
GTA,gta,Bobitst,2023-06-05T00:45:39,2023,1,I need help with GTA RP SERVER configuration,need help gta rp server configuration
GTA,gta,sooperbowels,2023-06-05T01:49:03,2023,1,"PEGASUS - International Trafficking, Blackmail, Assassinations, and more - brought to you by TPTB",pegasus international trafficking blackmail assassinations brought tptb
GTA,gta,ElTaco6195,2023-06-05T02:10:40,2023,1,Modding GTA 4 Complete Edition (1.2.0.43),modding gta 4 complete edition 12043
GTA,gta,Typical_Conflict_162,2023-06-05T03:05:03,2023,1,Account Transfer,account transfer
GTA,gta,Raztan,2023-06-05T03:40:40,2023,12,Too late to grow a conscious now Rockstar.,late grow conscious rockstar
GTA,gta,Comfortable-Oil9182,2023-06-05T05:06:55,2023,9,Found this random pizza box in director mode,found random pizza box director mode
GTA,gta,SpideyMighty,2023-06-05T06:06:26,2023,1,Will the online rank transfer from GTA IV main game to DLC's separate disc?,online rank transfer gta iv main game dlcs separate disc
GTA,gta,ISROCK777,2023-06-05T06:45:26,2023,1,Stanced like a snail shell,stanced like snail shell
GTA,gta,hi_x3,2023-06-05T06:45:39,2023,3,Drift was so zesty i had to put it in 480p,drift zesty put 480p
GTA,gta,Just_Data2286,2023-06-05T09:42:36,2023,18,Camera caught me at dreamhack . Tommy vercetti enjoys video games,camera caught dreamhack tommy vercetti enjoys video games
GTA,gta,Responsible_Today898,2023-06-05T09:45:34,2023,0,Do you know what heist this is???,know heist
GTA,gta,TheNewFlisker,2023-06-05T10:38:36,2023,2,Why did Rockstar released their remasters on mobile but not on console/PC?,rockstar released remasters mobile consolepc
GTA,gta,Specific_Interest_80,2023-06-05T11:03:38,2023,0,Legitimate site to download cracked version of GTA San Andreas?,legitimate site download cracked version gta san andreas
GTA,gta,No_Supermarket_6669,2023-06-05T13:06:34,2023,1,First Person Driving in GTA 5,first person driving gta 5
GTA,gta,BamboozledCat,2023-06-05T13:50:40,2023,1,Does anyone have a realistic period-correct (pre 2013 cars) car pack for gta 5?,anyone realistic periodcorrect pre 2013 cars car pack gta 5
GTA,gta,awesomedan24,2023-06-05T15:15:31,2023,1039,The current state of this subreddit,current state subreddit
GTA,gta,StickyHoovy,2023-06-05T15:25:10,2023,0,Should trees be destructible in GTA VI?,trees destructible gta vi
GTA,gta,AidenHaddad23,2023-06-05T15:34:24,2023,1,Grand Theft Auto VI cover concept,grand theft auto vi cover concept
GTA,gta,ImaginationAodhan,2023-06-05T15:43:55,2023,0,Grand Theft Auto VI cover concept,grand theft auto vi cover concept
GTA,gta,TheControl05,2023-06-05T16:22:53,2023,1,DPad doesnt work in GTA 4 for the phone.,dpad doesnt work gta 4 phone
GTA,gta,East-Chemical4957,2023-06-05T17:02:50,2023,2,I found a frog in GTA,found frog gta
GTA,gta,TobiasRieperAKA47,2023-06-05T17:29:12,2023,1,"Abandoned hospital mission in gta 4? Yep, theses guys explored the real thing.",abandoned hospital mission gta 4 yep theses guys explored real thing
GTA,gta,gotham1999,2023-06-05T19:31:45,2023,215,What is your favorite game in the series?,favorite game series
GTA,gta,GodzBoy18,2023-06-05T20:34:53,2023,1,GTA online Xbox friend group 18+,gta online xbox friend group 18
GTA,gta,nightwica,2023-06-05T20:39:28,2023,1,I just spent like $120 on a friend date with Little Jacob,spent like 120 friend date little jacob
GTA,gta,mjking97,2023-06-05T21:02:06,2023,1,Can GTA 5 players join sessions with GTA Online players?,gta 5 players join sessions gta online players
GTA,gta,Affectionate_Bus7766,2023-06-05T21:02:33,2023,2,Can someone please help me out,someone please help
GTA,gta,TheGamerScorer,2023-06-05T21:37:03,2023,3,Does anyone have the picture/screenshot of the fake GTA mobile game meme?,anyone picturescreenshot fake gta mobile game meme
GTA,gta,vch01,2023-06-05T21:38:20,2023,4,r/GTA3 is back in business!,rgta3 back business
GTA,gta,Impressive-Ad7151,2023-06-05T22:24:34,2023,26,I made a trailer for GTA V in the style of Guardians Of The Galaxy. Vol 3,made trailer gta v style guardians galaxy vol 3
GTA,gta,ArmedTrexstakeover,2023-06-05T23:02:23,2023,2,Moon pool sparrow upgrades,moon pool sparrow upgrades
