game,subreddit,author,created_utc,year,score,original_title,cleaned
GTA,gta,RareDogeFox,2023-06-10T15:09:54,2023,2,GTA SA Save File Corrupted,gta sa save file corrupted
GTA,gta,0vertakeGames,2023-06-10T15:28:10,2023,344,What is your favorite GTA V car brand and why?,favorite gta v car brand
GTA,gta,soldierG19G,2023-06-10T16:17:47,2023,1,Join Glock 19 Gang,join glock 19 gang
GTA,gta,papajaipgames_yt,2023-06-10T16:52:03,2023,4,Big Smoke ate too much number 9s (crazy stunt),big smoke ate much number 9s crazy stunt
GTA,gta,uhhhhhkillercock,2023-06-10T18:26:37,2023,3,All the events that take place in gta v is solely because of Amanda fucking the tennis coach and getting caught,events take place gta v solely amanda fucking tennis coach getting caught
GTA,gta,Serious_Revolution77,2023-06-10T18:58:31,2023,482,I have officially got every gta mobile game,officially got every gta mobile game
GTA,gta,LopettajaBitch,2023-06-10T19:28:03,2023,2,Hi so i wanted to get mods in to gta 3 bc i wanted nissan skyline and other cars and stuff and i downlaoded imgEd and i couldnt find the gta 3 folder from my steamapps → common and it weasnt there and also there wasnt my other games there was only 3 games so yeha anyone had the samo problem or answr,hi wanted get mods gta 3 bc wanted nissan skyline cars stuff downlaoded imged couldnt find gta 3 folder steamapps → common weasnt also wasnt games 3 games yeha anyone samo problem answr
GTA,gta,Krazyki360o,2023-06-10T20:50:16,2023,1,If you trying do act 2 back to back app Krazyki360 on ps4,trying act 2 back back app krazyki360 ps4
GTA,gta,jamiejzero7,2023-06-10T20:59:33,2023,0,Good idea for GTA 6?,good idea gta 6
GTA,gta,legomangos11,2023-06-10T21:40:20,2023,3,Where can i get GTA:SA digitally?,get gtasa digitally
GTA,gta,naydenthegreatone,2023-06-10T21:56:54,2023,3,Which game had the better soundtrack GTA IV or Saints Row 2?,game better soundtrack gta iv saints row 2
GTA,gta,ZbymChudjak,2023-06-10T22:08:32,2023,2,Shooting Bug on PS5,shooting bug ps5
GTA,gta,ShockZestyclose1148,2023-06-10T22:25:23,2023,16,Shoot me I'm Stuck,shoot im stuck
GTA,gta,timhunt412,2023-06-10T22:26:35,2023,3,I'm playing GTA: San-Andreas for the 1st Time!,im playing gta sanandreas 1st time
GTA,gta,Ambitious_Dog558,2023-06-10T23:03:29,2023,2,Rare Car Spawn Question,rare car spawn question
GTA,gta,cabbagefromtwitter,2023-06-10T23:04:27,2023,3,Does the steam version of GTA IV still has the helicopter glitch?,steam version gta iv still helicopter glitch
GTA,gta,_numanuma,2023-06-10T23:41:45,2023,17,msx fm has yet to be topped,msx fm yet topped
GTA,gta,some_sad_rookie,2023-06-11T00:23:50,2023,3,Is it possible to get a kuruma in story mode,possible get kuruma story mode
GTA,gta,Dar3k77,2023-06-11T00:37:04,2023,1,Help i cant connect to other players,help cant connect players
GTA,gta,mynameisjames303,2023-06-11T01:37:06,2023,2,Is this for real? Just now in LA,real la
GTA,gta,LG_smart_freezer,2023-06-11T02:51:41,2023,48,Well that’s a good place to park,well that’s good place park
GTA,gta,ps_tuskii,2023-06-11T07:09:43,2023,0,Can our subReddit also join the Reddit strike to save 3rd party apps ?,subreddit also join reddit strike save 3rd party apps
GTA,gta,Historical_Quiet_874,2023-06-11T07:21:12,2023,2,Help needed to add Mods in GTA 5 [Offline mode],help needed add mods gta 5 offline mode
GTA,gta,NebTheDestroyer,2023-06-11T07:31:59,2023,3,Definitive edition worth $40 CAD?,definitive edition worth 40 cad
GTA,gta,ISPY_denzo,2023-06-11T08:41:49,2023,2,I NEED HELLLPPPP,need helllpppp
GTA,gta,notlyan,2023-06-11T09:15:31,2023,56,Your version of GTA IV is...,version gta iv
GTA,gta,Successful-City-7495,2023-06-11T10:43:50,2023,2,is there a way to achieve 100% on gta sa on ios without grinding,way achieve 100 gta sa ios without grinding
GTA,gta,The_Evil_Owl,2023-06-11T10:44:26,2023,1,Why can't I go into full screen?,cant go full screen
GTA,gta,lighousestudio,2023-06-11T11:22:46,2023,249,Just found this after 10 years in my drawer,found 10 years drawer
GTA,gta,DistributionParty674,2023-06-11T11:30:51,2023,0,doing $ drops/selling accounts dm me,dropsselling accounts dm
GTA,gta,MrMakavelli01,2023-06-11T12:18:29,2023,2,Was this song in GTA IV or is this Mandela affect,song gta iv mandela affect
GTA,gta,Army_Men,2023-06-11T12:43:11,2023,2,Trying to change my MC name but it keeps kicking me out of gta online for doing so,trying change mc name keeps kicking gta online
GTA,gta,Aggravating-Arm-3788,2023-06-11T13:21:38,2023,1,Hit my head so damn hard,hit head damn hard
GTA,gta,IntelligentMeeting97,2023-06-11T13:34:01,2023,3,Story Mission not showing on map (clearing the bureau),story mission showing map clearing bureau
GTA,gta,Pretty_Gorl,2023-06-11T13:53:27,2023,25,Lamar's remarks to Franklin's special ability,lamars remarks franklins special ability
GTA,gta,Shiiii-idek,2023-06-11T14:24:03,2023,1,Can anyone help me?,anyone help
GTA,gta,Miserable_Comedian_6,2023-06-11T14:40:32,2023,197,I’m not sure how this even happened but yeah,i’m sure even happened yeah
GTA,gta,Emotional_Willow2816,2023-06-11T15:13:19,2023,1,Grand Theft Auto V: An Epic Open-World Adventure in Los Santos,grand theft auto v epic openworld adventure los santos
GTA,gta,MuhaXx,2023-06-11T15:15:14,2023,2,"As new Mercenaries update drops in, i want to join a army/military based crew",new mercenaries update drops want join armymilitary based crew
GTA,gta,Doodoobag69,2023-06-11T16:06:27,2023,47,Whats the difference between these two?,whats difference two
GTA,gta,Smiley1578,2023-06-11T16:23:56,2023,2,GTA 4 running poorly with a good computer,gta 4 running poorly good computer
GTA,gta,DIAMONDZKC,2023-06-11T16:24:07,2023,1,Guys i just found a working gta 5 online glitch.,guys found working gta 5 online glitch
GTA,gta,iki0001,2023-06-11T16:43:25,2023,1,How do I remove it? It bugged and I don't know what to do anymore. Please help ☹️,remove bugged dont know anymore please help
GTA,gta,Winter_Soldier_002,2023-06-11T17:31:12,2023,54,"I'll have two number 9s, a number 9 large, a number 6 with extra dip, a number 7, two number 45s, one with cheese, and a large soda",ill two number 9s number 9 large number 6 extra dip number 7 two number 45s one cheese large soda
GTA,gta,tumadrelover,2023-06-11T18:31:59,2023,4,Wtf is with all of the modded level 7982 accounts on next gen?,wtf modded level 7982 accounts next gen
GTA,gta,Relevant-Asparagus-2,2023-06-11T18:38:44,2023,1,Anyway to cheat to get to the end of GTA V,anyway cheat get end gta v
GTA,gta,Bigpoopmaster666,2023-06-11T19:12:29,2023,19,accidentally got a new getaway driver,accidentally got new getaway driver
GTA,gta,BiPolarBaer7,2023-06-11T19:19:00,2023,3,Is Vice City all glitchy still or playable?,vice city glitchy still playable
GTA,gta,Feisty_Wolverine_319,2023-06-11T19:36:34,2023,5,Bring back the original!,bring back original
GTA,gta,razor_jaw86,2023-06-11T20:25:21,2023,3,DEADEYE- GTA 5 cinematic | Episode 5 Trailer [4K],deadeye gta 5 cinematic episode 5 trailer 4k
GTA,gta,DankPastaMaster,2023-06-11T21:00:08,2023,8,Just got GTA IV on Steam and noticed this. How is this possible?,got gta iv steam noticed possible
GTA,gta,pixelartistjewelie,2023-06-11T21:12:45,2023,3,GTA 5 CultStoppers,gta 5 cultstoppers
GTA,gta,Thick-Top-8835,2023-06-11T21:33:06,2023,6,Who was the best protagonist?,best protagonist
GTA,gta,Technical_Sir9302,2023-06-11T21:39:05,2023,3,How to find the hidden treasure in gta 5 online,find hidden treasure gta 5 online
GTA,gta,UpbeatFall9555,2023-06-11T21:55:34,2023,1,Selling Gta accounts,selling gta accounts
GTA,gta,lordfilipe,2023-06-11T22:41:46,2023,3,Bureau raid not showing on story mode PS5,bureau raid showing story mode ps5
GTA,gta,drim750,2023-06-11T22:48:41,2023,3,multiplayer features in story,multiplayer features story
GTA,gta,therealonnyuk,2023-06-11T23:06:55,2023,6,My collection of GTA titles,collection gta titles
GTA,gta,Visible_Elevator192,2023-06-17T08:11:24,2023,12,Is it possible to install and play gta sa ps2 or pc version in MacBook?,possible install play gta sa ps2 pc version macbook
GTA,gta,Sad-Ambassador-2255,2023-06-17T08:37:29,2023,965,Future's now old man,futures old man
GTA,gta,collinpiggy_4,2023-06-17T08:51:39,2023,71,How come I always spawn in the middle of nowhere?,come always spawn middle nowhere
GTA,gta,sno_acti,2023-06-17T09:01:16,2023,117,"How do i remove this graffiti? I checked the mods, didn't found anything suspicious.",remove graffiti checked mods didnt found anything suspicious
GTA,gta,TTheoBillCipher,2023-06-17T10:40:07,2023,2,Anyone know wtf is going on?,anyone know wtf going
GTA,gta,Bedcool128,2023-06-17T10:52:04,2023,8,the subreddt is back!,subreddt back
GTA,gta,Fearless_Ad_6091,2023-06-17T12:23:44,2023,1,Dynasty Electrician v2.0 [ESX/QBCore] free,dynasty electrician v20 esxqbcore free
GTA,gta,HP_594,2023-06-17T12:47:37,2023,1,Some GTA games have the option to add your own songs for creating your own radio station. What are your favorites for such a station?,gta games option add songs creating radio station favorites station
GTA,gta,bewacook,2023-06-17T12:51:11,2023,269,Killing playboy was the best decision.,killing playboy best decision
GTA,gta,Kitchen_Income_2112,2023-06-17T13:05:03,2023,1,What GTA Should Be Like Now Part 1,gta like part 1
GTA,gta,Hour_Interaction9284,2023-06-17T13:13:01,2023,2,I don’t have Mors Mutual as a contact anymore,don’t mors mutual contact anymore
GTA,gta,Pekisha04,2023-06-17T13:48:05,2023,2,Do I lose Epsilon program after scaring the meditating lady with a Gun?,lose epsilon program scaring meditating lady gun
GTA,gta,patriotn8,2023-06-17T14:10:19,2023,1,Message to Rockstar - Terrible Customer Serive,message rockstar terrible customer serive
GTA,gta,Memisterzz,2023-06-17T14:16:26,2023,2,Anyone able to help? Rockstar support refuse to fix it...,anyone able help rockstar support refuse fix
GTA,gta,Cripteen06,2023-06-17T14:38:54,2023,3,How do I complete the tutorial,complete tutorial
GTA,gta,Maak016,2023-06-17T14:53:30,2023,1,infinite loading after cutscenes GTA IV,infinite loading cutscenes gta iv
GTA,gta,999nicoo,2023-06-17T15:21:47,2023,2,Flight Controlls 60% keyboard,flight controlls 60 keyboard
GTA,gta,GrandYogurtcloset906,2023-06-17T15:25:48,2023,19,Poor Taxi had nothing to do with the crash. #JusticeForTaxi,poor taxi nothing crash justicefortaxi
GTA,gta,officialgamingfun,2023-06-17T15:38:05,2023,2,GTA Online : Project Overthrow - Reporting for Duty (PS5 Gameplay),gta online project overthrow reporting duty ps5 gameplay
GTA,gta,Unhappy-Operation774,2023-06-17T15:43:10,2023,3,Account transfer. What would happen?,account transfer would happen
GTA,gta,Prudent_Ad4122,2023-06-17T16:18:52,2023,2,GTA Water Cannon controls,gta water cannon controls
GTA,gta,DAMEN_CARMEN,2023-06-17T17:57:20,2023,195,Luigi and Waluigi with the homies,luigi waluigi homies
GTA,gta,Salty-Bat-1601,2023-06-17T18:18:50,2023,1,NEED HELP GTA 5 ONLINE i wanna buy the phantom wedge but i cant they say i have to buy a vehicle warehouse which i did but the truck is still locked 🤔 do i have to do missions??,need help gta 5 online wanna buy phantom wedge cant say buy vehicle warehouse truck still locked missions
GTA,gta,Ok_Pangolin_8038,2023-06-17T18:49:23,2023,4,"For the music of GTA 6, Rockstar should put in a modern & an old school R&B radio station. Idk why they didn't put in a modern R&B GTA 5 cause the closest we got was The Lowdown.",music gta 6 rockstar put modern old school rb radio station idk didnt put modern rb gta 5 cause closest got lowdown
GTA,gta,honeyfurr444,2023-06-17T19:03:56,2023,1,Who remembers SA-MP,remembers samp
GTA,gta,Decent-League964,2023-06-17T19:11:18,2023,1,Gta 5 Story references SMG4:,gta 5 story references smg4
GTA,gta,Trevor_58,2023-06-17T19:17:03,2023,52,GTA 5: “Sorry you will need a parent to buy this game” GTA 6: “Cash or card sir?”,gta 5 “sorry need parent buy game” gta 6 “cash card sir”
GTA,gta,Thomas_Brunkle,2023-06-17T19:38:45,2023,159,When GTA is cooler than Hollywood,gta cooler hollywood
GTA,gta,BerkcanUmut,2023-06-17T19:39:53,2023,2,how to make gta sa work on win 10?,make gta sa work win 10
GTA,gta,Koro_Iesnes,2023-06-17T20:06:38,2023,1,Gta 5 Ps4 Edition Installing Stuck at 0% (need help urgently),gta 5 ps4 edition installing stuck 0 need help urgently
GTA,gta,Crystal-clean01,2023-06-17T20:07:32,2023,2,24M & 23F couple- Looking for friends,24m 23f couple looking friends
GTA,gta,c0tour,2023-06-17T20:34:29,2023,2,just bought the kosatka,bought kosatka
GTA,gta,james_carr9876,2023-06-17T20:46:02,2023,1,Stuck in my car and can’t move or exit and haven’t saved progress. Any way to solve this?,stuck car can’t move exit haven’t saved progress way solve
GTA,gta,foxtrot90210,2023-06-17T21:02:36,2023,1,How are ppl able to jump in another persons arms?,ppl able jump another persons arms
GTA,gta,Usele2sPlayer,2023-06-17T21:50:29,2023,19,Put the guns down n pick the batons up 🍍,put guns n pick batons
GTA,gta,Bapgames1,2023-06-17T22:31:44,2023,1,A bit of a dumb question...,bit dumb question
GTA,gta,JungleLast,2023-06-17T22:46:04,2023,1,"How tf do you get those? Is this some ""DrIP fEeD"" shit?",tf get drip feed shit
GTA,gta,Benitorojas05,2023-06-17T22:50:57,2023,1,In search of crew on ps5,search crew ps5
GTA,gta,TheOjur,2023-06-17T23:01:26,2023,1,How to play script mods with friends like hulk mod and such?,play script mods friends like hulk mod
GTA,gta,anothergoes,2023-06-17T23:20:47,2023,1,Can't wait to see the GTA.5 online public session Halloween theme this year 👽👻🧟‍♂️,cant wait see gta5 online public session halloween theme year
GTA,gta,BizzbazzJizzjazz,2023-06-17T23:20:54,2023,2,New ps5 player in need of cash,new ps5 player need cash
GTA,gta,Jack_Berenato,2023-06-17T23:57:49,2023,1,How do I get the atonomizers and other guns? (What do I have to buy on the Xbox store),get atonomizers guns buy xbox store
GTA,gta,jayceminecraft,2023-06-18T00:09:37,2023,2,Casino heist trouble,casino heist trouble
GTA,gta,EconomyTap6984,2023-06-18T01:14:54,2023,2959,this place looks quite familiar 🤔,place looks quite familiar
GTA,gta,Zappe2020,2023-06-18T01:39:14,2023,1,Red prismatic pearl ps5,red prismatic pearl ps5
GTA,gta,SatanicParadox,2023-06-18T01:39:37,2023,23,"I was expecting homing missiles but to my shock. NPC car:1, Newbie Griefer:0.",expecting homing missiles shock npc car1 newbie griefer0
GTA,gta,THATBOYYYYMERE,2023-06-18T02:27:38,2023,1,"You know what? I got total $2,985 on Temu. Click here and see how much you can earn👉 https://temu.com/s/SX5xwwtKNWQ8CQJd",know got total 2985 temu click see much earn httpstemucomssx5xwwtknwq8cqjd
GTA,gta,Adrian_safraj,2023-06-18T02:32:25,2023,2,Does anyone know why there’s too helicopters on my gta 4 ps3 cover? Is it a printing error or is it just like certificate copys,anyone know there’s helicopters gta 4 ps3 cover printing error like certificate copys
GTA,gta,Amber_Bloom_147,2023-06-18T02:33:46,2023,3,What is your #1 Favorite GTA Game and Why?,1 favorite gta game
GTA,gta,JimDoggg,2023-06-18T02:39:03,2023,2,[NovaTXL] GtaRP.. THEY TRIED TO FRAME ME,novatxl gtarp tried frame
GTA,gta,tomytube211,2023-06-18T02:50:56,2023,1,This Game is Buggin 💀,game buggin
GTA,gta,dinghy53,2023-06-18T03:27:15,2023,1,Help? Can't play!,help cant play
GTA,gta,Cauliflower-Timely,2023-06-18T06:00:09,2023,1,Planes helicopters and motorcycles have minds of their own on GTA 5 on PS4,planes helicopters motorcycles minds gta 5 ps4
GTA,gta,Exotic_Delay5308,2023-06-18T06:02:59,2023,2,Who is the best GTA character? and why?,best gta character
GTA,gta,Novel-Bag5745,2023-06-18T08:25:04,2023,1,#Arnold_Strong 1987. Like n subscribe,arnoldstrong 1987 like n subscribe
GTA,gta,CH4MP10N777,2023-06-18T08:25:41,2023,4,Why did Rockstar remove 200 something cars?,rockstar remove 200 something cars
GTA,gta,Giuliomisticmandingo,2023-06-18T08:44:37,2023,1,"Keyboard not working on GTA trilogy; definitive edition, on ps5",keyboard working gta trilogy definitive edition ps5
GTA,gta,Jamesbando-gaming,2023-06-18T09:27:35,2023,1,Why am I stuck in combat mode,stuck combat mode
GTA,gta,Redditor0526,2023-06-18T10:22:38,2023,2,COD lovers in here ?,cod lovers
GTA,gta,kirasxwet,2023-06-18T10:44:17,2023,440,Do you ever just appreciate GTA 5’s scenery 🌃,ever appreciate gta 5’s scenery
GTA,gta,CoolDude938,2023-06-18T10:55:42,2023,1,Does anyone know how I can play the original San Andreas on pc?,anyone know play original san andreas pc
GTA,gta,mr-phillips-237,2023-06-18T11:07:23,2023,1,Starting over in online,starting online
GTA,gta,ReviewCompetitive347,2023-06-18T11:20:30,2023,1,Can someone help please,someone help please
GTA,gta,TeekensMark,2023-06-18T11:41:22,2023,1,Gta race props or tracks wont load,gta race props tracks wont load
GTA,gta,Anezayna,2023-06-18T11:48:41,2023,1,What's your fondest memory of GTA CTW?,whats fondest memory gta ctw
GTA,gta,Competitive-Win-7596,2023-06-18T12:00:50,2023,597,New Lucia pictures bikini,new lucia pictures bikini
GTA,gta,Pretend_Plan_7038,2023-06-18T12:09:20,2023,11,Can somebody tell me what this is?,somebody tell
GTA,gta,Rukahs-,2023-06-18T12:15:42,2023,82,Why did I move here ? I guess it was the weather.,move guess weather
GTA,gta,SOULLESS66666,2023-06-18T12:58:33,2023,15,Where todays and yesterdays (still in some sessions) gun van is for y’all :),todays yesterdays still sessions gun van y’all
GTA,gta,rallzzy,2023-06-18T13:27:55,2023,1,"So I’m broke in gta (i have like 300,000) and I was wondering if there is any way I could get money (like billions) without using websites in my laptop that require paying + untrustworthy",i’m broke gta like 300000 wondering way could get money like billions without using websites laptop require paying untrustworthy
GTA,gta,UrMomsAreMine,2023-06-18T13:45:59,2023,3,Imagine this as GTA VI soundtrack,imagine gta vi soundtrack
GTA,gta,Ok_Winter2612,2023-06-18T14:15:54,2023,1,Best Car Deal Ever | GTA V RP | #youtube,best car deal ever gta v rp youtube
GTA,gta,ILikeMayo35,2023-06-18T14:46:08,2023,1,How to fix stuttering,fix stuttering
GTA,gta,gabuetes65,2023-06-18T15:10:54,2023,15,They have opened,opened
GTA,gta,Peter0Griffin0,2023-06-18T15:25:00,2023,62,What things would you like to see in GTA 6 ? Things that should be in it in your opinion.,things would like see gta 6 things opinion
GTA,gta,GoldenCompass452,2023-06-18T15:33:33,2023,1,Cayo Perico Finale Not Starting,cayo perico finale starting
GTA,gta,Pristine-Soil-8201,2023-06-18T16:04:16,2023,1,this real somone try and tell me please,real somone try tell please
GTA,gta,Jonathan_E8_RBLX,2023-06-18T16:33:45,2023,1,Why are the cops so annoying and mean?,cops annoying mean
GTA,gta,sunsetcuboid,2023-06-18T16:39:10,2023,2,No letters on map to start mission,letters map start mission
GTA,gta,Aymengamer37,2023-06-18T16:54:34,2023,3,low fps in gta iv but my pc meets the system requirements!,low fps gta iv pc meets system requirements
GTA,gta,WHOSHOEMAN,2023-06-18T17:21:32,2023,1,Should They Make a 6th GTA?,make 6th gta
GTA,gta,Fillowskyy_,2023-06-18T17:26:32,2023,1,Will my PC run GTA V? (I think it meets the minimum requirements but I'm not sure),pc run gta v think meets minimum requirements im sure
GTA,gta,NoobGamer880088,2023-06-18T18:40:34,2023,2,All Artworks in GTA IV | Pause Menu Theme | 4K,artworks gta iv pause menu theme 4k
GTA,gta,thewomanoftomorrow,2023-06-18T18:43:36,2023,1,Which GTA should I replay?,gta replay
GTA,gta,Ok-Swing-6997,2023-06-18T19:08:33,2023,1,Anyone knows if this is true?,anyone knows true
GTA,gta,prthm0501,2023-06-18T19:19:19,2023,3,"""GTA 5 already running error""---please help me !!",gta 5 already running errorplease help
GTA,gta,CheesyCowboy,2023-06-18T19:51:48,2023,1,A long time coming - Franklin 👏👏,long time coming franklin
GTA,gta,geek-win,2023-06-18T20:31:33,2023,1,This has taken ages,taken ages
GTA,gta,Ok-Document-4415,2023-06-18T20:35:28,2023,2,My gta 5 which ran smoothly on my PC with high graphics suddenly started to lag a lot,gta 5 ran smoothly pc high graphics suddenly started lag lot
GTA,gta,Comfortable-Bonus939,2023-06-18T21:10:11,2023,1,What do you call the drift button,call drift button
GTA,gta,swifto12,2023-06-18T21:19:21,2023,390,Is anyone else having genuine anxiety about dying before GTA 6 comes out?,anyone else genuine anxiety dying gta 6 comes
GTA,gta,Chemical_Diamond1872,2023-06-18T21:44:18,2023,2,Use your motivation to make money on GTA to do it in real life!,use motivation make money gta real life
GTA,gta,GTAGrinder100,2023-06-18T21:46:33,2023,1,"anyone know any legit fast money making methods quickly, like under 20 30 mins?",anyone know legit fast money making methods quickly like 20 30 mins
GTA,gta,Capable_Raspberry_11,2023-06-18T22:04:21,2023,1,Need a group of 4 for criminal mastermind challenge,need group 4 criminal mastermind challenge
GTA,gta,BOBROSSTHETRUEGOD,2023-06-18T22:25:37,2023,3,How do I mod/ adjust traffic speed in GTA IV?,mod adjust traffic speed gta iv
GTA,gta,Ok_Membership9122,2023-06-18T22:29:54,2023,1,Gta modded accounts,gta modded accounts
GTA,gta,Elegant-Operation-16,2023-06-18T22:43:58,2023,5,Favorite GTA 5 story mode mission? Screenshot is mine,favorite gta 5 story mode mission screenshot mine
GTA,gta,Gta-modded-account,2023-06-18T23:22:07,2023,1,Dm for gta moded account,dm gta moded account
GTA,gta,Gold-Maybe-592,2023-06-18T23:26:08,2023,1,First GTA playthrough,first gta playthrough
GTA,gta,lolthatsfunnybroILY,2023-06-18T23:42:58,2023,2,"Game crashing in loading screen, no fix fount yet",game crashing loading screen fix fount yet
GTA,gta,Abstract47,2023-06-19T00:46:14,2023,1,"Bought the new jet today, noticed this on the side of it. 🤔",bought new jet today noticed side
GTA,gta,MrWigggles,2023-06-19T01:51:29,2023,1,Why be excited over GTA 6?,excited gta 6
GTA,gta,Ko0oL-Aid,2023-06-19T01:53:16,2023,6,GTAV On The ROG Ally,gtav rog ally
GTA,gta,Quabbo223,2023-06-19T03:07:24,2023,1,Make car fly gta,make car fly gta
GTA,gta,frogfuckers,2023-06-19T03:41:50,2023,3,The Definitive Trilogy worth $30?,definitive trilogy worth 30
GTA,gta,Pineapple_King047,2023-06-19T04:20:15,2023,68,The Legends of Delay… still waiting for that half life leak,legends delay… still waiting half life leak
GTA,gta,YourPrisonCellmate,2023-06-19T04:41:57,2023,1,What type of tv does Trevor have?,type tv trevor
GTA,gta,Raiding_plauges,2023-06-19T06:12:34,2023,34,"He admitted it, he finally admitted it!!",admitted finally admitted
GTA,gta,mistyy-vr,2023-06-19T06:54:33,2023,1,what are some ways to make gta more family friendly?,ways make gta family friendly
GTA,gta,HippieWilliam,2023-06-19T07:13:37,2023,1,"From a civil designer viewpoint, what do you think of the freeway system in GTA V?",civil designer viewpoint think freeway system gta v
GTA,gta,doctormorbiusfan,2023-06-19T08:16:04,2023,82,What if they teamed up? Would the events of vice city have happened differently?,teamed would events vice city happened differently
GTA,gta,silentwolfgaming,2023-06-19T08:18:34,2023,1,GTA IV | Ray Tracing Latest Custom ReShade 2023 Real Traffic | Ultra Graphics Mod,gta iv ray tracing latest custom reshade 2023 real traffic ultra graphics mod
GTA,gta,jacobgrv00,2023-06-19T08:21:07,2023,1,"Been seeing so many people saying how they got their modded account (duped) for cheap, but never specify where they got it from. Anyone here knows someone or can sell me a modded acc for cheap? Duped or not I really don’t care, need a fun account",seeing many people saying got modded account duped cheap never specify got anyone knows someone sell modded acc cheap duped really don’t care need fun account
GTA,gta,---1---1---,2023-06-19T08:46:12,2023,1,Anyone else worried they’ll fuck it up,anyone else worried they’ll fuck
GTA,gta,fatneek563,2023-06-19T09:31:26,2023,2,"Could someone help I have just bought gta on my Xbox series s and my friend has it on the original xbox, can we play together because I have heard about new gen and old gen etc",could someone help bought gta xbox series friend original xbox play together heard new gen old gen etc
GTA,gta,Kianoblaze,2023-06-19T10:01:06,2023,2,I need help with the final mission,need help final mission
GTA,gta,Interesting_Figure_,2023-06-19T10:13:12,2023,2,My APC is gone??,apc gone
GTA,gta,namelessking181,2023-06-19T10:56:51,2023,1,"In GTA V, I realized Jimmy and Franklin are kinda similar in the beginning of the story, but why exactly do you think Jimmy is disliked while Franklin was in the same position but at least hustling?",gta v realized jimmy franklin kinda similar beginning story exactly think jimmy disliked franklin position least hustling
GTA,gta,CozMo_Rud,2023-06-19T12:09:25,2023,4,Returning GTA player looking on advice weather to come back or not to the game,returning gta player looking advice weather come back game
GTA,gta,CubeX-,2023-06-19T12:37:47,2023,3,GTA 5 costing more space,gta 5 costing space
GTA,gta,Orto_Dogge,2023-06-19T12:52:52,2023,1,"Everything Wrong with ""Liberty City Stories""",everything wrong liberty city stories
GTA,gta,Austin_is_a_munch,2023-06-19T13:19:50,2023,1,Why is oppressor MKII not showing up when I go to click the vehicle on lost. I sending a ticket to r*,oppressor mkii showing go click vehicle lost sending ticket r
GTA,gta,tissajamie_22,2023-06-19T13:30:18,2023,2,Want to run some heists soon if anyone wants to make some cash ps4 dm me your psn,want run heists soon anyone wants make cash ps4 dm psn
GTA,gta,SharkBiteX,2023-06-19T13:51:38,2023,2,Why was Maria's personality so different in GTA SA and GTA3?,marias personality different gta sa gta3
GTA,gta,Black-dragon4129,2023-06-19T14:36:56,2023,38,Sure installing them is the easy part... the hard part is actually playing it with mods without crashing.,sure installing easy part hard part actually playing mods without crashing
GTA,gta,Fraperl,2023-06-19T14:40:13,2023,2,Do you know how much money i get totally from the San Andreas mercenaries dlc ?,know much money get totally san andreas mercenaries dlc
