game,subreddit,author,created_utc,year,score,original_title,cleaned
Skyrim,skyrim,SharkyBoi2005,2024-07-01T00:09:11,2024,6,Whats something that other people do that you cant stand?,whats something people cant stand
Skyrim,skyrim,SpaceProstitute77,2024-07-01T00:17:18,2024,32,This makes me giggle with glee.,makes giggle glee
Skyrim,skyrim,JA116s,2024-07-01T00:21:29,2024,2,What do you think is written inside the Spell Tomes?,think written inside spell tomes
Skyrim,skyrim,RevolutionaryBad5983,2024-07-01T00:26:20,2024,6,Invisible hand bug,invisible hand bug
Skyrim,skyrim,kurtzyy16,2024-07-01T00:46:54,2024,1,What should I pair with a bound bow?,pair bound bow
Skyrim,skyrim,lNuggyl,2024-07-01T00:48:54,2024,2,How to I get out of this hurt mode? I’ve tried resurrect but I get permanently stuck in third person,get hurt mode i’ve tried resurrect get permanently stuck third person
Skyrim,skyrim,WankStain615,2024-07-01T01:06:12,2024,227,One of my greatest pet peeves,one greatest pet peeves
Skyrim,skyrim,Prestigious_Lead_997,2024-07-01T01:32:43,2024,12,My level 70 female Dragonborn,level 70 female dragonborn
Skyrim,skyrim,jono0120,2024-07-01T01:48:40,2024,1,Would anyone know the name of this missing texture? Better Console won't identify it when I click on it,would anyone know name missing texture better console wont identify click
Skyrim,skyrim,jhonCuzYes,2024-07-01T01:56:37,2024,5,"Found a random, essential, pale hold guard with weird dialogue",found random essential pale hold guard weird dialogue
Skyrim,skyrim,Bannybear1,2024-07-01T01:57:10,2024,1,Any fast level up glitches that still work?,fast level glitches still work
Skyrim,skyrim,potate12323,2024-07-01T02:01:05,2024,2,Color change with different segments of dungeon,color change different segments dungeon
Skyrim,skyrim,Dear_Figure3552,2024-07-01T02:14:42,2024,6,"The companions are out here paying respects to Kodlak at his funeral. Meanwhile, Serana walks over to the forge and begins stoking the flames.",companions paying respects kodlak funeral meanwhile serana walks forge begins stoking flames
Skyrim,skyrim,CuLancer,2024-07-01T02:14:49,2024,30,"I (Nord) was getting killed in one hit by frost spells, until I found out that my resistance was 800 negative lol",nord getting killed one hit frost spells found resistance 800 negative lol
Skyrim,skyrim,I_AM_THE_SLANDER,2024-07-01T02:15:07,2024,1,"Meridia’s beacon stole my follower, is there any way to fix it?",meridia’s beacon stole follower way fix
Skyrim,skyrim,a_normal_dude2,2024-07-01T02:20:06,2024,4,How to do a stealth archer,stealth archer
Skyrim,skyrim,horrorstory1169,2024-07-01T02:36:21,2024,3,Help please? I can't start A New Source of Stahlrim.,help please cant start new source stahlrim
Skyrim,skyrim,Needsupgrade,2024-07-01T02:39:38,2024,94,Completionist perks,completionist perks
Skyrim,skyrim,W01fKing,2024-07-01T03:05:44,2024,177,I was cleaning up a drive with a bunch of old Videos and came upon this little gem. Thought I would share the chuckles with everyone :-),cleaning drive bunch old videos came upon little gem thought would share chuckles everyone
Skyrim,skyrim,Ozzynick2018,2024-07-01T03:44:49,2024,1,"New to modding, what are some must have mods? Bonus points for mods that i havent seen on the front page of nexus",new modding must mods bonus points mods havent seen front page nexus
Skyrim,skyrim,Basketbomber,2024-07-01T03:51:59,2024,1,I need the form id for “Report to the Jarl of Whiterun.”,need form id “report jarl whiterun”
Skyrim,skyrim,Ready-Cow-9794,2024-07-01T03:54:56,2024,1166,Got a skyrim tattoo!! Can you guess what thu'um it is?,got skyrim tattoo guess thuum
Skyrim,skyrim,_ThatOneMimic_,2024-07-01T03:56:35,2024,1,why ever side with the stormcloaks?,ever side stormcloaks
Skyrim,skyrim,waitingforstormgate,2024-07-01T04:00:18,2024,1,Anybody have a good looking male Breton (NO MODS)?,anybody good looking male breton mods
Skyrim,skyrim,Few_Statistician6672,2024-07-01T04:07:20,2024,1,Am I the only one who got a raging erection the first time they saw nocturnal?,one got raging erection first time saw nocturnal
Skyrim,skyrim,Wrong-Marsupial-9767,2024-07-01T04:21:30,2024,12,Celcelmo's courier needs a delay,celcelmos courier needs delay
Skyrim,skyrim,Viktrodriguez,2024-07-01T04:27:11,2024,12,Am I the only one who just sometimes deliberately ignores Solstheim in an entire playthrough? Especially when ignoring the main story entirely.,one sometimes deliberately ignores solstheim entire playthrough especially ignoring main story entirely
Skyrim,skyrim,superbadgermilk,2024-07-01T04:28:03,2024,67,PSA dont go out into the sun with very low health as a vampire.,psa dont go sun low health vampire
Skyrim,skyrim,FitzgeraldJorge878,2024-07-01T04:30:14,2024,1,Help with “Revealing the Unseen” to “Containment” quest bug,help “revealing unseen” “containment” quest bug
Skyrim,skyrim,trustworthy-adult,2024-07-01T04:34:49,2024,35,Who else was curious,else curious
Skyrim,skyrim,BargerMarger,2024-07-01T05:12:02,2024,48,Theoretical battle between Ebony Warrior vs. Dagoth Ur,theoretical battle ebony warrior vs dagoth ur
Skyrim,skyrim,AnotherClumsyLeper,2024-07-01T05:25:57,2024,17,Female clothing that aren't dresses? (I can't use mods),female clothing arent dresses cant use mods
Skyrim,skyrim,Infamous-Advice1281,2024-07-01T05:30:39,2024,2,Will my laptop with 4 gb ram run anniversary edition?,laptop 4 gb ram run anniversary edition
Skyrim,skyrim,witchybatx,2024-07-01T05:40:18,2024,2,No mod run through,mod run
Skyrim,skyrim,Vilbert150,2024-07-01T05:56:17,2024,5,Why isnt this showing up in the map,isnt showing map
Skyrim,skyrim,Clean_Ad_5683,2024-07-01T06:01:23,2024,101,The sky is so beautiful here,sky beautiful
Skyrim,skyrim,Centurion4396,2024-07-01T07:26:58,2024,1,dragonborn and his new laser sighting,dragonborn new laser sighting
Skyrim,skyrim,Salsa_drips,2024-07-01T07:32:33,2024,1,Arcanum - New Age of Magic bug,arcanum new age magic bug
Skyrim,skyrim,MrDino9704,2024-07-01T08:09:23,2024,1,Mod Manager 2 Launching not working.,mod manager 2 launching working
Skyrim,skyrim,MuteKasper,2024-07-01T08:15:19,2024,2729,"Helgen was destroyed but, before this, what curious facts could you tell me about this city?",helgen destroyed curious facts could tell city
Skyrim,skyrim,goopgoop221,2024-07-01T08:18:38,2024,1,Could Geralt solo the Elder Scrolls universe?,could geralt solo elder scrolls universe
Skyrim,skyrim,Repulsive-Self1531,2024-07-01T08:51:10,2024,11,LUCIA! I did not grant you permission to play in the backrooms!,lucia grant permission play backrooms
Skyrim,skyrim,Neat-Watercress-1778,2024-07-01T09:30:37,2024,1,Lusty Argonian Maid has inspired a new genre,lusty argonian maid inspired new genre
Skyrim,skyrim,cyber_pirate010,2024-07-01T09:37:55,2024,1,Why do sometimes animals spawn mid air and die from fall damage🤣🤣🤣,sometimes animals spawn mid air die fall damage
Skyrim,skyrim,Academic_Minimum361,2024-07-01T09:46:28,2024,1,Whoa... I didn't know I can find Cicero here..,whoa didnt know find cicero
Skyrim,skyrim,Fluegelnuss420,2024-07-01T10:37:07,2024,1,What‘s your favorite mod collection/pack?,what‘s favorite mod collectionpack
Skyrim,skyrim,Melboyyo,2024-07-01T10:49:17,2024,2,Why he fly like that tho,fly like tho
Skyrim,skyrim,Generic-Schlub,2024-07-01T10:49:34,2024,13,"Was waiting for Kharjo to spawn so I could give him his amulet and finally have my favorite companion when this happened. Never change, Todd. Never change.",waiting kharjo spawn could give amulet finally favorite companion happened never change todd never change
Skyrim,skyrim,Kumachipx0,2024-07-01T10:55:33,2024,1,Mod tips to a OG player,mod tips og player
Skyrim,skyrim,zombieman1945,2024-07-01T11:07:07,2024,1,Exploring the Enchanting Atmosphere of Skyrim: A Deep Dive into the Game’s Scenery and Soundtrack,exploring enchanting atmosphere skyrim deep dive game’s scenery soundtrack
Skyrim,skyrim,FlameWarDuck700,2024-07-01T11:21:48,2024,2,running into modding issues please help :(,running modding issues please help
Skyrim,skyrim,JonahLobe,2024-07-01T11:26:28,2024,311,Did you know that the Dragon Priest masks are based on West African masks (with just a dash of SW Storm Trooper)?,know dragon priest masks based west african masks dash sw storm trooper
Skyrim,skyrim,KomturAdrian,2024-07-01T11:44:55,2024,46,If Balgruuf joined Ulfric in the Civil War would your opinion change?,balgruuf joined ulfric civil war would opinion change
Skyrim,skyrim,MonsieurPatateuh,2024-07-01T12:04:32,2024,1,Sofia... Stop boozing please.,sofia stop boozing please
Skyrim,skyrim,Troyrerian,2024-07-01T12:56:07,2024,4,Rescue from fort neugrad broken,rescue fort neugrad broken
Skyrim,skyrim,fruitycauti,2024-07-01T13:08:02,2024,175,who did you marry and why?,marry
Skyrim,skyrim,cptsdemon,2024-07-01T13:22:06,2024,1,A new hand touches the beacon!,new hand touches beacon
Skyrim,skyrim,nubiangamer,2024-07-01T13:22:36,2024,1,Who else has been taking the easy way up?,else taking easy way
Skyrim,skyrim,International_Egg_30,2024-07-01T13:24:33,2024,7,New to game (stuck),new game stuck
Skyrim,skyrim,Fabas_Beany,2024-07-01T13:24:55,2024,6,Where the hell is unbounded storm in Switch version,hell unbounded storm switch version
Skyrim,skyrim,DanceSharp1770,2024-07-01T13:27:24,2024,1,Am I the only person who is afraid that the new game will be a disappointment?,person afraid new game disappointment
Skyrim,skyrim,Purple_Replacement71,2024-07-01T13:37:53,2024,3,Need help can't load into the game,need help cant load game
Skyrim,skyrim,Wrayth_Skitzofrenik,2024-07-01T13:38:39,2024,22,Favorite kill animations?,favorite kill animations
Skyrim,skyrim,GrimReaper20077,2024-07-01T13:45:25,2024,1,Im trying to start delpine's quest so i can join da blades faction but i cant talk to her bout it for some reason all it says is dat i can only rent a room and das it...can some please help me out,im trying start delpines quest join da blades faction cant talk bout reason says dat rent room das itcan please help
Skyrim,skyrim,Ambitious_Drink_1350,2024-07-01T13:46:29,2024,8,Best way to find new quests?,best way find new quests
Skyrim,skyrim,Crusaderboeh,2024-07-01T14:09:37,2024,9,Dawnguard rant incomming,dawnguard rant incomming
Skyrim,skyrim,GamesWithGregVR,2024-07-01T14:18:40,2024,1,How much gold do I need for Master Architect?,much gold need master architect
Skyrim,skyrim,BurstMurst,2024-07-01T14:19:42,2024,2355,Is sanguine supposed to show up randomly in the world?,sanguine supposed show randomly world
Skyrim,skyrim,Morinine,2024-07-01T14:32:34,2024,179,Just another peaceful day in Whiterun,another peaceful day whiterun
Skyrim,skyrim,RandomAwesomeSwede,2024-07-01T14:35:08,2024,1,The Agony of Waiting,agony waiting
Skyrim,skyrim,Jeeblebubz,2024-07-01T14:35:37,2024,2,Issue with nexus,issue nexus
Skyrim,skyrim,lunar_dune,2024-07-01T14:58:25,2024,561,are cows in skyrim omnivores?,cows skyrim omnivores
Skyrim,skyrim,Sr_Scarpa,2024-07-01T15:03:07,2024,1,Why do people think you were NOT trying to cross the border in the beggining of the game?,people think trying cross border beggining game
Skyrim,skyrim,Realistic-Read4277,2024-07-01T15:10:45,2024,3,"Does anyone know if there is a cast spells while jumping mod? For LE, 1st person.",anyone know cast spells jumping mod le 1st person
Skyrim,skyrim,__Kornbread__,2024-07-01T15:25:01,2024,2,Archer Playthrough - Fresh Account,archer playthrough fresh account
Skyrim,skyrim,Unusual_Possible_831,2024-07-01T15:29:31,2024,1,Pride of Skyrim download,pride skyrim download
Skyrim,skyrim,Boi1722,2024-07-01T15:41:53,2024,1,You should get a scented candle for playing Skyrim,get scented candle playing skyrim
Skyrim,skyrim,Trundlenator,2024-07-01T16:15:27,2024,1,Improving Nordic plate armor beyond flawless?,improving nordic plate armor beyond flawless
Skyrim,skyrim,wbfccmn,2024-07-01T16:31:18,2024,6,Help me find this one Vampire/Necromancer location,help find one vampirenecromancer location
Skyrim,skyrim,sporkyuncle,2024-07-01T16:35:40,2024,1,Looking for a list of quest items you can steal back after the quest,looking list quest items steal back quest
Skyrim,skyrim,Deezdadestroyer,2024-07-01T16:44:36,2024,3,what are some good ps5 mods for making the game look better,good ps5 mods making game look better
Skyrim,skyrim,Only-Carpenter-6689,2024-07-01T16:55:03,2024,11,How would you rank each Daedric artifact from worst to best and why?,would rank daedric artifact worst best
Skyrim,skyrim,xDarnelx,2024-07-01T17:16:58,2024,1249,TIL that you can light the beacons on the path to the College of Winterhold,til light beacons path college winterhold
Skyrim,skyrim,Reasonable_Ice_1288,2024-07-01T17:35:56,2024,4,So unicorn in Skyrim,unicorn skyrim
Skyrim,skyrim,Jostalicious,2024-07-01T18:10:15,2024,1,High warmth non-armor gloves?,high warmth nonarmor gloves
Skyrim,skyrim,ProCatFood,2024-07-01T18:23:49,2024,5,Riften Wed by Julie Giroux performed by my high school’s wind ensemble,riften wed julie giroux performed high school’s wind ensemble
Skyrim,skyrim,Raibo_DxD,2024-07-01T18:42:01,2024,1,Are there any mods for these things?,mods things
Skyrim,skyrim,WiseCourt1902,2024-07-01T18:43:06,2024,4,Can’t start a dying wish quest,can’t start dying wish quest
Skyrim,skyrim,TheJabrons,2024-07-01T18:54:46,2024,4,Need names for Ebony Blade’s sacrifices,need names ebony blade’s sacrifices
Skyrim,skyrim,KitchenArmadillo,2024-07-01T19:10:09,2024,38,who did you sacrifice at the shrine of boethia?,sacrifice shrine boethia
Skyrim,skyrim,elessarelfinit,2024-07-01T19:21:24,2024,1359,What is the inspiration for skyrim's geography?,inspiration skyrims geography
Skyrim,skyrim,Johannes8,2024-07-01T19:37:59,2024,1,It’s been over 10 years. How has there not been one game as good as Skyrim?,it’s 10 years one game good skyrim
Skyrim,skyrim,Old_Taste7076,2024-07-01T19:54:51,2024,3,Glitch with the treasure maps?,glitch treasure maps
Skyrim,skyrim,No-Log-9379,2024-07-01T20:05:36,2024,1,Sharing our Skyrim journal - Take a Note!,sharing skyrim journal take note
Skyrim,skyrim,WolfmansGotNards2,2024-07-01T20:06:48,2024,2,Any fixes for losing a follower who is still following you without loading an old save?,fixes losing follower still following without loading old save
Skyrim,skyrim,Extension-Flower9764,2024-07-01T20:13:55,2024,1,"I play Skyrim special edition on pc and when I first started it was fine, buttery smooth.",play skyrim special edition pc first started fine buttery smooth
Skyrim,skyrim,RaspberryRock,2024-07-01T20:14:57,2024,1,"""Go to Kathwasten!"" the said. ""For sure there won't be two dragons there,"" they said. ""You'll be fine,"" they said.",go kathwasten said sure wont two dragons said youll fine said
Skyrim,skyrim,BlacksmithOk6202,2024-07-01T20:16:57,2024,8,Anyone for custom Skyrim boardgame dice ? 💞🤟....,anyone custom skyrim boardgame dice
Skyrim,skyrim,Starlight-Edith,2024-07-01T20:17:44,2024,9,Can you place keys at golden hills?,place keys golden hills
Skyrim,skyrim,Accomplished_Low3991,2024-07-01T20:18:26,2024,1,Does anybody know any good combat mods,anybody know good combat mods
Skyrim,skyrim,Oroborus18,2024-07-01T20:24:19,2024,1,which is better armor?,better armor
Skyrim,skyrim,bad_arts,2024-07-01T20:31:19,2024,1,"Permanent looping background noise after completing ""The Black Star""",permanent looping background noise completing black star
Skyrim,skyrim,iceekingg,2024-07-01T20:34:14,2024,510,Never in 10+ years,never 10 years
Skyrim,skyrim,TimelyRaddish,2024-07-01T20:39:53,2024,69,The headless... Man?,headless man
Skyrim,skyrim,ReflectionAshamed182,2024-07-01T20:40:56,2024,4,So this just happened,happened
Skyrim,skyrim,zenyaloror,2024-07-01T20:51:20,2024,10,"Sweet Mother, sweet Mother, send your child unto me, for the sins of the unworthy must be baptized in blood and fear.",sweet mother sweet mother send child unto sins unworthy must baptized blood fear
Skyrim,skyrim,ravendragon666,2024-07-01T20:56:04,2024,2,Getting attacked by two dragons at a time??,getting attacked two dragons time
Skyrim,skyrim,bigjoe123121412241,2024-07-01T21:08:06,2024,1,I’m worried for the elder scrolls 6,i’m worried elder scrolls 6
Skyrim,skyrim,Nicole_0818,2024-07-01T21:10:20,2024,1,"Small player homes? Non-thane, non-Dragonborn.",small player homes nonthane nondragonborn
Skyrim,skyrim,StinkyPickles420,2024-07-01T21:19:49,2024,6,Spam work leads at the bannered mare until you get missing merchant. free dawdric armor no level requirement…,spam work leads bannered mare get missing merchant free dawdric armor level requirement…
Skyrim,skyrim,lumpynose,2024-07-01T21:29:29,2024,1,When does the backpack become available in the shops and forges?,backpack become available shops forges
Skyrim,skyrim,Bluefoxtheone,2024-07-01T21:34:22,2024,5,Does leveling conjuration for the weapon summons have any drawbacks when comparing?,leveling conjuration weapon summons drawbacks comparing
Skyrim,skyrim,Pay2stay,2024-07-01T21:44:34,2024,1,Would anyone like to see my best bow shots? Or does no one care haha,would anyone like see best bow shots one care haha
Skyrim,skyrim,merrycreedmas,2024-07-01T21:51:54,2024,4,you can hear the graybeards talk to one another,hear graybeards talk one another
Skyrim,skyrim,sassysorcerer1,2024-07-01T22:04:24,2024,1,Created a Skyrim shirt since this game comprises 95% of my mental space,created skyrim shirt since game comprises 95 mental space
Skyrim,skyrim,Unique-Passenger1903,2024-07-01T22:11:23,2024,1,What is best dagger combination?,best dagger combination
Skyrim,skyrim,Few_Focus_4479,2024-07-01T22:28:00,2024,1,Very obvious (and ugly) shadow lines,obvious ugly shadow lines
Skyrim,skyrim,Vapor-Deathstrider,2024-07-01T22:32:17,2024,124,Should I enter the alleyway?,enter alleyway
Skyrim,skyrim,dj91king,2024-07-01T22:37:37,2024,2,Hey there's some new decoration in front of riften,hey theres new decoration front riften
Skyrim,skyrim,Derulais,2024-07-01T22:51:34,2024,1,Ulfric Stormcloak fucked me raw,ulfric stormcloak fucked raw
Skyrim,skyrim,CandidShadow1313,2024-07-01T23:05:06,2024,11,Watch out for low flying dragons,watch low flying dragons
Skyrim,skyrim,Redskinrey,2024-07-01T23:26:52,2024,8,The break of dawn bug?,break dawn bug
Skyrim,skyrim,VisionDragon,2024-07-01T23:44:02,2024,532,You mean the Dark Brotherhood is in Dawnstar???,mean dark brotherhood dawnstar
Skyrim,skyrim,foreverduke868,2024-07-02T00:07:25,2024,4,what the fuck is this psijic mage doing? secret magic society my ass bro cant even cast a recall spell!,fuck psijic mage secret magic society ass bro cant even cast recall spell
Skyrim,skyrim,DUDEjustwandering1,2024-07-02T00:24:37,2024,29,Why is Morthal a hold capital?,morthal hold capital
Skyrim,skyrim,Blue_Nipple_Hair,2024-07-02T00:47:45,2024,13,Sounds like I’m not the only one who was happy to see Nazeem go,sounds like i’m one happy see nazeem go
Skyrim,skyrim,Salanmandra,2024-07-02T01:09:59,2024,2,"Any mod recommendations to add quests, locations or something related?",mod recommendations add quests locations something related
Skyrim,skyrim,GoBackToLeddit,2024-07-02T01:46:26,2024,900,"If you're going to be a feral savage and eat raw hands, why even bother putting them on a plate?",youre going feral savage eat raw hands even bother putting plate
Skyrim,skyrim,CalebJankowski,2024-07-02T01:54:15,2024,1,"CTD When entering abandoned lodge during ""A New Source of Stalhrim"" quest?",ctd entering abandoned lodge new source stalhrim quest
Skyrim,skyrim,HumongousP3N1S,2024-07-02T01:55:30,2024,1,I managed to ressurect J'zargo with a mod on ps5 (ps4 version ported) but he won't follow me anymore. Any fixes?,managed ressurect jzargo mod ps5 ps4 version ported wont follow anymore fixes
Skyrim,skyrim,GusGangViking18,2024-07-02T02:01:30,2024,14,I can’t be the only one who hates this damn bridge.,can’t one hates damn bridge
Skyrim,skyrim,ZestycloseSoil4091,2024-07-02T02:02:55,2024,1,"I finish scottis tale in: Skyrim lore to sleep to - Reading ""Argonian Account book 4""",finish scottis tale skyrim lore sleep reading argonian account book 4
Skyrim,skyrim,FoxytheChaotic,2024-07-02T02:25:58,2024,3,Lesser Known Followers,lesser known followers
Skyrim,skyrim,__MilkDrinker__,2024-07-02T02:36:16,2024,23,Who's your favorite angry bastard in Skyrim?,whos favorite angry bastard skyrim
Skyrim,skyrim,KoruptDawg,2024-07-02T02:45:11,2024,2,Black Book: The Sallow Regent pitch black bug (AE-PS5),black book sallow regent pitch black bug aeps5
Skyrim,skyrim,Wormhole_Explorer,2024-07-02T02:46:18,2024,44,did not know facehuggers are in skyrim :D,know facehuggers skyrim
Skyrim,skyrim,Bisonboy242,2024-07-02T02:47:13,2024,2,I think I just thought of a paradox,think thought paradox
Skyrim,skyrim,whakoworld,2024-07-02T02:48:26,2024,1,Trying to find and resurrect Lydia,trying find resurrect lydia
Skyrim,skyrim,RawrTheDinosawrr,2024-07-02T03:06:17,2024,756,Is there a way to get rid of a specific perk? I don't care if it gets refunded or not I just do not want this.,way get rid specific perk dont care gets refunded want
Skyrim,skyrim,mikehenshaw,2024-07-02T03:30:38,2024,1,Anniversary edition: Unable to obtain the Imperial Dragon Armour set from Legate in Solitude,anniversary edition unable obtain imperial dragon armour set legate solitude
Skyrim,skyrim,ThunderChief__,2024-07-02T04:01:05,2024,1,Should I buy Skyrim?,buy skyrim
Skyrim,skyrim,CaseohAteAllDaedra,2024-07-02T04:03:48,2024,1,"King Þyórrin, leader of the Adamites. (And Lydia too...)",king þyórrin leader adamites lydia
Skyrim,skyrim,BubbleRetard,2024-07-02T04:26:32,2024,139,"Some more work on the hand drawn, accurately scaled Whiterun map",work hand drawn accurately scaled whiterun map
Skyrim,skyrim,LongjumpSpinach,2024-07-02T04:39:26,2024,5,"After 300+hrs into my first game, this might be the most annoying bugged quest.",300hrs first game might annoying bugged quest
Skyrim,skyrim,Odd-Chair9244,2024-07-02T05:09:19,2024,1,I need help with the fucking guards not coming,need help fucking guards coming
Skyrim,skyrim,kyros1221,2024-07-02T05:16:16,2024,5,I didn’t know this was possible,didn’t know possible
Skyrim,skyrim,MouetteEstre,2024-07-02T05:40:04,2024,39,What is the newest thing you have discovered/learnedin Skyrim?,newest thing discoveredlearnedin skyrim
Skyrim,skyrim,redditorofreddit666,2024-07-02T06:01:03,2024,1,save funclist 1 creates blank text file,save funclist 1 creates blank text file
Skyrim,skyrim,washedcreeper_94,2024-07-02T06:23:23,2024,3,Help with getting some of the stones of baranziah that are locked behind quests.,help getting stones baranziah locked behind quests
Skyrim,skyrim,Archziegel,2024-07-02T06:55:26,2024,6,Now I understand why settlements in Skyrim has few homes,understand settlements skyrim homes
Skyrim,skyrim,DragemD,2024-07-02T07:02:06,2024,1,Stuck. 1st time player. How do I begin the Battle for Whiterun. And join the Imperials.,stuck 1st time player begin battle whiterun join imperials
Skyrim,skyrim,Rouge_Kyojin,2024-07-02T07:13:18,2024,48,What is happening to Skyrim.?,happening skyrim
Skyrim,skyrim,daPhipz,2024-07-02T07:43:12,2024,1,"What is the more morally correct way to play the game, in your opinion? Join the Stormcloaks or side with the Imperium?",morally correct way play game opinion join stormcloaks side imperium
Skyrim,skyrim,Ok_Bid_4441,2024-07-02T07:55:07,2024,1,Has anyone managed to get Skyrim to run on Xbox without crashing?,anyone managed get skyrim run xbox without crashing
Skyrim,skyrim,Pure_Software3661,2024-07-02T08:05:41,2024,3,Lost to the Ages is not starting,lost ages starting
Skyrim,skyrim,HolyReeeee,2024-07-02T09:35:04,2024,1,I cant report in to Galmar Stone-Fist?,cant report galmar stonefist
Skyrim,skyrim,Extra_Principle_2773,2024-07-02T09:35:46,2024,2,I'm coming out of the closet,im coming closet
Skyrim,skyrim,RoyalArmyBeserker,2024-07-02T09:37:14,2024,232,What is the Test Vorpal Sword and why is it threatening to castrate this mannequin,test vorpal sword threatening castrate mannequin
Skyrim,skyrim,erii28,2024-07-02T09:49:23,2024,1,Un-armed. One- or two handed skill?,unarmed one two handed skill
Skyrim,skyrim,Substantial-Elk-9568,2024-07-02T09:58:34,2024,644,Hated Quests that you think are actually good,hated quests think actually good
Skyrim,skyrim,That_randompotato37,2024-07-02T11:05:19,2024,2,Does the dark sacrament apply to members too ?,dark sacrament apply members
Skyrim,skyrim,J_Man_McCetty,2024-07-02T12:08:20,2024,4,Recommendations for a magic playthrough,recommendations magic playthrough
Skyrim,skyrim,This_Cancel1373,2024-07-02T12:15:24,2024,93,Tolfdir’s a creep,tolfdir’s creep
Skyrim,skyrim,_fiz9_,2024-07-02T12:31:23,2024,1,Loading Mods in 2024,loading mods 2024
Skyrim,skyrim,Thordak35,2024-07-02T12:45:40,2024,2,Ps4 hall of the dead,ps4 hall dead
Skyrim,skyrim,VantaneKun,2024-07-02T12:46:01,2024,12,"Riften Guards really are into excercise, even on lunch break",riften guards really excercise even lunch break
Skyrim,skyrim,blondie_nerd,2024-07-02T12:59:50,2024,331,Anyone ever seen this before? Someone else sitting in the Jarl's seat 🤷🏼‍♀️,anyone ever seen someone else sitting jarls seat
Skyrim,skyrim,Determined420,2024-07-02T13:09:24,2024,5,Does the weapon tie you use matter?,weapon tie use matter
Skyrim,skyrim,Cornycob202,2024-07-02T13:16:35,2024,4,Husband and kids disappeared from Hendraheim,husband kids disappeared hendraheim
Skyrim,skyrim,InternetTheBest,2024-07-02T13:20:19,2024,21,What’s something in Skyrim that creeps you out?,what’s something skyrim creeps
Skyrim,skyrim,Obethur,2024-07-02T13:49:24,2024,1,Interception on Survival,interception survival
Skyrim,skyrim,Substantial_Track_17,2024-07-02T13:53:04,2024,3,Today the game taunted me,today game taunted
Skyrim,skyrim,EPSILON_373,2024-07-02T14:10:30,2024,1,I can't absorb a dragon soul,cant absorb dragon soul
