game,subreddit,author,created_utc,year,score,original_title,cleaned
Skyrim,skyrim,No-Economist1157,2024-07-03T22:48:04,2024,1,Glitches or the lack thereof?,glitches lack thereof
Skyrim,skyrim,EqualNewt5562,2024-07-03T23:48:50,2024,5,How important are named NPCs?,important named npcs
Skyrim,skyrim,Loud_Acanthaceae_907,2024-07-04T00:17:22,2024,1,I've no idea which mod broke my game.,ive idea mod broke game
Skyrim,skyrim,Fluffy_Significance1,2024-07-04T00:33:12,2024,1,Morrowind like races,morrowind like races
Skyrim,skyrim,BakedTate,2024-07-04T00:43:20,2024,28,Im 31 and playing skyrim for the 1st time.,im 31 playing skyrim 1st time
Skyrim,skyrim,Aggravating-Heat-480,2024-07-04T00:51:58,2024,40,"I'm really digging the Nightingale armor, I think its my favorite in the game",im really digging nightingale armor think favorite game
Skyrim,skyrim,bobrossgaming08,2024-07-04T00:54:14,2024,2,Some frost dragons attacked and somehow managed to kill party snax,frost dragons attacked somehow managed kill party snax
Skyrim,skyrim,firesonmain,2024-07-04T01:06:56,2024,130,"My character saved the world, then murdered a bunch of people. How should I make her repent?",character saved world murdered bunch people make repent
Skyrim,skyrim,vlad_kushner,2024-07-04T01:42:17,2024,2,What happen if you are married with Ysolda before doing the sanguine quest?,happen married ysolda sanguine quest
Skyrim,skyrim,Visible-Jackfruit769,2024-07-04T02:01:22,2024,8,What’s your favorite house in Skyrim?,what’s favorite house skyrim
Skyrim,skyrim,mbikkyu,2024-07-04T02:27:29,2024,9,"Anyone tried this?? I just found this out today, and now I’m so excited to go home and finally enjoy the immersive roleplaying experience of walking down the road with my walking stick!",anyone tried found today i’m excited go home finally enjoy immersive roleplaying experience walking road walking stick
Skyrim,skyrim,ShakyShaggy101,2024-07-04T02:29:33,2024,1,I know hendraheim house is bugged but to what extent? Also is Myrwatch safe to store stuff in?,know hendraheim house bugged extent also myrwatch safe store stuff
Skyrim,skyrim,boredlurkerjr,2024-07-04T02:40:03,2024,4,Sometimes it’s just the little things….,sometimes it’s little things…
Skyrim,skyrim,Comrade_Vladimir190,2024-07-04T03:01:36,2024,1,Does any one know if there's a home I can live in Black reach?,one know theres home live black reach
Skyrim,skyrim,Common_Reference_774,2024-07-04T03:29:52,2024,1,The thieves guild has riften in their grip,thieves guild riften grip
Skyrim,skyrim,jterwin,2024-07-04T03:46:07,2024,1,Fending off a goblin horde,fending goblin horde
Skyrim,skyrim,RoseFernsparrow,2024-07-04T03:59:18,2024,79,Favourite season to play Skyrim?,favourite season play skyrim
Skyrim,skyrim,Killcade,2024-07-04T04:02:40,2024,18,Does anyone have a high resolution image of the Skyrim map that came with the game?,anyone high resolution image skyrim map came game
Skyrim,skyrim,birmuzyedim,2024-07-04T05:02:28,2024,1,Epic games achievments are not showing up,epic games achievments showing
Skyrim,skyrim,NexusRaven7,2024-07-04T05:15:04,2024,6,"Im playing skyrim for the first time in 3 years, on legendary survival, any advice?",im playing skyrim first time 3 years legendary survival advice
Skyrim,skyrim,GoldenDust0,2024-07-04T05:19:22,2024,1,Will the season unending quest still happen if I’ve already taken Markarth for the stormcloaks?,season unending quest still happen i’ve already taken markarth stormcloaks
Skyrim,skyrim,SmallMochaFrap,2024-07-04T05:24:51,2024,1,Is there a way to put mods on the switch lite version of Skyrim Anniversary?,way put mods switch lite version skyrim anniversary
Skyrim,skyrim,ThatGuyDom17,2024-07-04T05:41:42,2024,2,Why is the Dragonborn so short?,dragonborn short
Skyrim,skyrim,Potential-Audience43,2024-07-04T06:05:07,2024,1,Is this a mod or vanilla and if vanilla what is it,mod vanilla vanilla
Skyrim,skyrim,fwuffles69,2024-07-04T06:37:06,2024,5,I made a overpowered one handed weapon in vanilla skyrim,made overpowered one handed weapon vanilla skyrim
Skyrim,skyrim,SouthAlexander,2024-07-04T07:21:53,2024,1,PS4 can't get to Main Menu after adding mods from Creation Club,ps4 cant get main menu adding mods creation club
Skyrim,skyrim,Roscoe_Chistosomo,2024-07-04T07:41:07,2024,226,Who else agreed the college of winterhold questline sucks!?,else agreed college winterhold questline sucks
Skyrim,skyrim,Red-Throwaway2020,2024-07-04T07:56:57,2024,1,Ended up with 2 Dawnbreakers,ended 2 dawnbreakers
Skyrim,skyrim,Deutsche_Wurst2009,2024-07-04T08:14:18,2024,1,"Skyrim is a game engine for mods, change my mind",skyrim game engine mods change mind
Skyrim,skyrim,Deartuo94,2024-07-04T08:56:10,2024,3198,Playing Survival Mode for the first time. What rip-off is this? This some Martin Luther-sale of indulgences stuff?,playing survival mode first time ripoff martin luthersale indulgences stuff
Skyrim,skyrim,SaMePo10,2024-07-04T09:52:08,2024,1,"Skyrim won't launch, please help",skyrim wont launch please help
Skyrim,skyrim,CryptographerSad5682,2024-07-04T10:06:14,2024,13,"installed the ""you n'wah shout"" mod",installed nwah shout mod
Skyrim,skyrim,gestaltdude,2024-07-04T10:14:40,2024,4,Elder Scrolls Online: How does it compare to Skyrim?,elder scrolls online compare skyrim
Skyrim,skyrim,silvester_sebby,2024-07-04T10:32:53,2024,1,Skyrim vr worth it?,skyrim vr worth
Skyrim,skyrim,AggravatingStock2399,2024-07-04T10:48:01,2024,1,Any ideas what can i do?,ideas
Skyrim,skyrim,JessPanter,2024-07-04T10:58:50,2024,56,Me after leaving the Dwemer Ruins 😭,leaving dwemer ruins
Skyrim,skyrim,rajdeepguha0937,2024-07-04T11:06:11,2024,2,"I was doing the ""Proving honor"" quest and for no reason I got murder bounty on my head. Whiterun guards are on my case , I didn't kill anybody from whiterun , no civilian , no guards , no one.",proving honor quest reason got murder bounty head whiterun guards case didnt kill anybody whiterun civilian guards one
Skyrim,skyrim,Professional-Cut3096,2024-07-04T11:19:45,2024,28,Teldryn sero looks awesome in her hand heavy armour,teldryn sero looks awesome hand heavy armour
Skyrim,skyrim,fallen_Tarnished,2024-07-04T11:23:01,2024,8,May I just say the Wetness Effect Community shader is just one of the best things to ever be made for Skyrim! (Sorry for low quality),may say wetness effect community shader one best things ever made skyrim sorry low quality
Skyrim,skyrim,Unhappy-Performer-57,2024-07-04T11:25:06,2024,1,Serana stuck with me,serana stuck
Skyrim,skyrim,MrPeace083,2024-07-04T13:12:24,2024,13,TIL that you could do this in Ansilvund,til could ansilvund
Skyrim,skyrim,HikeMyPantsUpJohnson,2024-07-04T13:25:04,2024,1,"NPC dead, then alive, then dead again",npc dead alive dead
Skyrim,skyrim,Few-Competition-8195,2024-07-04T13:38:33,2024,1,Skyrim freezes when using bow,skyrim freezes using bow
Skyrim,skyrim,Glass_Ad_1490,2024-07-04T13:40:24,2024,1609,Didn't know you could disintegrate dragons,didnt know could disintegrate dragons
Skyrim,skyrim,lilith_bakh,2024-07-04T13:44:55,2024,2,“Creations” option missing from the menu,“creations” option missing menu
Skyrim,skyrim,karmaChameleon676,2024-07-04T14:34:00,2024,2,New to Modding - need some advice.,new modding need advice
Skyrim,skyrim,AstronomerKind8976,2024-07-04T14:44:32,2024,1,The Winking Skeever Why are people running out to kill each other?,winking skeever people running kill
Skyrim,skyrim,eknobl,2024-07-04T14:47:57,2024,1029,Heard they're reforming the Dawnguard,heard theyre reforming dawnguard
Skyrim,skyrim,search234,2024-07-04T15:08:42,2024,5,Starting a new loader what should i know,starting new loader know
Skyrim,skyrim,SBCwarrior,2024-07-04T15:17:14,2024,13,I don't care what anyone says about the Thalmor,dont care anyone says thalmor
Skyrim,skyrim,Seishura,2024-07-04T15:21:47,2024,239,Dead dragon won't give me his Soul,dead dragon wont give soul
Skyrim,skyrim,The_Blight_,2024-07-04T15:28:49,2024,422,Sometimes i forget how beautiful this game is,sometimes forget beautiful game
Skyrim,skyrim,Maleoppressor,2024-07-04T15:35:53,2024,7,Burn the vampire!,burn vampire
Skyrim,skyrim,Lilshredder187,2024-07-04T15:37:03,2024,1,Are ranger builds in Skyrim any fun?,ranger builds skyrim fun
Skyrim,skyrim,Faraz_5_,2024-07-04T15:44:07,2024,1,Occulsion.esp conflicting with USSEP to crash game.,occulsionesp conflicting ussep crash game
Skyrim,skyrim,Gakojuro1,2024-07-04T15:45:47,2024,1,Is it normal to low level bandits always have 2nd weapons,normal low level bandits always 2nd weapons
Skyrim,skyrim,Wonderful-Comfort300,2024-07-04T15:50:42,2024,1,Which armor is the most Argonian looking?,armor argonian looking
Skyrim,skyrim,ThePragmaticTodd,2024-07-04T16:12:42,2024,7,I am spending hours trying to make a perfect nord name before I allow myself to start my modded playthrough. Is this normal?,spending hours trying make perfect nord name allow start modded playthrough normal
Skyrim,skyrim,0L1V14H1CKSP4NT13S,2024-07-04T16:35:40,2024,556,I made this potion but it doesn't increase my enchantments?,made potion doesnt increase enchantments
Skyrim,skyrim,OwlFeather21,2024-07-04T16:35:44,2024,4,"What do you do when you ""finish"" the game?",finish game
Skyrim,skyrim,Belle_of_Dawn,2024-07-04T16:59:26,2024,15,Beloved Blackreach,beloved blackreach
Skyrim,skyrim,UlfhednarChief,2024-07-04T16:59:47,2024,14,What is your preferred questline completion order?,preferred questline completion order
Skyrim,skyrim,McRandom,2024-07-04T17:14:51,2024,17,Markarth Guards are having a secret party,markarth guards secret party
Skyrim,skyrim,No-Border-3623,2024-07-04T17:22:12,2024,1,March of the dead quest,march dead quest
Skyrim,skyrim,Thin-Permission-3416,2024-07-04T17:30:14,2024,2,"Skyrim without crafting, adept or expert?",skyrim without crafting adept expert
Skyrim,skyrim,Anorangutan,2024-07-04T17:40:15,2024,6,How to Keep the game challenging in higher levels?,keep game challenging higher levels
Skyrim,skyrim,Giftlessfavours,2024-07-04T17:49:45,2024,1,"Wait, there's a path there?",wait theres path
Skyrim,skyrim,Medieval_Flames88,2024-07-04T17:53:01,2024,1,Does anybody else have a problem with vilkas breaking when a companion mod is installed?,anybody else problem vilkas breaking companion mod installed
Skyrim,skyrim,belgianulfr2001,2024-07-04T17:56:25,2024,1,"A bottle thrown in the sea, a question to Skyrim PC players.",bottle thrown sea question skyrim pc players
Skyrim,skyrim,Questionasker271,2024-07-04T18:03:25,2024,1,Any mods that allow companions to loot bodies (Xbox)?,mods allow companions loot bodies xbox
Skyrim,skyrim,Puzzleheaded_Fig614,2024-07-04T18:20:35,2024,5,How to get into Alftand?,get alftand
Skyrim,skyrim,astronautducks,2024-07-04T18:37:44,2024,15,one of these days I will catch the elusive deerfish,one days catch elusive deerfish
Skyrim,skyrim,DalmixTZ,2024-07-04T18:53:29,2024,9,Uhhh... Thanks ? I guess ?,uhhh thanks guess
Skyrim,skyrim,CorpseWriteer,2024-07-04T19:06:06,2024,4,Random Character Idea,random character idea
Skyrim,skyrim,Zalex_atyourservice,2024-07-04T19:10:43,2024,1,What do I do with Solstheim Dragon Masks?,solstheim dragon masks
Skyrim,skyrim,Medical_Lettuce7911,2024-07-04T19:15:02,2024,548,think this is where the player enters skyrim,think player enters skyrim
Skyrim,skyrim,tastelsanic,2024-07-04T19:20:31,2024,48,My boi got the :D,boi got
Skyrim,skyrim,Outinthewheatfields,2024-07-04T19:48:49,2024,10,It's raining... Spider?,raining spider
Skyrim,skyrim,frankievt,2024-07-04T19:49:52,2024,1,Amulet of Akatosh help,amulet akatosh help
Skyrim,skyrim,Klassmasking,2024-07-04T20:02:57,2024,786,"Wabbajack, handcarved out of a TreeBranch. (140cm)",wabbajack handcarved treebranch 140cm
Skyrim,skyrim,The_Pieinator,2024-07-04T20:04:02,2024,1,(Switch) Can't move player character and stuck in raven rock mine,switch cant move player character stuck raven rock mine
Skyrim,skyrim,Jamey4,2024-07-04T20:16:19,2024,1,"I've played this game so many times, and just recently discovered that there is a hidden chest and unique shield near the Gildergreen.",ive played game many times recently discovered hidden chest unique shield near gildergreen
Skyrim,skyrim,Simple_Dig_449,2024-07-04T20:49:57,2024,4,I CANT FIND ESBERNN!,cant find esbernn
Skyrim,skyrim,phantom-scribbler,2024-07-04T20:56:13,2024,60,I think this draugr died after a visit to the chiropractor,think draugr died visit chiropractor
Skyrim,skyrim,BaronVvoltage,2024-07-04T21:18:45,2024,2,Legacy of the dragonborn?,legacy dragonborn
Skyrim,skyrim,steakandcheesepi,2024-07-04T21:26:47,2024,2,Far Horizons - surely the best in the soundtrack?,far horizons surely best soundtrack
Skyrim,skyrim,RiverIsDivine,2024-07-04T21:48:05,2024,12,Barbas the Falkreath Dog,barbas falkreath dog
Skyrim,skyrim,Low-Charge-8554,2024-07-04T21:49:05,2024,35,I am the sweet roll king!!,sweet roll king
Skyrim,skyrim,Tacticaleks,2024-07-04T22:05:18,2024,2,The Elder Ass Scrolls Of The Creed,elder ass scrolls creed
Skyrim,skyrim,Kumirkohr,2024-07-04T22:17:25,2024,69,Does anyone not use Lockpicking on some characters? I can’t not use Lockpicking,anyone use lockpicking characters can’t use lockpicking
Skyrim,skyrim,Here4DaPorno,2024-07-04T23:13:51,2024,1,Do NPC followers use scrolls?,npc followers use scrolls
Skyrim,skyrim,inquisitir,2024-07-04T23:17:46,2024,1,can someone explain to me the link between bretons and reachmen?,someone explain link bretons reachmen
Skyrim,skyrim,SuperAwesomeDude100,2024-07-04T23:20:54,2024,97,"If you could visit one Skyrim city IRL, where would you go and why?",could visit one skyrim city irl would go
Skyrim,skyrim,Fresh_Bat253,2024-07-04T23:40:57,2024,946,got this tattoo yesterday,got tattoo yesterday
Skyrim,skyrim,doomangel69,2024-07-04T23:41:42,2024,6,I really really frickin hate horses!!!,really really frickin hate horses
Skyrim,skyrim,CommitteeCapable1157,2024-07-05T00:15:45,2024,1,Daedric Greatsword and Bow worse than Ebony?,daedric greatsword bow worse ebony
Skyrim,skyrim,thedarksavant,2024-07-05T00:21:41,2024,116,They're All Lined Up,theyre lined
Skyrim,skyrim,jellyfishjam22,2024-07-05T00:32:42,2024,10,"brb, gonna shower while leveling up alteration",brb gonna shower leveling alteration
Skyrim,skyrim,Bethesda_Magic,2024-07-05T00:48:02,2024,59,Go fiddlin’ with any mods around here and we’re going to have a big problem.,go fiddlin’ mods around we’re going big problem
Skyrim,skyrim,Kator_88,2024-07-05T02:04:10,2024,7,All your vitality are belong to us,vitality belong us
Skyrim,skyrim,Spiritual_Prune2707,2024-07-05T02:18:31,2024,1,Doing no damage to Draugrs why not,damage draugrs
Skyrim,skyrim,fallonc9716,2024-07-05T02:27:32,2024,5,what skills tend to be among your lowest across builds?,skills tend among lowest across builds
Skyrim,skyrim,Daedalus_Ex,2024-07-05T02:45:24,2024,5,"Won't reach 60fps, but will sometimes?",wont reach 60fps sometimes
Skyrim,skyrim,Deviledapple,2024-07-05T02:48:15,2024,1,"Destruction ritual spell powers of the elements, requesting hint but not spoiler",destruction ritual spell powers elements requesting hint spoiler
Skyrim,skyrim,Professional-Owl3822,2024-07-05T02:49:50,2024,32,Does it every time i load the save LoL,every time load save lol
Skyrim,skyrim,Dovahkiin837,2024-07-05T02:52:26,2024,1,Anniversary Edition Quest Starters no showing,anniversary edition quest starters showing
Skyrim,skyrim,jack85955,2024-07-05T02:55:35,2024,1,"Alduin’s Wall glitch, XB1",alduin’s wall glitch xb1
Skyrim,skyrim,VitasVitaly,2024-07-05T03:02:52,2024,1,Dumb question. Why is Paarthurnax called Party Snacks?,dumb question paarthurnax called party snacks
Skyrim,skyrim,Own-Perspective-1536,2024-07-05T03:05:14,2024,1,This is confusing to some gamers Lol,confusing gamers lol
Skyrim,skyrim,RuntyBike834,2024-07-05T03:05:36,2024,3,Character Name Ideas for Your Next Adventure,character name ideas next adventure
Skyrim,skyrim,BottasHeimfe,2024-07-05T03:13:28,2024,5,I wish dragon bone plate Armor could be scrimshawed,wish dragon bone plate armor could scrimshawed
Skyrim,skyrim,RoleLong7458,2024-07-05T03:16:34,2024,1,Angelo's Journey part 10,angelos journey part 10
Skyrim,skyrim,aquacrimefighter,2024-07-05T03:38:01,2024,24,Does anyone else struggle with constantly being at carrying capacity because you want to keep everything you’ve ever picked up even though you know deep down you’ll never use it?,anyone else struggle constantly carrying capacity want keep everything you’ve ever picked even though know deep you’ll never use
Skyrim,skyrim,JarlBalgruffSwag,2024-07-05T04:01:10,2024,5,Who do you recommend sacrificing to Boethiah?,recommend sacrificing boethiah
Skyrim,skyrim,pvparenalol,2024-07-05T04:07:32,2024,1,Crops not growing golden hills plantation,crops growing golden hills plantation
Skyrim,skyrim,cabuceus,2024-07-05T04:11:30,2024,1,what is this glitch,glitch
Skyrim,skyrim,HelpNovel,2024-07-05T04:12:25,2024,19,Thief regrets everything,thief regrets everything
Skyrim,skyrim,ScottishWildcatFurry,2024-07-05T04:20:38,2024,2,Are my dropped items safe in the thieves guild?,dropped items safe thieves guild
Skyrim,skyrim,Beneficial-Bother265,2024-07-05T05:29:14,2024,2,Vampire Question. (Read Post for info),vampire question read post info
Skyrim,skyrim,TheDragonborn3,2024-07-05T05:59:50,2024,6,"The Thu’um.org website isn’t working, is there a known reason why?",thu’umorg website isn’t working known reason
Skyrim,skyrim,Famous_Bag_8849,2024-07-05T06:46:27,2024,1,Skyrim sweet roll fox won’t spawn in please explain,skyrim sweet roll fox won’t spawn please explain
Skyrim,skyrim,Round-Ad4720,2024-07-05T06:46:58,2024,1,Bug with Soul Cairn with the blue orbs?,bug soul cairn blue orbs
Skyrim,skyrim,Yugen422,2024-07-05T06:47:14,2024,1,Relics of the crusader glitch,relics crusader glitch
Skyrim,skyrim,SupremeOwl48,2024-07-05T06:56:20,2024,3,early game enchanting goes hard🔥🔥,early game enchanting goes hard
Skyrim,skyrim,Prestigious_Cause_18,2024-07-05T07:00:59,2024,149,I ADOPTED MY FIRST CHILD,adopted first child
Skyrim,skyrim,Elfkazu,2024-07-05T07:03:26,2024,2,Any tips for a mage build? Looking to change from stealth for once,tips mage build looking change stealth
Skyrim,skyrim,gravyballs25,2024-07-05T07:35:43,2024,1,What build should I play as?,build play
Skyrim,skyrim,NoAwareness8591,2024-07-05T07:46:33,2024,5,"can't harvest snowberry bushes(maybe others as well, haven't tested yet)",cant harvest snowberry bushesmaybe others well havent tested yet
Skyrim,skyrim,Brilliant_Point9074,2024-07-05T08:32:43,2024,1,my favorite platinum trophy,favorite platinum trophy
Skyrim,skyrim,Nazowrin,2024-07-05T08:40:26,2024,125,Why does my daughter hate going outside?,daughter hate going outside
Skyrim,skyrim,Goatbucks,2024-07-05T09:18:33,2024,4,I’m finishing up the thieves guild quest,i’m finishing thieves guild quest
Skyrim,skyrim,MIRAQ032,2024-07-05T09:18:40,2024,1,Help me with this bug,help bug
Skyrim,skyrim,majorpaleface,2024-07-05T09:27:03,2024,1,Hearthfore DLC issue,hearthfore dlc issue
Skyrim,skyrim,sushibelts,2024-07-05T09:29:41,2024,1863,Comfort Level: High,comfort level high
Skyrim,skyrim,Wild-Technology7600,2024-07-05T09:37:35,2024,6,Can't get past Raldbthar gate due to gears glitching.,cant get past raldbthar gate due gears glitching
Skyrim,skyrim,IronBound98,2024-07-05T10:16:42,2024,11,How to level alchemy and destruction magic?,level alchemy destruction magic
Skyrim,skyrim,Climbonclimbhigh,2024-07-05T11:01:15,2024,2,Where is Lydia!!!,lydia
Skyrim,skyrim,Lower-Comment-1108,2024-07-05T11:17:12,2024,10,I found an unknown opsie,found unknown opsie
Skyrim,skyrim,XXeadgbeXX,2024-07-05T11:43:59,2024,75,New player here who just bought the game. Should I play the game without mods first?,new player bought game play game without mods first
Skyrim,skyrim,AntiJackCoalition,2024-07-05T11:53:28,2024,1,What is this in the soul cairn,soul cairn
Skyrim,skyrim,orc_supporter,2024-07-05T12:37:05,2024,1,"whats yall's least favorite part of the dawnguard questline, mine is working with serena",whats yalls least favorite part dawnguard questline mine working serena
Skyrim,skyrim,Horny_yet_lonely,2024-07-05T12:50:26,2024,1,Would like some tips and tricks.,would like tips tricks
Skyrim,skyrim,Captain-Rex-117,2024-07-05T12:51:46,2024,11,This is driving me nuts so I need help,driving nuts need help
Skyrim,skyrim,Ashemodragon,2024-07-05T13:06:40,2024,2225,So today i learned and it made me 🤦🏼‍♀️ how did i not realise this before,today learned made realise
Skyrim,skyrim,inuzuka4,2024-07-05T13:26:01,2024,2,Funny chain of events in Dragonsreach,funny chain events dragonsreach
Skyrim,skyrim,TrashInspector69,2024-07-05T13:57:31,2024,79,Can anyone else feel literally their blood pressure relax and all their problems temporarily go away when they listen to the soundtrack?,anyone else feel literally blood pressure relax problems temporarily go away listen soundtrack
Skyrim,skyrim,unknown_user1294,2024-07-05T14:04:46,2024,10,Unpopular opinion: Conjuration?,unpopular opinion conjuration
Skyrim,skyrim,Poch1212,2024-07-05T14:46:28,2024,13,Ok guys... What´s wrong with this Skeleton?,ok guys what´s wrong skeleton
Skyrim,skyrim,SouthOfOz,2024-07-05T15:15:51,2024,26,Requiring that Delphine light the braziers with a torch is a ridiculous design decision,requiring delphine light braziers torch ridiculous design decision
Skyrim,skyrim,InaudibleShout,2024-07-05T16:00:09,2024,1,How to start extending playthroughs?,start extending playthroughs
Skyrim,skyrim,ieattambourinesIG,2024-07-05T16:03:09,2024,456,I finally got all Skill Trees maxed out. Sneak and Archery were the bane of my existence for a while lol,finally got skill trees maxed sneak archery bane existence lol
Skyrim,skyrim,NhanGamerVN,2024-07-05T16:21:48,2024,1,finally enough space to install all Skyrim mods,finally enough space install skyrim mods
Skyrim,skyrim,BigEvilSpider,2024-07-05T16:23:52,2024,1,Struggling to play pure thief,struggling play pure thief
Skyrim,skyrim,RenownedPilot,2024-07-05T16:58:18,2024,13,Lightning spells are a pathway to many abilities some consider to be… unnatural,lightning spells pathway many abilities consider be… unnatural
Skyrim,skyrim,drtd698,2024-07-05T17:13:48,2024,19,Super secret camping site,super secret camping site
Skyrim,skyrim,No_District3338,2024-07-05T17:14:40,2024,1,"If they were truly as patriotic gas they claim, they’d just organize a parade in May. I think",truly patriotic gas claim they’d organize parade may think
