game,subreddit,author,created_utc,year,score,original_title,cleaned
Skyrim,skyrim,OrneryRange7653,2024-07-02T14:14:38,2024,1,"As you can see, the keys have been replaced by ??? symbols. anyone know why this is happening and solutions please",see keys replaced symbols anyone know happening solutions please
Skyrim,skyrim,DatAlienGuy,2024-07-02T14:30:43,2024,7,Sibbi Black Briar has my money because I'm an idiot,sibbi black briar money im idiot
Skyrim,skyrim,All_Right_Alright,2024-07-02T14:35:41,2024,2,This character looks slightly familiar after playing bg3…,character looks slightly familiar playing bg3…
Skyrim,skyrim,DAWNSP1RE,2024-07-02T14:38:40,2024,1,Any tips/tricks for a first timer?,tipstricks first timer
Skyrim,skyrim,PinkVelvette,2024-07-02T14:46:11,2024,1,is the game that buggy or it's just me?,game buggy
Skyrim,skyrim,CaptainGolemActual,2024-07-02T14:50:51,2024,3,Constant crashing when I just walk around (modded),constant crashing walk around modded
Skyrim,skyrim,DriverFirm2655,2024-07-02T14:53:51,2024,1,Which Civil War side hurts the Aldmeri Dominion the most,civil war side hurts aldmeri dominion
Skyrim,skyrim,boxface01,2024-07-02T14:56:09,2024,6,Benefits of one-handed w/ offhand free,benefits onehanded w offhand free
Skyrim,skyrim,DemSpookz,2024-07-02T14:59:25,2024,1,What mod is this mace animation from it’s overriding my MCO moveset :(,mod mace animation it’s overriding mco moveset
Skyrim,skyrim,Due-Collection8198,2024-07-02T15:03:45,2024,3,The spider carousel,spider carousel
Skyrim,skyrim,FibreTTPremises,2024-07-02T15:05:24,2024,309,"Hey guys, do NOT park on this curb.",hey guys park curb
Skyrim,skyrim,naturevicc,2024-07-02T15:22:15,2024,2,Am I cooked? Can’t absorb dragon souls,cooked can’t absorb dragon souls
Skyrim,skyrim,SoulGoalie,2024-07-02T15:23:19,2024,955,Two actual real world dollars. For this.,two actual real world dollars
Skyrim,skyrim,WolfofAustria,2024-07-02T15:28:32,2024,4,Questions about the Werewolf Totems AND Thieves Guild,questions werewolf totems thieves guild
Skyrim,skyrim,Intelligent-Gur-1190,2024-07-02T15:29:03,2024,2,I need help with the Winterhold College bridge crash on PS4,need help winterhold college bridge crash ps4
Skyrim,skyrim,Dependent-Cake-7643,2024-07-02T15:52:09,2024,31,Hadvar just won't go away,hadvar wont go away
Skyrim,skyrim,Hobbun,2024-07-02T16:09:30,2024,2,Downloaded Skyrim SE and have a few questions on the Farming CC,downloaded skyrim se questions farming cc
Skyrim,skyrim,Nugget_Boy69420,2024-07-02T16:20:36,2024,2,Will the dawn guard attack me if I decide to become a vampire in order to access the soul cairn?,dawn guard attack decide become vampire order access soul cairn
Skyrim,skyrim,Betriz2,2024-07-02T17:05:19,2024,1,I'm trying to sneak into fort Neugrad but the objective keeps failing,im trying sneak fort neugrad objective keeps failing
Skyrim,skyrim,Several-Leader3340,2024-07-02T17:14:00,2024,2,HELP! I've lost Serana,help ive lost serana
Skyrim,skyrim,ExplorerJackfroot,2024-07-02T17:14:41,2024,11,Whose dog is this?,whose dog
Skyrim,skyrim,mothde,2024-07-02T17:16:53,2024,1993,Do you think I can slay this beast?,think slay beast
Skyrim,skyrim,hassan_dislogical,2024-07-02T17:25:52,2024,1,blood on ice fucking sucks.,blood ice fucking sucks
Skyrim,skyrim,DarthConnor06,2024-07-02T17:39:37,2024,1,Is it worth redownloading Skyrim and playing again?,worth redownloading skyrim playing
Skyrim,skyrim,EntertainmentTrue215,2024-07-02T18:02:32,2024,3,"i cant have two things in my hands, pls help i cant find anyone with the same problem:(",cant two things hands pls help cant find anyone problem
Skyrim,skyrim,Jeffrey_ShowYT,2024-07-02T18:19:00,2024,1,"Never played the game before and don’t know anything about it, but I’ll pretend I’m an expert. Ask me anything!",never played game don’t know anything i’ll pretend i’m expert ask anything
Skyrim,skyrim,WiseOldChicken,2024-07-02T18:30:36,2024,209,Has playing Skyrim skewed your perception in real life?,playing skyrim skewed perception real life
Skyrim,skyrim,NostalGiaPron3,2024-07-02T18:42:33,2024,1,It's getting boring man,getting boring man
Skyrim,skyrim,Centurion_Six,2024-07-02T18:44:59,2024,4,I think I shouldn't have killed that guy,think shouldnt killed guy
Skyrim,skyrim,Idkrem_Montoya,2024-07-02T18:48:56,2024,47,I think I need a break,think need break
Skyrim,skyrim,LordXavion,2024-07-02T18:49:09,2024,17,What's your opinion of the fisher quest?,whats opinion fisher quest
Skyrim,skyrim,OddlyGodly4,2024-07-02T18:56:35,2024,6,Recommendation please,recommendation please
Skyrim,skyrim,NoobySnail,2024-07-02T19:25:55,2024,2,does twohanded dmg buff from perks stack multiplicatively or additively with apparel buff,twohanded dmg buff perks stack multiplicatively additively apparel buff
Skyrim,skyrim,PBGXXI,2024-07-02T19:36:41,2024,2,Maybe someone can help me.,maybe someone help
Skyrim,skyrim,SpaceMonkey3601,2024-07-02T19:40:13,2024,2,I need help w my game,need help w game
Skyrim,skyrim,MetryusD,2024-07-02T19:45:41,2024,3,just a moment of love for endon’s family (markarth),moment love endon’s family markarth
Skyrim,skyrim,Illustrious_Can_639,2024-07-02T19:47:49,2024,5,Anyone else waiting for Xbox to come back up? 🤣,anyone else waiting xbox come back
Skyrim,skyrim,orlanthi,2024-07-02T19:56:09,2024,3,Unrelenting force not working,unrelenting force working
Skyrim,skyrim,Spice_has_no_brain,2024-07-02T19:58:38,2024,16,Sending Nazeem to the Cloud District,sending nazeem cloud district
Skyrim,skyrim,PelinalWhitesteak,2024-07-02T20:13:41,2024,29,Made a historically accurate viking using various mods from NordwarUA.,made historically accurate viking using various mods nordwarua
Skyrim,skyrim,JimSFV,2024-07-02T20:17:00,2024,1,Only three saves?,three saves
Skyrim,skyrim,Anti-Yelp,2024-07-02T20:27:19,2024,84,"I love Skyrim so much no other game even comes close to its timelessness. (I love Zelda too) I’d love some suggestions of other games you guys have enjoyed just as much, or that I should check out?",love skyrim much game even comes close timelessness love zelda i’d love suggestions games guys enjoyed much check
Skyrim,skyrim,KyokoEspeon,2024-07-02T20:33:11,2024,3,Does Necromage affect Survival Mode coldness?,necromage affect survival mode coldness
Skyrim,skyrim,Andrew-ss,2024-07-02T20:41:20,2024,2,I'm new at modding Skyrim and overwhelmed,im new modding skyrim overwhelmed
Skyrim,skyrim,cantcoloratall91,2024-07-02T20:48:57,2024,67,Which women in Skyrim had the most impact on you and why??,women skyrim impact
Skyrim,skyrim,PreviousResearcher66,2024-07-02T20:52:58,2024,3,What’s the fastest way to lvl up smithing?,what’s fastest way lvl smithing
Skyrim,skyrim,zombiekilla169,2024-07-02T20:56:33,2024,2,Trying to do some research as I am new,trying research new
Skyrim,skyrim,Best_Philosopher_857,2024-07-02T20:57:11,2024,4,bloodcursed arrows command?,bloodcursed arrows command
Skyrim,skyrim,steamIbreather,2024-07-02T20:57:22,2024,41,Beautiful as ever,beautiful ever
Skyrim,skyrim,Thersty,2024-07-02T21:05:54,2024,1,Need help understanding my Crash Logs,need help understanding crash logs
Skyrim,skyrim,KnoxOber,2024-07-02T21:09:48,2024,1,CTD entering Moorside inn at Morthal,ctd entering moorside inn morthal
Skyrim,skyrim,ShamefulElf,2024-07-02T21:24:22,2024,1,"Mispeld my email for crwation club, hiw do i change it?",mispeld email crwation club hiw change
Skyrim,skyrim,ChipotleBanana,2024-07-02T21:45:39,2024,8,I always start in Bruma. I always play a male Khajiit. Something might be wrong with me.,always start bruma always play male khajiit something might wrong
Skyrim,skyrim,Ok_Narwhal2676,2024-07-02T21:46:56,2024,1,What is it with run off caverns? I did all the side rooms,run caverns side rooms
Skyrim,skyrim,One_Spell_45,2024-07-02T22:04:58,2024,1,What Is Everyone’s Favourite Race?,everyone’s favourite race
Skyrim,skyrim,LeoBoy_Tea7,2024-07-02T22:23:29,2024,2,Not absorbing dragon souls,absorbing dragon souls
Skyrim,skyrim,1thebricks,2024-07-02T22:44:43,2024,6,Urag refuses to give me info on the elder scroll,urag refuses give info elder scroll
Skyrim,skyrim,Kingderpturtle,2024-07-02T22:50:59,2024,60,Is an almost pure hand to hand build viable?,almost pure hand hand build viable
Skyrim,skyrim,Queen_Secrecy,2024-07-02T22:54:00,2024,3,Black Book Soundeffect?,black book soundeffect
Skyrim,skyrim,theillbill,2024-07-02T23:07:57,2024,1,How do you know when to start a new playthrough?,know start new playthrough
Skyrim,skyrim,AlphaMak8888,2024-07-02T23:11:25,2024,2,Brawling on legendary difficulty is pure brainrot.,brawling legendary difficulty pure brainrot
Skyrim,skyrim,slayer21___,2024-07-02T23:17:11,2024,1,How to resurrect both characters at warmaidens,resurrect characters warmaidens
Skyrim,skyrim,bigbuffbabylive,2024-07-02T23:19:20,2024,17,What happened to Gerdur?,happened gerdur
Skyrim,skyrim,Beneficial_Account78,2024-07-02T23:27:16,2024,1,How do i continue the dawngaurd dlc?,continue dawngaurd dlc
Skyrim,skyrim,ShadyMoleRat,2024-07-02T23:32:26,2024,2,to kill an empire glitch,kill empire glitch
Skyrim,skyrim,UselessGojo123,2024-07-02T23:47:06,2024,953,Legate Rikke is the hardest person ever,legate rikke hardest person ever
Skyrim,skyrim,MetatypeA,2024-07-02T23:49:50,2024,1,That one time Tony Swatton forged an Orcish Battleaxe,one time tony swatton forged orcish battleaxe
Skyrim,skyrim,Spearix1793,2024-07-02T23:58:20,2024,99,AKAAAAATOOOOOSHH! IS THIS HOW YOU FACE ME? COWARD!,akaaaaatoooooshh face coward
Skyrim,skyrim,EnvironmentalShape79,2024-07-03T00:13:53,2024,1,Thieves guild issue.,thieves guild issue
Skyrim,skyrim,pink_vo1d,2024-07-03T00:18:26,2024,1,would anyone happen to know the sale schedule of special edition on xbox?,would anyone happen know sale schedule special edition xbox
Skyrim,skyrim,Aeokikit,2024-07-03T00:22:31,2024,2,Things to do on my survival/final playthrough I started a couple weeks ago.  Anything I should add?,things survivalfinal playthrough started couple weeks ago anything add
Skyrim,skyrim,MiddlePsychology8385,2024-07-03T00:31:32,2024,1,Stormcloaks or imperials,stormcloaks imperials
Skyrim,skyrim,ZacianMaster,2024-07-03T00:35:57,2024,2,No place to display the amethyst claw(s),place display amethyst claws
Skyrim,skyrim,Kharoas95,2024-07-03T00:55:28,2024,1,Can someone design an ai ability generator for Bethesda mods on Skyrim xbox1?,someone design ai ability generator bethesda mods skyrim xbox1
Skyrim,skyrim,Eecera,2024-07-03T00:57:57,2024,2,BUG Help Black Book Untold Legends cant leave,bug help black book untold legends cant leave
Skyrim,skyrim,SadisticBuddhist,2024-07-03T01:15:17,2024,748,How I like to play. Does anyone else do this?,like play anyone else
Skyrim,skyrim,Knupnez,2024-07-03T01:20:59,2024,42,What is the best weapon that doesn't have to recharge?,best weapon doesnt recharge
Skyrim,skyrim,Known-Assistance-435,2024-07-03T01:41:48,2024,4,My attempt at creating a Lilmothiit in vanilla Skyrim. Thoughts?,attempt creating lilmothiit vanilla skyrim thoughts
Skyrim,skyrim,6DarkWhite9,2024-07-03T01:45:01,2024,1,Anniversary Edition,anniversary edition
Skyrim,skyrim,orbstealer_,2024-07-03T01:51:01,2024,2513,When I was a kid I used to think “Milk-Drinker” was an exclusively Khajiit Dragonborn thing because cats drink milk. What were some of your misconceptions?,kid used think “milkdrinker” exclusively khajiit dragonborn thing cats drink milk misconceptions
Skyrim,skyrim,Delliott213,2024-07-03T01:53:57,2024,1,Question about lag on xbox skyrim,question lag xbox skyrim
Skyrim,skyrim,Emotional_Passenger3,2024-07-03T02:01:53,2024,1,Blood on ice won’t start. I have the key and went into the house but the body wont spawn,blood ice won’t start key went house body wont spawn
Skyrim,skyrim,Main-Meringue5697,2024-07-03T02:33:35,2024,1,This is how I Imagined a stealth archer playing soccer,imagined stealth archer playing soccer
Skyrim,skyrim,HexaAquaIron,2024-07-03T02:40:25,2024,11,Dwarven Centurion,dwarven centurion
Skyrim,skyrim,Itsajoke69420,2024-07-03T02:42:44,2024,2,Does the anniversary edition include online on steam? I’m new  to this game .,anniversary edition include online steam i’m new game
Skyrim,skyrim,maraj7x,2024-07-03T02:42:46,2024,2,What is that dancing mod that everyone has their anime characters do where they sway their hips from side to side? I see a lot of people have it but I can't find the name of the mod. I tried searching Skyrim se dance mods but can't find the one what I'm looking for.,dancing mod everyone anime characters sway hips side side see lot people cant find name mod tried searching skyrim se dance mods cant find one im looking
Skyrim,skyrim,moonleaf-tea,2024-07-03T02:43:06,2024,2,Sounds like this happens a lot.,sounds like happens lot
Skyrim,skyrim,Outrageous-Farm3190,2024-07-03T02:50:17,2024,1,If only it was like Majoras Mask,like majoras mask
Skyrim,skyrim,OnePostToast,2024-07-03T02:58:12,2024,185,What shout do you now wish you used more?,shout wish used
Skyrim,skyrim,Vast_Impress_8850,2024-07-03T03:01:26,2024,3,Where do I find snowy Sabre cats?,find snowy sabre cats
Skyrim,skyrim,AncientDragoness23,2024-07-03T03:02:06,2024,36,This dragon acknowledged I was Dragonborn and just decided to give me its soul mid battle lol,dragon acknowledged dragonborn decided give soul mid battle lol
Skyrim,skyrim,kangroobaby,2024-07-03T03:10:04,2024,1,Who else is really annoyed at the fact that Skyrim is not like morrowind and made it so we can’t kill key quest figures. Next time I have to listen to Byrnolf in  Riften no I will not join the thieves guild.,else really annoyed fact skyrim like morrowind made can’t kill key quest figures next time listen byrnolf riften join thieves guild
Skyrim,skyrim,Icy_Bass_3850,2024-07-03T03:15:06,2024,1,Just A Theory about future Elder Scrolls installment assets from a Starfield Creation Kit Mod,theory future elder scrolls installment assets starfield creation kit mod
Skyrim,skyrim,Zidakai222,2024-07-03T03:15:06,2024,1,Need some mod help,need mod help
Skyrim,skyrim,KatOfTheEssence,2024-07-03T03:15:38,2024,1,"Help, Ulfberth is hostile and I didn't kill his wife",help ulfberth hostile didnt kill wife
Skyrim,skyrim,Psychological_Toe_76,2024-07-03T03:21:19,2024,8,Favorite destruction spell for mage playthrough?,favorite destruction spell mage playthrough
Skyrim,skyrim,PlayaPlayaUnown,2024-07-03T03:25:44,2024,3,"If Skyrim got a remake, what is one feature you wish to be added/removed?",skyrim got remake one feature wish addedremoved
Skyrim,skyrim,ZeroxSP7,2024-07-03T03:25:57,2024,3,Been a long time since I’ve played. How do you break people’s guard?,long time since i’ve played break people’s guard
Skyrim,skyrim,Don_Pe,2024-07-03T03:28:54,2024,1,"Yo, DJ, Spin that sh*t!!",yo dj spin sht
Skyrim,skyrim,Krazy_Keno,2024-07-03T03:33:00,2024,1,Question on starting the stalhrim smithing quest (no i did not kill Deor Woodcutter),question starting stalhrim smithing quest kill deor woodcutter
Skyrim,skyrim,Sk0p3r,2024-07-03T03:44:14,2024,1,Funny glitch where Ralof sits on air while talking to Gerdur half across Riverwood,funny glitch ralof sits air talking gerdur half across riverwood
Skyrim,skyrim,wazzledazzle,2024-07-03T03:44:41,2024,1,"I’ve been to all 4 locations for the Aetherium Shards, but I only have 3",i’ve 4 locations aetherium shards 3
Skyrim,skyrim,Different-Tea-6526,2024-07-03T03:55:24,2024,660,"Ive bought this game 10 times, and my wife is angry at me, ask me anything",ive bought game 10 times wife angry ask anything
Skyrim,skyrim,baggybeetle,2024-07-03T04:12:49,2024,1,Are there quests related to the the racism/justice of it in skyrim?,quests related racismjustice skyrim
Skyrim,skyrim,Lehk369,2024-07-03T04:33:05,2024,1,how to cinematically btfo namira (and others),cinematically btfo namira others
Skyrim,skyrim,CFAinvestor,2024-07-03T04:36:43,2024,2,Would High Hrothgar be a comfortable place to sleep and hide from enemies?,would high hrothgar comfortable place sleep hide enemies
Skyrim,skyrim,SebberWeber,2024-07-03T04:44:25,2024,1,Is this normal ?,normal
Skyrim,skyrim,MellyKidd,2024-07-03T04:52:12,2024,1,"I want to move my kids and spouse to a new home, but only my husband has the option when talking to him. Will moving him make the kids follow? (They have a pet rabbit as well.)",want move kids spouse new home husband option talking moving make kids follow pet rabbit well
Skyrim,skyrim,PATRIOT880,2024-07-03T05:04:58,2024,4,Thieves Guild vs Dark Brotherhood,thieves guild vs dark brotherhood
Skyrim,skyrim,Desperate_Guava4526,2024-07-03T05:36:05,2024,6,Does anyone else frequently skip the Dawnguard quest line when they do new playthroughs?,anyone else frequently skip dawnguard quest line new playthroughs
Skyrim,skyrim,Personal-Reaction411,2024-07-03T05:46:29,2024,1,So I have an idea for an ALL WEREWOLF PARTY.,idea werewolf party
Skyrim,skyrim,Heavy_Talk_378,2024-07-03T05:58:07,2024,3,Finally got to stealth archer,finally got stealth archer
Skyrim,skyrim,Ejradio,2024-07-03T07:28:58,2024,8,Revealing the unseen,revealing unseen
Skyrim,skyrim,Kaptain_Kaoz,2024-07-03T08:24:04,2024,1,Says Cure Disease. It must cure disease!,says cure disease must cure disease
Skyrim,skyrim,Zalikaikitten,2024-07-03T09:13:14,2024,7,So I gave him money? DLC spoilers??,gave money dlc spoilers
Skyrim,skyrim,kingkulesza88,2024-07-03T09:14:40,2024,1,The Elder Scrolls V: Skyrim | Steam Deck (OLED) Performance Test | Low vs Medium vs High vs Ultra,elder scrolls v skyrim steam deck oled performance test low vs medium vs high vs ultra
Skyrim,skyrim,the_human_specimen,2024-07-03T09:22:13,2024,8,I just experienced the most devastating bug in Goldenhills plantation,experienced devastating bug goldenhills plantation
Skyrim,skyrim,Sanguine_Rosey,2024-07-03T09:25:43,2024,63,Got to love skyrim for its bugs,got love skyrim bugs
Skyrim,skyrim,dochen01pps,2024-07-03T10:02:50,2024,10,Glitched into a wholesome moment with my boy Inigo / like cuddling with my big cat,glitched wholesome moment boy inigo like cuddling big cat
Skyrim,skyrim,The2ndDegree,2024-07-03T10:04:49,2024,28,How do you play through Skyrim?,play skyrim
Skyrim,skyrim,LucarioMagic,2024-07-03T11:17:01,2024,50,Don't save while riding a horse.,dont save riding horse
Skyrim,skyrim,24Naps,2024-07-03T11:38:24,2024,1,The Power of CHEESE (and vegetable soup),power cheese vegetable soup
Skyrim,skyrim,n7shepard1987,2024-07-03T11:39:20,2024,4,Views on the high kings death,views high kings death
Skyrim,skyrim,RealisticHour344,2024-07-03T11:47:47,2024,1,how to remove dirt on the face for all human female or mod to remove it?,remove dirt face human female mod remove
Skyrim,skyrim,Hanged-Goose,2024-07-03T12:03:13,2024,1,"Shhh! I've sneaked in a mod combat video! For all you mod-tolerant folks, please watch it so the vanilla fundamentalists don't find out!",shhh ive sneaked mod combat video modtolerant folks please watch vanilla fundamentalists dont find
Skyrim,skyrim,andy_7677,2024-07-03T12:15:14,2024,1,Lurker Poison Effect Won't Go Away,lurker poison effect wont go away
Skyrim,skyrim,SiwySiwjqk,2024-07-03T12:54:33,2024,3,can someone tell me whats the problem that crashing my game,someone tell whats problem crashing game
Skyrim,skyrim,TheFalseLogical,2024-07-03T13:29:14,2024,8,Fighting Archers in Legendary Mode,fighting archers legendary mode
Skyrim,skyrim,Ralf12345678,2024-07-03T13:30:42,2024,9,My game is stuck on the loading screen any ideas?,game stuck loading screen ideas
Skyrim,skyrim,blurry-echo,2024-07-03T13:52:06,2024,135,Which cheats/console commands do you use the most?,cheatsconsole commands use
Skyrim,skyrim,JustPassingThrough53,2024-07-03T13:59:21,2024,6,"I’m a total newbie, but what do you guys mean Magic is weak?",i’m total newbie guys mean magic weak
Skyrim,skyrim,Superdonkeyspank,2024-07-03T14:01:59,2024,5,Is it possible to obtain hysteria again after selling it?,possible obtain hysteria selling
Skyrim,skyrim,Puzzleheaded_Ad_4441,2024-07-03T14:28:07,2024,3461,"Objectively, who was better? The Dawnguard or the Harkon Vampires?",objectively better dawnguard harkon vampires
Skyrim,skyrim,thaSavory_dude,2024-07-03T14:28:48,2024,7,shipwrecks along the northern coast,shipwrecks along northern coast
Skyrim,skyrim,Thatone110,2024-07-03T14:59:55,2024,8,No enb but a few mods,enb mods
Skyrim,skyrim,FantasticBend686,2024-07-03T15:03:25,2024,1,Skyrim lags horribly after playing for 10 minutes,skyrim lags horribly playing 10 minutes
Skyrim,skyrim,r4f4dr0y,2024-07-03T15:08:27,2024,1,Help: bodyslide don't show presets,help bodyslide dont show presets
Skyrim,skyrim,creaturesonthebrain,2024-07-03T15:20:30,2024,5,Glitch or racism?,glitch racism
Skyrim,skyrim,AlfonsoAnguiano23,2024-07-03T15:29:03,2024,1,Every time you have to visit Septimus in survival mode it's a pain in the ass.,every time visit septimus survival mode pain ass
Skyrim,skyrim,Maleficent_Jaguar807,2024-07-03T15:29:12,2024,1,What r ur most popular opinions,r ur popular opinions
Skyrim,skyrim,LordGraygem,2024-07-03T15:34:33,2024,1,Which forced CC material from the AE has mod conflicts?,forced cc material ae mod conflicts
Skyrim,skyrim,AgedDovah,2024-07-03T15:57:17,2024,22,Free long distance lobotomy via yours truly,free long distance lobotomy via truly
Skyrim,skyrim,NobodySpecific9354,2024-07-03T16:21:16,2024,4,First time seeing Serana's eyes!,first time seeing seranas eyes
Skyrim,skyrim,ced__98,2024-07-03T16:22:10,2024,1230,1700 hours of skyrim and i discovered Haelga's bunker now...,1700 hours skyrim discovered haelgas bunker
Skyrim,skyrim,BoymoderGlowie,2024-07-03T16:31:09,2024,4,is there a way to edit the magnitude of active effects?,way edit magnitude active effects
Skyrim,skyrim,ParkingNecessary1273,2024-07-03T16:47:30,2024,1,Reasons of becoming A Vampire( A Fallen Hero),reasons becoming vampire fallen hero
Skyrim,skyrim,DegreeFar7564,2024-07-03T17:05:32,2024,14,What is the best use for Linen Wrap?,best use linen wrap
Skyrim,skyrim,KakashiKes,2024-07-03T17:07:43,2024,13,What quests do y'all do late in the game?,quests yall late game
Skyrim,skyrim,parisprisoner1865,2024-07-03T17:28:15,2024,1,Looking for Custom Tapestry,looking custom tapestry
Skyrim,skyrim,Special-Horror9495,2024-07-03T17:35:49,2024,10,First time doing this,first time
Skyrim,skyrim,Umsattiro,2024-07-03T17:55:02,2024,2,"where to find good stuff (incredibly specific , I know)",find good stuff incredibly specific know
Skyrim,skyrim,Fantastic-Art-146,2024-07-03T17:59:51,2024,4,Going back into Skyrim,going back skyrim
Skyrim,skyrim,chevria0,2024-07-03T18:19:10,2024,1,Why can't I hire a room in the Bannered Mare?,cant hire room bannered mare
Skyrim,skyrim,QuasiCosmicEntity,2024-07-03T18:26:56,2024,333,When you can't get your lock open...,cant get lock open
Skyrim,skyrim,SladeIsDead,2024-07-03T18:28:31,2024,42,Vanilla Skyrim still hides many beautiful locations 🌛,vanilla skyrim still hides many beautiful locations
Skyrim,skyrim,Snipesgirl1678,2024-07-03T18:55:12,2024,2,Sun hollow arrows?,sun hollow arrows
Skyrim,skyrim,heresanother12,2024-07-03T19:02:34,2024,1,Everything Dwemer is resisting soul trap,everything dwemer resisting soul trap
Skyrim,skyrim,AlexBazh,2024-07-03T19:25:07,2024,2,Started my first Dunmer playthrough. Guess i'll play only for them now. Tbh i never knew they have so so much rizz.,started first dunmer playthrough guess ill play tbh never knew much rizz
Skyrim,skyrim,Snyx137,2024-07-03T19:26:16,2024,4,Report to jarl of Whiterun PlayStation,report jarl whiterun playstation
Skyrim,skyrim,PoopsMcGroots,2024-07-03T19:31:24,2024,221,My youngest son (14) has just started playing Skyrim for the first time 🥹,youngest son 14 started playing skyrim first time
Skyrim,skyrim,Branman1234,2024-07-03T19:45:59,2024,1,After playing Skyrim for 12 years I only just discovered I can go to Blackreach straight away,playing skyrim 12 years discovered go blackreach straight away
Skyrim,skyrim,HideBoar,2024-07-03T20:01:00,2024,139,"For some reasons, Sofia kept asking my boi LDB to carry her. So I have an idea to draw this in particular.",reasons sofia kept asking boi ldb carry idea draw particular
Skyrim,skyrim,Worldly_Permission78,2024-07-03T20:05:47,2024,85,"Wanted to show my friend how my projector works, the timing of a video I was watching was perfect",wanted show friend projector works timing video watching perfect
Skyrim,skyrim,originalavedium,2024-07-03T20:19:16,2024,1,Skyrim Nexus Downloads for Wabbajack Modpack Installer,skyrim nexus downloads wabbajack modpack installer
Skyrim,skyrim,LordOord23,2024-07-03T20:21:05,2024,71,I love these little cut scenes.,love little cut scenes
Skyrim,skyrim,porkbun2k,2024-07-03T20:29:19,2024,1,Return to Brynjolf...,return brynjolf
Skyrim,skyrim,Designer-Coast9160,2024-07-03T20:37:28,2024,1935,Which one handed sword do you think looks the best in ( not modded) Skyrim?,one handed sword think looks best modded skyrim
Skyrim,skyrim,ErikTheRed99,2024-07-03T21:08:11,2024,6,"My game is completely borked, and I'd like help fixing it.",game completely borked id like help fixing
Skyrim,skyrim,Heavy_Animal4950,2024-07-03T21:46:15,2024,1,How do i no longer become a vampire if ive killed the vampire lord andcant beome a werewolf?,longer become vampire ive killed vampire lord andcant beome werewolf
Skyrim,skyrim,Deez_25,2024-07-03T21:46:26,2024,67,What is a race/build you'll never play but love to have as a follower,racebuild youll never play love follower
Skyrim,skyrim,Hot-Purchase9084,2024-07-03T21:47:49,2024,1,"CC not working, i think??",cc working think
Skyrim,skyrim,TheBigGopher,2024-07-03T21:50:30,2024,2,"Help, my compass is gone",help compass gone
Skyrim,skyrim,Get_Back_235,2024-07-03T22:02:57,2024,1,Unearthed Quest Not Working (Dragonborn DLC),unearthed quest working dragonborn dlc
Skyrim,skyrim,ThatOneMexicanMK,2024-07-03T22:39:46,2024,42,I disnt do anything to hadvar but now he follows me and im pretty sure he cant be a companion,disnt anything hadvar follows im pretty sure cant companion
