game,subreddit,author,created_utc,year,score,original_title,cleaned
The Sims,thesims,_bodycatchrose_,2024-07-14T20:49:29,2024,1,Sims 4 Gallery Down?,sims 4 gallery
The Sims,thesims,Ok-Tour7131,2024-07-14T20:50:24,2024,9,"Question: Sims 4 Pet 'ran away', but never left",question sims 4 pet ran away never left
The Sims,thesims,Doom_guy271,2024-07-14T21:27:19,2024,8,What would be the perfect version of Project rene for you,would perfect version project rene
The Sims,thesims,NoizchildJohnson,2024-07-14T21:31:01,2024,1,Rate the Makeover of Connie Nair,rate makeover connie nair
The Sims,thesims,UnicorncreamPi,2024-07-14T21:59:49,2024,2,What do you use the most from the Sims 4 gallery filling town with new npcs or lots?,use sims 4 gallery filling town new npcs lots
The Sims,thesims,valwonteat,2024-07-14T22:24:48,2024,4,my sim's clone won't disappear,sims clone wont disappear
The Sims,thesims,fantoche15-,2024-07-14T22:25:14,2024,1,My first legacy challenge is going crazy so far,first legacy challenge going crazy far
The Sims,thesims,ElegantApplication72,2024-07-14T23:52:13,2024,118,Sim wants to eat dirt?,sim wants eat dirt
The Sims,thesims,YouthInternal1202,2024-07-15T00:53:01,2024,1,Is sims worth playing rn,sims worth playing rn
The Sims,thesims,Environmental-Owl445,2024-07-15T01:03:24,2024,1,what hairstyle should i give her and what name?,hairstyle give name
The Sims,thesims,Scientyyy,2024-07-15T01:18:09,2024,5,Will my sim's husband ever ask to expand the family/have kids?,sims husband ever ask expand familyhave kids
The Sims,thesims,marlowcactus,2024-07-15T01:30:39,2024,217,Does anyone know what this notification is??,anyone know notification
The Sims,thesims,bunnymaevenus,2024-07-15T02:32:22,2024,58,"Decided to build the Broke Family house in the Sims 4! Took a few creative liberties where needed... but I feel like I honored it well! Only CC used was from the BAYSIC set by houseofharlix, HeyHarrie, and felixandresims on Curseforge! (which was just the kitchen counters)",decided build broke family house sims 4 took creative liberties needed feel like honored well cc used baysic set houseofharlix heyharrie felixandresims curseforge kitchen counters
The Sims,thesims,Sidhe_shells,2024-07-15T03:03:55,2024,1,Raise/Lower objects - am I bugged?,raiselower objects bugged
The Sims,thesims,OddSuit7805,2024-07-15T04:20:41,2024,35,Do we think this was intentional when they picked a name for Ms. Crumplebottom?,think intentional picked name ms crumplebottom
The Sims,thesims,Krm4sWrld,2024-07-15T04:34:44,2024,6,Plants are evolving,plants evolving
The Sims,thesims,yellow_ish,2024-07-15T04:38:39,2024,3,Can Sims disappear from family trees in ts4?,sims disappear family trees ts4
The Sims,thesims,Electrical_Complex69,2024-07-15T04:58:58,2024,1,Build mode items not showing up at all,build mode items showing
The Sims,thesims,jordanfahn,2024-07-15T05:02:10,2024,1,New laptop to play Sims4?,new laptop play sims4
The Sims,thesims,LowRestaurant5858,2024-07-15T05:42:49,2024,1,Is it allowed to download custom content for sims 4 in the Netherlands?,allowed download custom content sims 4 netherlands
The Sims,thesims,Elle_Driver_,2024-07-15T06:07:24,2024,6,Pets in sims 3 or 4,pets sims 3 4
The Sims,thesims,Kenners_Sop,2024-07-15T07:34:18,2024,554,Does anyone else wish moving into a new house was a bigger deal?,anyone else wish moving new house bigger deal
The Sims,thesims,Personal-Face7905,2024-07-15T09:20:46,2024,1,Progress From Ugly to Hot : Sim Remake,progress ugly hot sim remake
The Sims,thesims,GoatBoySteve,2024-07-15T10:19:50,2024,3,Editing CC in S4S,editing cc s4s
The Sims,thesims,Cheap_Ad_2237,2024-07-15T13:22:54,2024,3,Help with update?,help update
The Sims,thesims,wasteful_archery,2024-07-15T14:09:31,2024,1,Moving sims folder to external drive -> symbolic path issues,moving sims folder external drive symbolic path issues
The Sims,thesims,Aliciayasminexo,2024-07-15T14:34:10,2024,6,Does anyone know what is causing this?,anyone know causing
The Sims,thesims,JayandMeeka,2024-07-15T15:18:29,2024,3,Um.. What is this hat?,um hat
The Sims,thesims,Various-Pie-4120,2024-07-15T15:39:49,2024,39,Why Are There Blonde Glitchy Streaks In My Sims Hair?,blonde glitchy streaks sims hair
The Sims,thesims,Skinny-and-Weird,2024-07-15T16:12:20,2024,13,"My first sim, her name is Aisha",first sim name aisha
The Sims,thesims,fosforan,2024-07-15T16:26:17,2024,1,So in poland the new pack is cheaper,poland new pack cheaper
The Sims,thesims,sanriobunniii,2024-07-15T16:30:19,2024,1,Lashes in the Sims?,lashes sims
The Sims,thesims,Octaviaaa3,2024-07-15T16:49:20,2024,1,Can’t equip traits through cheats - HELP,can’t equip traits cheats help
The Sims,thesims,jasmiejewelthequeen,2024-07-15T17:31:02,2024,1,all sims travelling together,sims travelling together
The Sims,thesims,PeachAndApricots,2024-07-15T17:38:59,2024,1,What pack is this hairstyle in?,pack hairstyle
The Sims,thesims,Repulsive-Ad-3989,2024-07-15T17:41:53,2024,1,Certain Sim spawns at every lot i visit,certain sim spawns every lot visit
The Sims,thesims,KelleyCos,2024-07-15T18:20:23,2024,1,"When I start The Sims 4, it does not get past the first screen says Application not responding",start sims 4 get past first screen says application responding
The Sims,thesims,greentea1985,2024-07-15T18:49:04,2024,439,Project Rene Cancelled?,project rene cancelled
The Sims,thesims,MadRayneSims,2024-07-15T18:59:32,2024,2,"I updated all flooring from The Urbz: Sims in the City to use the HD Xbox textures! (for The Sims 2, Sims 3 and The Sims 4) I love the wonky look of this game",updated flooring urbz sims city use hd xbox textures sims 2 sims 3 sims 4 love wonky look game
The Sims,thesims,austinlfm,2024-07-15T19:10:14,2024,1,Custom mod request help.,custom mod request help
The Sims,thesims,Electronic-Estate999,2024-07-15T20:00:59,2024,3,Horse cant move at all or walk,horse cant move walk
The Sims,thesims,Extension-Serve7703,2024-07-15T20:28:25,2024,2,"""Have meal"" option not appearing with new game/new Sims (Sims 4).",meal option appearing new gamenew sims sims 4
The Sims,thesims,purpleoctopus769,2024-07-15T20:42:51,2024,1,Why are half of my outfits not showing up?,half outfits showing
The Sims,thesims,Similar_Bridge5218,2024-07-15T20:47:00,2024,1,New Facebook Group for Sims Photography,new facebook group sims photography
The Sims,thesims,trousershark22,2024-07-15T21:01:30,2024,18,"Played for the first time in a while, made a quick build: Carrie's Prom (Hay_Dont_Slip in the gallery)",played first time made quick build carries prom haydontslip gallery
The Sims,thesims,escapedfromeurodark,2024-07-15T22:25:27,2024,2,wanted to place an house and its stuck like this for an hour what can i do i cant lose the progress (mac),wanted place house stuck like hour cant lose progress mac
The Sims,thesims,abbyeet07,2024-07-15T22:26:24,2024,575,What to do when the classes are scheduled at the same time and day?,classes scheduled time day
The Sims,thesims,UpsetEmergency5248,2024-07-15T22:58:59,2024,258,Does anyone remember The Sims 2 Exchange?,anyone remember sims 2 exchange
The Sims,thesims,CrashLightning22,2024-07-15T23:11:05,2024,1,Need help with MySims on PC,need help mysims pc
The Sims,thesims,Secure_Stuff_1678,2024-07-15T23:12:49,2024,8,Why this trees look like this?,trees look like
The Sims,thesims,ZealousidealDrink991,2024-07-15T23:28:36,2024,55,Woohoo ruined a loving relationship,woohoo ruined loving relationship
The Sims,thesims,Environmental-Ad6551,2024-07-15T23:31:17,2024,1,Accidentally bought an expansion on steam but i play on EA. How do i connect the accounts?,accidentally bought expansion steam play ea connect accounts
The Sims,thesims,reptillianclubboy,2024-07-16T00:00:06,2024,1,how to get chefs to show up at owned restaurants?,get chefs show owned restaurants
The Sims,thesims,x0kelssss,2024-07-16T00:10:58,2024,1,How much space will I need ?,much space need
The Sims,thesims,SteviieMoon,2024-07-16T00:35:41,2024,33,Thumbnail for my Sims 4 Let’s Play Series! What y’all think ?,thumbnail sims 4 let’s play series y’all think
The Sims,thesims,Cognizant_Npc,2024-07-16T00:55:50,2024,1,Unrecognized script mod?,unrecognized script mod
The Sims,thesims,ichmichauch,2024-07-16T01:10:58,2024,1,Is there a NoCD patch for 1.0.631?,nocd patch 10631
The Sims,thesims,gorillabootycrack,2024-07-16T01:19:03,2024,40,"""Why yes I have CAS Items, how'd you figure it out?""",yes cas items howd figure
The Sims,thesims,paganism-,2024-07-16T02:10:21,2024,6,why are sims so aggressive,sims aggressive
The Sims,thesims,OverHnurrrr,2024-07-16T02:26:25,2024,1,Console Debug Items,console debug items
The Sims,thesims,SparrowEverlark,2024-07-16T02:27:02,2024,4,"Help, please? I wanna play!",help please wanna play
The Sims,thesims,xbrooke_ashley66x,2024-07-16T03:39:57,2024,471,why is this game so cute? 🥺,game cute
The Sims,thesims,ConfidentAd3638,2024-07-16T05:04:23,2024,18,My teen had enough money to move out into her own home,teen enough money move home
The Sims,thesims,EnvironmentalSite332,2024-07-16T06:35:05,2024,4,Cheats not working???,cheats working
The Sims,thesims,FreshCharity6300,2024-07-16T07:42:59,2024,1,how is this legal to do so?,legal
The Sims,thesims,oph1uchus,2024-07-16T08:39:31,2024,2,Double Fisting Cupcakes,double fisting cupcakes
The Sims,thesims,MissNever22,2024-07-16T10:08:14,2024,3,Good things about Sims 4,good things sims 4
The Sims,thesims,c95Neeman,2024-07-16T12:10:16,2024,37,Please stop setting my house on fire!,please stop setting house fire
The Sims,thesims,bored_mum,2024-07-16T12:50:13,2024,406,"""The Sims 5 has been cancelled suggests developer updates""",sims 5 cancelled suggests developer updates
The Sims,thesims,satchikostar,2024-07-16T14:25:09,2024,3,Why is the fireman doing flirty dance with odd woohoo music?,fireman flirty dance odd woohoo music
The Sims,thesims,Tryingherfuckingbest,2024-07-16T14:25:42,2024,11,8 sims with 1 set of presets,8 sims 1 set presets
The Sims,thesims,ellecoxib,2024-07-16T15:46:40,2024,1,TSM or FreePlay?,tsm freeplay
The Sims,thesims,GabeTomatoes,2024-07-16T15:49:24,2024,494,I did a makeover to the Goth family so they look more like their sims 2 counterparts!!,makeover goth family look like sims 2 counterparts
The Sims,thesims,Mathil2prtr,2024-07-16T16:01:12,2024,1,Well that’s an interesting dream 🤔,well that’s interesting dream
The Sims,thesims,Effective-Mix-4170,2024-07-16T16:50:28,2024,37,Welcome! We're always excited to see you suffer and steal your wallet! 😃💀,welcome always excited see suffer steal wallet
The Sims,thesims,Lucky_Reindeer4037,2024-07-16T17:07:57,2024,1,Is this one of the traits for the new expansion pack?,one traits new expansion pack
The Sims,thesims,quacksrack,2024-07-16T17:17:53,2024,1,MacBook Air playing issues sims 4,macbook air playing issues sims 4
The Sims,thesims,spaghettiwithmeat,2024-07-16T17:32:17,2024,1,Will redownloading the Sims 4 come with all my custom content?,redownloading sims 4 come custom content
The Sims,thesims,ILOVEDOGS3333333,2024-07-16T17:40:11,2024,1,Why won’t my game start?,won’t game start
The Sims,thesims,theh4mburgler,2024-07-16T17:45:53,2024,5,"My sims lose the E-Sports and Soccer ""careers"" every time I open the save",sims lose esports soccer careers every time open save
The Sims,thesims,macy_starmoon,2024-07-16T18:24:41,2024,3,oh no....it takes forever to let the child to forget this moment.,oh noit takes forever let child forget moment
The Sims,thesims,Bloadclaw,2024-07-16T18:29:03,2024,12,I tried turning Grim into a Plant Sim and......,tried turning grim plant sim
The Sims,thesims,Such_Reveal5186,2024-07-16T19:06:21,2024,1,Can't Launch Game. . . help pls,cant launch game help pls
The Sims,thesims,JoeyDG09,2024-07-16T19:44:35,2024,1,How do you play your save file?,play save file
The Sims,thesims,Nice_Crazy_9569,2024-07-16T20:16:02,2024,2,How do I find my Sim ID?,find sim id
The Sims,thesims,nellavxs,2024-07-16T21:13:09,2024,2,Why does my toddler's face look like that?,toddlers face look like
The Sims,thesims,iamgettingaway,2024-07-16T21:22:22,2024,3,NOT THE SIMS ACCOUNT liking😂 I get it tho,sims account liking get tho
The Sims,thesims,paracosim,2024-07-16T21:52:00,2024,97,Here are some of the Sims I've made recently!,sims ive made recently
The Sims,thesims,Gohan111111,2024-07-16T22:01:08,2024,1,Random new items,random new items
The Sims,thesims,Alarming_Ad8074,2024-07-16T22:42:41,2024,1,How long of sims video would watch on YouTube?,long sims video would watch youtube
The Sims,thesims,chatty101,2024-07-16T23:33:07,2024,1,what computers are you using?,computers using
The Sims,thesims,Kyrra_,2024-07-16T23:44:19,2024,1,The select traits menu not showing up. My mods are turned off. How do I fix this?,select traits menu showing mods turned fix
The Sims,thesims,Emotional-Ladder-267,2024-07-17T00:30:28,2024,4,Get to work furniture/clothes messed up,get work furnitureclothes messed
The Sims,thesims,erithequeen43,2024-07-17T01:16:48,2024,1,Which expansion pack is best?,expansion pack best
The Sims,thesims,Either-Candle2651,2024-07-17T01:19:45,2024,1,Help I need to buy  laptop,help need buy laptop
The Sims,thesims,Pochi-Dreams,2024-07-17T01:27:43,2024,30,"Ya'll, I cannot, this baby's just so cute <333",yall cannot babys cute 333
The Sims,thesims,Yelan_Ophelia,2024-07-17T01:39:49,2024,397,Literatly just my extremely glamarous sim,literatly extremely glamarous sim
The Sims,thesims,MarsupialDesperate,2024-07-17T01:48:19,2024,2,Game breaking when removing the floor to my house,game breaking removing floor house
The Sims,thesims,Hannover94,2024-07-17T02:01:46,2024,2,Help Using Platform Tools,help using platform tools
The Sims,thesims,-_Snivy_-,2024-07-17T02:26:50,2024,264,Anybody know what tf is going on here?,anybody know tf going
The Sims,thesims,Revolutionary_Bit437,2024-07-17T02:30:13,2024,1,coulumns and walls misaligned,coulumns walls misaligned
The Sims,thesims,Haunting_Ad_2155,2024-07-17T03:18:10,2024,14,What da hail is da horse doing?,da hail da horse
The Sims,thesims,PT-Redditor,2024-07-17T04:19:23,2024,1,Sims 4: How do you add angst to your stories?,sims 4 add angst stories
The Sims,thesims,Round-Refrigerator99,2024-07-17T04:28:21,2024,1,"Wait, What's going on with Project Rene?",wait whats going project rene
The Sims,thesims,JustTieEmToATree,2024-07-17T05:34:20,2024,12,I think I fixed it.,think fixed
The Sims,thesims,ladulceloca,2024-07-17T05:45:02,2024,1,The Sims 4 is boring and it makes me sad,sims 4 boring makes sad
The Sims,thesims,ThePr0vider,2024-07-17T05:53:43,2024,10,Old sims forum being closed prematurely,old sims forum closed prematurely
The Sims,thesims,Hour_Path7483,2024-07-17T06:17:27,2024,1,Why does the cliff in windenberg look like that?,cliff windenberg look like
The Sims,thesims,Mr_Comedy69,2024-07-17T06:34:49,2024,10,The Sims 3 Mobile [Android],sims 3 mobile android
The Sims,thesims,Marie_DreamN,2024-07-17T06:42:38,2024,62,I just created a bar with a fountain and sims decided to swim in there. Seeking help.,created bar fountain sims decided swim seeking help
The Sims,thesims,_-ollie,2024-07-17T08:15:49,2024,1,how do i get pets? is that only possible with a special pack?,get pets possible special pack
The Sims,thesims,Stlieutenantprincess,2024-07-17T08:58:50,2024,94,What's your unpopular gaming style / opinion?,whats unpopular gaming style opinion
The Sims,thesims,OtakuNinja1311,2024-07-17T09:29:17,2024,24,I made a really pretty Sim 🥺,made really pretty sim
The Sims,thesims,kackaskuckova,2024-07-17T09:39:25,2024,1,some good mineral accessories cc,good mineral accessories cc
The Sims,thesims,gaimxi,2024-07-17T09:44:45,2024,44,The Palm Terrace Apartment Complex,palm terrace apartment complex
The Sims,thesims,CodAnxious7208,2024-07-17T09:52:32,2024,1,MODS THAT I COULD USE,mods could use
The Sims,thesims,iamfarhan_202,2024-07-17T11:51:07,2024,1,Which features from TS2 and TS3 would have been in TS4 and TS5 in the future?,features ts2 ts3 would ts4 ts5 future
The Sims,thesims,AngelTaboo,2024-07-17T11:54:20,2024,2,TS4 / Looking for a specific foot/lower leg slider that allows you to turn the feet inwards or outwards?,ts4 looking specific footlower leg slider allows turn feet inwards outwards
The Sims,thesims,DEADPOOL4LIFE93,2024-07-17T11:56:07,2024,2,Lycanthropy curing and regaining,lycanthropy curing regaining
The Sims,thesims,Key-Hamster3319,2024-07-17T12:11:14,2024,1,"This is stuck in my screen and i cant save my game, any ideas?",stuck screen cant save game ideas
The Sims,thesims,twiyr,2024-07-17T12:19:12,2024,254,Always a treat to go onto the next category in CAS…🥲,always treat go onto next category cas…
The Sims,thesims,Zer0Void_0,2024-07-17T12:31:48,2024,1,My sims won’t listen to some commands,sims won’t listen commands
The Sims,thesims,kaypoauntie,2024-07-17T12:44:22,2024,30,Sims 4 Infant moodlet,sims 4 infant moodlet
The Sims,thesims,elizawhite3276,2024-07-17T13:03:31,2024,1,YouTube Content Opinions!,youtube content opinions
The Sims,thesims,Senior-Cookie6639,2024-07-17T13:36:24,2024,3,Life span on sims 4,life span sims 4
The Sims,thesims,LostKidWonder,2024-07-17T13:53:57,2024,12,What kind of pack or mod makes your sim look like this?,kind pack mod makes sim look like
The Sims,thesims,TheUtopianCat,2024-07-17T14:26:04,2024,1,Fridge pie menu options suddenly disappeared,fridge pie menu options suddenly disappeared
The Sims,thesims,Traditional_Date_620,2024-07-17T14:28:54,2024,1,Where to get the sims,get sims
The Sims,thesims,Sasukeuchiha_420,2024-07-17T15:03:57,2024,1,Recover save files? (Sims 4),recover save files sims 4
The Sims,thesims,Lejnbruh,2024-07-17T15:30:26,2024,3,The game has downloaded a pack and it removed everything,game downloaded pack removed everything
The Sims,thesims,xXCJTheDJXx,2024-07-17T15:50:55,2024,1,Top Half of Sims Disappearing?,top half sims disappearing
The Sims,thesims,RoseOfTheNight4444,2024-07-17T16:10:55,2024,1,The Sims 4 Reboot | Bass Household | Ep. 1 | Part 3 | It's Avi's turn to Transform!,sims 4 reboot bass household ep 1 part 3 avis turn transform
The Sims,thesims,Dazzling-Will2601,2024-07-17T16:20:39,2024,620,I may have locked up the 60 children of my sim in a 3x3 cage🙃,may locked 60 children sim 3x3 cage
The Sims,thesims,MagicSillia,2024-07-17T17:05:36,2024,1,Could someone share a program to locate broken/corrupted CC?,could someone share program locate brokencorrupted cc
The Sims,thesims,Muted_Effect_9680,2024-07-17T17:24:54,2024,1,Can someone help cause this is doing my nut clean in now.,someone help cause nut clean
The Sims,thesims,Kong_Diddy,2024-07-17T17:44:26,2024,1677,I showed The Sims to a guy at work,showed sims guy work
The Sims,thesims,lizzylizzylizzy,2024-07-17T17:47:58,2024,1,Looking for good townie creators on the gallery.,looking good townie creators gallery
The Sims,thesims,darekafukasakara,2024-07-17T18:09:55,2024,1,What things you would like to see as an update to your favorite Sims game?,things would like see update favorite sims game
The Sims,thesims,soot-newt,2024-07-17T18:43:06,2024,1,how do i start again?,start
The Sims,thesims,maraj7x,2024-07-17T19:08:23,2024,7,If I buy sims 4 games on disk can I play without the ea app? Google's not turning up any answers.,buy sims 4 games disk play without ea app googles turning answers
The Sims,thesims,katelynrtonderum,2024-07-17T19:14:56,2024,1,Laundry list updates July 9th,laundry list updates july 9th
The Sims,thesims,kaybae105,2024-07-17T19:52:57,2024,1,THEY CANCELLED SIMS 5?!?,cancelled sims 5
The Sims,thesims,saah8787,2024-07-17T20:00:05,2024,1,Missing features previously on The Sims games,missing features previously sims games
The Sims,thesims,FoxTheWoz69,2024-07-17T20:03:39,2024,1194,Saw this on pinterest and wanted to share as I hadn't even noticed either,saw pinterest wanted share hadnt even noticed either
The Sims,thesims,beachhdogz,2024-07-17T20:25:06,2024,1,Sims 4 mods dont work in the game even tho cc works fine,sims 4 mods dont work game even tho cc works fine
The Sims,thesims,followthetrail_,2024-07-17T20:25:50,2024,1,I'm getting an ssd for extra storage and I have a question...,im getting ssd extra storage question
The Sims,thesims,TinySatanzz,2024-07-17T20:43:39,2024,3,Did They Change Work At Home Tasks?,change work home tasks
The Sims,thesims,sp0okybitvh,2024-07-17T21:09:01,2024,3,looking for sims save files with cc,looking sims save files cc
The Sims,thesims,BreakfastNo9535,2024-07-17T21:15:54,2024,29,how to become my worst self on the Sims?,become worst self sims
The Sims,thesims,Jumpy-Job5196,2024-07-17T21:32:05,2024,1,Why aren't all items available?,arent items available
The Sims,thesims,Bitter-University616,2024-07-17T21:49:55,2024,1,Can someone please bye me the cats and dogs expansion pack for the sims 4 plssssss,someone please bye cats dogs expansion pack sims 4 plssssss
The Sims,thesims,Different-Donut7574,2024-07-17T21:50:40,2024,2,Can Indoor Plants Not Be Sheltered? [Sims 4],indoor plants sheltered sims 4
The Sims,thesims,hey___yoooo,2024-07-17T22:29:36,2024,1,"Please, help me with this moodlet issue(check the pic below)",please help moodlet issuecheck pic
The Sims,thesims,morwannneg,2024-07-17T22:45:24,2024,21,spill your lore! what game are you currently playing and how it's going?,spill lore game currently playing going
The Sims,thesims,the_storm_shit,2024-07-17T23:04:13,2024,1,Cas Relationship not showing for sims with adult children,cas relationship showing sims adult children
The Sims,thesims,emojksofficalplug,2024-07-17T23:19:22,2024,2,ong i hate this game,ong hate game
The Sims,thesims,ZK_247,2024-07-17T23:32:57,2024,1,Can’t install my game,can’t install game
The Sims,thesims,Beneficial-Quail3035,2024-07-18T00:24:08,2024,6,How can i stop the waste manager from coming to my house?,stop waste manager coming house
The Sims,thesims,VestigialRage,2024-07-18T01:22:03,2024,817,TSR is definitely shady nowadays,tsr definitely shady nowadays
The Sims,thesims,Rikusgirl1,2024-07-18T01:46:34,2024,8,"Put pet up for adoption, but the game claims they were taken away due to neglect?",put pet adoption game claims taken away due neglect
The Sims,thesims,Iamnotakoreabo27,2024-07-18T01:52:56,2024,2,"My saved game won't load, it just stays on the load screen",saved game wont load stays load screen
The Sims,thesims,Huge-Plane-3206,2024-07-18T02:30:49,2024,5,Any way to view NPC Roles?,way view npc roles
The Sims,thesims,Loveagoodkeekee,2024-07-18T04:52:17,2024,9,Please Help!!!!😩,please help
The Sims,thesims,Short-Street-2169,2024-07-18T04:54:36,2024,3,My Sim 4 Twins 🤍,sim 4 twins
The Sims,thesims,blueshyperson,2024-07-18T05:12:51,2024,19,The sim of my sleazy punk rock dude dreams 😍,sim sleazy punk rock dude dreams
The Sims,thesims,WxtchTrialz0104,2024-07-18T05:12:51,2024,51,I DON’T UNDERSTAND,don’t understand
The Sims,thesims,fullsunni,2024-07-18T05:21:24,2024,3,sims coming home from work/school early,sims coming home workschool early
The Sims,thesims,norepinephrinebby,2024-07-18T05:39:05,2024,1,"New to sims, kinda confused",new sims kinda confused
The Sims,thesims,Arturr67,2024-07-18T07:52:11,2024,27,I miss the challenge from older Sims games...,miss challenge older sims games
The Sims,thesims,Ornery-Ad-2012,2024-07-18T08:12:55,2024,2,Can I merge sims 4 accounts,merge sims 4 accounts
The Sims,thesims,OrientalMadman,2024-07-18T09:56:42,2024,9,How do I fix my Spellcaster turning into a Werewolf?,fix spellcaster turning werewolf
The Sims,thesims,Anya12088,2024-07-18T10:31:54,2024,1,Best laptop that’s affordable for the sims ?,best laptop that’s affordable sims
The Sims,thesims,SammyCatLove,2024-07-18T10:40:20,2024,1,Nice find the sims 3 starter pack.,nice find sims 3 starter pack
The Sims,thesims,Sad-Contact9580,2024-07-18T11:29:36,2024,2,Bug in transferring money to business,bug transferring money business
The Sims,thesims,VisibleAnteater1359,2024-07-18T12:22:14,2024,1,Can’t download from TSR,can’t download tsr
The Sims,thesims,Reddydaddy22,2024-07-18T12:35:14,2024,23,When mum makes food,mum makes food
The Sims,thesims,oceanights,2024-07-18T12:48:07,2024,1,Separating TS4 files with two EA accounts on one PC,separating ts4 files two ea accounts one pc
The Sims,thesims,pemmycat0204,2024-07-18T13:19:30,2024,1,Which expansion pack?: High school years or Horse Ranch,expansion pack high school years horse ranch
The Sims,thesims,Anazura,2024-07-18T14:30:13,2024,14,I've been really inspired recently and have created a lovely bunch of no cc/defaults Lovestruck singles that I'm quite pleased with and deem worth sharing.,ive really inspired recently created lovely bunch ccdefaults lovestruck singles im quite pleased deem worth sharing
The Sims,thesims,Alarmed-Bluejay-1900,2024-07-18T14:36:17,2024,132,Found my fav sims game again,found fav sims game
The Sims,thesims,kiraneurysm,2024-07-18T14:43:25,2024,1,Help with CC mods,help cc mods
The Sims,thesims,milfad_1205,2024-07-18T14:58:52,2024,1,Sims 5 Cancelled,sims 5 cancelled
The Sims,thesims,Weird-Bug-5086,2024-07-18T15:25:45,2024,1,Youth brigade/No school,youth brigadeno school
The Sims,thesims,cleanmahlungs,2024-07-18T15:53:35,2024,1,TwistedMexi's BetterBuildBuy Does. Not. Work.,twistedmexis betterbuildbuy work
The Sims,thesims,BahaMama10,2024-07-18T16:28:21,2024,6,New Player Question,new player question
The Sims,thesims,its10pm,2024-07-18T16:38:48,2024,639,Is this possible (floor plan)?,possible floor plan
The Sims,thesims,Ok_Amoeba8969,2024-07-18T17:20:59,2024,2,Mods for different eye shapes? for sims 4,mods different eye shapes sims 4
The Sims,thesims,SimSlayerr,2024-07-18T17:27:20,2024,1,"Immaculate conception? The second coming of Jesus, Jolene.",immaculate conception second coming jesus jolene
The Sims,thesims,SEAF00D_N00DLE,2024-07-18T17:36:48,2024,6,For the person who suggested Tyler royal for one of my sims' names and I said it didn't fit i loved the name sm so here is my version,person suggested tyler royal one sims names said didnt fit loved name sm version
