game,subreddit,author,created_utc,year,score,original_title,cleaned
The Sims,thesims,jeyjeybink,2024-07-01T00:04:47,2024,1,I built the Brooklyn nine-nine Precinct on the Sims 4 👮🏾‍♂️,built brooklyn ninenine precinct sims 4
The Sims,thesims,Admirable_Trust_3642,2024-07-01T00:08:42,2024,1,Disappearing traits in CAS,disappearing traits cas
The Sims,thesims,qarlings,2024-07-01T00:13:50,2024,1,Tiny town help!,tiny town help
The Sims,thesims,nonibluejay,2024-07-01T00:14:19,2024,44,Just wanted to show her off,wanted show
The Sims,thesims,IdiotGoddess,2024-07-01T00:39:53,2024,1,I somehow made two new OCs based on these two.,somehow made two new ocs based two
The Sims,thesims,ilJessicali,2024-07-01T00:45:43,2024,1,Kissing Booth for Sims 4,kissing booth sims 4
The Sims,thesims,caitie83,2024-07-01T01:52:21,2024,3,Game Causing Issues,game causing issues
The Sims,thesims,ConsciousWindow4591,2024-07-01T02:09:40,2024,2,"Why do my sims move while ""waiting for photographer""?",sims move waiting photographer
The Sims,thesims,MissMunkii,2024-07-01T02:54:37,2024,2,TS2 & TS3 won’t play,ts2 ts3 won’t play
The Sims,thesims,Queasy_Owl_8492,2024-07-01T03:17:26,2024,1,is anyone else not getting charged rent?,anyone else getting charged rent
The Sims,thesims,elevatorscreamer,2024-07-01T03:24:06,2024,824,Why is my sim’s beanie….like…this..?,sim’s beanie…like…this
The Sims,thesims,One_Condition7986,2024-07-01T03:57:53,2024,7,a gift to everyone,gift everyone
The Sims,thesims,pastdivision,2024-07-01T04:13:18,2024,8,Rotating between two sims with the Strangerville Mystery aspiration so of course I had to recreate this meme,rotating two sims strangerville mystery aspiration course recreate meme
The Sims,thesims,strawberryshortycake,2024-07-01T04:55:31,2024,1,Caption this image,caption image
The Sims,thesims,FFroggged,2024-07-01T05:01:00,2024,1,The difference between TS4 and the only other game I have on steam,difference ts4 game steam
The Sims,thesims,Fluffy_Mortgage_6831,2024-07-01T05:18:43,2024,235,What is going on with my demon baby??😭,going demon baby
The Sims,thesims,ReceptionWeak1345,2024-07-01T05:21:20,2024,20,ugly career outfit,ugly career outfit
The Sims,thesims,BlakeGame,2024-07-01T05:33:11,2024,1,Turns out there are still hidden phone call message boxes waiting to be discovered.,turns still hidden phone call message boxes waiting discovered
The Sims,thesims,Shadow25_LesbianMess,2024-07-01T05:46:31,2024,1,Anyone else getting these weird lines?,anyone else getting weird lines
The Sims,thesims,last-miss,2024-07-01T06:02:07,2024,1,Does anyone know of eyelash remover cc besides Kijiko?,anyone know eyelash remover cc besides kijiko
The Sims,thesims,Mekati3me,2024-07-01T06:07:24,2024,1,Just the End of a Sims Highschool Day,end sims highschool day
The Sims,thesims,Kittykatxx9,2024-07-01T07:07:00,2024,12,Just an ordinary day at the haunted house,ordinary day haunted house
The Sims,thesims,pengmeddie,2024-07-01T07:13:03,2024,2,What are your thoughts on all the broken packs?,thoughts broken packs
The Sims,thesims,trblsims,2024-07-01T08:03:04,2024,551,todays list of reasons TS4 pissed me off,todays list reasons ts4 pissed
The Sims,thesims,InterviewLeast2278,2024-07-01T08:17:59,2024,56,"Ugh, I just love these 2 and their home so much",ugh love 2 home much
The Sims,thesims,wtfishappening-77,2024-07-01T08:48:23,2024,1,so I got a lot of packs and kits but whenever I try to use them in the game it says that it isnt installed or on top of it download to use and I cannot find how to start downloading them pls pls help,got lot packs kits whenever try use game says isnt installed top download use cannot find start downloading pls pls help
The Sims,thesims,Hookup_Tonight_9200,2024-07-01T10:10:58,2024,1,I’m looking for matured Minded people,i’m looking matured minded people
The Sims,thesims,dogtoebeans101,2024-07-01T10:13:04,2024,1,Is it possible to put everything onto a USB stick?,possible put everything onto usb stick
The Sims,thesims,Safe-Pension1901,2024-07-01T10:16:19,2024,1,I need help with building,need help building
The Sims,thesims,Content_Call5083,2024-07-01T11:28:40,2024,5,NSB (Straud Legacy) Gen 9 Ep. 105: Moving On and Moving In,nsb straud legacy gen 9 ep 105 moving moving
The Sims,thesims,out_of_this_world814,2024-07-01T11:35:42,2024,4,I didnt know this,didnt know
The Sims,thesims,help_I_got_isekaid_,2024-07-01T11:36:42,2024,47,"Uhh Penny iv'e been leaving you to do whatever you want, are you okay?",uhh penny ive leaving whatever want okay
The Sims,thesims,just-jotaro,2024-07-01T12:00:35,2024,2,How do i activate cheats at my PS4?,activate cheats ps4
The Sims,thesims,_FluffyDoughh,2024-07-01T12:10:47,2024,6,Can someone suggest a good name for her?,someone suggest good name
The Sims,thesims,MaybeIneffable,2024-07-01T12:13:24,2024,1,Sims 3 cds in another language,sims 3 cds another language
The Sims,thesims,Own_Quiet_5337,2024-07-01T13:16:49,2024,1,How to delete save files that you download from creators?,delete save files download creators
The Sims,thesims,Solid-Station6070,2024-07-01T13:42:40,2024,1,Pictures of people,pictures people
The Sims,thesims,Sillybumblebee33,2024-07-01T13:56:41,2024,1,roofing abnormal shapes,roofing abnormal shapes
The Sims,thesims,greta12465,2024-07-01T14:15:03,2024,2659,If EA added burglars to the sims 4:,ea added burglars sims 4
The Sims,thesims,Popular-Hornet-6294,2024-07-01T14:29:46,2024,12,"God, how terrible. This is what the kids are watching, lol.",god terrible kids watching lol
The Sims,thesims,Zealousideal_Dot6785,2024-07-01T15:10:28,2024,292,My baby seems to be growing up wrong...,baby seems growing wrong
The Sims,thesims,Puzzleheaded-Line372,2024-07-01T15:13:22,2024,66,Arrogant cat sits wherever he wants),arrogant cat sits wherever wants
The Sims,thesims,DeadgirlRot,2024-07-01T15:15:50,2024,1,"Weird bug, or feature?",weird bug feature
The Sims,thesims,theneighborchick,2024-07-01T15:17:45,2024,5,What is in the sky in San Sequoia?,sky san sequoia
The Sims,thesims,East_Boysenberry_595,2024-07-01T15:34:45,2024,1,Bumpers won't cycle through,bumpers wont cycle
The Sims,thesims,KkooladeStream,2024-07-01T15:53:58,2024,8,I Built an AroAce House for Pride Month! 🧡💛🤍🩵💙- No CC,built aroace house pride month cc
The Sims,thesims,livingdeadbratzgirl,2024-07-01T15:55:16,2024,50,What CAS features would you want in your ideal sims game?,cas features would want ideal sims game
The Sims,thesims,WorldlyAd7514,2024-07-01T16:06:53,2024,1,Is this a good pc to run sims 4? Plus cc,good pc run sims 4 plus cc
The Sims,thesims,outseong,2024-07-01T16:35:33,2024,1,my sims couple ♡,sims couple ♡
The Sims,thesims,yuriwk565,2024-07-01T16:39:10,2024,1,I’ve lost my Sims high school homework and I can’t find it. What do I do?,i’ve lost sims high school homework can’t find
The Sims,thesims,Echolot120,2024-07-01T16:48:57,2024,4,Wcif these two hairs?,wcif two hairs
The Sims,thesims,CommentMedical7218,2024-07-01T16:53:10,2024,1,my sims game wont open,sims game wont open
The Sims,thesims,MarzipanNo3989,2024-07-01T17:03:51,2024,1,Why was my SIM rejected from all uni courses,sim rejected uni courses
The Sims,thesims,uraverageshrimp,2024-07-01T17:23:36,2024,8,My sims keep getting moodlets for traits they don't have,sims keep getting moodlets traits dont
The Sims,thesims,melhacgllr88,2024-07-01T17:43:24,2024,2,why is this happenning,happenning
The Sims,thesims,tristynxo,2024-07-01T17:53:13,2024,1,Messed up installing lighting mod,messed installing lighting mod
The Sims,thesims,cultistgf,2024-07-01T18:44:20,2024,1,Just Downloaded This.. Now what?,downloaded
The Sims,thesims,mibi1kenobi,2024-07-01T18:45:35,2024,24,"Siobhan, Sofia and Luna makeovers",siobhan sofia luna makeovers
The Sims,thesims,goldels,2024-07-01T18:58:11,2024,1,When i can watch my sims forever...,watch sims forever
The Sims,thesims,Green_Narwhal_1241,2024-07-01T19:04:30,2024,1,Help! I can't launch my game,help cant launch game
The Sims,thesims,flipping_lauren,2024-07-01T19:16:02,2024,1,the death of a sim,death sim
The Sims,thesims,ispep11,2024-07-01T19:28:57,2024,1,Help with building my house,help building house
The Sims,thesims,simmer1114,2024-07-01T19:43:16,2024,1,Sims 4 new free update,sims 4 new free update
The Sims,thesims,babyxaryy,2024-07-01T19:52:27,2024,153,my sim is lowkey serving here,sim lowkey serving
The Sims,thesims,Famous-Reputation-10,2024-07-01T20:11:48,2024,2,Can anybody help me with this?,anybody help
The Sims,thesims,Thin-Palpitation-643,2024-07-01T20:56:59,2024,1,"Actions taking too long to be ""registered""",actions taking long registered
The Sims,thesims,myhoneypup,2024-07-01T21:33:26,2024,3,What is this outfit about?,outfit
The Sims,thesims,LWeezyy1,2024-07-01T21:45:34,2024,40,I survived planning TWO weddings back 2 back ... does that make me unstoppable?,survived planning two weddings back 2 back make unstoppable
The Sims,thesims,Dasinel,2024-07-01T22:10:11,2024,2,Why do traits not change overtime,traits change overtime
The Sims,thesims,SmeargKing,2024-07-01T22:52:59,2024,1,Advice on roofs and bb.moveobjects on?,advice roofs bbmoveobjects
The Sims,thesims,LittyKittyKat,2024-07-01T23:30:22,2024,1,Do I Need The HQ Mod To Make Sims 4 Stories?,need hq mod make sims 4 stories
The Sims,thesims,Icy_Physics_8776,2024-07-02T00:12:09,2024,2,Why does this happen everytime?,happen everytime
The Sims,thesims,Due_Excitement2100,2024-07-02T00:29:40,2024,1,"UPDATE: Rory, her wife and their daughter",update rory wife daughter
The Sims,thesims,DeliciousArtist5119,2024-07-02T01:07:48,2024,2,sims glitches and it’s driving me crazyyy,sims glitches it’s driving crazyyy
The Sims,thesims,Ok_Earth_1844,2024-07-02T01:09:25,2024,2,Sending multiple households to school,sending multiple households school
The Sims,thesims,ShouRonbou,2024-07-02T01:21:25,2024,2,"Honest Opinions, what do you think?",honest opinions think
The Sims,thesims,Powerful-Policy8387,2024-07-02T01:40:01,2024,1,Can i buy packs from the EA store for my play station?,buy packs ea store play station
The Sims,thesims,Calisto1717,2024-07-02T01:40:34,2024,6,How do I use MCCC to stop a Sim from continuing to get pregnant?,use mccc stop sim continuing get pregnant
The Sims,thesims,Sea-Chard553,2024-07-02T02:09:43,2024,459,I accidentally used *Destroy objects* on one of the dorm's buildings of discover university. Does anyone know how to get it back?,accidentally used destroy objects one dorms buildings discover university anyone know get back
The Sims,thesims,souptowel,2024-07-02T02:21:04,2024,12,"Had an idea for a futuristic laboratory home, but I'm struggling with the interior layout. Any suggestions?",idea futuristic laboratory home im struggling interior layout suggestions
The Sims,thesims,JasminEve25,2024-07-02T02:34:32,2024,5,Are there any Filipino townies?,filipino townies
The Sims,thesims,decswifey,2024-07-02T03:58:07,2024,1,I have a Question,question
The Sims,thesims,redtitanjr,2024-07-02T04:17:33,2024,1,Copypasto changes?,copypasto changes
The Sims,thesims,swytchooks,2024-07-02T04:43:30,2024,1,when i say match my freak this is what i mean,say match freak mean
The Sims,thesims,clerifiks,2024-07-02T04:49:25,2024,1,Is it possible to use 2 EA accounts for 1 Sims 4 game?,possible use 2 ea accounts 1 sims 4 game
The Sims,thesims,Radiant_Juice_155,2024-07-02T04:51:52,2024,3,‘Can’t run TS4 with the video card in this system’,‘can’t run ts4 video card system’
The Sims,thesims,Ok-Investigator6128,2024-07-02T05:05:02,2024,1,Just fell down the rabbit hole of watching sims 4 love stories on YouTube. Any recs?,fell rabbit hole watching sims 4 love stories youtube recs
The Sims,thesims,michberk,2024-07-02T05:30:01,2024,58,Why aren’t there Sims games for Nintendo Switch?,aren’t sims games nintendo switch
The Sims,thesims,LuckyWish1,2024-07-02T06:02:30,2024,1,How do I remove this?,remove
The Sims,thesims,Upset-Ad7882,2024-07-02T07:17:15,2024,34,The Akiyama family has just recently moved into their new house BUT it's rumored that the house is haunted...,akiyama family recently moved new house rumored house haunted
The Sims,thesims,Empty-Permission9807,2024-07-02T07:36:02,2024,1,Sunrise Shores Save Overview,sunrise shores save overview
The Sims,thesims,zzie09,2024-07-02T08:52:18,2024,1,Vampire or not??,vampire
The Sims,thesims,iluvkyroo,2024-07-02T09:41:54,2024,2,"Why isn't the ""Load game"" ""New Game"" showing on my screen? And also, how do you recover them?",isnt load game new game showing screen also recover
The Sims,thesims,Careless_Reflections,2024-07-02T09:56:55,2024,1,Considering purchasing sims 3 now that it is on sale,considering purchasing sims 3 sale
The Sims,thesims,Pilvus,2024-07-02T10:02:14,2024,9,Tiny Town Challenge - Extra tasks,tiny town challenge extra tasks
The Sims,thesims,charlesevee,2024-07-02T10:26:21,2024,8,What are your favorite problematic household dynamics/stories to play?,favorite problematic household dynamicsstories play
The Sims,thesims,Dottboy19,2024-07-02T10:31:27,2024,3,For anyone having corrupted lots - error message/infinite load. Possible workaround,anyone corrupted lots error messageinfinite load possible workaround
The Sims,thesims,National_Laugh5929,2024-07-02T11:03:48,2024,47,I wanted to share my recent rental build. :),wanted share recent rental build
The Sims,thesims,Impossible-sims-420,2024-07-02T11:59:40,2024,1,EA App issues WINDOWS,ea app issues windows
The Sims,thesims,tinysparrowsims,2024-07-02T12:38:53,2024,15,Hillside Bistro EA ID TinySparrowSims,hillside bistro ea id tinysparrowsims
The Sims,thesims,Awa022709,2024-07-02T13:06:00,2024,53,Billboards that i made,billboards made
The Sims,thesims,root_mse,2024-07-02T13:15:24,2024,105,TIL there’s a exclusive Legally Blonde sim for The Sims 1,til there’s exclusive legally blonde sim sims 1
The Sims,thesims,Present_Mine6058,2024-07-02T14:24:54,2024,1,TS3 Downloaded lots not showing up in town edit,ts3 downloaded lots showing town edit
The Sims,thesims,Healthy-Ad964,2024-07-02T14:56:12,2024,1,How to disable/Remove Shadows in The Sims 4?,disableremove shadows sims 4
The Sims,thesims,x-lyssa-x,2024-07-02T15:15:58,2024,1,I need help with for the for rent pack,need help rent pack
The Sims,thesims,TheBigJayAgenda,2024-07-02T15:32:06,2024,9,What is my sim doing?? It doesn't appear in her action area.,sim doesnt appear action area
The Sims,thesims,hanka-_-,2024-07-02T15:35:55,2024,3,Can anyone help me?,anyone help
The Sims,thesims,Wuiginuke,2024-07-02T15:43:32,2024,140,Guess which dumbass lost 9 hours of sims building,guess dumbass lost 9 hours sims building
The Sims,thesims,jona28d,2024-07-02T15:54:50,2024,187,New Daily Rewards,new daily rewards
The Sims,thesims,recentarchives,2024-07-02T15:58:02,2024,1,Can't run the sims 4 with the video card in this system.,cant run sims 4 video card system
The Sims,thesims,Rujapa,2024-07-02T16:17:12,2024,48,Household can’t sleep anymore!,household can’t sleep anymore
The Sims,thesims,Cipher-_-_-,2024-07-02T16:24:10,2024,1,Does anyone know why the Sims 4 keeps randomly closing and causing me to lose all progress?,anyone know sims 4 keeps randomly closing causing lose progress
The Sims,thesims,zmeya_147,2024-07-02T17:22:53,2024,2,what are some mods you have that enhance the game experience?,mods enhance game experience
The Sims,thesims,No-Consequence-9962,2024-07-02T17:56:02,2024,2,Sims house fire but no fire,sims house fire fire
The Sims,thesims,lattekosmiko,2024-07-02T18:16:34,2024,57,"Today I found out that if you download a lot from the gallery - built with some EP/GP/SP/Kit - and then click on any pack's icon used for creating it, you can see which specific items from that pack is present in that lot.",today found download lot gallery built epgpspkit click packs icon used creating see specific items pack present lot
The Sims,thesims,Manchester_Buses,2024-07-02T19:31:56,2024,6,So someone ported the entire sims bustin out Console sets to the sims 2 PC,someone ported entire sims bustin console sets sims 2 pc
The Sims,thesims,tismonthebrain,2024-07-02T19:32:52,2024,5,"Cat stepped on my keyboard somehow completely changing the resolution, help needed",cat stepped keyboard somehow completely changing resolution help needed
The Sims,thesims,CutieRandom,2024-07-02T19:37:42,2024,461,So I Made Every CPU From Wii Sports and Wii Sports Resort In The Sims,made every cpu wii sports wii sports resort sims
The Sims,thesims,Bouldercrestbaby_6,2024-07-02T19:50:01,2024,17,I can never leave my sim self alone for too long 🥴🥴,never leave sim self alone long
The Sims,thesims,TheEndowedPenguin,2024-07-02T20:10:43,2024,14,Can someone make out the user name that built this house? Its too blurry for me to read. I wanna download it in my game but im unable to find it on the gallery.,someone make user name built house blurry read wanna download game im unable find gallery
The Sims,thesims,Independent_Feed_617,2024-07-02T20:39:56,2024,2,Help! I just installed the game after a windows reinstallation and…,help installed game windows reinstallation and…
The Sims,thesims,Squids_Arts,2024-07-02T21:22:18,2024,24,Ztipo’s Sim character Elaine!,ztipo’s sim character elaine
The Sims,thesims,-pr3tty_st4r_b0y-,2024-07-02T21:32:29,2024,1,What laptops can run the sims 4?,laptops run sims 4
The Sims,thesims,salsacreated,2024-07-02T22:03:04,2024,1,Help!! OG Sims 4 bug still makes the game impossible as a rotational player. Does the MCCC or another mod fix this issue? Unactive sims do not work or go to school.,help og sims 4 bug still makes game impossible rotational player mccc another mod fix issue unactive sims work go school
The Sims,thesims,Ayavaxoxo,2024-07-02T23:02:15,2024,7,my sims have the height difference we deserve,sims height difference deserve
The Sims,thesims,Tiny-Assignment-1779,2024-07-02T23:04:20,2024,96,Pov: you are playing a regular legacy challenge but decide to dress up the prior gens like their royal portraits,pov playing regular legacy challenge decide dress prior gens like royal portraits
The Sims,thesims,FudgeWitty5659,2024-07-02T23:18:13,2024,1,Sims 4 expansions not downloading,sims 4 expansions downloading
The Sims,thesims,evilkitten03,2024-07-02T23:44:36,2024,1,How do you make Sims interesting and not too samey?,make sims interesting samey
The Sims,thesims,bakerbat,2024-07-02T23:52:35,2024,179,When two gregarious sims meet on a convival lot,two gregarious sims meet convival lot
The Sims,thesims,SimpleCorrect5999,2024-07-03T00:08:15,2024,1,Guys help please!!!,guys help please
The Sims,thesims,CatRosalina,2024-07-03T00:31:33,2024,8,How To Easily Get Every Death in The Sims 4 [GUIDE],easily get every death sims 4 guide
The Sims,thesims,dawnducks,2024-07-03T00:38:39,2024,27,Suggestions on moving multiple rooms at once?,suggestions moving multiple rooms
The Sims,thesims,MissFlawlessIB,2024-07-03T01:05:12,2024,8,Showing off a couple of my sims,showing couple sims
The Sims,thesims,cyberch1ck,2024-07-03T02:16:25,2024,5,'Life-altering' phone calls for played households even though neighborhood stories off?,lifealtering phone calls played households even though neighborhood stories
The Sims,thesims,Fancy-Boysenberry139,2024-07-03T02:31:26,2024,38,anyone know how i can get rid of the Animal crate?,anyone know get rid animal crate
The Sims,thesims,boba-is-depressing,2024-07-03T02:41:34,2024,1,is there a good default skin cc that doesn’t change any facial features?,good default skin cc doesn’t change facial features
The Sims,thesims,AnimeMoon13,2024-07-03T03:13:28,2024,3,I made a few X-Men characters,made xmen characters
The Sims,thesims,Big_Team2746,2024-07-03T03:30:51,2024,1,Guys please help,guys please help
The Sims,thesims,i__hate__stairs,2024-07-03T04:47:13,2024,2,"Ea+ version, cloud save is gone?",ea version cloud save gone
The Sims,thesims,Financial_Ad_4328,2024-07-03T05:29:12,2024,1,Baby #3 is due any day now 😍,baby 3 due day
The Sims,thesims,Pretend-Set7802,2024-07-03T06:37:06,2024,3,Does anyone have this skin and eye preset?,anyone skin eye preset
The Sims,thesims,pinknight2000,2024-07-03T07:05:36,2024,1,Should I buy these packs? I need your honest reviews,buy packs need honest reviews
The Sims,thesims,Pretty-Weird-1722,2024-07-03T08:56:19,2024,1,toddler quirks not appearing?,toddler quirks appearing
The Sims,thesims,ImperatorAntonius,2024-07-03T10:40:29,2024,3,Does My Wedding Stories Work Now?,wedding stories work
The Sims,thesims,AmbushedMush,2024-07-03T11:12:52,2024,47,The Fish-Boat House (No CC),fishboat house cc
The Sims,thesims,Remote_Magician_1875,2024-07-03T11:32:54,2024,1,Mods for steam version not working,mods steam version working
The Sims,thesims,lurrur,2024-07-03T11:47:48,2024,1,"thanks game, very helpful",thanks game helpful
The Sims,thesims,Critical-Knowledge68,2024-07-03T12:22:30,2024,1,Streaming The Sims,streaming sims
The Sims,thesims,Jewbacca1185,2024-07-03T12:26:43,2024,1,Where’s all the stuff in the PS Gallery?,where’s stuff ps gallery
The Sims,thesims,washingtonpost,2024-07-03T13:23:04,2024,6,See how The Sims helped these players change their real lives,see sims helped players change real lives
The Sims,thesims,EmuPuzzleheaded5720,2024-07-03T14:07:10,2024,1,What sims 4 challenge should i do?,sims 4 challenge
The Sims,thesims,_helena_p,2024-07-03T14:07:53,2024,1,What causes that?,causes
The Sims,thesims,bloodyk1dneys,2024-07-03T14:24:07,2024,1,my ea app doesn’t have any games???,ea app doesn’t games
The Sims,thesims,Bebetthy,2024-07-03T14:24:55,2024,1,Traits not showing up on cas.,traits showing cas
The Sims,thesims,HThandi1985,2024-07-03T14:28:37,2024,10,Roll For Sims sheet,roll sims sheet
The Sims,thesims,Working-Spread-9866,2024-07-03T15:04:28,2024,1,What name should we give him?,name give
The Sims,thesims,WittyNameOrSomething,2024-07-03T15:09:58,2024,6,Renting out the plot you own?,renting plot
The Sims,thesims,Melodic_elf2580,2024-07-03T15:58:30,2024,1,Favorite cc Creators for the sims 4,favorite cc creators sims 4
The Sims,thesims,LurkingTulip,2024-07-03T16:00:11,2024,1,Has the Sims 4 online/offline mode bs finally been resolved?,sims 4 onlineoffline mode bs finally resolved
The Sims,thesims,Consistent_Ad_2093,2024-07-03T16:41:51,2024,7,Help to find a heart frog??,help find heart frog
The Sims,thesims,Warm-Dot3563,2024-07-03T16:52:42,2024,1,When i click on windows key my game won't go to the home screen,click windows key game wont go home screen
The Sims,thesims,AdditionalIncome6,2024-07-03T16:55:17,2024,2,am i the only one experiencing lots of bugs?,one experiencing lots bugs
The Sims,thesims,valencia_moon,2024-07-03T17:23:26,2024,1,Thoughts on Sims DLCs - What I Love and Don't Love,thoughts sims dlcs love dont love
The Sims,thesims,FarCelebration8819,2024-07-03T17:42:10,2024,1,how do i get a sim that i downloaded on patroon into my game after adding it to mods?,get sim downloaded patroon game adding mods
The Sims,thesims,illusionofjoy,2024-07-03T18:04:51,2024,1,See how The Sims helped these players change their real lives,see sims helped players change real lives
The Sims,thesims,glasscat33,2024-07-03T18:17:25,2024,14,The pets in this neighbourhood need to calm down with these gifts...,pets neighbourhood need calm gifts
The Sims,thesims,Supergirl_25,2024-07-03T18:53:33,2024,1,Sitycims YouTube,sitycims youtube
The Sims,thesims,Any_Income_9683,2024-07-03T19:45:41,2024,1,Where is the online gallery?,online gallery
The Sims,thesims,cockroachesmilk,2024-07-03T19:46:24,2024,1109,What's stopping my sims from both getting into bed at the same time? I can't figure it out :P,whats stopping sims getting bed time cant figure p
The Sims,thesims,Sunmoonstone,2024-07-03T20:15:29,2024,274,"Does it happen to anyone else that when you put clothes on your sims, the physique changes?",happen anyone else put clothes sims physique changes
The Sims,thesims,Used-Media7539,2024-07-03T20:33:43,2024,2,14th of June update,14th june update
The Sims,thesims,autumn-dancing,2024-07-03T20:42:26,2024,1,I want my money back,want money back
The Sims,thesims,Sensitive_Most_1383,2024-07-03T20:51:03,2024,189,"My Sims holy grail: in 2014 EA said anyone who messaged support and proved they had a copy of TS2 got a free digital copy of the ultimate collection. In 2017 I sent support a photo of a copy of a TS2 EP I had gotten for $1 at Goodwill, and they honored their offer still.",sims holy grail 2014 ea said anyone messaged support proved copy ts2 got free digital copy ultimate collection 2017 sent support photo copy ts2 ep gotten 1 goodwill honored offer still
The Sims,thesims,Juicy_jay321,2024-07-03T21:09:09,2024,41,anger. nothing but anger.,anger nothing anger
The Sims,thesims,ACVgames,2024-07-03T21:11:35,2024,6,I made a speedbuild of a tiny cottage by a lake!,made speedbuild tiny cottage lake
The Sims,thesims,HeyItsChrishy,2024-07-03T21:19:17,2024,1,How to make the « wedding »gameplay interesting ?,make « wedding »gameplay interesting
The Sims,thesims,spookiglam,2024-07-03T21:33:45,2024,6,Any idea why my sims hate each other?,idea sims hate
The Sims,thesims,Peter-Spering,2024-07-03T21:52:02,2024,12,The den under the stairs...,den stairs
The Sims,thesims,StorytellerElla,2024-07-03T22:24:09,2024,79,A Wedding A Honeymoon And Soon To Be New Parents!,wedding honeymoon soon new parents
The Sims,thesims,tfoul21,2024-07-03T22:28:59,2024,1,I need help with the interior layout of my sim’s house.,need help interior layout sim’s house
The Sims,thesims,UsernamesPressureMe,2024-07-03T23:04:37,2024,2,"Hi! I got a work around to get the sims practice makes perfect trait for anyone who missed the event. Idk how to upload directly videos here so I put it on yt. In the description there's also a link to get the objects, all free!",hi got work around get sims practice makes perfect trait anyone missed event idk upload directly videos put yt description theres also link get objects free
The Sims,thesims,timebombinyourhead,2024-07-03T23:38:16,2024,4,is there a better way to find broken cc,better way find broken cc
