game,subreddit,author,created_utc,year,score,original_title,cleaned
The Sims,thesims,yrbam,2024-07-07T18:20:40,2024,19,small feature you want added?,small feature want added
The Sims,thesims,TamadoSalad,2024-07-07T18:21:53,2024,5,My sim randomly got possessed by the spirit of a middle aged business man.,sim randomly got possessed spirit middle aged business man
The Sims,thesims,milystrix,2024-07-07T18:39:19,2024,60,Oh no! The Goths have “new money” neighbors.,oh goths “new money” neighbors
The Sims,thesims,Kilooo5,2024-07-07T18:44:36,2024,13,About to cut his creatine and workouts why is bro bigger than Jason Mamoa😂😂.,cut creatine workouts bro bigger jason mamoa
The Sims,thesims,millzacnh,2024-07-07T19:25:12,2024,1,Game not loading,game loading
The Sims,thesims,ProfessionalDoubt499,2024-07-07T19:39:53,2024,1,does anyone know any good sims mods?,anyone know good sims mods
The Sims,thesims,Positive-Row5414,2024-07-07T19:47:01,2024,10,My sim won’t stop claiming her marriage will fail.,sim won’t stop claiming marriage fail
The Sims,thesims,HumanTacoz,2024-07-07T20:12:12,2024,1,Thinking of getting a laptop to play sims - is it worth it?,thinking getting laptop play sims worth
The Sims,thesims,AquaSunshine4,2024-07-07T20:23:25,2024,2,My Sims have randomly aged up upon opening my game,sims randomly aged upon opening game
The Sims,thesims,Lilbabya_,2024-07-07T20:33:46,2024,1,growing together (on mac),growing together mac
The Sims,thesims,g0dlymeow,2024-07-07T20:54:01,2024,1,Why did I just accidentally make Ariana Grande? LOL,accidentally make ariana grande lol
The Sims,thesims,OwlTop2299,2024-07-07T21:02:11,2024,1,My The Sims is Broken - Help?,sims broken help
The Sims,thesims,Sorrelfur,2024-07-07T21:08:14,2024,1,Can someone help me make this family in sims?,someone help make family sims
The Sims,thesims,Key-Loquat4028,2024-07-07T21:14:22,2024,1,game keeps crashing,game keeps crashing
The Sims,thesims,BullfrogPerfect620,2024-07-07T21:18:16,2024,1,Opinions on which of the following offers the best gameplay,opinions following offers best gameplay
The Sims,thesims,laviedavantgarde,2024-07-07T21:23:50,2024,2,Sims 4 Not Able to Run on PC,sims 4 able run pc
The Sims,thesims,minionlover222,2024-07-07T21:39:13,2024,2,App won’t let me open it or repair due to a permissions error,app won’t let open repair due permissions error
The Sims,thesims,Temporary-Web-3389,2024-07-07T21:44:44,2024,1,I need help. Im having issues with aline sims ;-;,need help im issues aline sims
The Sims,thesims,1universeonourfeet,2024-07-07T21:45:50,2024,60,I got a recreation of that famous meme by accident lol.,got recreation famous meme accident lol
The Sims,thesims,raturger,2024-07-07T22:07:07,2024,3,sims 4 wont open after power outage?,sims 4 wont open power outage
The Sims,thesims,mads-Mermaid,2024-07-07T23:01:01,2024,193,My Boy Has Some Cake,boy cake
The Sims,thesims,adelia___,2024-07-07T23:11:59,2024,1,Writting aspiration bug,writting aspiration bug
The Sims,thesims,Nearby_Group7101,2024-07-07T23:18:20,2024,1,Which expansion/ game pack recommended?,expansion game pack recommended
The Sims,thesims,DaBloodyApostate,2024-07-07T23:29:38,2024,23,Tell me you've never played the sims without telling me you've never played the sims 😶,tell youve never played sims without telling youve never played sims
The Sims,thesims,gr0undup0,2024-07-07T23:38:07,2024,1,My sims (4) wont cook ?!?!,sims 4 wont cook
The Sims,thesims,Massive-Finding6840,2024-07-07T23:57:32,2024,115,Family thinking we had a baby?,family thinking baby
The Sims,thesims,fosforito_rgb,2024-07-08T00:32:51,2024,1,Mods and CC not showing in game,mods cc showing game
The Sims,thesims,Tasty_Plan_6230,2024-07-08T01:08:35,2024,2,Mccc not working,mccc working
The Sims,thesims,thetranspondster,2024-07-08T01:09:30,2024,4,"Rental Houses for Del Sol Valley (two partially furnished shells, one furnished fully)",rental houses del sol valley two partially furnished shells one furnished fully
The Sims,thesims,Jamieo1111,2024-07-08T01:45:06,2024,46,Bffs Through The Years,bffs years
The Sims,thesims,Gloomy_Soft_1612,2024-07-08T02:26:00,2024,1,What can cause error 12 in sims 3?,cause error 12 sims 3
The Sims,thesims,TipIntrepid5753,2024-07-08T02:32:49,2024,1,What packs do you consider your “must-haves” and couldn’t play the game without?,packs consider “musthaves” couldn’t play game without
The Sims,thesims,Katyann623,2024-07-08T02:34:38,2024,1,Is anyone else having issues with the door locks resetting every time you load the lot?,anyone else issues door locks resetting every time load lot
The Sims,thesims,Fluid_Ebb5263,2024-07-08T03:05:18,2024,1,There is a sims youtuber taking other simmers content - missjollysims,sims youtuber taking simmers content missjollysims
The Sims,thesims,Critical_Run_4571,2024-07-08T03:36:08,2024,518,The windows look like when I’m trying to position them without bb.moveobjects on lol,windows look like i’m trying position without bbmoveobjects lol
The Sims,thesims,Due_Landscape_8448,2024-07-08T04:45:02,2024,4,My sims toddler is so cute,sims toddler cute
The Sims,thesims,LoveyPudgy94,2024-07-08T05:52:48,2024,312,Be honest..What does this man look like he do for a living?,honestwhat man look like living
The Sims,thesims,Raven_Freea,2024-07-08T06:24:56,2024,1,Clipping objects for closets,clipping objects closets
The Sims,thesims,Deeibdeeib,2024-07-08T07:40:43,2024,1,I had a dream about the sims being scary,dream sims scary
The Sims,thesims,Civil_Cellist5589,2024-07-08T07:41:58,2024,3,Problem with hair and makeup,problem hair makeup
The Sims,thesims,Master_Wrangler1659,2024-07-08T08:55:01,2024,471,Doctor died during childbirth. Did you have the same situation?)),doctor died childbirth situation
The Sims,thesims,Spirited_Outside4085,2024-07-08T10:20:18,2024,3,how can I ask for help to EA?,ask help ea
The Sims,thesims,LaraPoppins,2024-07-08T10:26:38,2024,3,Don't know how to finish my Writing aspiration,dont know finish writing aspiration
The Sims,thesims,Substantial-Hat-2466,2024-07-08T10:37:59,2024,1,Is this a good laptop for the sims 4 mods and cc?,good laptop sims 4 mods cc
The Sims,thesims,Beautiful-Two-2227,2024-07-08T10:43:29,2024,72,Do sims in your game ever get sick?,sims game ever get sick
The Sims,thesims,ASTR0PIA,2024-07-08T11:59:46,2024,1,Can’t age up children,can’t age children
The Sims,thesims,IndependenceOne5279,2024-07-08T12:16:15,2024,56,If Manic Panic Green Envy was a Sim,manic panic green envy sim
The Sims,thesims,No_Theory9226,2024-07-08T12:19:21,2024,32,He may have a slight problem,may slight problem
The Sims,thesims,Playful_Insect_2869,2024-07-08T12:50:57,2024,3,I need help with the graphics (plus the sims are t-posing for some reason),need help graphics plus sims tposing reason
The Sims,thesims,neighborhoodmess,2024-07-08T14:12:23,2024,2,"Packs I purchased yesterday showing up in the add-ons list, but not in the game itself (for context, this is on the Xbox One S)",packs purchased yesterday showing addons list game context xbox one
The Sims,thesims,Anxious-Currency4003,2024-07-08T14:53:26,2024,3,Can't find Wondymoon set..,cant find wondymoon set
The Sims,thesims,asj0107,2024-07-08T15:05:45,2024,9,In a rut with sims,rut sims
The Sims,thesims,yikes15229,2024-07-08T16:18:10,2024,7,Help! stuck on highschool years pop up and can’t click anything,help stuck highschool years pop can’t click anything
The Sims,thesims,Adept_Emu_7148,2024-07-08T16:46:36,2024,149,Are their any official or CC hairs that look like this?,official cc hairs look like
The Sims,thesims,Mysterious-Sea-4122,2024-07-08T16:53:55,2024,1,Not working opening for The sims 4,working opening sims 4
The Sims,thesims,brokewithprada,2024-07-08T17:09:21,2024,8,Sims Tiki Collectible?,sims tiki collectible
The Sims,thesims,Kitty-Pimms,2024-07-08T17:33:58,2024,1,Future of The Sims,future sims
The Sims,thesims,luvley_avey,2024-07-08T18:53:32,2024,1,I need more cc (pls help),need cc pls help
The Sims,thesims,MamaLookAwayFromMe,2024-07-08T18:58:42,2024,1,"Howdy!! Problems booting up my game (sims 4, steam) and I need help (Windows 10)",howdy problems booting game sims 4 steam need help windows 10
The Sims,thesims,RadioOne8332,2024-07-08T19:06:50,2024,76,Plumbobs at the zoo,plumbobs zoo
The Sims,thesims,The_Green_Cacti,2024-07-08T19:08:03,2024,5,I have a stuff pack I never bought (sims 3),stuff pack never bought sims 3
The Sims,thesims,MDMAmy,2024-07-08T19:46:25,2024,193,male vampire pregnant after 4th alien abduction!,male vampire pregnant 4th alien abduction
The Sims,thesims,Ok-Register8950,2024-07-08T19:56:28,2024,1,"Another sim dump - villains since I had so much fun creating lore for them. As always, download in comments 😋",another sim dump villains since much fun creating lore always download comments
The Sims,thesims,Nervous_Shelter1541,2024-07-08T20:37:57,2024,56,"Can’t make one twin less successful, any advice?",can’t make one twin less successful advice
The Sims,thesims,Dogdaysareover365,2024-07-08T20:58:27,2024,17,Was the sims FreePlay anybody else’s first sims game?,sims freeplay anybody else’s first sims game
The Sims,thesims,sunflower_skky79,2024-07-08T21:07:55,2024,1,SOL Mod Recommendations,sol mod recommendations
The Sims,thesims,ultradespairthot,2024-07-08T21:32:42,2024,859,"I’ve been stuck on the saving screen for a while, how do I get it to stop buffering?",i’ve stuck saving screen get stop buffering
The Sims,thesims,BeachSloth_,2024-07-08T21:57:37,2024,17,"Every time I finish streaming, my son insists on watching the recent broadcast with my headset on",every time finish streaming son insists watching recent broadcast headset
The Sims,thesims,daisyhearts,2024-07-08T22:33:50,2024,1,Faceless mermaid glitch??,faceless mermaid glitch
The Sims,thesims,Remarkable_Film_1911,2024-07-08T23:30:35,2024,352,Why is there no interactions in bed in Sims 4? Mildly infuriating!,interactions bed sims 4 mildly infuriating
The Sims,thesims,Individual-Fact6984,2024-07-08T23:31:10,2024,1,Stuck on community lot without sims… SOS!,stuck community lot without sims… sos
The Sims,thesims,AngelDolly223,2024-07-08T23:42:11,2024,1,Favorite Aspects of All Sims Games?,favorite aspects sims games
The Sims,thesims,PM-Me-Your-Dragons,2024-07-09T00:14:13,2024,9,How do you guys make genuinely scumbag (not supervillain) sims for greyer storylines?,guys make genuinely scumbag supervillain sims greyer storylines
The Sims,thesims,Mx-Adrian,2024-07-09T00:27:30,2024,4,Not even day two of a new Bachelor-type save and this is our third fire.,even day two new bachelortype save third fire
The Sims,thesims,duckbro7543,2024-07-09T01:06:38,2024,32,Whats so speical with the Blue Moon noCC house?,whats speical blue moon nocc house
The Sims,thesims,SloothTheLucidSloth,2024-07-09T01:14:16,2024,1,Summer sale not showing up when I go to buy it on Xbox.,summer sale showing go buy xbox
The Sims,thesims,SeadSims,2024-07-09T01:23:23,2024,1,I gave the Sims Sessions Bebe Rexha a makeover,gave sims sessions bebe rexha makeover
The Sims,thesims,hiphopbulldozer,2024-07-09T02:11:27,2024,1,Is there a way to do this? With or without mods.,way without mods
The Sims,thesims,Gogurtisthegame,2024-07-09T02:12:54,2024,2,Is there any way I just copy and paste a neighborhood?,way copy paste neighborhood
The Sims,thesims,Akito_900,2024-07-09T02:13:40,2024,55,"Builders of reddit, what architectural features do you want to be added the most in the sims?",builders reddit architectural features want added sims
The Sims,thesims,viscerealmilk,2024-07-09T03:49:54,2024,116,"i prefer to build messy houses. here are some of my favourite rooms in an unkempt grouphome that i built (because i got tired of playing with perfect families in perfect houses, haha)",prefer build messy houses favourite rooms unkempt grouphome built got tired playing perfect families perfect houses haha
The Sims,thesims,Practical_Sky_6255,2024-07-09T04:24:11,2024,12,"Sims wishlist: chance cards based on traits, life phase or mood at work",sims wishlist chance cards based traits life phase mood work
The Sims,thesims,ClassyPhoenix324,2024-07-09T04:29:50,2024,29,"so in the sims 2 i never understood why they did this on this lot, like its suppose to be a display to view from outside but they never added windows, or just had them facing the other way",sims 2 never understood lot like suppose display view outside never added windows facing way
The Sims,thesims,Mission-Low-7152,2024-07-09T04:50:14,2024,1,Sims in CAS not fully naked,sims cas fully naked
The Sims,thesims,CourseLast4999,2024-07-09T06:18:43,2024,1,Is sims 4 worth it. Ive played previous games and this one just seems so bland,sims 4 worth ive played previous games one seems bland
The Sims,thesims,TransitionOk8109,2024-07-09T08:08:08,2024,580,Women are very difficult to understand),women difficult understand
The Sims,thesims,Greedy_Flatworm6208,2024-07-09T09:22:04,2024,24,Where did this necklace come from!? It’s no where in CAS. (Sorry for the bad quality image),necklace come it’s cas sorry bad quality image
The Sims,thesims,spanningt1me,2024-07-09T09:34:22,2024,81,proud of my new sim,proud new sim
The Sims,thesims,Life_Persimmon7793,2024-07-09T11:05:03,2024,1,Sims 4 Offers Question,sims 4 offers question
The Sims,thesims,rjmclkne,2024-07-09T13:35:27,2024,1,Should I play TS3 or TS4.??,play ts3 ts4
The Sims,thesims,RnLee20,2024-07-09T13:38:14,2024,1,Help w/ laptop to run all dlc & cc,help w laptop run dlc cc
The Sims,thesims,OrwellianWiress,2024-07-09T14:34:53,2024,80,Adult calls my son during school to ask him to join a mysterious group? Seems legit,adult calls son school ask join mysterious group seems legit
The Sims,thesims,Adorable_Sentence346,2024-07-09T14:51:00,2024,1,which packs for bundle sims 4,packs bundle sims 4
The Sims,thesims,stressedhoe_,2024-07-09T15:54:55,2024,1,Trait box not showing up,trait box showing
The Sims,thesims,Misanthrophia,2024-07-09T16:15:10,2024,1711,Just wanted to share my newest tattoo!💚,wanted share newest tattoo
The Sims,thesims,elisegameplays_,2024-07-09T17:00:14,2024,1,I made a legacy challenge for spellcasters,made legacy challenge spellcasters
The Sims,thesims,sansthe21stpilot,2024-07-09T17:06:50,2024,5,Video Length for Rags to Riches,video length rags riches
The Sims,thesims,anonymousgdodug,2024-07-09T17:07:47,2024,1,"Im on sims 4,pls help",im sims 4pls help
The Sims,thesims,Nearby-Mention-453,2024-07-09T18:41:31,2024,1,"Rank your top four Sims games of all time: The Sims 1, 2, 3, and 4.",rank top four sims games time sims 1 2 3 4
The Sims,thesims,Obsessedwithdogs67,2024-07-09T19:09:47,2024,1694,I love the sims laundry lists,love sims laundry lists
The Sims,thesims,OneKindheartedness12,2024-07-09T19:34:13,2024,5,i need a very specific male hair PLEASE HELP,need specific male hair please help
The Sims,thesims,Derpy_Banette,2024-07-09T19:59:51,2024,1,"♦️The same sim,different life stages♦️",simdifferent life stages
The Sims,thesims,elmsshi,2024-07-09T20:20:32,2024,14,"For those of you that have been playing the sims for a while, does the game still excite you?",playing sims game still excite
The Sims,thesims,Any_Kiwi_2741,2024-07-09T20:25:33,2024,3,Family relationship missing,family relationship missing
The Sims,thesims,ydoihavetopickaname,2024-07-09T20:34:40,2024,2,My Gallery won't finish loading?,gallery wont finish loading
The Sims,thesims,peach_poppy,2024-07-09T20:50:12,2024,38,Is there a “natural” or organic way to get a Spellcaster famous?,“natural” organic way get spellcaster famous
The Sims,thesims,books-and-pixels,2024-07-09T21:08:44,2024,1,Anyone interested in a long form Sims storytelling Discord?,anyone interested long form sims storytelling discord
The Sims,thesims,ilovelese,2024-07-09T22:04:53,2024,8,Anyone know what this is? I can’t seem to get rid of it no matter how many times they flirt or woohoo,anyone know can’t seem get rid matter many times flirt woohoo
The Sims,thesims,vllnll,2024-07-09T22:09:42,2024,10,i forget i use cc until i send a sim to a friend to play with…,forget use cc send sim friend play with…
The Sims,thesims,0aadir0,2024-07-09T22:41:52,2024,41,my vamipre sim likes looking at his refection??,vamipre sim likes looking refection
The Sims,thesims,Recent-Finance3036,2024-07-09T22:43:30,2024,1,Sims 4 DLC recommendations,sims 4 dlc recommendations
The Sims,thesims,elizabethaugust,2024-07-09T22:50:18,2024,1,Help with Sims 4,help sims 4
The Sims,thesims,CyanCyn,2024-07-09T22:55:08,2024,147,Why do you think modders haven't overhauled the genetics system?,think modders havent overhauled genetics system
The Sims,thesims,Appropriate_River_56,2024-07-09T23:10:27,2024,2,Need Help Finding A Sim,need help finding sim
The Sims,thesims,OutrageousRelation67,2024-07-09T23:17:28,2024,6,please tell me or show me a screenshot of a setup where this works. Or is the Freelance Photography career still completely broken?,please tell show screenshot setup works freelance photography career still completely broken
The Sims,thesims,Ok_File5157,2024-07-09T23:17:46,2024,2,The sims4 wont open,sims4 wont open
The Sims,thesims,JuneBeckker,2024-07-09T23:31:35,2024,4,New to The Sims 3- HELP!,new sims 3 help
The Sims,thesims,Macaroon1056,2024-07-09T23:37:05,2024,4,My Sim has a Baby but who’s the father?,sim baby who’s father
The Sims,thesims,ltonkerz,2024-07-09T23:46:20,2024,31,"Betty and Tsuyoshi’s plans got cancelled, so they stayed at home to watch some TikToks",betty tsuyoshi’s plans got cancelled stayed home watch tiktoks
The Sims,thesims,throwaway10131619,2024-07-10T00:06:11,2024,4,One Drive ate my game (TS4),one drive ate game ts4
The Sims,thesims,QuestPotato99,2024-07-10T01:39:10,2024,8,the vampire brothers the Duskborne,vampire brothers duskborne
The Sims,thesims,Flat-Television-2811,2024-07-10T01:48:20,2024,3,How do I know what can be deleted from tray folder?,know deleted tray folder
The Sims,thesims,Damn_Damocles,2024-07-10T03:25:10,2024,84,Created Cliche No CC townies to date: gallery id - DangDamocles,created cliche cc townies date gallery id dangdamocles
The Sims,thesims,Winter1111111,2024-07-10T04:07:40,2024,5,lack of population,lack population
The Sims,thesims,rainaisbored,2024-07-10T05:44:01,2024,13,My beautiful sims - no CC except hair for one :),beautiful sims cc except hair one
The Sims,thesims,Jazmilia,2024-07-10T06:57:24,2024,1,"Sunken luxury home, no CC, Sims4",sunken luxury home cc sims4
The Sims,thesims,Cece2395,2024-07-10T07:07:16,2024,6,New hairstyle in The Sims 4?,new hairstyle sims 4
The Sims,thesims,Significant_Ice_5006,2024-07-10T08:08:23,2024,2,What is this damn wardrobe called?!,damn wardrobe called
The Sims,thesims,Sir_Tea-Rex,2024-07-10T10:12:15,2024,760,You'd never guess his favorite food,youd never guess favorite food
The Sims,thesims,Droyup,2024-07-10T10:49:29,2024,48,Made Gary and Petey from Bully!,made gary petey bully
The Sims,thesims,Federal-Variety-6786,2024-07-10T11:50:01,2024,3,hiya! how do i delete platforms?,hiya delete platforms
The Sims,thesims,betterlatesims,2024-07-10T11:57:00,2024,85,"After watching Inside Out 2, I felt like recreating Riley's Emotions on Sims 3!",watching inside 2 felt like recreating rileys emotions sims 3
The Sims,thesims,DesperateNumber9,2024-07-10T12:25:51,2024,1,Sims drama regarding oshinsims and MissJollySims,sims drama regarding oshinsims missjollysims
The Sims,thesims,BandicootFun9326,2024-07-10T13:08:38,2024,3,hey ya i need help with something not that important. How do I change the lighting off the building from world view? I downloaded save file from someone for the buildings and I entered one lot through build mode and the lighting has changed to this basic one and i really want it back lol,hey ya need help something important change lighting building world view downloaded save file someone buildings entered one lot build mode lighting changed basic one really want back lol
The Sims,thesims,Oat_Miilk,2024-07-10T13:39:01,2024,1,"A normal natural death in the Sims 4: lying under the table, urn and spoiled pufferfish on the table. Nothing wrong here.",normal natural death sims 4 lying table urn spoiled pufferfish table nothing wrong
The Sims,thesims,Starswift99,2024-07-10T15:35:52,2024,11,Rambling about my current favorite sim! :),rambling current favorite sim
The Sims,thesims,xolovelos,2024-07-10T16:51:14,2024,1,EA Help says that PC has the ability to tag and reminisce about a memory...,ea help says pc ability tag reminisce memory
The Sims,thesims,filteredsushi,2024-07-10T16:52:34,2024,4,Stop Sims acting on their own,stop sims acting
The Sims,thesims,ChaoticInsanity_,2024-07-10T17:29:59,2024,7,"EA app will stay like this for a few minutes then load with ""can't connect to servers""?",ea app stay like minutes load cant connect servers
The Sims,thesims,ARMYssii,2024-07-10T17:44:51,2024,29,My OCs but they’re in The Sims 2,ocs they’re sims 2
The Sims,thesims,OutrageousEgg9818,2024-07-10T18:02:37,2024,1,Gallery is missing,gallery missing
The Sims,thesims,TheGothGranny,2024-07-10T18:25:41,2024,1,Potty mouth toilet 2.0 blasting off?,potty mouth toilet 20 blasting
The Sims,thesims,aurora_011,2024-07-10T18:44:40,2024,3,Help with House partiesa,help house partiesa
The Sims,thesims,Dahlilynnx,2024-07-10T18:51:24,2024,1,wicked whims help,wicked whims help
The Sims,thesims,kitten_paws_1437,2024-07-10T19:10:29,2024,53,"Truly the most tragic use for a park- Mt. Komorebi. The park itself is beautiful and I get the lots have to be squared, but the space to the right makes me so irritated because I could place kids stuff there. I know there are mods to build outside of the lot limits, but it's the principal :(",truly tragic use park mt komorebi park beautiful get lots squared space right makes irritated could place kids stuff know mods build outside lot limits principal
The Sims,thesims,InsightsIE,2024-07-10T19:14:39,2024,39,TIL: EA Thailand offered an OFFICIAL Nude Patch for The Sims 1 in 2000! 🤣,til ea thailand offered official nude patch sims 1 2000
The Sims,thesims,Individual_Ad7168,2024-07-10T19:35:07,2024,1,EA Isn't Working (help),ea isnt working help
The Sims,thesims,alicheek,2024-07-10T19:37:05,2024,1,SIMS 4 How to property invite people of for events such as Winterfest & New Years Eve,sims 4 property invite people events winterfest new years eve
The Sims,thesims,pngfilez,2024-07-10T19:48:34,2024,4,Sims don’t finish woohooing,sims don’t finish woohooing
The Sims,thesims,ef1010,2024-07-10T19:51:30,2024,1,gallery not connecting!,gallery connecting
The Sims,thesims,Darija_Galaxy,2024-07-10T20:43:47,2024,114,I never knew this! (My sim bathed the baby mermaid and after that this moodlet appeared),never knew sim bathed baby mermaid moodlet appeared
The Sims,thesims,AlliCakes,2024-07-10T20:55:34,2024,23,What Do You Do With Newcrest?,newcrest
The Sims,thesims,Brutalmagic,2024-07-10T21:02:54,2024,1,Could someone make my glasses please as a functional CC with the case for The Sims 4? Would be awesome :),could someone make glasses please functional cc case sims 4 would awesome
The Sims,thesims,G_and_F,2024-07-10T21:07:01,2024,19,"Don’t blame my sims, it was my fault",don’t blame sims fault
The Sims,thesims,Level_Painter_9230,2024-07-10T21:07:03,2024,1,Blue Confetti Cake glitched?!,blue confetti cake glitched
The Sims,thesims,IncognitoChinchillea,2024-07-10T21:07:18,2024,3,"Please help!! - ""The Sims 4 is already running"" error is ruining my life.",please help sims 4 already running error ruining life
The Sims,thesims,TheNumbahSeven,2024-07-10T21:10:34,2024,3,Android 16's Ready To Love!,android 16s ready love
The Sims,thesims,B4thB0mb,2024-07-10T21:12:17,2024,2,Everytime I try to open ts4 it gives me this error. It was working fine yesterday can anyone help me figure out whats happening or what this is? Ive never gotten this before.,everytime try open ts4 gives error working fine yesterday anyone help figure whats happening ive never gotten
The Sims,thesims,Gender_Theft,2024-07-10T21:18:23,2024,44,"Welcome to Wabbit's Pizza Place, where Fantasy and Fun comes to life!",welcome wabbits pizza place fantasy fun comes life
The Sims,thesims,lcasey14,2024-07-10T21:20:01,2024,11,My current sims mobile household bc I can’t afford to kick the ex husband (right) out yet,current sims mobile household bc can’t afford kick ex husband right yet
The Sims,thesims,nikolateslasgf,2024-07-10T21:38:29,2024,131,does my sim look creepy 😭,sim look creepy
The Sims,thesims,MajesticReaper92,2024-07-10T22:38:48,2024,1,Toddler Nightmare Milestone Not Working.,toddler nightmare milestone working
The Sims,thesims,ash0801,2024-07-10T23:44:46,2024,1,"Lost Access to Old Account with All Expansion Packs , Sims4 Account Share ?",lost access old account expansion packs sims4 account share
The Sims,thesims,sibelgnr,2024-07-11T00:03:02,2024,17,Beginner to taking photos in-game & I love it now <3,beginner taking photos ingame love 3
The Sims,thesims,Human-sulucnumoH,2024-07-11T00:36:25,2024,3,Controversial : my sim cosleeps,controversial sim cosleeps
The Sims,thesims,Frostnatt,2024-07-11T00:43:49,2024,1,The group of femboy friends before and after getting ready for the club.,group femboy friends getting ready club
The Sims,thesims,Sd_chilli,2024-07-11T01:38:55,2024,3,My sims 4 packs aren’t downloading,sims 4 packs aren’t downloading
The Sims,thesims,Plenty-Category-4475,2024-07-11T01:49:21,2024,2,Need help with placing a house.,need help placing house
The Sims,thesims,TheLgbtDuck,2024-07-11T01:59:37,2024,1,I’ll just leave this here and let the comments do the rest.,i’ll leave let comments rest
The Sims,thesims,opreston,2024-07-11T02:54:58,2024,168,My Oldest Sim Ever on Normal Life-Span.,oldest sim ever normal lifespan
The Sims,thesims,2gaywitches,2024-07-11T03:21:48,2024,23,"Been playing Tomarang, I gave Vanesha and Zhafira a little memorial for their parents :]",playing tomarang gave vanesha zhafira little memorial parents
