game,subreddit,author,created_utc,year,score,original_title,cleaned
The Sims,thesims,danohero5291,2024-07-04T00:39:42,2024,1,Can someone tell me which Sims game it is where you start out living with your grandma and have to carpool to work and stuff?,someone tell sims game start living grandma carpool work stuff
The Sims,thesims,monplays2d,2024-07-04T00:51:42,2024,3,making anime characters as sims (Day 1: Yelan from Genshin Impact),making anime characters sims day 1 yelan genshin impact
The Sims,thesims,TheDJPonyChan,2024-07-04T00:58:48,2024,1,So uh.. my game is stuck repairing. Files corrupted and I’m trying to repair but it’s stuck.,uh game stuck repairing files corrupted i’m trying repair it’s stuck
The Sims,thesims,Bulky-Protection9354,2024-07-04T01:12:44,2024,265,"Designed these Nifty bookends, thought you bunch would enjoy them!",designed nifty bookends thought bunch would enjoy
The Sims,thesims,Soso_63,2024-07-04T01:13:46,2024,1,Washing dishes in the bathroom,washing dishes bathroom
The Sims,thesims,fml82719,2024-07-04T01:30:30,2024,1,My sims game un download itself help please,sims game un download help please
The Sims,thesims,Silver_Books20,2024-07-04T01:46:31,2024,1,Sims I made in CAS because why not?,sims made cas
The Sims,thesims,Somniphobia_Dark,2024-07-04T02:22:51,2024,44,I think my baby may be possessed 😂😱,think baby may possessed
The Sims,thesims,sneaky-doloo,2024-07-04T02:33:25,2024,1,Need help with reshade,need help reshade
The Sims,thesims,IcecreamSundae621,2024-07-04T03:22:59,2024,3,Can’t get households to load,can’t get households load
The Sims,thesims,AliveVictory2006,2024-07-04T03:41:09,2024,10,do you ever wonder what it would be like to meet your sims in human form and how they would actually be like as a person?,ever wonder would like meet sims human form would actually like person
The Sims,thesims,grashel,2024-07-04T03:49:38,2024,246,The sims 4 at Ikea,sims 4 ikea
The Sims,thesims,Nobodyknowsme237,2024-07-04T03:57:55,2024,1,Name & Occupation?,name occupation
The Sims,thesims,Averybizz,2024-07-04T04:01:37,2024,17,Which twins should be heir?,twins heir
The Sims,thesims,Confused_Cutie222,2024-07-04T04:48:41,2024,4,Gallery won’t show up,gallery won’t show
The Sims,thesims,slamcharcoal,2024-07-04T05:45:34,2024,2,How do I fix this weird lighting on these platform stairs?,fix weird lighting platform stairs
The Sims,thesims,Gio6887568,2024-07-04T08:31:12,2024,1,Roommates I've been playing with :D,roommates ive playing
The Sims,thesims,seameamea01,2024-07-04T09:35:24,2024,3,I have a broken save but I love my family what can I do ? (Sims 4),broken save love family sims 4
The Sims,thesims,Careful_Baseball_234,2024-07-04T10:20:19,2024,2,"A few Stardew Valley Bachelors (Elliot, Sebastian, Harvey)",stardew valley bachelors elliot sebastian harvey
The Sims,thesims,elaxxii,2024-07-04T10:33:55,2024,1,The sims 4 override you NEED in your game!🩷 #thesims4 #gaming #shorts #kawaii #cute,sims 4 override need game thesims4 gaming shorts kawaii cute
The Sims,thesims,Professional-Big-840,2024-07-04T10:47:54,2024,8,"Ask me anything, Do your worst",ask anything worst
The Sims,thesims,Dangerous-Hat-8076,2024-07-04T10:53:32,2024,1,city living or get together??,city living get together
The Sims,thesims,BananaSlipLlamaDrama,2024-07-04T11:20:39,2024,4,4 bed + butler suite,4 bed butler suite
The Sims,thesims,DueData5,2024-07-04T12:33:02,2024,8,baby mother married his nephew??,baby mother married nephew
The Sims,thesims,Calm-Supermarket1048,2024-07-04T12:35:13,2024,1,Made the Making money scenario in 2 days,made making money scenario 2 days
The Sims,thesims,k33bambi,2024-07-04T13:19:32,2024,36,My sim was sunbathing,sim sunbathing
The Sims,thesims,dylicious23,2024-07-04T13:30:27,2024,1,Build cheats/hacks?,build cheatshacks
The Sims,thesims,ufoatofu,2024-07-04T13:35:38,2024,2,I hate this app I cant even PLAY,hate app cant even play
The Sims,thesims,TheKey32,2024-07-04T14:46:09,2024,1,"Meet Victor Marino, a retired Navy captain who now takes on cruise ships to have a relaxed time while traveling around the Sim Nation. Would you join his cruises?",meet victor marino retired navy captain takes cruise ships relaxed time traveling around sim nation would join cruises
The Sims,thesims,yomeko_kayato,2024-07-04T14:48:27,2024,1,I wanted to give her some traits but it didn't work,wanted give traits didnt work
The Sims,thesims,mikebiggs68,2024-07-04T15:15:06,2024,92,real vs sims4 build,real vs sims4 build
The Sims,thesims,69Potetmos,2024-07-04T15:35:57,2024,4,Any good face mods?,good face mods
The Sims,thesims,Loveyousomuch06,2024-07-04T15:36:14,2024,7,Can somebody please give me building tips!,somebody please give building tips
The Sims,thesims,heyebones,2024-07-04T15:58:16,2024,1,"Please help, stuff pack not downloading :(",please help stuff pack downloading
The Sims,thesims,aQ_tA,2024-07-04T15:58:57,2024,15,Has anyone come across anyone infant cc like this? 🙏,anyone come across anyone infant cc like
The Sims,thesims,undercovercatman,2024-07-04T16:31:06,2024,556,When I said I wanted a matriarchy I didn’t mean that EVERYONE had to be a girl 😭,said wanted matriarchy didn’t mean everyone girl
The Sims,thesims,HoneyButterAddict,2024-07-04T16:43:21,2024,3,Should I download HSY and MWS?,download hsy mws
The Sims,thesims,Hams_LeShanbi,2024-07-04T16:47:04,2024,37,Kid spawned suddenly in one of my household.,kid spawned suddenly one household
The Sims,thesims,Ilosc,2024-07-04T18:35:29,2024,1,"Hello, are there any mods to make male clothes fit women sims properly? It's so hard to make a masculine female sim without using cc...",hello mods make male clothes fit women sims properly hard make masculine female sim without using cc
The Sims,thesims,BlackheartM,2024-07-04T18:47:42,2024,2,Is there a way to change the work outfit for all sims for each job?,way change work outfit sims job
The Sims,thesims,sheronddale,2024-07-04T19:06:17,2024,1,I can’t find my mods in game,can’t find mods game
The Sims,thesims,Expensive_Storage_69,2024-07-04T19:26:00,2024,2,MCC Populatiom tray sims from gallery change household name?,mcc populatiom tray sims gallery change household name
The Sims,thesims,drfreemanss,2024-07-04T19:43:41,2024,17,cant make food sims 4,cant make food sims 4
The Sims,thesims,OnkeIiroh,2024-07-04T19:47:31,2024,944,Day 1 of creating Sims for the new pack,day 1 creating sims new pack
The Sims,thesims,Unhappy_Delivery6131,2024-07-04T20:54:20,2024,13,Please tell me this looks like Hunter Schafer,please tell looks like hunter schafer
The Sims,thesims,skyhold_my_hand,2024-07-04T21:12:12,2024,7,"Sims Medieval - Are NPCs, territories, etc randomized each time?",sims medieval npcs territories etc randomized time
The Sims,thesims,Leahfaith6077,2024-07-04T21:21:03,2024,1,Pls help 😭 my last chance,pls help last chance
The Sims,thesims,CrazyAffectionate166,2024-07-04T21:28:18,2024,4,Need to find my dog,need find dog
The Sims,thesims,jaylowow,2024-07-04T21:53:48,2024,137,The third Sims 4 painting is done! Or I guess it's technically a Spore painting? 🤔 Any ideas for other paintings?,third sims 4 painting done guess technically spore painting ideas paintings
The Sims,thesims,LimpStudio,2024-07-04T21:58:39,2024,6,"I downloaded the body mod of Golyhawhaw, but the mod is not working properly, how do I solve this?",downloaded body mod golyhawhaw mod working properly solve
The Sims,thesims,Bonita_100,2024-07-04T22:15:09,2024,5,Olena Bondarenko (Download link in comments),olena bondarenko download link comments
The Sims,thesims,ethmantech,2024-07-04T22:50:01,2024,2,my sim wont graduate,sim wont graduate
The Sims,thesims,Bookworm444782,2024-07-04T23:29:52,2024,6,Why do sims NPCs keep fighting?,sims npcs keep fighting
The Sims,thesims,Alone_Row_1432,2024-07-05T00:47:30,2024,4,Advice and tips on how to make better male sims.,advice tips make better male sims
The Sims,thesims,AngelicMidari,2024-07-05T01:42:16,2024,2,Help mc command center pregnancy,help mc command center pregnancy
The Sims,thesims,SnakeBellyy,2024-07-05T02:17:31,2024,2,scenario rewards?,scenario rewards
The Sims,thesims,deveeeux,2024-07-05T03:15:45,2024,22,Does anyone know what this is?,anyone know
The Sims,thesims,Banana_dude11,2024-07-05T05:28:49,2024,1,What is the best graphics settings/mods to have for iMac 64 bit?,best graphics settingsmods imac 64 bit
The Sims,thesims,Swimming_Dot42,2024-07-05T05:30:23,2024,1,Sims sex addiction?,sims sex addiction
The Sims,thesims,automaticbitch,2024-07-05T05:31:22,2024,4,Recommendation for sims4 builders on YouTube,recommendation sims4 builders youtube
The Sims,thesims,True-Collection-3702,2024-07-05T05:51:04,2024,99,Sims CC glitch scary,sims cc glitch scary
The Sims,thesims,Global_Obligation458,2024-07-05T05:53:38,2024,7,Uma Kompton in the Sims Mobile,uma kompton sims mobile
The Sims,thesims,Fairysnindo,2024-07-05T06:01:08,2024,2,When will the Lovestruck gameplay trailer release?,lovestruck gameplay trailer release
The Sims,thesims,Dragon_1820,2024-07-05T06:20:47,2024,2,Is there a way to stop NPC sims from generating with make up in the Sims 4?,way stop npc sims generating make sims 4
The Sims,thesims,TreClaire,2024-07-05T06:31:03,2024,975,I had a baby with every single default townie in the game! If I did my counting right that's exactly 100 babies!,baby every single default townie game counting right thats exactly 100 babies
The Sims,thesims,Friendly-Narwhal-186,2024-07-05T08:09:04,2024,38,He built a launch pad in an Astronaut's plot,built launch pad astronauts plot
The Sims,thesims,Lexie_DK,2024-07-05T08:50:00,2024,3,Does anyone know what this is?,anyone know
The Sims,thesims,her-starlight,2024-07-05T11:01:38,2024,2,Vets are just leaving the lot and then not spawning new ones,vets leaving lot spawning new ones
The Sims,thesims,Seffybean,2024-07-05T11:32:12,2024,1,game keeps not responding on start up,game keeps responding start
The Sims,thesims,beau-monty,2024-07-05T12:26:27,2024,3,Questions from a New Simmer!,questions new simmer
The Sims,thesims,Dudezila,2024-07-05T12:44:51,2024,13,So I found out from this sub that I can change object size... my first instinct was this,found sub change object size first instinct
The Sims,thesims,jahub0110,2024-07-05T12:57:35,2024,15,Too much ivy or not enough?,much ivy enough
The Sims,thesims,Great_Replacement_40,2024-07-05T13:55:34,2024,1,which pack should i rather buy,pack rather buy
The Sims,thesims,BoAndAriTheGhosties,2024-07-05T15:46:53,2024,1,ts4script and package files not working,ts4script package files working
The Sims,thesims,Mumu_Kiki,2024-07-05T17:03:21,2024,44,"Just curious, how much GB of cc do you have and how well does your game run?",curious much gb cc well game run
The Sims,thesims,clarityanon,2024-07-05T17:07:51,2024,1,Categorising all the Sims 4 DLC as a basic guide on what to buy.,categorising sims 4 dlc basic guide buy
The Sims,thesims,Superb-Conclusion739,2024-07-05T17:23:31,2024,155,The baby just disappeared??????,baby disappeared
The Sims,thesims,Pretty_Pnk_Sunflower,2024-07-05T18:07:49,2024,8,Electrocuted On Wedding Day 🥴,electrocuted wedding day
The Sims,thesims,MichaelaH253,2024-07-05T18:17:07,2024,90,"I built a spacious community lot, that can serve as a café, bar, karaoke bar, restaurant, lounge or a nightclub with a small apartment on the second floor 🤎 What do you think? | ID: michaelasimsyt",built spacious community lot serve café bar karaoke bar restaurant lounge nightclub small apartment second floor think id michaelasimsyt
The Sims,thesims,PrinZessBubblegum,2024-07-05T18:22:15,2024,19,Appreciation Post: Sims 3 pre-build Houses are amazingly great build!,appreciation post sims 3 prebuild houses amazingly great build
The Sims,thesims,Lizardsflizzers,2024-07-05T18:55:45,2024,42,Can I get an honest review of the Horse Ranch Pack?,get honest review horse ranch pack
The Sims,thesims,Interesting_Log7757,2024-07-05T20:35:41,2024,21,Genuine question: How do you guys enjoy the game?,genuine question guys enjoy game
The Sims,thesims,Chicken_Small,2024-07-05T20:40:49,2024,2,Forced Proximity Trope?,forced proximity trope
The Sims,thesims,Fun_Pie5055,2024-07-05T20:44:24,2024,3,Help how do I fix that?,help fix
The Sims,thesims,seraphaware,2024-07-05T20:55:46,2024,64,making more sims for the upcoming pack!,making sims upcoming pack
The Sims,thesims,coneyisland92,2024-07-05T21:24:03,2024,4,Solar System Legacy Challenge.,solar system legacy challenge
The Sims,thesims,shitposter69-1,2024-07-05T21:33:17,2024,200,Why does acting count as cheating?,acting count cheating
The Sims,thesims,Accomplished_Oil196,2024-07-05T21:58:09,2024,1,Rooms from my 'each room is my favourite movie/series scene' challenge. Just sharing,rooms room favourite movieseries scene challenge sharing
The Sims,thesims,man1dc,2024-07-05T22:00:24,2024,9,are the wii and psp versions of the sims 2: pets the same?,wii psp versions sims 2 pets
The Sims,thesims,Beneficial-Remove-71,2024-07-05T22:44:10,2024,1,While my sims is loading,sims loading
The Sims,thesims,Obvious_Sir_544,2024-07-05T22:57:07,2024,2,Sims 4 keeps crashing?,sims 4 keeps crashing
The Sims,thesims,Gummybe4,2024-07-05T23:48:01,2024,1,Is there any way to place flooring without walls?,way place flooring without walls
The Sims,thesims,Outside_Climate4222,2024-07-05T23:50:52,2024,6,Cannot get rounded wall/room to delete or undo??,cannot get rounded wallroom delete undo
The Sims,thesims,Monkfrootx,2024-07-05T23:51:59,2024,2,I just saw the Malware issue (from months ago) with Sims mods / ts4 scripts. Any issue with S4MP?,saw malware issue months ago sims mods ts4 scripts issue s4mp
The Sims,thesims,galaxyanimalloverr,2024-07-06T00:17:56,2024,17,Was scrolling though kits to see what they had and for some reason there’s a couple things missing?,scrolling though kits see reason there’s couple things missing
The Sims,thesims,Environmental-Ad8898,2024-07-06T00:23:46,2024,1,Zenless Zone Zero Strategy Station is live,zenless zone zero strategy station live
The Sims,thesims,Maleficent-Duty-8809,2024-07-06T00:26:07,2024,1,For rent or eco lifestyle?,rent eco lifestyle
The Sims,thesims,ICarlygavemeHIV,2024-07-06T01:03:48,2024,31,Day 1 of playing on my PC,day 1 playing pc
The Sims,thesims,Throwawayyyy__qqq,2024-07-06T01:17:47,2024,1,Best cas stand still?,best cas stand still
The Sims,thesims,JStheSEGAfan,2024-07-06T02:57:01,2024,1,How do I decide what to take screenshots of?,decide take screenshots
The Sims,thesims,Diligent_Bee2387,2024-07-06T02:59:43,2024,2,Anyone else having this problem??,anyone else problem
The Sims,thesims,i-eat-crayons123,2024-07-06T03:16:10,2024,115,I’m dog sitting for a neighbor and stumbled across this gem,i’m dog sitting neighbor stumbled across gem
The Sims,thesims,RosieAlto,2024-07-06T03:40:39,2024,2,World doesnt work and now my MODS and CC dont,world doesnt work mods cc dont
The Sims,thesims,Prettypenny_,2024-07-06T03:54:43,2024,156,Wondering if this is a lot? Whatre your hours?,wondering lot whatre hours
The Sims,thesims,AnxiousFarmer4803,2024-07-06T04:24:11,2024,118,Why are sims so useless?! 😩,sims useless
The Sims,thesims,MoekkoLoli,2024-07-06T04:27:16,2024,1,How do you enter game tournaments?,enter game tournaments
The Sims,thesims,Lobrees,2024-07-06T04:39:52,2024,15,Made Inna Cents' family in the sims + some unnecessary lore I created in a comment,made inna cents family sims unnecessary lore created comment
The Sims,thesims,AdonisBatheus,2024-07-06T04:44:28,2024,192,just girly things <3,girly things 3
The Sims,thesims,Cold-Programmer622,2024-07-06T05:33:16,2024,1,What’s wrong with my game? 😭,what’s wrong game
The Sims,thesims,LoptAuf,2024-07-06T05:52:13,2024,8,Trying out new looks with Sims I made (except for that first girl. She's the daughter of one of my creations and Johnny Zest).,trying new looks sims made except first girl shes daughter one creations johnny zest
The Sims,thesims,Choice_Piccolo_5763,2024-07-06T06:26:13,2024,1,Which guy sim looks the best?,guy sim looks best
The Sims,thesims,violetpurpleblue,2024-07-06T06:26:26,2024,1,Why is my roof floating?,roof floating
The Sims,thesims,vanillagirl32,2024-07-06T06:37:54,2024,1,I havent got any motivation to play!,havent got motivation play
The Sims,thesims,AlexisHbutterfly,2024-07-06T07:13:06,2024,1,UI cheats slowing down the game?,ui cheats slowing game
The Sims,thesims,Houndstoothslutwoo,2024-07-06T08:26:31,2024,7,How come all my houses suck ass?,come houses suck ass
The Sims,thesims,Ambitious-Run7031,2024-07-06T08:38:20,2024,1,How old does this sim look?,old sim look
The Sims,thesims,Western-Cloud-2338,2024-07-06T09:18:06,2024,2,Does registering your game/EP on the sims 3 store still give you free simpoints?,registering gameep sims 3 store still give free simpoints
The Sims,thesims,meagan176,2024-07-06T09:51:45,2024,19,Started a Newcrest storybook inspired build,started newcrest storybook inspired build
The Sims,thesims,koopabudda,2024-07-06T11:00:19,2024,10,Who else loved playing bustin out for the gba has a child?,else loved playing bustin gba child
The Sims,thesims,das_kabinette,2024-07-06T11:34:10,2024,47,Family/Legacy Players - Do you play on rotation or with an heir?,familylegacy players play rotation heir
The Sims,thesims,BrandonIsWhoIAm,2024-07-06T11:41:08,2024,1239,The Sims’ Official Clarification on Cupid’s Corner’s Lack of Acceptance of CC. 🤣,sims’ official clarification cupid’s corner’s lack acceptance cc
The Sims,thesims,Jamienhil,2024-07-06T12:40:12,2024,34,So in one day my sim lost her husband due to embarrassment (not paying rent oops) her cat ran away and she had a miscarriage,one day sim lost husband due embarrassment paying rent oops cat ran away miscarriage
The Sims,thesims,PugMaci156,2024-07-06T13:08:54,2024,22,New to The Sims building. Can anyone help?,new sims building anyone help
The Sims,thesims,azizidesign,2024-07-06T13:25:22,2024,9,WCIF this pose? I clicked on the link from a thread but it led to nowhere :/ Thanks in advance for any help!,wcif pose clicked link thread led nowhere thanks advance help
The Sims,thesims,Gametastisch,2024-07-06T13:49:20,2024,30,Bright Victorian House | NO CC | EA ID ParadiseBeach90,bright victorian house cc ea id paradisebeach90
The Sims,thesims,NationalAmount3387,2024-07-06T14:00:40,2024,2,PlayStation sims,playstation sims
The Sims,thesims,RZovo,2024-07-06T14:03:52,2024,1,Ranting about the Sims,ranting sims
The Sims,thesims,Zebra_Electrical,2024-07-06T14:08:24,2024,9,Willow Creek Library (links in comments),willow creek library links comments
The Sims,thesims,Hot_Meat8358,2024-07-06T14:31:16,2024,7,Why isn’t my sim transforming into a vampire??,isn’t sim transforming vampire
The Sims,thesims,RestlessRhys,2024-07-06T14:43:48,2024,7,I made this picture of my sim my playlist cover,made picture sim playlist cover
The Sims,thesims,NoseEnvironmental274,2024-07-06T14:49:04,2024,2,Give me a storyline!,give storyline
The Sims,thesims,regshowguy,2024-07-06T14:54:38,2024,2,i will pay someone to make my sim in sims 4,pay someone make sim sims 4
The Sims,thesims,yokkiru,2024-07-06T14:55:24,2024,2,My sims 4 is closing every time i press 'new game',sims 4 closing every time press new game
The Sims,thesims,JamieYoungL,2024-07-06T16:43:12,2024,129,"My sims just got married, These are Their Pre-wedding photos :)",sims got married prewedding photos
The Sims,thesims,Biscuitbear111,2024-07-06T16:54:49,2024,18,Why do they go outside to take a picture,go outside take picture
The Sims,thesims,iNoxiar,2024-07-06T17:32:11,2024,1,Help. PS5 sims 4 build Camera.,help ps5 sims 4 build camera
The Sims,thesims,Itchy_Ad6452,2024-07-06T18:25:46,2024,2,What should I name her and what should her story be?,name story
The Sims,thesims,ayoung446,2024-07-06T18:38:46,2024,5,Get rent world not loading,get rent world loading
The Sims,thesims,Starvixicek,2024-07-06T19:24:48,2024,2,Best moment in The Sims 4🥰,best moment sims 4
The Sims,thesims,No-Highway1086,2024-07-06T19:39:32,2024,1,Spinning a wheel to create my sim 😳.. I DID NOT expect these results!😱|#...#sims4,spinning wheel create sim expect resultssims4
The Sims,thesims,Sweetheart213119,2024-07-06T19:51:52,2024,246,I need my sim to stop laughing hysterically,need sim stop laughing hysterically
The Sims,thesims,Winter_Whole,2024-07-06T20:01:55,2024,8,Help the baby keeps teleporting,help baby keeps teleporting
The Sims,thesims,lesserasimz,2024-07-06T20:14:41,2024,47,redid another one of my old sims💕,redid another one old sims
The Sims,thesims,DeadShoot-1311,2024-07-06T20:50:59,2024,7,Outgoing sims can introduce to famous sims?,outgoing sims introduce famous sims
The Sims,thesims,Creative-Top-9247,2024-07-06T20:58:25,2024,1,Bug? No traits showing up so i can't proceed with the game,bug traits showing cant proceed game
The Sims,thesims,miababy346,2024-07-06T21:34:50,2024,2,looking for laptop recommendations,looking laptop recommendations
The Sims,thesims,lovergirl66471,2024-07-06T21:38:10,2024,1,I can’t get G shade to work,can’t get g shade work
The Sims,thesims,MathematicianNo8704,2024-07-06T21:50:57,2024,66,I built a church where you can get married + explore some hidden stuff in the basement,built church get married explore hidden stuff basement
The Sims,thesims,Remarkable_Sweet_333,2024-07-06T23:50:10,2024,19,Yeah... I ended up chicken out.,yeah ended chicken
The Sims,thesims,rebelcapybara,2024-07-07T00:48:09,2024,1,PLEASE HELP: Red X’s,please help red x’s
The Sims,thesims,OiMyGiblets,2024-07-07T01:02:07,2024,90,Just another typical high school fire drill.,another typical high school fire drill
The Sims,thesims,Thalypen,2024-07-07T01:12:00,2024,1,My package does not appear in the library,package appear library
The Sims,thesims,Starspangledass,2024-07-07T01:49:11,2024,8,Dock and Island Paradise,dock island paradise
The Sims,thesims,OkPage5617,2024-07-07T02:18:23,2024,1,Does hard drive affect Mod performance? SSD VS HDD,hard drive affect mod performance ssd vs hdd
The Sims,thesims,Potatokey03,2024-07-07T02:58:59,2024,2,"Sims cc, mods and male clothes",sims cc mods male clothes
The Sims,thesims,Curious_Big2995,2024-07-07T03:20:22,2024,9,What should I put in this space?,put space
The Sims,thesims,Jojkou,2024-07-07T05:07:06,2024,6,The Sims 4 what is going on?,sims 4 going
The Sims,thesims,julianewww,2024-07-07T06:00:23,2024,51,"Just played The Urbz, Sims in the city for the first time",played urbz sims city first time
The Sims,thesims,Imaginary_Map_2278,2024-07-07T07:26:42,2024,11,"Im build mode, why does it say that im missing build mode requirements for my lot",im build mode say im missing build mode requirements lot
The Sims,thesims,AccomplishedRegret63,2024-07-07T07:48:42,2024,1,Dose anyone know how to get /where this aspiration is from,dose anyone know get aspiration
The Sims,thesims,Previous_Return7024,2024-07-07T10:28:44,2024,1,Should I get Cats and Dogs or Parenthood?,get cats dogs parenthood
The Sims,thesims,Gloomyguavalover69,2024-07-07T10:39:59,2024,60,Is there a way to freeze a sim completely in sims 4 ?,way freeze sim completely sims 4
The Sims,thesims,EntrepreneurFit3349,2024-07-07T11:02:15,2024,1,Neighbours on sims free play,neighbours sims free play
The Sims,thesims,speaknoow,2024-07-07T12:16:02,2024,8,i don’t think she’s in her best state of mind,don’t think she’s best state mind
The Sims,thesims,smoothhoperatorr,2024-07-07T12:41:25,2024,1,The Sims 3 download on Lenovo.,sims 3 download lenovo
The Sims,thesims,payalpatidar,2024-07-07T13:02:36,2024,5,Need suggestion,need suggestion
The Sims,thesims,Interesting-Leg-6499,2024-07-07T13:19:13,2024,5,Cottage living mushrooms,cottage living mushrooms
The Sims,thesims,hunni93,2024-07-07T14:25:02,2024,63,My 2nd time achieving this!,2nd time achieving
The Sims,thesims,Super-Shallot-8597,2024-07-07T15:02:55,2024,6,My twin sims < 3,twin sims 3
The Sims,thesims,mabelwaspmincer,2024-07-07T15:10:22,2024,1,Sim can't use vacation days?,sim cant use vacation days
The Sims,thesims,Crafty_Clothes_906,2024-07-07T15:25:27,2024,6,Working on slowly rebuilding my sims world because mcc overpopulated it…this is goth house for gen 2 and 3 of the goth fam,working slowly rebuilding sims world mcc overpopulated it…this goth house gen 2 3 goth fam
The Sims,thesims,SatisfactionRich5493,2024-07-07T15:46:29,2024,2,How to fix this window?,fix window
The Sims,thesims,Disastrous_Matter252,2024-07-07T15:46:52,2024,1,The Sims doesn't satisfy me anymore!,sims doesnt satisfy anymore
The Sims,thesims,Inevitable_Target_,2024-07-07T15:49:47,2024,1,Trying to make the cute npc fall in love with me and the mom isn't helping,trying make cute npc fall love mom isnt helping
The Sims,thesims,SmartRgrl3251,2024-07-07T16:28:16,2024,52,Toddlers say the darndest things…,toddlers say darndest things…
The Sims,thesims,animalcrackersinm,2024-07-07T16:56:00,2024,5,"Moved out sims still in... taskbar? I'm not sure how to even search this so I'm sorry if a bunch of people already asked. The four greyed out were moved out via manage worlds. Clicking ""bring ___ here"" does nothing.",moved sims still taskbar im sure even search im sorry bunch people already asked four greyed moved via manage worlds clicking bring nothing
The Sims,thesims,Hairy_Maize_3699,2024-07-07T17:02:27,2024,1,What computer do you use?,computer use
The Sims,thesims,Vampriss2024,2024-07-07T17:51:45,2024,3,Please help me!!!,please help
The Sims,thesims,First_Variation5171,2024-07-07T17:55:34,2024,2,How could I change the language?,could change language
The Sims,thesims,ElectricalKiddo,2024-07-07T18:01:20,2024,27,I love these two so much,love two much
The Sims,thesims,TheValectro,2024-07-07T18:08:07,2024,10,Rock Ridge Canyon Glimmerbrook Makeover. Gallery ID Kaotik-Insanity,rock ridge canyon glimmerbrook makeover gallery id kaotikinsanity
The Sims,thesims,Neatasapeach-99,2024-07-07T18:08:09,2024,1,No option to publish book.,option publish book
