Subreddit,Year,Month,Text,Created_utc
GTAV,2020,1,[deleted],1577837549
GTAV,2020,1,Uhh so I just decided to come around and do the revolver treasure hunt. I found all the clues (5/5) and proceeded to claim the revolver but as I was flying I was kicked from the session and now it’s gone will I get the emails to do it over or did I just lose my chance at 250k lol. I also went into a new session and everything is gone. I haven’t gotten an email yet and the treasure icon at the beach is gone,1577837581
GTAV,2020,1,2 wolves 1 bullet,1577838231
GTAV,2020,1,Welcome to 2020.,1577838372
GTAV,2020,1,"i know for a fact i’m not the only one who’s aware of it but knowing that the game’s been out for years now, don’t you think rockstar could’ve at least considered taking the time to change up the npc’s appearance? you know, making them actually look weather ready instead of wearing shorts and flip flops outside while a blizzard is active. is there a reason as to why they don’t do that? it’ll take too much time to model each and every npc? they’re too occupied looking at other stuff? afraid that updating them every time will take up data? or simply they just don’t got time fo dat??? what do you guys think",1577839621
GTAV,2020,1,I’m having problems with FPS while running an RTX 2060 and i5 8600k. Could the snow be an issue? Running on ultra and sometimes dropping to 40 FPS.,1577842079
GTAV,2020,1,"PS4 ONLY 

ALL TRUCKS ARE ALLOWED 

ADD FLRyanYoutube

MEET AT THE AIRPORT",1577842215
GTAV,2020,1,Anyone want to add me as a freind and do the casino heist I have it all set up just have to find someone else 50/50 payout,1577842463
GTAV,2020,1,"So in SP when I go in a characters garage and go to use a special vehicle, only the Elegy pops up? I'm using the same account I was using for 360 a couple years ago, which had quite a few special vehicles.

My friend has done the same, used a 360 account from a few years ago on his XBone, except he has all the special vehicles showing up. Am I doing something wrong here? Idk what to do.",1577842612
GTAV,2020,1,"I got the discount and got 10% to legendary Motorsport, does it apply to any car I buy after purchasing or do I have to find it somewhere?",1577844032
GTAV,2020,1,I’m looking for a mission with a party in the end scene,1577844532
GTAV,2020,1,I know you can do it on online but I can’t seem to find any way to open them on story mode. Is there any mod that allows me to open the doors?,1577845283
GTAV,2020,1,Mission kind of accomplished,1577845472
GTAV,2020,1,My game was running great on the bank mission and the first part of the driving mission with Franklin but after we cut through an alley  all the textures stopped loading and then the game crashed. When I reloaded the game it was super slow and I dont know what to do. PLEASE HELP.,1577845520
GTAV,2020,1,[deleted],1577849950
GTAV,2020,1,[deleted],1577852584
GTAV,2020,1,In menyoo I picked bunker then it sent me to gta online then to story mode to load it up will i get banned?,1577854361
GTAV,2020,1,[deleted],1577854417
GTAV,2020,1,[deleted],1577854484
GTAV,2020,1,"So with a keyboard and mouse, you can change the sprint key to whatever you want or even leave it blank. How do you do the same with an xbox controller on pc?",1577855536
GTAV,2020,1,"I cannot find any of the hidden packages underwater. im a bit confused as to why. they simply are not there. i tried 3 different locations. 

&amp;#x200B;

im on xbox 360",1577856210
GTAV,2020,1,when I move my mouse to look around its choppy and isn't smooth like it once was. I tried changing my mouse input method and that din't help.,1577856484
GTAV,2020,1,I cant progress after the Franklin &amp; Lamar mission.,1577859571
GTAV,2020,1,Can i play gta online on my ps4 with my brother on pc?,1577860997
GTAV,2020,1,Stupid griefers they never learn,1577861570
GTAV,2020,1,Banshee 900r,1577861602
GTAV,2020,1,Its an investment,1577862200
GTAV,2020,1,"A post that has since been deleted that talks about a Trailer release for GTAVI, which supposedly would take place at the PS5 Reveal Conference in February. Sounds cool even if it is fake to me.",1577862308
GTAV,2020,1,"Just join a public lobby and when you're loaded in go to your settings, network settings, and click test NAT type. Let it run and when it's done go back into the game and you'll see you're by yourself. You can even invite friends and have them work with/for you",1577864275
GTAV,2020,1,A couple months ago this happened on a stunt race I designed.,1577866413
GTAV,2020,1,[deleted],1577869017
GTAV,2020,1,[removed],1577879130
GTAV,2020,1,Holiday cheer,1577882842
GTAV,2020,1,"Question 1 what is the easiest way to obtain a stockade in story mode

Question 2 is it possible to store in a player purchased garage

I need the Stockade because I'm attempting to record a rockstar editor thing and I cannot record it in online which I own a stockade in online unfortunately.",1577882879
GTAV,2020,1,"Hey, I got quite weird question. I have GTA V activated on social club, I would love to buy it again on Steam, am I able to connect my social club with steam and play GTA Online etc. with my current saved player, settings etc.?

Thanks.",1577883822
GTAV,2020,1,Recently i started playing GTA V for the first time in my life. I was using the LCN ''market'' but i noticed that when i tried to open a company stock information (eg. Debonaire) it opens the stock information of another company (GoldCoast) is this normal or is theis any bug?,1577885126
GTAV,2020,1,"I recently got the terrorbyte for the oppressor mkII and I'm wondering if I should get the turret station.

I've watched videos going over the turret station but they haven't helped me decide",1577885205
GTAV,2020,1,I don't have a facility Im just looking for someone to do the bogdown glitch with,1577885583
GTAV,2020,1,How do I make a job for the gamemode where 1 person has a sniper and is supposed to try and kill the runner with things like falling vehicles?,1577888521
GTAV,2020,1,I think I hit something on the way to Paleto. You guys think my car looks fine?,1577888820
GTAV,2020,1,"Do a patrol and grapeseed they said, it would be fun they said. Meth heads they took my doors and hood again",1577889439
GTAV,2020,1,"With the current offer of receive 2.7x the amount normally received, I bought 2x $500K, and only got 1 $800K",1577889475
GTAV,2020,1,I’ve got the sixth sense,1577890486
GTAV,2020,1,Highway Patrol with LSPD Buffalo,1577890857
GTAV,2020,1,[deleted],1577890982
GTAV,2020,1,"I just started recently,  I’m lvl 16. Got a decent hotel, driving a Zentorno and sitting on 1mil due to shark cards. 

How can I “invest” my remaining 1mil to help me make more money. 

A lot of the heist properties are 2mil+. Every time I try to join heists through the cell phone, I get kicked for being too low.",1577891154
GTAV,2020,1,"Am I the only one to find it a bit odd that the vehicle that the LSPD Cruiser, Sheriff Cruiser, and taxi use doesn't have a name nor civilian counterpart. The closest thing to it is the stainer and they don't even look that much alike.",1577891462
GTAV,2020,1,[deleted],1577891599
GTAV,2020,1,[deleted],1577891650
GTAV,2020,1,I was sent a video by a friend and as far as i can tell it looks like GTA 6 to me. I could be wrong. Can someone confirm this?  [https://youtu.be/hkZkag4kr0w](https://youtu.be/hkZkag4kr0w),1577891837
GTAV,2020,1,[deleted],1577893680
GTAV,2020,1,Can people please help me complete this heist? The setup is complete it’s just my team always screw it up! Please?,1577895338
GTAV,2020,1,[deleted],1577895400
GTAV,2020,1,"Is NVR+PSRA the best graphics mod so far?

And what is the most realistic car pack? I don't really want to install them one by one. Can Redux and NVR PSRA coexist? Do you have any other mod suggestions? I finally have a proper machine and want to squeeze GTA to its max.",1577895766
GTAV,2020,1,[deleted],1577896275
GTAV,2020,1,Does it take everyone like 5 mins to load in to GTA online? It seems retarded long. I have pretty quick load times with every other game.,1577896535
GTAV,2020,1,[removed],1577897048
GTAV,2020,1,"Grand Theft Auto 5, but I invade Lifeinvader",1577898213
GTAV,2020,1,"In the taxis there's a sign that shows prices, are these prices accurate or just decoration, it sounds stupid but gtaV has some amazing details that you never know.",1577898734
GTAV,2020,1,I can’t stay online for more than 2 minutes before I get kicked out saying network error. My internet is fine as my kids are playing other games online.,1577901318
GTAV,2020,1,"I own 3 office garages, but I only use one. How can I get rid of them?",1577903137
GTAV,2020,1,"What is up with me finding skilled players, damn his k/d ratio is so good",1577904230
GTAV,2020,1,[deleted],1577906106
GTAV,2020,1,"I’m new to gta... I have installed almost 5 car mods and everything was fine, until today all cars just started sliding on the roads and not only the modded ones. Cars just don’t get a grip on the road .... help",1577906575
GTAV,2020,1,"I have around 200k right now. I want to be able to buy a high end office for 500k for the new year deal, so what are some of the best ways to make 300-400k in about 2 hours?
Thanks in advance.",1577908151
GTAV,2020,1,"I'm going to host a car meet on friday 3rd of january, starting at 5/6pm UK time. Xbox One, if you're interested then drop your gt below and I will add you.",1577909349
GTAV,2020,1,[removed],1577910522
GTAV,2020,1,I am too late to join the fun?? PS4 player here.,1577911098
GTAV,2020,1,GUYS I FOUND LESTER IRL!!,1577911367
GTAV,2020,1,You can select your rc tank as a personal vehicle in the doomsday heist,1577911519
GTAV,2020,1,I am wondering if I can play on the same rockstar account on both my Xbox and Pc. My lil bro just got it on his Xbox and I’m wondering if he can sign into my account and play on it while still being able to play it on my PC (not at the same time obviously),1577911630
GTAV,2020,1,"GtaV announced that ""players have much to look forward to in these final few days of the year, including gift packages on New Year's Eve and Day alike."" When do I get these gifts?",1577911953
GTAV,2020,1,Forgive me for the watermark but the truth must be said,1577912196
GTAV,2020,1,"I haven’t complete the gta v story mode yet, I’m nearly finished. But for some reason no missions or S&amp;F missions are showing on any of the players. I’ve done the taxi skip thing and the save game but nothing is popping up. Also I have been playing for around a day and still nothing. Any help?",1577912539
GTAV,2020,1,"How should I do the diamond heist, what setups and entry way for the big con?",1577915495
GTAV,2020,1,"I am looking to get gta v to play with my nephew but he is on ps4 as I am on pc, can we play together?",1577916736
GTAV,2020,1,[deleted],1577917442
GTAV,2020,1,"I just completed the diamond casino heist, how do I start the prep again?",1577917823
GTAV,2020,1,"Is it true that Rockstar checks all the money you've earned in the month, sums it up and see if it's equal to how much money you currently have ? (To catch hackers) Or does she do it every day?
I received 10k of money from a hacker (when I was eating), than, immediately I left the session.
Will I be banned? It will be today that rockstar will verifies my money and see that I received money from hackers or will be in the final of the month?

(Sorry about my english)",1577919837
GTAV,2020,1,"Haven’t played the main game in a while and have booted it up a few times and now most the map is showing up undiscovered, is this normal and has anyone else had this problem?",1577920178
GTAV,2020,1,"Ok so for Christmas I was given $60 which I said was for Destiny 2 but I spent it on GTA V and Rainbow 6 and other games. I've started to feel really guilty about what I've done and I just wanted to know what I should do because right now I'm going to get it refunded and spend the  money on what is was supposed to be spent on.

If it helps I'm 16.",1577920560
GTAV,2020,1,"fake, lester doesn't smile 🧐",1577922145
GTAV,2020,1,"I’m super broke I have $0. Who would like to hire me to do jobs? 
Ps4",1577923233
GTAV,2020,1,"I got this output while trying to get 123-764-5112 for the phone call and couldn't find it on any sites, anyone have any idea what it means? I'm guessing it's a hint at the Mount Chilliad Mystery?

https://preview.redd.it/bp7fl8qlg9841.png?width=1017&amp;format=png&amp;auto=webp&amp;s=7976ffd5dc4f41bbe23de03f3cd202d407cf12ac",1577925332
GTAV,2020,1,Does anyone know how to get the dinka kanjo? It should cost 580k on ssa but its not there,1577926500
GTAV,2020,1,GTA Wasted Be Like...(Subscribe if you like!),1577927894
GTAV,2020,1,[deleted],1577927918
GTAV,2020,1,[deleted],1577928004
GTAV,2020,1,The randoms mind is the most complex and erratic thing in gta (he used my akula to do this),1577929203
GTAV,2020,1,GTA V moments [God I love the AI in this game],1577929653
GTAV,2020,1,The moment when your character has feelings,1577931663
GTAV,2020,1,[deleted],1577931837
GTAV,2020,1,Is it possible to share a modded map with a friend?,1577932372
GTAV,2020,1,[deleted],1577932809
GTAV,2020,1,"Hey Bryony, you stupid fucking bitch!!! Lose my number",1577932866
GTAV,2020,1,What should I buy?,1577932878
GTAV,2020,1,This new update has ruined the inside horse track. It doesn’t payout for shit now,1577933565
GTAV,2020,1,[deleted],1577933731
GTAV,2020,1,Is it worth it to get more machines,1577933799
GTAV,2020,1,[deleted],1577933962
GTAV,2020,1,LS Cop in training.,1577935501
GTAV,2020,1,I have completed all heists offline and have roughly 30mil. I want to put it all on stocks. Can anyone help in choosing which one I have to buy?,1577936215
GTAV,2020,1,I started playing this game last year (2018) when I downloaded it around Black Friday. I have been grinding online to make money and selling supplies and doing my work has been a struggle. I have been attacked almost every time I was doing my work by people in Oppressors. I barely make money despite all the grinding I do in this game. When will griefers ever understand that destroying people’s stuff is so wrong and doesn’t profit them.,1577936738
GTAV,2020,1,"Looking for someone willing to run the bogdan problem heist with me or any heist
Feel free to Add my psn (FluffyMugen)",1577937225
GTAV,2020,1,My game keeps crashing on the FIB heist everytime i get to the point of leaving the building please someone help me its so frustrating I've played this mission for 7 times and it charsed 7 times i am so pissed off.,1577938381
GTAV,2020,1,[removed],1577938688
GTAV,2020,1,looking just for fast cars and stuff. anyone know?,1577939567
GTAV,2020,1,Is the elegy a good car for customizations like does it have a lot if options?,1577939668
GTAV,2020,1,Hey I’m new to the group but I wanted to see if anyone’s looking to do the bogdan heist with me so we can make some cash :D if you have it as well please dm me so we can get rich together,1577941051
GTAV,2020,1,Story mode. Car in garage (not my personal car) died in my personal car. Goes home. Car not there. No car symbol on map. No impound symbol on map. ??,1577942435
GTAV,2020,1,Am I the only one who didn't realize Del perro Pier had a police station?,1577942444
GTAV,2020,1,"Ive gotten back into gtav and now i am constantly getting put into solo public lobbys, like when i buy something i instantly have everyone else leave, is there a way to stop this bc i dont want solo lobbys

&amp;#x200B;

Thanks.",1577942586
GTAV,2020,1,"Looking for people who don’t mind driving/flying long distances in heists and other missions etc. I really get tired of it lol, just hmu !!",1577944360
GTAV,2020,1,I've been playing since 2013 and I only just now realized noose had an LSIA branch and building,1577944429
GTAV,2020,1,Haven’t found the post the one person posts giving the heads up on all that good stuff,1577944787
GTAV,2020,1,Whoever added the spawns for the Fort Zancudo fire trucks was definitely on something because they're placed erratically,1577945369
GTAV,2020,1,[deleted],1577949260
GTAV,2020,1,That’il buff out,1577951184
GTAV,2020,1,[deleted],1577951367
GTAV,2020,1,"I’m sure this has been asked several times, but I couldn’t find a solution. 

There’s a glitch I encounter whenever I open the game, every time I try logging in the game makes me replay the tutorial mission (where you rob the bank), is there a known fix for this?

For context, this happens primarily when I switch wifi networks.",1577951775
GTAV,2020,1,It happened again,1577954757
GTAV,2020,1,"So, I'll do my best to make this short and sweet. I'm playing in a GTA V FiveM server that has recently transitioned to TokoVOIP and I'm having some troubles broadcasting over the radio. Namely, the radio system in TokoVOIP is push to talk, bound to CAPS LOCK. I've tried multiple macros through Logitech Gaming Software and AutoHotKey but I cannot seem to get them to work. Anything repeating, even with a delay of 5ms, cuts in and out. Anything with a downpress, delay, release, just doesn't register in the game. Even holding the key down myself or taping it down, the radio deactivates when I tab out of the game, even in windowed mode. Help, tips or suggestions would be greatly appreciated!",1577955232
GTAV,2020,1,[deleted],1577955528
GTAV,2020,1,"¿Aren't people playing races in gta v online?
 I try to play races and it doesn't match me with anyone, ¿is it normal? I'm from PC",1577958009
GTAV,2020,1,To see the UFO people say you need to complete 100% of story. Is this just the main missions?,1577959601
GTAV,2020,1,[deleted],1577959875
GTAV,2020,1,I hunt the NPCs down that hit me,1577963065
GTAV,2020,1,Cool screenshot I got in Director Mode,1577963238
GTAV,2020,1,The smoothest drift I ever did. I freaking love the snow,1577964815
GTAV,2020,1,I didn't know she had a twin! 😂,1577967826
GTAV,2020,1,"I logged in for the first time in years onto my PC account and to my surprise, I have maxed out all of my stamina and managed to reach a rank of 256. There are a number of vehicles on the garage that I'm 100% certain it is not mine.

&amp;#x200B;

What can I do to reset this? I don't want to risk getting banned.",1577970615
GTAV,2020,1,"So i don't think 7910.5% is a norm percentage , im really confused here. Can someone help me understand this and probably the community too",1577974773
GTAV,2020,1,When dude perfect rides a bike then crashes:,1577975253
GTAV,2020,1, [https://www.youtube.com/watch?v=SoUmkHeYvjM](https://www.youtube.com/watch?v=SoUmkHeYvjM),1577976176
GTAV,2020,1,"After changing some settings reflections look jaggery and pixelated. Truly disgusting. I tried reinstalling the game, settings the graphics to default, nothing helps. I have a friend with the same issue and he doesn't know how to fix it either, please help me solve it!",1577977116
GTAV,2020,1,[deleted],1577977657
GTAV,2020,1,"If I cheat with the cheat code bar on PC, will it make my game worse? 



Why do I think this? I used to play on Xbox 360 and I used tons of cheats. Then it just got worse and more laggy on GTA5.",1577979289
GTAV,2020,1,Come join this amazing group in a gta v ps4 role play need more people but that also means it will be easier to move up in ranks and get ahead before others do in the ranks!,1577979957
GTAV,2020,1,"It was on sale and i wanted it so why not? Sorry about the low quality but i don’t have screen recording software, gotta get OBS.",1577979961
GTAV,2020,1,Paleto Bay sheriff station has a lot of vehicle spawns around back you can also find a ambulance,1577981289
GTAV,2020,1,I play offline and I don't know how to invest in stocks. I have also completed all the Lester assassinations. Plz help me,1577982017
GTAV,2020,1,[deleted],1577982264
GTAV,2020,1,"Anyone know some ways to get rp, afk or fast preferably",1577982642
GTAV,2020,1,[deleted],1577983103
GTAV,2020,1,I feel like Lester is supposed to be rich from the 500-600k that he takes.,1577983619
GTAV,2020,1,"I just started an instagram for custom cars on gta5, it's called _gtacustoms_ if you could follow I would appreciate it. Also if anyone has any photos they would like me to upload then message me on insta. Thankyou",1577984726
GTAV,2020,1,[removed],1577985153
GTAV,2020,1,Wish we had snow events through the winter season..,1577985679
GTAV,2020,1,no way!!!!!!!,1577988555
GTAV,2020,1,"For some reason (this only happens in story mode) almost every vehicle that spawns is black, very rarely will there ever be a white or red car but that's it. Even vehicles that aren't supposed to even spawn black are black. This doesn't seem to affect my game at all, it's just annoying. Any fixes? (Also I play on PC)",1577992483
GTAV,2020,1,Gas Gas Gas Initial D,1577994045
GTAV,2020,1,[deleted],1577995421
GTAV,2020,1,Rockstar copies Lego star wars,1577995474
GTAV,2020,1,"Me and my friend have been trying to go through all the heists in GTA but our biggest problem ,like most others, is that we can’t really find anyone that stays long enough for the heists
If you’re interested ,we are currently doing the prison break and are done with one out of three setups

P.M me and I’ll give you my tag in GTA,I hope I’ll see you soon!",1577995904
GTAV,2020,1,"Every time I claim my GTA loot from twitch prime it never shows up, claimed one recently about seven or eight days ago and it hasn't showed up. I think it might be because I skipped the online tutorial, but that would be stupid. Anyone got any answers ? (I play on PC)",1577995979
GTAV,2020,1,[deleted],1577996323
GTAV,2020,1,Why are the servers down?,1578001815
GTAV,2020,1,Uhh Trevor What Did You Do When I'm Gone.....,1578002113
GTAV,2020,1,What's everyone's thoughts on the new iFruit Radio update?🔥🤔,1578003282
GTAV,2020,1,[deleted],1578003449
GTAV,2020,1,I don't know which gun is better and I need help so is the Unholy Hellbringer or Widowmaker,1578003467
GTAV,2020,1,[removed],1578004091
GTAV,2020,1,"So after a heist setup, I had a long black loading screen so i decided to reset my game (xb one) . would it save or not and would it affect my all in order progress",1578005672
GTAV,2020,1,"I got a new gtx 980 for christmas and just installed it today. It has caused me problems all over, but this is the only one I can't seem to fix. 

The game had always run fine on the 1 980, but now that I have a second I have problems. I try to open up gta v, but in the loading screen the screen just flickers all over and ultimately works its way up from the bottom until I can't see anything, and then it crashes. I get the error message ""ERR\_GFX\_D3D\_INIT"", and I've googled around trying to solve that issue and tried everything I could find, but I'm ultimately resorting to re-installing the game.

Has anyone experienced something like this and/or have an idea as to how I could fix it? All help is greatly appreciated :)",1578006311
GTAV,2020,1,[deleted],1578007620
GTAV,2020,1,I had a upgraded car with Franklin and does while driving it. I went to the impound yard and two random cars where in there. How do I get my upgraded car back.,1578007803
GTAV,2020,1,"Ahh, second day of owning the game, getting modders galore!",1578007854
GTAV,2020,1,One of my closest race wins,1578008234
GTAV,2020,1,Im trying to get the A New Perspective trophy and when i came back on gta 5 i noticed the first person stats had been reset from a couple of hours. So i was wondering if anyone knew wether the overall time is kept and the visible stats are just for show?,1578009017
GTAV,2020,1,Zhaba is toad in Russian but written in English Letters.,1578009835
GTAV,2020,1,[deleted],1578010986
GTAV,2020,1,What is the Zhaba even good for?,1578011075
GTAV,2020,1,Anyone else having issues getting online? Im on xbox and me and my buddies cant log on,1578011541
GTAV,2020,1,Sunny with snow on the ground... glitch in the Matrix,1578011763
GTAV,2020,1,[deleted],1578012896
GTAV,2020,1,"As the title says whenever I launch GTAV it prompts me to sign in to social club as I have been logged out. This wouldn't be a big deal, but whenever I put in my login details and then do the captcha, after I hit sign in the captcha resets and it tells me to verify that I am not a robot. The captcha itself works fine, and I've checked on the website and I have the correct login information. I have already tried deleting my Rockstar Games folder in my Documents but it didn't do anything. Any suggestions are welcome.",1578012897
GTAV,2020,1,"XBOX/PS4 is self explanatory and I can't see it causing any major problems, but PC/Console is where the problems seem to start. However, the problems with PC/Console can mainly be fixed.

Problem 1: Balance

Using KB+M gives a huge advantage in combat over console players, since you can move the camera much quicker and more accurately.

Solution: Input Lock 

Ignore any inputs from a keyboard/mouse and only allow for inputs from a controller.

&amp;#x200B;

Problem 2: Modding On PC, modding is a much larger problem than on console. This could cause the modding problem to move over to Console servers.

Solution: Seperate Servers

Create the option to join Cross Platform servers so that people who want to avoid modders or PC players can join non cross platorm servers. In Cross Platform servers, the PC message chat would be disabled, but voice chat would work as normal. If you created a private session with Cross Platform servers on, the private session would be a Cross Platform session. If Cross Platform servers are on, you can also join missions with PC players.

&amp;#x200B;

These are all the problems I could think of. Reply to this thread with any problems you've thought of, and I'll think of a solution. Thanks for reading this post!",1578014359
GTAV,2020,1,So I only have 50k and I really need to get an appartment. What are some fast ways I can get some money?,1578014517
GTAV,2020,1,[deleted],1578015038
GTAV,2020,1,[removed],1578015292
