Subreddit,Year,Month,Text,Created_utc
thesims,2022,1,"#**VOTE FOR WEEK 118: Home for the Holidays [HERE!](https://www.surveymonkey.com/r/DF653YQ)**


######**Winners**

**Week 117: A-Contemporary A-Frame Cabins!**


**🥇1st Place (48.28% of the votes):**

&gt; /u/DaphPoke - [Deconstructed A-Frame - TS4](https://imgur.com/a/ULSgwDI)


**🥈2nd Place - (44.83% of the votes):**

&gt; /u/ZinniaSim - [Daisy Hovel A-Frame House  - TS4](https://imgur.com/a/W87srhv)


**🥉3rd Place - (41.38% of the votes):**

&gt; /u/gneissity - [Stoney Hill Retreat - TS4](https://imgur.com/a/zPhM4es)


See all results [here](https://www.surveymonkey.com/results/SM-MK5H7H3C9/).
____



#**Introduction for Newcomers**

Every two weeks the challenge will change, We’ll design a different house or interior of a room and we might even sneak a few Create-A-Sims in to break it up a little.

Certain challenges will have a monetary limit, some will be spend as much as you like/can to impress.

We try to make it so everyone can participate in all challenges no matter which Sims game you have and which expansion/stuff packs you have.

If you would like to see some of our past challenges, please check out [THIS](https://docs.google.com/document/d/1qo2P0G5JdfOxMXutRC3YPI5YFQ4yHSmXOGwuDOAUtSE/edit) link.

____


#**Bi-Weekly Build Challenge, Week 117: Around the World; Tudor Homes!** 

Tudor homes look like something straight out of a fairytale, with a charming style that takes its cues from medieval English architecture. Their distinctive wood-faced facades and white stuccoed walls were popular with well-to-do homeowners from the the mid-19th century until WWII. Tudor homes are characterized by their steeply pitched gable roofs, playfully elaborate masonry chimneys, embellished doorways, groupings of windows, and decorative timbering. Unlike the centuries-old homes they used for inspiration, Tudor homes are built with brick, not wood, and often have exposed-brick siding on their first floor. On the upper floors, the large sections of the siding are covered in white stucco, which is then accented with large, dark timber beams to create the illusion that the house is built on a wooden frame.  Inside, Tudor houses continue their historically-inspired motif with walls covered in a veneer of plaster and ornate, detailed wooden elements like wainscoting and trim. Like the exterior, Tudor ceilings are accented with dark, heavy wooden beams that run across a white plaster finish.

Residential &amp; vacation properties ONLY. Must be fully functional. (TIP: Consider using cheats to unlock debug/hidden items and to place objects more freely!)

***NOTE: Challenges are open for TWO weeks!***

_____ 

Reference Links -- 

* [1927 St Louis Tudor](https://imgur.com/a/Grp4o0c)

* [D.C. Tudor ](https://imgur.com/a/h30iAGV)

* [Oklahoma Tudor](https://imgur.com/a/BSL0r4F)

* [Portland Tudor](https://imgur.com/a/2v5Ss4t)



To submit an entry you must comment on this post and format your comment like this, **IF IT'S NOT IN THIS FORMAT IT WILL BE DISQUALIFIED:** 

&gt;*Your reddit username - Title of submission - Version info - unformatted link to photo or video*

Link to Gallery Download (Use #RedditBuildChallenge as a tag for ease!) You don't have to link to the Gallery, its only to make it easy for people to find if they want to download



#**Build Guidelines**

**Requirements:**

- One entry per person.

- Residential &amp; vacation properties only (NO apartments).

- No Photoshopping images.

- **CC allowed.**


#**Important Dates**

**January 16th**: Challenge Closes around 10pm EST. This deadline is the ""cut off"" for sharing submissions. The deadline is not when you should expect a new challenge to be posted. Winners will be announced when the next challenge goes live **(typically within a week of the deadline).**",2022-01-02 15:35:27
thesims,2022,1,Anyone has the link for this toilet/sink?,2022-01-02 15:48:55
thesims,2022,1,Does anyone has the link for this? i found only broken ones :(,2022-01-02 15:51:51
thesims,2022,1,I recreated some TS2 sims in TS4! (renders),2022-01-02 15:54:15
thesims,2022,1,I think I would enjoy cooking in The Sims 4 a lot more if the food looked as good as it does in Animal Crossing,2022-01-02 15:59:05
thesims,2022,1,[View Poll](https://www.reddit.com/poll/rucork),2022-01-02 16:06:25
thesims,2022,1,Another year of Sims 4 builds: this is all I built during 2021!,2022-01-02 16:32:13
thesims,2022,1,"I'm working on renovating my worlds, and removed all sims. But now I'm wondering how to add vendors, sages, service Sims etc? I know the game kind of generates new ones but is there any way to have some kind of control over which sims have these roles?",2022-01-02 16:53:24
thesims,2022,1,I posted my second YouTube video: modern Scandinavian lake cabin. Feedback is welcome,2022-01-02 17:03:22
thesims,2022,1,At 1:03 I started hearing Desperate Housewives music. Then googled and realized it’s the same composer for The Sims (Steve Jablonsky)!,2022-01-02 17:15:38
thesims,2022,1,Is sims 3 worth buying. Is it better than sims 4?,2022-01-02 17:23:06
thesims,2022,1,"so I've been watching the red plumbob videos recently and now i want to try out the older sims .can someone give me a comprehensive and tbh updated  guide on remastering those. sims 3 is a priority but sims 2 will also do.

some of posts i checked out are now 2 or 3 years old.",2022-01-02 17:42:27
thesims,2022,1,Arrived at Romance Fest to find these two unrelated townies. They talked all night.,2022-01-02 17:48:08
thesims,2022,1,"My first mermaid sim, &amp; the first time I’ve discovered these terrifying fish eyes in CAS | No CC | Gallery ID JimothySimothy",2022-01-02 17:50:39
thesims,2022,1,"I recently got a new computer and I have The Sims 2, The Sims 3 and The Sims 4.

I decided I wanted to install The Sims 3 first. I only got the base game when it first came out and I never bought any of the expansion packs. I was in senior year of high school so I was a little interested in this version but life happened and I stopped playing The Sims 3 and dived right into The Sims 4.

There's like 12 expansion packs!

&amp;#x200B;

Well, I didn't realize how many expansion packs there was and so I decided to get the Generations, World Adventures, and Late Night expansion packs and I FORGOT about the open world concept and no loading screens. The open world feature made me fall in love with The Sims 3 again and I love the ease of going to the Map View screen and then click on my Sim whereever they are and it's so easy. I love watching my Sim drive their car or bicycle or walk wherever and follow them. I am so sad that The Sims 4 does not have this feature. It just makes the gameplay smoother and enjoyable.

&amp;#x200B;

The second thing I forgot about was the color wheel! I loved rediscovering that you can create literally anything and create your own style and colors or patterns, not only with your Sims clothing/accessories but also the house! It made me re-inspired again but the only thing I noticed was as I was trying to build my house with using that color wheel tool, the game kept freezing on me and took forever to load, I don't know what that's all about but I am hoping to continue with the color wheel.

&amp;#x200B;

I am enjoying the new expansions so far. I've dabbled into the World Adventures one and it was cool going on vacation to Egypt and I liked the Adventures quests and having your Sim go on these quests and doing the puzzles and I am glad they have prompts to help you along with the quests so it's not too difficult. I like that you can call long distance and create friends from these faraway countries and build long distance relationships! 

&amp;#x200B;

I plan on playing The Sims 3 for awhile before I install the Sims 4 again. I got really bored with The Sims 4. So I am happy to play The Sims 3 and create new houses and stories and have fun again!!

&amp;#x200B;

Looking forward to buying the other expansion packs for The Sims 3",2022-01-02 18:07:41
thesims,2022,1,Decades Challenge - 1890s - Gen. 1 - II,2022-01-02 18:24:59
thesims,2022,1,Morty the kitten,2022-01-02 18:38:14
thesims,2022,1,Help! Steam won’t let me buy a full collection without the base game…,2022-01-02 19:16:05
thesims,2022,1,When you max out a career level and start another one,2022-01-02 19:47:20
thesims,2022,1,Don't know if a glitch or not but it's kinda cute lol,2022-01-02 19:50:28
thesims,2022,1,I tried creating a realistic sim. Meet Sophia,2022-01-02 20:00:05
thesims,2022,1,"Things ain't always as it ""sims""",2022-01-02 20:10:11
thesims,2022,1,"Hi all,
Issue is the same as title - I recently started to build dungeons for my Vampire Sim, but faced this bug.
I have 4 fridges on my lot, when I put food in fridge that is in main kitchen I cannot take it out in dungeon. When I click on certain thing on downstairs fridge my main Sim is just going upstairs to take it out, my prisoners sims are just stucking with bubble showing that they cannot walk there.
I'm using some mods but fridges are EA.
Is there any fix for that? Or is it just my issue?",2022-01-02 20:15:06
thesims,2022,1,i love the sims 3 graphics,2022-01-02 21:04:38
thesims,2022,1,[insert funny title about my bad builds],2022-01-02 21:34:24
thesims,2022,1,"So my female sim died due to grief (just had a miscarriage). She left her boyfriend/enemies with benefits and daughter..

Normally I'd quit the game, but.. I want chaos.
So now I'm thinking, who's marriage should Lazlo (current sim) destroy to take the wife? Who'd you choose?

And I'm so terribly sorry if my spelling or grammar is off. English is not my native language 🙈.",2022-01-02 21:34:25
thesims,2022,1,How is the Sims 3 Better than the Sims 4?,2022-01-02 21:36:15
thesims,2022,1,"I’ve been debating whether to purchase it or not, i’ve seen a load of mixed reviews about it. I have TS2 &amp; TS3 collection since those are my favourite. I’m not sure whether to try out TS4, it looks cool and ts4 tag on this reddit is tempting me but is it worth the money? 🤔",2022-01-02 21:37:22
thesims,2022,1,My Gen 10 Sim,2022-01-02 21:41:41
thesims,2022,1,this is fine,2022-01-02 21:50:04
thesims,2022,1,A Sims 1 Winter Build &lt;3,2022-01-02 22:21:19
thesims,2022,1,The Sims Castaway Stories Build,2022-01-02 22:23:02
thesims,2022,1,"Hello, so I made a vampire sim, and then he died minutes into the game due to a meteor while he was in china -.- I couldn't bring his grave with me for some reason. 

So since I had already saved this sim to the bin I decided to go to edit town and create a new household with just him and then merged him with the household I am playing with. 

but for some reason he is now an alien? like he still look the same and all except his eyes are all black, In CAS it says he is a vampire but in game he is an alien. 

So I wonder if there is a way to change him from alien to human in game?",2022-01-02 22:33:19
thesims,2022,1,i made bobs burgers!,2022-01-02 22:50:41
thesims,2022,1,"Cozy Starter Home - Under 20,000 Simoleons - Gallery ID: anglearchee",2022-01-02 23:06:01
thesims,2022,1,"A tree was struck by lightning and Moon died to fire, so I made my husband and I and she is haunting us. She's red cause fire...

https://preview.redd.it/gctfahc7xc981.png?width=800&amp;format=png&amp;auto=webp&amp;s=d20949046d11885742eced12e747c5988a79c407",2022-01-02 23:12:35
thesims,2022,1,Running a roadside car dealership at home. This has been a very fun game so far.,2022-01-02 23:36:12
thesims,2022,1,2021 MEGA SAVE FILE! (No CC),2022-01-02 23:47:01
thesims,2022,1,The problems of making the outside then the inside. I guess the welcome wagon will have to sit on the floor.,2022-01-02 23:59:08
thesims,2022,1,"I’m playing Sims 4 on PS4 and every time I hire a maid, they arrive as black female characters. Is that always the case? I always thought Sims were pretty inclusive and progressive with character traits and relationships, but this is super racist.",2022-01-03 00:20:20
thesims,2022,1,"&amp;#x200B;

https://preview.redd.it/v4iazuv2gd981.png?width=952&amp;format=png&amp;auto=webp&amp;s=74d183f2ad5f07f702dd668ff92da3d4e7fce9db",2022-01-03 01:00:37
thesims,2022,1,Does anyone know where to buy the game discounted I used to have almost all the packs and over the years they were lost but I really want to play again. EA has them of course but at full price I can’t justify it,2022-01-03 01:13:20
thesims,2022,1,"I'm going through my save's households, here are a few of the sims I've made!",2022-01-03 02:10:44
thesims,2022,1,"I gave in and finally bought Sims 3 on PC while it was on sale :) so far, I’m liking the open world aspect",2022-01-03 02:27:37
thesims,2022,1,"Athena's mother, Elsa Bjergsen, died from laughter, and now she's lost all control. But Athena has good things going in her life, like her fiancé Xavier and their son. Even though Athena didn't want kids, she puts a lot of effort to be a present mother as much as her sobriety allows.",2022-01-03 02:42:22
thesims,2022,1,"I have no mods, but my sim was able to have two wives, is she actually married to both of them? She eloped with one, and then got a text basically saying she proposed to the second and I was able to have her elope with her too. Has this happened to anyone else? Is it a neighborhood voting thing for the Free Love?",2022-01-03 02:55:34
thesims,2022,1,"Hello all. Ive been on this sub for awhile but haven’t played in forever.

I loved Sims 1 &amp; 2 but didnt play 3 at all. I recently bought a computer and wanted to start playing again but am feeling overwhelmed by the options/gameplay in Sims 4. 

I am wondering if anyone knows a good tutorial? For some reason I am not able to find it on the website/game. It says there should be one but Im not seeing it. Any suggestions?",2022-01-03 03:04:10
thesims,2022,1,No CC vs CC,2022-01-03 03:09:15
thesims,2022,1,I THINK TF NOT,2022-01-03 03:11:57
thesims,2022,1,sorry if this is already a popular thread. i tried to look and couldn’t find any.,2022-01-03 03:18:19
thesims,2022,1,Shouldn't A HEAD OF STATE Lot Trait Be Added JUST FOR special Residential Builds Like THIS ONE??,2022-01-03 03:22:49
thesims,2022,1,Rocketship One On The South Lawn Of The White House,2022-01-03 03:27:54
thesims,2022,1,"As We Have No Airplanes In The Sims, It Has Been Decided (In My Game At Least 😁) That The President Of The Universe Shall Travel By Rocketship &amp; Arrive &amp; Depart From Here",2022-01-03 03:32:19
thesims,2022,1,"I Turned This Downloaded CAR Dealership Into A ROCKETSHIP Dealership. When I Get The Rocketships Assembled, I'll Put It On The Gallery 😁",2022-01-03 03:37:54
thesims,2022,1,What Does This Square Denote?? The Location Of The Baby??,2022-01-03 03:40:53
thesims,2022,1,Tom &amp; Kris' New Toddler's Room (The Baby's Room Is Upstairs),2022-01-03 03:45:45
thesims,2022,1,Nothing to see here..,2022-01-03 03:46:46
thesims,2022,1,I Think I'll Have Tom &amp; Kris Hire Stephanie (Who's An Interior Designer) To See What She Can Do About This 🙄,2022-01-03 03:48:58
thesims,2022,1,I Did This With My PlayStation Sims More Than A Monrh Ago When I Was Among The Offline World. NOW I've Done It With My Xbox Sims 🤣😂,2022-01-03 03:55:17
thesims,2022,1,"I created 1940s dancers to work in my lot, ""Bourbon Street"", a jazz club that doubles as a ""fun club"" ;)",2022-01-03 04:00:25
thesims,2022,1,"When I load up my game, I get a pop-up telling me the wicked whims file is missing. I went back to check and the ""missing"" file is still in my mods folder. I've reinstalled it multiple times and nothing works. I only have it 1 folder deep and script mods are enabled in my settings. Does anyone know how to fix this?",2022-01-03 04:00:34
thesims,2022,1,I Suppose I Should've Said From The Outset That I Replaced The 1 Torrendi Tower Penthouse Tom &amp; Kris WERE Living In With THIS Penthouse,2022-01-03 04:04:50
thesims,2022,1,"&amp;#x200B;

https://preview.redd.it/2arz4jm4de981.png?width=1113&amp;format=png&amp;auto=webp&amp;s=076b79b3d606290c6c40576c7e110dedb1f036b7",2022-01-03 04:06:40
thesims,2022,1,Indoor Ppol?? 😳,2022-01-03 04:07:23
thesims,2022,1,I Place ONE Bunk Bed In World BUT Household Inventory Still Shows TWO 😳 (EA LOGIC 🙄),2022-01-03 04:11:24
thesims,2022,1,(( XBOX )) Watch The Progress Bar,2022-01-03 04:13:48
thesims,2022,1,Why Do All These Screenshots Look SO DIFFERENT (They Are Of THE SAME FAMILY - Taken TODAY,2022-01-03 04:15:39
thesims,2022,1,As is Moveobjects BUT CONVENTIONAL WISDOM &amp; COMMON SENSE Says I Should Be Able To Place This In World EVEN ATOP A Penthouse,2022-01-03 04:17:39
thesims,2022,1,My sim was on a date when Agatha Crumplebottom decided to visit 😳,2022-01-03 04:19:10
thesims,2022,1,"I guess Mila never got over her dad becoming a vampire and leaving her mom for someone else. Leo, I hope you enjoyed your human + vampire life ( and the two marriages)",2022-01-03 04:27:38
thesims,2022,1,I finally bought it guys,2022-01-03 04:32:03
thesims,2022,1,made my stardew farmer and her himbo husband in the sims!,2022-01-03 04:36:10
thesims,2022,1,I have looked everywhere and these are the only images I can find. Is there anywhere I can find the lot layout or images so I can recreate this on TS4? My absolute favourite the sims lots.,2022-01-03 05:07:11
thesims,2022,1,"before i start, i want to clarify that THIS IS NOT A POST ASKING WHAT LAPTOP I SHOULD BUY. i already know that. my question is this: i have a macbook air currently, and it's on its last legs. i'm considering getting myself a new laptop soon, most likely of the same type. assuming i do buy one, should i be concerned about my saves and cc and stuff not transferring to the new one? this might be a dumb question but i really don't care. thanks in advance!",2022-01-03 05:08:21
thesims,2022,1,Is there any South Park cc?,2022-01-03 05:40:22
thesims,2022,1,Something is telling me that her parents really love sugar free products,2022-01-03 05:54:12
thesims,2022,1,Meanwhile in the sims4,2022-01-03 05:54:45
thesims,2022,1,i compared four different popular save files! (with pictures),2022-01-03 06:19:59
thesims,2022,1,"Hi everyone,

I was hoping for some guidance on how to download Wonderful Whims. I've watched videos and tried many times but it's not working. For reference, I have never used mods before so it has never worked. I made sure that the scripts and mods were enabled on the game options screen and the files are in the mods folder, shown as package and ts4script endings, so I believe they are unzipped. I have also followed these instructions exactly: [https://wonderfulwhims.com/installation/](https://wonderfulwhims.com/installation/).  I am unsure of where I am going wrong so any help would be greatly appreciated, thanks!",2022-01-03 06:34:24
thesims,2022,1,"idk if my sim is secretly insane, she took a shower in there outerwear and changed into her formal wear",2022-01-03 08:19:27
thesims,2022,1,"As someone who made the mistake of buying the sims on a ps4 I genuinely think the laptop/computer players have a much More fun experience. Anybody who’s playing on a Consol cannot use the popular mods that the players seem to enjoy, at this point EA games should just choose the top five most popular mods and put them into the game so everyone can enjoy them because it sucks ass hearing about all these awesome mods and I can’t use any of them. I especially want to use modification that give the players more crazier stories and conversation.",2022-01-03 09:08:40
thesims,2022,1,Anything else I can do to make it look more like her? (besides removing the beauty mark),2022-01-03 09:37:23
thesims,2022,1,"I mean I want that in Sims 4 as well, but not as much as I want one in a new Sims medieval because I like Sims medieval more lol",2022-01-03 09:41:39
thesims,2022,1,Placing plants with moveobjects on,2022-01-03 10:15:08
thesims,2022,1,"Can the sims 4 and all dlc run with these specs?

**Processor: 2.5 GHz Intel Core i5**

**Memory: 4 GB 1600 MHz DDR3**

**Video card: Intel HD Graphics 4000 1536 MB**",2022-01-03 10:35:32
thesims,2022,1,"I know a lot of people don’t like TSR but I’ve used it for years and haven’t had an issue until now.

So I’ve tried submitting the same (TS4) lot about 4 times, and each time it’s been rejected for different reasons.

One time it was because I’d apparently attempted to say which packs I’d used in the build - because I listed my packs in the notes section as “packs I have installed” - something I see COUNTLESS others doing. So I just deleted that section, because again, I’ve seen countless other lots on TSR that don’t have the packs listed in the notes, and submitted again. That got rejected because I hadn’t listed the packs.

I’ve tried looking for a contact option but it all seems to direct to their crappy FAQs. I’m at the end of my tether lol. Idk if it’s because they just don’t like the lot? But if so why not just say it’s not what they’re looking for? And it’s doing okay in the Gallery so it’s clearly not hideous lol.

Anyway it’s just annoying when you’ve gone to the effort of putting a submission together for it to be rejected for dumb/unfair reasons heaped in double standards.",2022-01-03 11:55:59
thesims,2022,1,[View Poll](https://www.reddit.com/poll/rv1nay),2022-01-03 13:24:30
thesims,2022,1,Modern Conscious Mansion from FilMdSPereira on the gallery. NO CC,2022-01-03 13:37:42
thesims,2022,1,"SURVIVOR CHALLENGE PART 7 ""THE PACT""",2022-01-03 13:39:11
thesims,2022,1,"Magical Market Stall in Sims 4, without cc! Speedbuild on my youtube :D",2022-01-03 13:49:31
thesims,2022,1,"So I’ve never used mods before and I think it’s about time I change that, what are the best mods to improve my game?",2022-01-03 14:01:26
thesims,2022,1,i’m on ps4 btw,2022-01-03 14:06:12
thesims,2022,1,Hi guys I love this sims games series and wish to have some fun with you guys. So may I know which is your favourite sim game?,2022-01-03 14:21:40
thesims,2022,1,CC Creator Spotlight: Peachyfaerie,2022-01-03 15:14:24
thesims,2022,1,Small things like that make me love sims 3 so much,2022-01-03 15:31:05
thesims,2022,1,Building an Invisible House in the Sims 2!,2022-01-03 16:07:56
thesims,2022,1,Anyone has the link for this hair?,2022-01-03 16:45:11
thesims,2022,1,"New here, so here's my favourite two of my sims builds!",2022-01-03 16:45:36
thesims,2022,1,"As the title says, I would love to know if any of you knows/has any cottages they made or play with that are “abandoned”, meaning empty or just needed to be refurbished. I’d like to start a legacy playthrough in Henford-On-Bagley with a cottage like that! Let me know x",2022-01-03 17:29:53
thesims,2022,1,"this is a first, don't think i've seen random foals with there parent",2022-01-03 17:41:10
thesims,2022,1,I had a lot of time and put every bit in gen9 of my family. Never would’ve planned that story for Maya but with her husband Julian it all just played it out itself. They met two/three times when they were children and reconnected as young adults. He’s on top of the technic career and she’s an artist,2022-01-03 17:55:45
thesims,2022,1,"Hi!

I haven't purchased any expansion or game pack or anything like that in a number of months, so my sims game is getting a little dull. Looking to buy a new one. What would you say the best ones out there right now are? 

I have these for expansion packs: 
University
Seasons
Sulani
San Myshuno
Del Sol Valley 
Eco Lifestyle 
Strangerville 

I only have 1-2 game packs, honestly can't think of them all right now.

I like having new worlds to explore, particularly building houses/ businesses.",2022-01-03 18:08:00
thesims,2022,1,"Last night I wanted to take my vampire sim to the gym to workout. This particular gym had an outdoor pool but no one could use it because it was the middle of winter...

Except Makoa Kealoha. 

He of course freezes to death in the pool and drowns which then prompts everyone else in the gym to come outside and witness the tragedy. Because of this a 9 sim massacre happened as everyone froze to death. I'm talking Don Lothario, Brant Hecking, Naoki Ito, Darrel Charm. More would have died if I hadn't cheated the weather to stop the madness. Grim couldn't even keep up with it all and the game just started auto reaping souls for him. My sim was there for 10 hours sobbing his poor little undead eyes out.

This is the funniest and most spontaneous event that has ever happened to me in Sims 4.",2022-01-03 18:18:34
thesims,2022,1,I had a lot of time and put it all in gen9 of legacy challenge. Maya is finally happy with Julian - an old friend she met when she was a child and they reconnected when they were young adults! He’s on top of the tech career and she’s an artist! (Read the pics for more),2022-01-03 18:40:09
