Subreddit,Year,Month,Text,Created_utc
thesims,2021,1,at least someone appreciates sims 3 graphics,2021-01-06 08:54:02
thesims,2021,1,"A stop motion of my old favorite coffee shop/LGBTQ+ community space, Cuties, which had to close in August. **I’m unaffiliated with Cuties, but did ask for and receive permission to create this**",2021-01-06 09:04:26
thesims,2021,1,Modern Kitchen CC,2021-01-06 12:13:03
thesims,2021,1,Made a mermaid sim!,2021-01-06 12:29:14
thesims,2021,1,"""Draw Me Like One of Your French Girls"" (Sorry, I just couldn't resist when I found that I actually had this dance pole in my game. I might have acquired it years ago)",2021-01-06 12:34:02
thesims,2021,1,I built Frasier's apartment in The Sims! This was surprisingly one of the hardest builds I've done in a while. Any Frasier superfans here? :),2021-01-06 12:41:27
thesims,2021,1,How I’ve felt this past 8 months.,2021-01-06 13:06:58
thesims,2021,1,Feeling nostalgic...,2021-01-06 13:14:44
thesims,2021,1,ok but someone literally bought my sim a headstone for winterfest,2021-01-06 13:17:34
thesims,2021,1,Spending my Covid quarantine watching my fish and playing sims 3 :),2021-01-06 13:42:25
thesims,2021,1,Haven't played this family in a year.. Found an interesting painting,2021-01-06 14:38:48
thesims,2021,1,"I read that it's easy but I couldn't pull it off at all. I used 3rd level emotion surge, fought with the guy, declared him enemy, essentially performed every mean interaction possible and he still was fine and his emotion was displayed as focused even tho he did the angry walk... It's totally possible that this feature was fixed at some point of course",2021-01-06 14:45:35
thesims,2021,1,Victorian Turret Dreams (links in comments),2021-01-06 14:49:12
thesims,2021,1,"I’ve been watching some Sims machinimas and was wondering, what do others think about Mortimer and Bella? What are your theories about their relationship? Are they really in love or did Bella marry him for his money ( is it a sugar daddy sort of situation?) 

What about their personalities? Is Bella in love with the Alien guy? Why is she so fascinated by aliens? Also, why is the Goths house never so goth-like? Like be dark and gloomy. In machinimas it’s too colorful. Were Mortimer‘s parents happy people? Were Bella‘s family cheerful people? Is Bella herself happy and cheerful? 

I always felt like she’s mysterious and seductive and Mortimer‘s kinda gloomy and naiive and totally in love with her. 

Also what age are they? In the sims 3 they were both children if i remember correctly. Why is Mortimer always shown much older than her. 
I should probably clarify that i never really played the sims 3 so i don’t know if these are answered in there as in the sims 3 they are both children and grow up together. 
Also I never really play with the premade sims in any of the games. 

I’m just curious and interested to know what you guys think about these iconic characters.",2021-01-06 14:51:11
thesims,2021,1,Ooooh no they went even further!,2021-01-06 14:55:17
thesims,2021,1,This Star Wars AU is getting out of hand,2021-01-06 15:02:27
thesims,2021,1,One of my Sims weighs in on the Happy Haunts rumour,2021-01-06 15:08:55
thesims,2021,1,When your sim is prettier than you:,2021-01-06 15:21:26
thesims,2021,1,Family Cottage for gardener &amp; animal lover - more build &amp; gallery info in the comments,2021-01-06 15:22:27
thesims,2021,1,I built Troy Bolton's house from High School Musical!,2021-01-06 15:33:01
thesims,2021,1,"A series I am working on. It is called ""OFFLINE"". It always had a bit of machinima, but, in the second season, is mostly made with videos filmed in Sims 4 and 3.",2021-01-06 15:35:55
thesims,2021,1,My First CAS video on my channel (Please be gentle),2021-01-06 15:56:32
thesims,2021,1,"Hey guys! I was wondering if anyone had any mods for adding weapons in CAS. Or I guess in game. I’m looking for more medieval or fantasy so like swords, axes, shields. Lmk!",2021-01-06 16:05:13
thesims,2021,1,"I’m now off work for 6 weeks, please can someone recommend me some good sims 4 mods so I have something to occupy my time!!! Thanks!",2021-01-06 16:12:51
thesims,2021,1,2020 kind of broke my game...&amp; me. I've finally uploaded the newest episode of Broke to Bespoke after a looOoOong one-speed semester. How do you think my rags to riches challenge is going?,2021-01-06 16:15:15
thesims,2021,1,Another example of not checking the side profile. Guess the father,2021-01-06 16:19:51
thesims,2021,1,"The moderators of the subreddit literally make no sense to me. So I tried posting this funny picture of something that happened in my game and they flagged it because apparently it is a “low effort” or whatever they want to call it post. Tried asking why when I have literally posted other content with about the sims 4 with photos taken from my phone is a similar way before just like everyone else and literally nothing has happened. But now all of a sudden it’s a problem. Tried messaging them again explaining and instead of having a conversation after I tried explaining my issues they BLOCKED me from messaging them for 7 days and my post is still blocked when it didn’t even violate any rules. Who the heck is even running this page? Like seriously I want to know. I’m somewhat new to redit I’m generally so I don’t know if it’s some rando running this or if it’s EA (but I’m guessing it’s some rando). Because their so called rules for what constitutes as “low effort” are very inconstant and make no sense. Also can we just talk about the fact of labeling somebody’s post “low effort”. What kind of freaking rude rule is that?

They’ll probably delete this too like they also try to do with my other posts. Just like when I tried to talk about bullying in the sims community. I guess bullying is not important to them. But it is what it is I guess.",2021-01-06 16:36:19
thesims,2021,1,Ghost Stuff Pack?,2021-01-06 16:40:20
thesims,2021,1,"So, Santa lives with me now and sleeps in boxer shorts.",2021-01-06 16:42:03
thesims,2021,1,BACK to the CRAZY HOUSE ➡️➡️ Asylum Challenge | Episode 9,2021-01-06 16:45:15
thesims,2021,1,Cheers,2021-01-06 16:47:20
thesims,2021,1,"I don't get to wear cute outfits very often now that I rarely leave my apartment, but at least I can live vicariously through my sims!",2021-01-06 17:13:54
thesims,2021,1,"So, recently a sim in my game fell over and died on the dorm bathroom floor cause my sim's mischievous shenanigans pissed her off too much. Every sim who lives there saw it happen and I've been stuck with a bunch of annoying mopey assholes who're all pathetically depressed about the death of this random bitch nobody cared about. She and my sim disliked each other and yet he *still* got an annoying sad moodlet for it??

Are there any good mods that tweak death reactions to make them more realistic for sims who had a neutral or negative relationship to the sim who died? Tried googling but most of what I found were mods that just did stuff like add funerals and extra steps to do when a sim dies. I've already got some gameplay mods that are worsening this situation since some of them (like roBurky's meaningful stories) make emotions less fleeting and more impactful...which is usually great but in this specific situation it's annoying. I get it's probably at least a little traumatizing to watch someone keel over before your eyes regardless of relationship but they shouldn't be depressed for days because of it and I just want it to ennnnd.

I did find this: https://modthesims.info/download.php?t=615431 IT'S EXACTLY WHAT I""M LOOKING FOR but it hasn't been updated since April 2019 and people in the comments seem to be confirming it's broken.",2021-01-06 17:19:53
thesims,2021,1,(1/2) The Exterior! Fantasy Steam Punk Beach House NO CC,2021-01-06 17:27:59
thesims,2021,1,"Could anyone recommend some good CC creators for clothing and furniture?
I am getting a bit bored of the stuff on the Sims resource/ the Sims catalog and I could really do with some good furniture/clothing for my game
It can be alpha or maxis, i don’t mind (though I prefer maxis) 
Ty :)",2021-01-06 17:50:19
thesims,2021,1,I made my first ever speedbuild of a cute cottage! I really hope you like it :),2021-01-06 17:52:39
thesims,2021,1,I built this modern family home in newcrest 😁 what do you think 🧡 ?,2021-01-06 18:05:47
thesims,2021,1,"Does anybody else have this issue right now? 
It either tells me I “could not connect” or “Account needs to be linked to origin” which is obviously linked as I’ve always used it.
I’ve tried signing off and on, restart, go offline and online, repair the game, deleted local cache and flush the dns. 
Ugh, am I the only one???",2021-01-06 18:31:26
thesims,2021,1,Plumbob! I’ve been painting things from my favorite game series.,2021-01-06 18:37:18
thesims,2021,1,"Nice filter, girl",2021-01-06 18:40:41
thesims,2021,1,Does anyone else find her particularly annoying ? I used to watch her but then slowly found her impossible to watch.,2021-01-06 18:42:56
thesims,2021,1,"I tried to build a little house in a scandinavian style, without CC! What do you think about it?",2021-01-06 18:49:35
thesims,2021,1,"Still veery far from complete, but I wanted to share my first mansion build! Also if someone can please teach me how to decorate the exterior with all these fancy things like pilasters and trims",2021-01-06 18:50:15
thesims,2021,1,"A Dylan Forte appreciation post ♡ As a Console simmer that likes to create stories, creativity is key. 🤣👌🏽 First person woohoo because that's all we've got lmao #Xbox #ConsoleSimmer",2021-01-06 18:51:23
thesims,2021,1,"They put an end to whole ""your Travis-our Travis"" thing. So happy for them ♡",2021-01-06 19:06:29
thesims,2021,1,Is anyone else just appalled by this eyeliner? Like why would they add this to the game? And in the Luxury Party stuff pack of all packs! It's uneven and just overall hideous.,2021-01-06 19:12:40
thesims,2021,1,"&amp;#x200B;

https://preview.redd.it/q9g65qmmkr961.png?width=1600&amp;format=png&amp;auto=webp&amp;s=119639b2850016d58eff1455d36298d5bf118d0b",2021-01-06 19:33:00
thesims,2021,1,I'm making a cute Winx Club house in TS4,2021-01-06 19:41:16
thesims,2021,1,Like tf do I do? It's on sale for 50% of,2021-01-06 19:42:29
thesims,2021,1,"All I wanted to do was building a bunkbed, somehow I ended up here. This is fine. I guess",2021-01-06 20:07:46
thesims,2021,1,A work in progress...,2021-01-06 20:13:46
thesims,2021,1,Sims Newbies: How to Play The Sims 4 (Tutorial Walkthrough &amp; Troubleshoo...,2021-01-06 20:25:21
thesims,2021,1,Found this relic of times past whilst cleaning the attic out.,2021-01-06 20:30:03
thesims,2021,1,I forgot a fire alarm :/,2021-01-06 20:33:32
thesims,2021,1,"Does anyone had this same thing? i hadn’t played with kids/toddlers for ages and when i tried to create one in cas, i couldn’t acess the body types, only skintone options would appear. any help would be welcome!",2021-01-06 20:42:47
thesims,2021,1,"He's in the science career, is searching for the truth each night, sets the satellite to contact the Aliens, and nothing. I know it's random but he's in the early adult stage and I was hoping he'd have two Alien kiddos by now. (Though one would be great finally.)  If he gets too old, I am just gonna reset his age meter but I am really worried that it just won't happen.

Is there a cheat for it or any way to make it happen soon?

Also I am really sorry I post so much on here.",2021-01-06 20:48:58
thesims,2021,1,I am mostly curious how it showed up twice- was looking for new mods and checking it old ones were updated..,2021-01-06 21:02:01
thesims,2021,1,Over Priced Starter Home 🤑🏠 || Speed Build (No CC) ~ The Sims 4,2021-01-06 21:08:54
thesims,2021,1,British manor I'm currently working on.,2021-01-06 21:36:44
thesims,2021,1,I made the FRIENDS cast with no CC. :-) Gallery ID: meetcutesims,2021-01-06 21:51:45
thesims,2021,1,Just found these in a box in the attic... no wonder I didn’t have any pocket money between ages 9 and 13 😂,2021-01-06 21:56:54
thesims,2021,1,"After taking a break from making YouTube videos, I’m back with a brand new stop motion building video 😁 it’s a modern family home in oasis springs . I really hope you’ll like it 🤍",2021-01-06 22:15:40
thesims,2021,1,I recreated a irl home in the sims! :) check it out ~,2021-01-06 22:25:51
thesims,2021,1,This screenshot brings me an absurd amount of joy-,2021-01-06 22:59:58
thesims,2021,1,"[https://i.imgur.com/mUf4iqE.jpg](https://i.imgur.com/mUf4iqE.jpg)

I thought it was banana bread, because who gives fruitcake nowadays? Had a slice and it is definitely fruitcake. Truly feel welcomed!",2021-01-06 23:16:40
thesims,2021,1,I'm thinking of buying RoM since it's on sale right now but I have a question: do regular sims not in the magic world become spellcasters? I don't want this pack to effect my normal gameplay... in other words I dont want it to force me to play with supernatural sims all the time.,2021-01-06 23:24:58
thesims,2021,1,relax :),2021-01-06 23:32:44
thesims,2021,1,"All my male sims are starting to look the same, I think we need more facial hair options. and it would also be cool if it could go along with more hair colors and all the same stuff they did with skin tones.

What do you think?",2021-01-06 23:34:47
thesims,2021,1,Vacation Cabin in the Mountains - 1 Minute Stop Motion. Also a somewhat late holiday build for those still in the holiday spirit 😊,2021-01-06 23:41:58
thesims,2021,1,"I decided to start the 100 Baby Challenge in Dec of 2018.   While I was into it for awhile, I stopped for a good 9-10 months after my computer died and I thought I lost it all.   After getting some computer advice I fixed it and got my saved game! Over the holidays I finished it off and completed my wall of baby daddy selfies and birth certificates.   Here is a picture of all the baby daddies.  Right now I am making a 'museum' to display everything in the game for the family to visit.  Was a fun challenge for sure!

https://preview.redd.it/u5xbrqm94t961.png?width=1920&amp;format=png&amp;auto=webp&amp;s=9a809b84d4d415f1b1acc762cebe188f0c5e2a56",2021-01-07 00:00:28
thesims,2021,1,"&amp;#x200B;

https://preview.redd.it/o0qfknxg3t961.jpg?width=2161&amp;format=pjpg&amp;auto=webp&amp;s=c0f612a3d8b1c3dc29c2d9c7dd825385f0b08404

I finally started playing the Sims 3 again. I don’t remember using a genie before, but the magic food and magic house cleaning are a plus. I forgot how easy it was to keep my sims happy and how much time it seems like they had. It makes the Sims 4 seem stressful.",2021-01-07 00:43:32
thesims,2021,1,I made Cyberpunk 2077 characters in The Sims 4,2021-01-07 00:46:48
thesims,2021,1,Just a small trendy apartment build :),2021-01-07 00:51:02
thesims,2021,1,My poor townies,2021-01-07 01:31:36
thesims,2021,1,What are the best expansions to have as a new player to ts4 ? (just got it like today ) I don’t want all of them I just want the best for classic gameplay I know and love for this friendchise!,2021-01-07 02:12:16
thesims,2021,1,I thought San Myshuno could use a Cat Cafe - Le Chat Noir!,2021-01-07 02:24:43
thesims,2021,1,"&amp;#x200B;

[it's a bit all over the place but im really happy with how it turned out :\)\)\)\)](https://preview.redd.it/84s5a3tcnt961.jpg?width=411&amp;format=pjpg&amp;auto=webp&amp;s=a5d7035566bbcf7f4a8f19c57863f96f1942ef78)",2021-01-07 02:31:39
thesims,2021,1,I chose the most iconic* male and female Sim from all 4 main games for the sake of a cover and hypothetical Smash Bros representation. Do you agree with the choices or should I have chosen someone else in other places?,2021-01-07 03:05:52
thesims,2021,1,Sooo I’m trying to figure this out. This sims 3 is supposed to take place before the sims 1 and the sims 2 takes place after the sims 1 and then the sims 4 is supposed to I guess take place after the sims 2? LMAO IM UTTERLY CONFUSED. How tf is the timeline supposed to go. Because I was searching up nervous subject and he’s I think a teen in the sims 2 BUT in the sims 3 he’s a baby that was included in Midnight Hollow (lmk if I got that wrong). I really like he idea that they made it this way to overall enhance the stories of the sims but I just wanna get the timeline correctly cause it’s buggin me.,2021-01-07 04:24:10
thesims,2021,1,"I’m a Japanese major and have lived in Japan twice (soon for a third time once the c-word blows over), and it feels incredibly weird and lacking for my Japanese sims to not be able to bow at a shrine, and it almost drives me nuts (EA removing it before release still irks me). 
Has anyone made a mod that lets my sims have this option?",2021-01-07 04:50:48
thesims,2021,1,Did anybody else notice the Jojo Reference they snuck in in Snowy Escape?,2021-01-07 05:04:07
thesims,2021,1,Into the Sim-verse? I created Miles and Gwen,2021-01-07 05:20:22
thesims,2021,1,CC sims be like:,2021-01-07 05:21:00
thesims,2021,1,"Hi all, I seem to recall that I used to be able to see how old my elder sims were, by hovering over the green age bar. But it will no longer show me their age, so is there a fix for this? Or some kind of workaround so I can find out how old they are?

Many thanks in advance.",2021-01-07 05:37:27
thesims,2021,1,"Randomly when I go on community lots, sims would gather around and start booing and laughing at my sim, occasionally shouting ""WOBA BIXIE!!!"" while having a thought bubble of my sim. I'm playing on base game without any expansions, although I'll get some when they're on sale.",2021-01-07 05:40:44
thesims,2021,1,Sul sul Nooboos! (ﾉ◕ヮ◕)ﾉ*:･ﾟ✧ Something a little different for me today! ↴ Sims mobile Was looking for a game to play when I'm away from home (I play on Xbox) So I heard of Sims mobile and decided to give it a try. ♡,2021-01-07 05:43:46
thesims,2021,1,That's probably the first meme I've put some effort on,2021-01-07 05:58:26
thesims,2021,1,Is it just me?,2021-01-07 05:58:44
thesims,2021,1,The bird's eye panoramic view in Sims 3 whenever you start a new world never fails to impress me,2021-01-07 06:33:22
thesims,2021,1,I swear to god,2021-01-07 06:33:38
thesims,2021,1,"Imagine sitting down in your new home, And then looking up at THIS",2021-01-07 06:38:07
thesims,2021,1,I painted prince using the terrain editor!,2021-01-07 07:36:09
thesims,2021,1,or should we be able to have jackets separate from tops in game for CAS?? :/,2021-01-07 07:54:05
thesims,2021,1,Is there any way I can set a natural death to occur at any age stage? So basically an young adult can die  without purposely killing them.,2021-01-07 08:14:41
thesims,2021,1,"Hi,

I loved the Sims Medieval but unfortunately, it’s no longer compatible with my computer. I was wondering if there was any game similar to it? A game where we could live in a medieval time period?

Thanks so much!",2021-01-07 09:14:48
thesims,2021,1,Heres my horse holup! (using mods) (https://twitter.com/Sims_shxtposts/status/1347108888185688067),2021-01-07 09:23:52
thesims,2021,1,"Hmm, also, if i don't feed my sims, they will die",2021-01-07 10:21:38
thesims,2021,1,"Cupcake House ❤ Fully functional, cupcake house made for one of my Twitch Viewers. They redeemed channel points for this custom build 💚",2021-01-07 11:02:03
thesims,2021,1,"My sims want to CONSTANTLY cook food. There’s about 20 things to eat in the fridge but let’s make some fish tacos. Alright, I just made fish tacos, let’s make pancakes! Why won’t they stop cooking???? They’re hungry and won’t eat what they cooked but immediately make another food. 
What are your current bugs that are driving you crazy?",2021-01-07 11:12:56
thesims,2021,1,"&amp;#x200B;

https://preview.redd.it/ri10wy51aw961.png?width=1082&amp;format=png&amp;auto=webp&amp;s=b6e8d8274c52cf805dc37bce17ed83163f6e7d90",2021-01-07 11:22:44
thesims,2021,1,When I click on the stove and click cook my sim doesn't cook he just waves his hand in the air. Is there any way I can fix this?,2021-01-07 11:22:49
thesims,2021,1,"""I'll just play The Sims for an hour or two before bed, it will be relaxing...""",2021-01-07 12:23:28
thesims,2021,1,"[deleted]

[View Poll](https://www.reddit.com/poll/kscj2u)",2021-01-07 12:43:07
thesims,2021,1,"I'm having a bit of a discussion with a friend: we both use a lot of gameplay mods in the sims 4, and personally I think it's ridiculous how much I personally have to depend on them, whereas I didn't use them at all in the sims 3. She's on team ""the small packs make sense because it's a small team"", which in itself is fair enough but that doesn't excuse the lack of gameplay, especially considering the amount of money people spend on it, in my opinion.I'd love to hear what you all think, do you play with mods in the sims 3/4 and why/why not?

ps. with mods I really mean gameplay mods, so not NRAAS/MCCC, custom content etc.

[View Poll](https://www.reddit.com/poll/ksclal)",2021-01-07 12:47:15
thesims,2021,1,Title says it all. I wanna know if game has limit before ctd. If it has i'll start cleaning the folders,2021-01-07 13:31:59
thesims,2021,1,EA WHO?,2021-01-07 14:00:17
thesims,2021,1,My sim is finally a big moviestar and she recently starred in her first blockbuster film. I madeover her co-star and did a little red carpet photoshoot for the “premiere.” Might keep this dude in my game because they look kinda cute together.,2021-01-07 14:39:47
thesims,2021,1,I renovated 910 Medina Studios and turned it into this cute boho inspired studio apartment 🌿✨ | NO CC | Gallery ID: tellmeimanangel,2021-01-07 14:46:08
thesims,2021,1,This is Alph. Alph Gnomes. The Gnomes will be the only family i play for the entirity of 2021. Alph don't care. Be like Alph.,2021-01-07 14:57:39
thesims,2021,1,"So, I just bought The Sims 4 for five bucks, and I'm having a blast. Yesterday, I bought a Build Your Bundle, and I want to get another! But, I need advice. In my bundle, should I put the Seasons expansion or the University expansion? Thanks!",2021-01-07 14:58:36
thesims,2021,1,What system do you guys use? I no longer have my old laptop but have the ultimate collection on origin! Is windows 10 compatible with it? Or do I need an older windows?,2021-01-07 15:10:34
thesims,2021,1,"I build my floor plans in the sims 4 before I build them in 3. This is for a resort, how does it look?",2021-01-07 15:42:13
thesims,2021,1,"After having built some houses he tried gameplay. 
He thought it was so much harder to keep them alive haha. Later in the day we get ready to go to sleep and he asks me nervously: do I need to go back and feed my Sims? Will they die when I'm not there? 
He thought playing Sims was the same as having a Tamagotchi haha. He's soo cute",2021-01-07 15:53:04
thesims,2021,1,"Seasons has a wedding decoration that covers all of then and it makes me happy. Found then while decorating for ""halloween"" and now I'm gonna use it in my wedding venues.",2021-01-07 16:06:21
thesims,2021,1,"Heads-up that EA has no way to refund Sims 3 Store SimPoints if something goes wrong, so keep a close eye on your SimPoints balance if you get an error message when trying to make a purchase. (Chat transcript in comments for easier reading)",2021-01-07 16:18:17
thesims,2021,1,"Yeah, I know it has been said before, but the snowy escape patch supposedly fixed the townies' weird clothing choices, but it didn't do much, and my townies still look horrendous.

And I have way more problems with the way townies look in general. not just clothing.

First of all, why the darkest skin tone with the brightest shade of hair? Now I know that [people have pulled this off in real life](https://www.essence.com/wp-content/uploads/2018/04/1524081093/DE81FCF3-7D27-4000-9084-0077B6357FC0.jpeg), and I would pretend it's dyed, But the eyebrows are blonde too usually, and for dark skinned people, it's usually not the natural hair color. [See an Example.](https://cdn.discordapp.com/attachments/754076292982374400/796772885292122132/01-02-21_10-22-12_PM.png)

And another thing, most townies tend to have the coolest skin tone with blonde hair, they look like a [zombie vampire with jaundice](https://cdn.discordapp.com/attachments/754076292982374400/796773755833024522/01-03-21_6-47-32_PM.png) from the deepest depths of the dollar store clearance section. And sometimes they just look [downright ugly.](https://cdn.discordapp.com/attachments/754076292982374400/796775038606770236/unknown.png)

^(PEAR SHAPED BODIES!!)

Now I'm all for body positivity and whatnot, and I knw that not everyone is pretty, but the way randomly generated sims are built is just [cartoonishly exaggerated](https://cdn.discordapp.com/attachments/754076292982374400/796776670744018954/unknown.png) to the point where I know I could never see someone that looks this horrendous IRL just walking down the street.

That's My Rant, Boys and Girls!!",2021-01-07 16:28:22
thesims,2021,1,Bye bye Sims 4,2021-01-07 16:35:29
thesims,2021,1,I built a cozy caravan in Sulani and gallery doesn't show how cute it is,2021-01-07 16:45:43
thesims,2021,1,(2/2) The Interior! Fantasy Steam Punk Beach House NO CC,2021-01-07 16:48:17
thesims,2021,1,I know some people think you need PC to make a machinima series but it actually is possible if you play on Xbox. Idk what u need to do for PS4 tbh. Using the console's game capture system I'm able to record scenes. If they need to be in an area that's not available in the game I build a set in a different lot.,2021-01-07 17:01:48
thesims,2021,1,I’ve been at work a lot in the pandemic so I added my uniform.,2021-01-07 17:55:24
thesims,2021,1,A tiny home and a micro home (recently started playing),2021-01-07 18:24:11
