Subreddit,Year,Month,Text,Created_utc
thesims,2020,1,"Greetings, everyone! New month, new thread.

To help keep these sort of preference/advice seeking posts to a minimum and facilitate better discussion, let's keep questions and comments about which EP, GP, SP, DLC, PC or Laptop here in one place.

Threads asking this question outside of this post will be removed (see rule 8!)

Happy simming, happy window-shopping, and happy upgrading!",2020-01-01 00:05:21
thesims,2020,1,Should I be concerned?,2020-01-01 00:06:35
thesims,2020,1,The last build I did in 2019! Happy New Year!,2020-01-01 00:06:48
thesims,2020,1,My legacy challenge family it's quite a crazy bunch.,2020-01-01 00:12:15
thesims,2020,1,i’m having a hard time choosing between these 2 expansion packs.. which is worth the money (adding more to the game &amp; gameplay) ? ah!!,2020-01-01 00:15:19
thesims,2020,1,Joseph's infamous primping,2020-01-01 00:17:51
thesims,2020,1,I dunno about you guys but I'm not exactly where I want to be in my life atm. But this sub and the feedback from you all feels good even on the worst days. So happy New Years. I appreciate all of you ❤️,2020-01-01 00:19:23
thesims,2020,1,Can anyone tell me who this guy on the suitcase is?,2020-01-01 00:32:35
thesims,2020,1,"I posted before about how cute my toddler was, normally Sims will be cute and turn into some sort of monster by there teens 😂 but I've finally won. My sim has remained cute 🙌🏻😂",2020-01-01 00:42:16
thesims,2020,1,There are--LITERALLY--two banner ads on either side of this,2020-01-01 00:43:28
thesims,2020,1,Randomized sims at it again,2020-01-01 00:46:22
thesims,2020,1,"Which expansion pack should I get next? Get Famous or Discover University...

And why?",2020-01-01 00:59:32
thesims,2020,1,Finally... I have them all!!,2020-01-01 01:05:43
thesims,2020,1,Starting 2020 with an open mind,2020-01-01 01:20:30
thesims,2020,1,"I had the repairman come and fix the tv. When he left, it was slightly askew until I had my sim use the interaction ""push tv back."" Such a cute little detail!",2020-01-01 01:26:22
thesims,2020,1,Apparently my female sim likes to pee standing up??🤔,2020-01-01 01:30:52
thesims,2020,1,"I've only ever built modern-style houses but wanted to branch out of my comfort zone a bit and attempt a cottage build ('attempt' because there are still many elements typical to modern housing). I usually forget to take pictures of my builds but luckily this one was incidentally captured in BB (the angle is an added bonus) - I think most can resonate with that.

You'll notice some fencing is invisible in some areas because my game was glitching - admittedly after numerous experimentation with the foundations - but I thought I'd share this anyway as an accomplishment for the year.

https://preview.redd.it/k2sj53hon2841.png?width=1366&amp;format=png&amp;auto=webp&amp;s=bf1ff39c7e2eef2a213e8f81b367b63848db8da7",2020-01-01 01:54:05
thesims,2020,1,"I was given the Sims: Complete Collection CD-ROM set for Christmas and have been having trouble launching the game on PC. I was able to install it with no problem, but when I attempt to launch, I get the pop up “administrative privileges required” despite using it on the admin account in the PC. It’s a newer computer (an HP, bought in 2015). If anyone has any tips on how to get it to work, I’d really appreciate it!!",2020-01-01 01:56:40
thesims,2020,1,I’ve been watched Clare Siobhan’s Rags to Riches and I really want to do something similar in my game. I love the country/rustic vibe cc she uses but I don’t know where to find them. Does anyone know where I can find hers or something similar to those types of vibes?,2020-01-01 01:57:41
thesims,2020,1,"I set a ""hobby goal"" for myself last year to get better at building in the Sims 4. Getting a Maxis fave is on my bucket list!",2020-01-01 01:59:36
thesims,2020,1,"So I’ve been playing university these past few days and have been enjoying it. I have a Bratz inspired playthrough of it and the first them the girls all got D’s/D+’s/D-‘s and I thought it was just being realistic how the first term of university isn’t the best. Now the second term I’m on top of everything with the girls making sure they do their homework, term papers, and presentations, all of this much more than I had in the first term. They literally pulled all dayers and all nighters for their term papers and presentations and for their homework. 

Tell me why they all got straight F’s in all their classes!!! This makes no sense to me. I’ve read past posts that living on campus makes them later to class but that’s so dumb especially if their homework is finished. So now they’re all suspended.

I’m honestly really pissed off lol and am kinda turned off from University even though I enjoyed the aspect of it.",2020-01-01 02:10:02
thesims,2020,1,"did anyone already play it? i'm curious and some npc prince would fit soooo well for my plot, but i want to ask first if anyone has anything to say about it. is it good? is it worth installing? i'm talking about llazyneiph's mod.",2020-01-01 02:31:59
thesims,2020,1,My builds compared to all the gorgeous builds I've seen today,2020-01-01 02:35:47
thesims,2020,1,"Happy New Year, simmers!!",2020-01-01 02:41:25
thesims,2020,1,"Assistance required! 

I've got a sim who has an eyebrow piercing, but it's only available as an option in the ""everyday"" category. I can't get the game to see them in the other categories, which seems daft as irl someone with an eyebrow piercing would probably wear it all the time... 

(I'm playing on Xbox One.)",2020-01-01 02:42:24
thesims,2020,1,I want that UI for the sims complete collection,2020-01-01 02:45:16
thesims,2020,1,Let's Play Sims 4 University. This video captures my reaction to seeing the class schedule for the first time...😱,2020-01-01 03:01:45
thesims,2020,1,"So, I created a Sim and started a family with Caleb. A few days of gaming later we had two vampire children.
(My created character already died, Caleb is still alive and I intend to keep him).

One of them is not a vampire anymore and has become a master spellcaster. Also reached top of mechanical engineering career (went to college) and quit, changing to cientist. He had a child, that is now a (human) teen.

The other child of my first couple is still a vampire, finished Drama School and is now an Actress.

I really wish I could continue the family - because I never had a really long lineage and wanted to do this for once -, but I'm out of ideas.

I have all the expansions packages and am willing to download mods. Also, the family has A LOT of money, so not a problem to start a low-paying job or not having a job.


Anyone has any ideas? Any history I could follow?
Thanks!!",2020-01-01 03:23:53
thesims,2020,1,"Okay so if I learnt to code, I'd love to bring this mod to life, because it seems like I can't find one anywhere. If anyone can suggest one, I'd be so thrilled.

I've got the Sacrifical Mod regard tradegy but it really isn't anything great, like even on the slowest setting, sims are dying left right and centre to some random murderer and it's doing my nut in.

But is there a mod out there that actually implements the random chance of contracting an illness that can actually end a Sims life? 

I have MC but don't want to do it out of my own choice, I'd love to be minding my own business and suddenly - Sim has a life threatening illness and that's it, a week or two go by and then they die. Or maybe something Chronic that affects them everyday, or something even less serious that affects their energy so it really feels like they're ill.

I've seen mods for mental health issues too but they're not great.

If anyone has any ideas or suggestions please fire away!",2020-01-01 03:37:44
thesims,2020,1,I made a florist alien who lives inside of a (disguised) flower shed!,2020-01-01 03:38:25
thesims,2020,1,Three teenagers,2020-01-01 03:59:37
thesims,2020,1,Birthday Proposal (She said yes 🖤),2020-01-01 04:26:29
thesims,2020,1,Come celebrate the New Year with me in my year 2020 Sims 3 New Years Livestream in Chardon Ohio! :),2020-01-01 04:37:06
thesims,2020,1,"Welcome to my Little Brick Loft, in the woods of Brindleton Bay! My painter, Aspen, resides here :)",2020-01-01 04:57:41
thesims,2020,1,No wonder the wait time is so long. Better pour two cups.,2020-01-01 04:58:14
thesims,2020,1,And I'm playing the sims still... Lol,2020-01-01 05:02:50
thesims,2020,1,"So I have The sims 4 installed on my game drive (G:) and I go from This Pc&gt; Newvolume (G:)&gt; Program files(x86)&gt; Origin Games&gt; The Sims 4&gt; , where do I go next to install mods?",2020-01-01 05:20:07
thesims,2020,1,"happy new year, friends",2020-01-01 05:49:19
thesims,2020,1,my game glitched....I’m scared,2020-01-01 06:11:07
thesims,2020,1,"They're not as fancy as some of the others, but these are my 4 favorite builds of 2019!",2020-01-01 07:19:41
thesims,2020,1,"My town is coming along. Some buildings are done, most are shells. I'm already getting overly anxious to play.",2020-01-01 07:51:23
thesims,2020,1,"I have to manually enroll kids/teens into school, and the game thinks of it as a career. I cannot have after school activities for kids and homework does not appear in their inventory. I'm not sure if this is a mod or an update, what should I do?",2020-01-01 07:53:32
thesims,2020,1,so i can take acting elective... as additon for my drama program? interesting...,2020-01-01 08:06:33
thesims,2020,1,he got LEGS,2020-01-01 09:00:48
thesims,2020,1,"I have been a huge fan of the sims games, including the old console versions, so I downloaded a house which is built like the house you first start out in the sims 2 for the ps2. 

While playing the sims 4 just to have some nostalgia and it was amazing, I miss the older games the little details were so amazing.",2020-01-01 09:55:19
thesims,2020,1,My Sims No-CC lookbook. Please judge my style (or lack of them).,2020-01-01 10:15:53
thesims,2020,1,I used to be an Alpha user but now I've completely fallen in love with MM so these are three of my first creations using them. Introducing the Berry Boys.,2020-01-01 10:51:05
thesims,2020,1,I built an apartment complex in San Myshuno and this is one of the furnished apartments (no cc) 🌇,2020-01-01 10:54:32
thesims,2020,1,None of us is going to hell!,2020-01-01 11:07:03
thesims,2020,1,Child are you doing fine?,2020-01-01 12:23:34
thesims,2020,1,Please tell me I'm not the only one that didn't know about the 5th cheat?! All this time I've been doing it the long way :'(,2020-01-01 12:40:06
thesims,2020,1,"I tell an adult to feed kid, adult stands there, cancels command. Input command, sim stands there does nothing. So frustrating. This is in sims 4",2020-01-01 12:46:34
thesims,2020,1,"Example - i can cook pancakes or peanut butter jelly , without fruit ingredient and many other dishes. I checked my inventory and fridge there is no fruit or any required ingredient to cook the food. I can cook anything as long as i know the recipe. 

How does ingredients work ?.


EDIT : Answered, so you automatically buy ingredients before cooking at home, i feel like this is a boring way to cook, what do you guys think about cooking in sims 3 ?",2020-01-01 12:54:49
thesims,2020,1,"I do love looking at sim content but recently I uninstall sims 3 from my computer. I also uninstall sims 4 a long time ago. What's been bugging me is how EA design these games and literally could improve both games but don't bother! I see online constantly people are blaming developers solely you can't entirely blame them. EA higher ups have the say on what they do with the games. Just witnessing how sims 4 is going downhill all through 2019. Made me think about the sims 3 and realize sims 3 major setbacks. Realizing all these issues I can't seem to enjoy playing the sims anymore.

I'm so bored with sims 4 so I don't bother. Literally yesterday I try to start up a family legacy challenge again in sims 3. But I eventually felt ""why bother the family tree always gets mess up and over time family members don't know each other"" (a big issue I have with sims 3). I just left the game and then eventually decided since I'm not enjoying sims 3 I should uninstall and plus my computer is now faster. Also, I watch a video of a youtuber talking about EA ruining their game series. They mention the sims at one point. I realize EA is the biggest problem right now with the series. I don't want to even bother getting upset about the issues anymore. Hell I don't want to spend my money on the sims anymore.

Recently I bought a ton of new games from different developers (all were on sale) and I realize. Simmers who are upset with how the sims is should just stop playing and buy new games off steam instead and enjoy those games.  I was just wondering are there any other people feel the same way about EA? and they don't want to bother buying sims 5 either? Personally I think I still to watching content about the sims but no more investing my time or money into the sims series.",2020-01-01 13:16:17
thesims,2020,1,I Love The Way My Newcrest Campus Looks In Winter! Happy new year!,2020-01-01 13:55:21
thesims,2020,1,Hey guys I'm starting a series for sims 3 console version since the console version always gets swept under the rug. I know every sim game is better on the PC but I dont want people to be discouraged for the ones who only have consoles. This game is still alot of fun and better then sims 4.,2020-01-01 14:12:11
thesims,2020,1,Here is part 2 of my series for the sims 3 its so much fun I'll upload 2 parts every wednesday a huge sims fans,2020-01-01 14:23:28
thesims,2020,1,I think she knows something,2020-01-01 15:05:29
thesims,2020,1,"Please help: I'm trying to build a roof on a diagonal corner, but the roof is visible on the inside. Is there a way to prevent this?",2020-01-01 15:05:31
thesims,2020,1,What the hell are you doin?,2020-01-01 15:15:21
thesims,2020,1,"I think I'm a CAS addict... Spending my holidays recreating celebrities in Sims 4 ( Saoirse Ronan, Michelle Dockery, Jessica Chastain, Sophie Turner)",2020-01-01 15:16:47
thesims,2020,1,"Mm yum, floating sink caprese salad my favourite 🤔😂",2020-01-01 15:17:26
thesims,2020,1,The many reactions to watching there mother die. And the one on the far left is definitely checking out Grim 🤦🏻‍♀️😂,2020-01-01 15:25:30
thesims,2020,1,So in nov 2019 maxis livestream they mentioned you can change the size of the bar at the bottom of the screen where the size portraits are. Anyone know if that is possible on console as well?,2020-01-01 15:41:30
thesims,2020,1,Starting off this year by practicing making sims. Here’s 8 male townies I created !,2020-01-01 15:52:37
thesims,2020,1,Fyres Sisters (Wasn't Sure About Short Hair for Morgan But Here We Are),2020-01-01 15:55:01
thesims,2020,1,"Current WIP - Old, cozy, wood-heavy den area for a grandparents' house in Brindleton Bay",2020-01-01 15:57:14
thesims,2020,1,"Dramatic asshole comes into my vet clinic, gets her pet's treatment, then dies before paying.",2020-01-01 16:04:26
thesims,2020,1,"I visualized a few of my biggest wishes for The Sims 4 in 2020! What are yours? 'Shabby Chicken Coop' No-CC Room, Origin ID: SatiSim",2020-01-01 16:08:42
thesims,2020,1,My Friend Just Uploaded Their First Speed Build!,2020-01-01 16:31:40
thesims,2020,1,"10 Bedroom Starter Trailer/Caravan Speed Build &lt; $20,000",2020-01-01 17:01:08
thesims,2020,1,A beautiful family home with a magnificent backyard! No cc and available on the gallery. Happy new year ✨,2020-01-01 17:02:22
thesims,2020,1,"Can anyone recommend some mods that might make the sims 4 feel more like the sims 2? I really liked the little mundane parts of the sims 2 like grocery shopping and buying clothes. The personality traits seemed to matter (I feel like I can make a mean sim in the sims 4 but they act the same as my other sims). 
The interactions sims had were cute too, kids would run to show their parents their report cards. And the automatic memories were so fun to look through! 

Any help would be greatly appreciated, also I’m new to reddit so sorry if I’m posting in the wrong place or something.",2020-01-01 17:06:16
thesims,2020,1,Sage of Untamed Magic Themed Bedroom,2020-01-01 17:15:11
thesims,2020,1,"I need some advice or direction as to where to find more witchy clothes for my mages. 

Perhaps someone on here knows of a site or blog that has categorized finds that would suit the ROM kind of vibe?

But I’m actually looking for anything witch/ wizard related or witchy looking that could pass as casual wear for any sim as well.",2020-01-01 17:17:19
thesims,2020,1,Since I started playing again and got the new version of MCCC I seem to not be able to see notifications of when other townies get married or get pregnant or die. The only notifications I seem to get are of pet adoptions. Does anyone know what I have to do to set those notifications back on?,2020-01-01 17:19:36
thesims,2020,1,wE tHiNk yOu'Ll eNjOy tHiS pAcK. Umm...no thank you,2020-01-01 17:19:39
thesims,2020,1,"Happy New Year everyone! Here’s a hair to start off the year!

You can go to my [Tumblr](https://bit.ly/2Qg56JQ) to learn more, or you can download it here: [https://simfileshare.net/download/1538772/](https://simfileshare.net/download/1538772/)

https://preview.redd.it/peq77gcdc7841.png?width=1000&amp;format=png&amp;auto=webp&amp;s=faaed72b6ceeae0f59c314cd42a52666f0e3de40",2020-01-01 17:28:18
thesims,2020,1,"My sim &amp; her man just bought a new house for their expanding family..when he got beaten to death by some bullies on New Years morning, she's really sad about it :(",2020-01-01 17:51:44
thesims,2020,1,"{SIMS 3}
My sim (business lvl9) has met all her coworkers, all of them are old/best friends, i still invite the old friends sometimes to my house, always pick the ""chat at water cooler"" status while working, but the relationship with them under my career tab is still listed as bad. Help?",2020-01-01 18:01:51
thesims,2020,1,"First build of 2020, a large family home. Not sure how I feel about it. Link to speed build video in comments if anyone is interested :D Can't wait to see all your builds this year. HAPPY NEW YEAR SIMMERS",2020-01-01 18:12:41
thesims,2020,1,2020 be like wine and the sims4,2020-01-01 18:37:07
thesims,2020,1,Anyone know how to fix this? It’s not showing I did the objective even though I did,2020-01-01 18:52:47
thesims,2020,1,How did this even happen!?,2020-01-01 19:02:58
thesims,2020,1,The story of how my sim and his alien wife became parents,2020-01-01 19:04:56
thesims,2020,1,"I've noticed that every time I play The Sims 4, I choose same aspiration, same job and very often same world to play in. So I came up with an idea to create an Android app (sorry, I have no money to develop iOS app) in which I could randomly choose aspiration, job, degree and world for gameplay. There would be possibility to choose owned packs and based on that the app would randomize what you want. I would also make randomizing based on sim's age. So I wonder if anyone is interested in that kind of an app? And if you are, feel free to suggest what else you want to see in the app :)",2020-01-01 19:08:05
thesims,2020,1,"Just as the title says, I've seen a lot of things suggested for new updates but haven't seen a daycare be a suggestion, I'm sure it's came up at one point in time.  

I currently play on PS4 so as I'm sure there maybe a mod for this as well I don't have access to it. With the toddler dlc adding the ball bit and the doll tree house I felt my home wasn't doing it justice and made my own Daycare. However it's kinda lacking in the actual child/toddlers as there is no option (not ability) for a recreational area or child hangout, the playground option requires things I didn't want to put on my lot. 

With the Daycare we can could actually finally see where our children go when the adults leave and also get a new playable work force.",2020-01-01 19:12:42
thesims,2020,1,Me playing The Sims,2020-01-01 19:13:35
thesims,2020,1,"Hum, well...",2020-01-01 19:14:06
thesims,2020,1,"How do you make an apartment complex?
With the idea that different households live in each apartment. Like the dorms. Idk how to build that.",2020-01-01 19:25:13
thesims,2020,1,"Shipping these two might've been one of the weirdest things I've done, but I don't regret it",2020-01-01 19:25:59
thesims,2020,1,Currently all game and expansion packs are 25-50% off on Origin.,2020-01-01 19:28:58
thesims,2020,1,"Hello friends! So I have a Macbook running on Catalina, so I can't play Sims 3. I was planning on waiting for EA to release the 64-bit which is compatible with the system, but I might bootcamp my computer instead. Question is, if I download the 64-bit, will I still be able to use the nraas mods I have? And what about custom worlds? I don't want to play without that stuff so if that's an issue I'll bootcamp it instead. What do you guys think?",2020-01-01 19:46:30
thesims,2020,1,My sim had accidental twin babies with Father Winter. This is one of them (Raven) and I think she is so cute!,2020-01-01 19:51:30
thesims,2020,1,"My sister is an avid player and I just noticed ""Walking on Sunshine"" was playing except it was in simlish!! I had a good laugh.

&amp;#x200B;

Has any artist commented on having their song on the game? How do they get the rights to do that??",2020-01-01 19:59:50
thesims,2020,1,My sims brother and sister Adelynn and Dakota (the latter I've shown before on here) shes y/a and he's a teen,2020-01-01 20:02:16
thesims,2020,1,"So I got suspended from university and I dont know how it happened - I took three classes, 2 core and 1 elective. I went to every class, completed the homework, did the presentation, term paper, and final exam, and even played as part of the soccer team every night (to keep my scholarship). I got an F and was suspended.

What did I do wrong???",2020-01-01 20:02:18
thesims,2020,1,"My sims, twins Jayme and Owen both teens",2020-01-01 20:05:24
thesims,2020,1,"The drawing of a Plumbob, took me an hour.",2020-01-01 20:05:59
thesims,2020,1,100 Baby Challenge quirks: the doctor is also the father,2020-01-01 20:14:08
thesims,2020,1,TF is wrong with there baby?!?,2020-01-01 20:26:01
thesims,2020,1,I'm proud of this stylish bedroom I made for my sims teen daughter.,2020-01-01 20:32:02
thesims,2020,1,[Sims 4] Does anyone know how to fix this glitch?,2020-01-01 20:41:00
thesims,2020,1,sulani 😍,2020-01-01 20:51:42
thesims,2020,1,I’m trying to have a save where I do everything and the list doesn’t seem to have gotten longer.,2020-01-01 20:52:08
thesims,2020,1,Happy New Year,2020-01-01 20:57:52
thesims,2020,1,Caption this,2020-01-01 21:02:26
thesims,2020,1,Hey guys I am wondering if it is possible to completely start a fresh world the way it was when you Frist started playing without losing my current world data,2020-01-01 21:08:05
thesims,2020,1,"Hello,

I just have the base game and I'm getting bored. I can't buy the expansions, they are too expensive.

There's some mod or tips to make things fun again?",2020-01-01 21:11:30
thesims,2020,1,Thought it also belonged here,2020-01-01 21:14:26
thesims,2020,1,"Made a cozy little house for my boyfriend! Not the most detailed build, but probably one of my favorites",2020-01-01 21:24:11
thesims,2020,1,Can I get this in Plumbob?,2020-01-01 21:37:16
thesims,2020,1,Just found my old laptop with the sims 2 and all expansions!,2020-01-01 21:42:03
thesims,2020,1,I haven’t played with vampires in a while so I thought I’d make a girlfriend for Caleb,2020-01-01 21:51:39
thesims,2020,1,"This random dude came in and just started to mop my grass...?

https://preview.redd.it/xgctrn6kn8841.png?width=1366&amp;format=png&amp;auto=webp&amp;s=520776d13be32bfba2185fc52c2d05d578f6e274",2020-01-01 21:54:10
thesims,2020,1,"So my sim graduated university with a psychology degree (with honors). She has the academic aspiration, and the last thing she needs to do to achieve it is to join a career using her degree. Psychology degrees go towards the education career, so she became a teacher (which is level 3... shouldn’t she be higher with a college degree?). It did not complete her aspiration as if becoming a teacher with the psych degree doesn’t count. Am I doing something wrong? I really didn’t want to cheat it but if I have to i guess i will.",2020-01-01 21:56:20
thesims,2020,1,"I got a new Windows 10 computer, and you'd think better technology would be able to play older games. SIKE! It's stuck to this 800x600 resolution, and crashes every now and them. I've tried installing the 4GB Patch. I've tried going to the files and changing the resolution that way. It's worked for a little while, and then some random items will get flashy and purple, and then it started crashing. I tried repairing the game through Origin, but all it did was get me back to square one with the crappy resolution. 

I've tried everything I could. What is something else I could try?",2020-01-01 22:04:15
thesims,2020,1,j needs to chill,2020-01-01 22:04:31
thesims,2020,1,well...,2020-01-01 22:08:25
thesims,2020,1,"Not sure why it’s taken me years to do this but I decided to start a few save, playing exclusively as the premades. It’s a lot of rotation and a LOT of plastic surgery was required (there’s no way in HELL I’m playing as Nina Caliente looking like that) and it’s surprisingly fun?

Naturally, Katrina is pregnant already and I’m currently plotting the downfall of the Pancakes’ marriage while Izzy Fabulous has spent three nights in a row at the gay bar. Icons only.",2020-01-01 22:11:38
thesims,2020,1,Anyone knew about those glasses and knows how to get them ?,2020-01-01 22:22:19
thesims,2020,1,One of my favorite builds from 2019- Crumplebottom Orphanage,2020-01-01 22:38:28
thesims,2020,1,Cute little Writers Cottage I built this last year.,2020-01-01 22:43:22
