Subreddit,Year,Month,Text,Created_utc
thesims,2020,1,"Doesn't seem to matter what time a class is actually scheduled for because I can't even send my sim to class until hours later. My sim's first class was supposed to start at 1:30pm but I didn't get the option to go to class until 7pm. Happens with every class, my sim won't go until hours after it's supposed to have started.

Anyone else having this issue?",2020-01-06 00:50:55
thesims,2020,1,"""Starting a new game in Sims 4"" starter pack",2020-01-06 01:03:02
thesims,2020,1,So many different moods being expressed in this scene,2020-01-06 01:08:07
thesims,2020,1,"Whenever I try to download it and put it in my game it doesn’t work it shows up in game but doesn’t let me do anything? 😢

Anyone know why it’s not working? Maybe I’m downloading it wrong idk 😫

Help would be appreciated 😂😫",2020-01-06 01:19:54
thesims,2020,1,Need to catch a morning jog but want to finish your yogurt? Just do both!,2020-01-06 01:20:12
thesims,2020,1,When your Sim starts looking a little bit too familiar !,2020-01-06 01:35:11
thesims,2020,1,"First time playing, forgot to turn off auto aging while playing as tutorial sim, and this happened",2020-01-06 01:38:24
thesims,2020,1,Every single time,2020-01-06 01:38:42
thesims,2020,1,"Wanted to share some sims inspired by Animal Crossing villagers! Here's Monique, Ed, Sven, and Spike",2020-01-06 01:43:43
thesims,2020,1,She could have at least tried to look less guilty.,2020-01-06 01:53:14
thesims,2020,1,Ever since I discovered CC I've been SO obsessed. My sims had the most beautiful daughter and I just LOVE my creation with her!,2020-01-06 02:01:57
thesims,2020,1,Sims 4 Mods,2020-01-06 02:08:59
thesims,2020,1,"Texas Suburban House base game, Laundry Day, Holiday pack, and Grim's Guitar only",2020-01-06 02:12:39
thesims,2020,1,Came to the Salty Paws Saloon to propose to my girlfriend. Instead found Mortimer Goth dancing for sick stray cats all by himself,2020-01-06 02:25:56
thesims,2020,1,"My new Sim, Graham! Graham runs a restaurant. Today's special is a mac-and-cheese burger that costs $30. Graham also has opinions about craft beer.",2020-01-06 03:37:03
thesims,2020,1,"Hello everyone. 
I'm hoping someone can help me find some poses for a family of mine. The family consists of 2 adults, 4 toddlers and a small dog. I wanna take a cute family photo, but I can't quite find any group poses that work the way I want. Thanks in advance!",2020-01-06 03:40:01
thesims,2020,1,"Officially forming an Eliza Pancakes hate club. Also, let’s complain about the townies that show up EVERYWHERE.",2020-01-06 04:05:54
thesims,2020,1,"I'm playing University and moved my sim into one of the university lots that's a house, three other Sims were there then MCCC gave me a notification they all moved to another house ? They're still hanging around right now. I tried to see if there is an option to advertise for a roommate but there isn't even a bubble for it. 

Is there a way to see who all lives in that house aside from just your sim? I don't want her to pay a ton of rent...",2020-01-06 04:07:19
thesims,2020,1,I’m playing the game normally and my cat does this very realistic thing! Lol,2020-01-06 04:34:48
thesims,2020,1,My newest sim! I'm in love with her,2020-01-06 04:39:26
thesims,2020,1,I know sims 3 has its problems.... But I've never had it duplicate each of my sims when I came back from traveling 😂,2020-01-06 05:14:03
thesims,2020,1,"Anyone having issues when you upload to gallery? I just renovated Peppers Pub and went to save and upload, but it just stays on this screen with the wheel turning...anyone help?! I don't want to lose my reno cause I'm an idiot and didn't save before 😭",2020-01-06 05:37:23
thesims,2020,1,I experienced winning the lotto for the first time since getting Seasons with my university sim (Lucky us),2020-01-06 05:48:02
thesims,2020,1,I’ve seen it in most posts but still can’t figure out what it relates to,2020-01-06 05:48:49
thesims,2020,1,The new roommate system has me inspired to play some challenges ISBI style,2020-01-06 05:52:36
thesims,2020,1,"Thanks to the Vinesauce [Meme House](https://tvtropes.org/pmwiki/pmwiki.php/WebVideo/MemeHouse) streams, I was inspired to become a Sims player. Since [Johnny Zest](https://sims.fandom.com/wiki/Johnny_Zest) doesn't exist in The Sims 3, I decided to [recreate him](https://i.imgur.com/qdeqC6h.png) to the best of my ability and give him a happy (hopefully) life. His default lifetime wish was International Super Spy, which I thought was too funny to change, so he got a job in law enforcement. Reading from the career choices that developing a relationship with your work partner is important, and since at the time I had no idea how to find/greet other Sims, Johnny became fast friends with fellow officer Felipe Marshall, a fairy. He was married already, but despite having the Good trait Johnny didn't mind, and they soon became best friends--but not before Johnny was [attacked](https://i.imgur.com/VFDdJjG.png) by [zombies](https://i.imgur.com/BGYJYcr.png), including one named Sage.

After a few in-game weeks, I made another Sim, a fairy with the Evil trait named [Cuddles Chokehold](https://i.imgur.com/H1DYYDi.png). She wanted to be a famous fortuneteller and became BFFs with a number of coworkers, including Sage, the zombie that attacked Johnny the other day, and...[Kim Marshall](https://i.imgur.com/Iqm5PzJ.png), Felipe's wife. Johnny and Kim were only acquaintances, but he'd learned enough to know that she was also Evil, while Felipe was Good. When Sage got married to one of Cuddles' friends, Li Lo, Cuddles was too happy at their happiness to break them up... so she decided to flirt with Kim instead. Cuddles and Kim were already very friendly so their romance developed quickly, and Johnny and Felipe's relationship blossomed into romance.

I had gotten better at playing the game by this point, so I took Johnny and Felipe out on their first date to the Spring Love Festival. We encountered [a clone of Cuddles](https://i.imgur.com/8s5Cx8A.png) working the kissing booth, but more importantly, Johnny and Felipe had their [first kiss](https://i.imgur.com/fe6XuVc.png)...which Kim saw. An argument ensued, but luckily Johnny's comedic skills saved the day and he and Kim somehow stayed friends. That night, Johnny got an emergency call to work...so Cuddles invited Kim over and they shared THEIR first kiss. They became a couple just as Johnny got home.

Then Johnny got abducted by aliens and became pregnant. Suffering from unexpected weight gain, he asked Felipe out on a date, and after a long, romantic night they became a couple as well. And then the full moon rose, and Felipe [became a zombie](https://i.imgur.com/5b3pgBm.png) (and so did the Cuddles clone). The date ended there, but Johnny was emboldened and asked him out the following day with intent to propose. I had Cuddles invite Kim to the same place with the same idea, completely forgetting the complicated dynamics I'd accidentally set up (My thought process was 'I need to keep track of my Sims, let's go to the same spot!'). Just as Johnny proposed to Felipe, Cuddles and Kim showed up. An argument between Kim and Johnny ensued, while Felipe made [a hilarious face](https://i.imgur.com/GPOkjji.png) as Cuddles and Kim made out. 

To make matters worse, the alien baby [was born](https://i.imgur.com/obenquQ.png). After some debate it was immediately sent back to its homeworld, cause really, things were a complete trainwreck by this point. Luckily, Kim perked up when Cuddles proposed to her too, and she accepted. Not wanting to waste any time, both couples had private weddings ASAP and moved into Johnny and Cuddles' house for convenience, taking along 3 pets Kim and Felipe hadn't told anyone about. The [household](https://i.imgur.com/WeuExN5.png) now consists of Johnny x Felipe and Cuddles x Kim plus the Marshalls' 2 dogs and 1 horse, and that was about where I left off for the night.

TL;DR  Two Sims worked at separate jobs with separate future romantic partners, who happened to be married to each other. Shenanigans ensued.",2020-01-06 06:16:53
thesims,2020,1,Let us not forget the best stuff pack ever to grace the sims.... Full Fart,2020-01-06 06:25:57
thesims,2020,1,I didn't know what i was missing!,2020-01-06 06:30:38
thesims,2020,1,"No matter which way my sims are dieing (old age, fire, etc) the game still shows them as alive and has them walk around. I get an urn for them so they 100% died. I've even tried killing them a second time with commands with no luck.

&amp;#x200B;

Anyone know how to fix this? It's kinda messing up my black widow save file.",2020-01-06 06:40:33
thesims,2020,1,"i5 9400F

Gtx 1060 super

ram 16

64bit windows10

&amp;#x200B;

Am i qualified to play it on the highest setting or should i just play it on the normal setting? 

&amp;#x200B;

I am talking about both sims3 and sims4.

&amp;#x200B;

Thank you in advance! &lt;3",2020-01-06 06:40:48
thesims,2020,1,Can you believe this sh!t,2020-01-06 07:10:09
thesims,2020,1,Potato quality photo but I made a pretty boy wannabe writer for University and he knew it. Work that camera.,2020-01-06 07:38:15
thesims,2020,1,"Added the Grim Reaper to my family to kill him with a Cow Plant and thanks to Slice of Life, I got this little buff... reow",2020-01-06 07:40:30
thesims,2020,1,"I have one problem with game on patch 1.67 and 1.69 - on different saves and operational systems. Really wonder if that is a bug.

Some Sims that I play (not created in CAS) that is already in game or born in my family behave themselves and have animations opposite to the traits they have.

Examples.

- Sim with Excitable trait always looks like they are grumpy mood - constantly making grumpy sounds to themselves etc.

- Sim with Brave trait behave scared when swimming in pool. Doesn't have trait ""Fear of water""

- Flirty sim was really hard to persuade on basic romantic actions. After proposed to marry I managed to exchange rings only after about week or so.

- Sim with ""Dislikes outdoor"" behaved more enthusiastic and friendly on open community lots while at home he acted like he had no mood for joint activities.

I have Awesome mod, NRaas SP (turned off), MC and couple of other small mods that doesn't alter relationships or Sims' character.

Maybe anyone from this community had similar problem? That really makes immersion worse for me.",2020-01-06 08:15:20
thesims,2020,1,"I don't mean sims studio or anything to create a mod, I mean like a mod that you can open images from file manager onto paintings, it'd take too long with sims studio, I got a bunch of textures i need to put on paintings.",2020-01-06 09:33:11
thesims,2020,1,My Sim's girlfriend watching him flirt with another woman from the outside,2020-01-06 09:46:05
thesims,2020,1,How to lose weight before High School Reunion,2020-01-06 09:50:23
thesims,2020,1,"I am rebuilding NewCrest, this house holds 3 bedrooms, one bath and open concept living/kitchen space. Check the link in comments to watch the speedbuild",2020-01-06 09:51:58
thesims,2020,1,These two seem like such a good couple,2020-01-06 10:12:35
thesims,2020,1,"I know this isn't a support page but I really need help. I've contacted support but they didn't really help at all. I tried to download Sims 4 but when it reaches 99% then goes into 100 it can't finalize. It just says VC++ Error. Then I found some youtube and tried repairing the vc but for some reason the vc 2013 keeps saying Access denided. Has anyone else had this problem? 

https://preview.redd.it/6eg59z9q35941.png?width=1366&amp;format=png&amp;auto=webp&amp;s=2296271cb986c35f98419ebb6cf87093f5ea81aa

https://preview.redd.it/2jzjjm1j35941.png?width=1366&amp;format=png&amp;auto=webp&amp;s=d2f700755a7dc459b99daa8e60563712ea2e13d4",2020-01-06 11:00:22
thesims,2020,1,"Just started embroidery, obviously the first thing I embroidered! I want this on a shirt.",2020-01-06 11:04:53
thesims,2020,1,"I recently installed Wicked Whims, so I built a strip club for my love-starved sims. 😈",2020-01-06 11:21:54
thesims,2020,1,"My sim just had triplets... I can barely cope with three sims, sorry bout the image quality",2020-01-06 11:27:53
thesims,2020,1,Me when I see a premade Sim,2020-01-06 12:11:30
thesims,2020,1,James Turner featured my build! A City in a Building,2020-01-06 12:23:05
thesims,2020,1,"So... I recently rebuilt my computer in its entirety (the only thing that stayed in were the fans and my old hard drive) and being halfway knowledgeable about things that get lost during computer changes I backed everything up.
Or so I thought.
I backed up my save files and my mods folder (to try and clean it out for a fresh run. The key word here being Try) and then went on my merry way and formatted my hard drive.
Now, after firing my game back up and everything running super nicely and smoothly I realised that I forgot to back up my tray files.
I want to strangle that version of me that thought I had everything backed up.",2020-01-06 12:30:54
thesims,2020,1,"My second build. A house with no yard, because it's hard to make them 😊",2020-01-06 12:31:40
thesims,2020,1,"Janet Goth, an MCC baby from the Goth family: she has a distinguished degree [with honors] in biology, Grim Reaper is her bestie and an awesome long-time roommate, and her pet is a ghost raccoon! Oh, and she's a vampire.",2020-01-06 12:50:07
thesims,2020,1,"So I got WW recently and been really enjoying it so far. Now I've come up with a couple of ideas for creating an NSFW visual story, but I have no idea where to post it. This Reddit doesn't seem like a good place 'cause it's mostly SFW. Tumblr is no longer open for NSFW content either. Are there any other options, apart from standalone website?

Also if you know any good NSFW sims stories creators, feel free to share them, I'd really like some inspiration ❤️",2020-01-06 12:51:54
thesims,2020,1,"Hey! My Sims game keeps glitching and going into ultra speed mode. It always happens right after my sims get the performance question (pop ups) whilst at work, but eventually stops after a while. Tonight I turned game on and it happened immediately even though they're in bed and it's the middle of the night! Every time I go back to normal speed or fast speed, ultra speed mode just kicks in! It doesn't occur when it's paused though. I can't find anything on Google, is anyone else experiencing this problem? It's only been happening for me since the most recent update. Thanks!",2020-01-06 13:07:21
thesims,2020,1,"I’m filling up a fully ready save file with a couple townies in every world.  Do you guys know any Simmers who make diverse sims? Or if you’d lend me yours that would be great.

I tried the gallery but it’s horrible. Every guy looks like they’re off a photo shoot from a high end brand and every girl is blonde, petite and with the romantic/famous star aspiration. Even every couple is ridiculously good looking, and I’m like “Where are the realistic looking sims?!”",2020-01-06 13:07:57
thesims,2020,1,Hi. I'm a Linux user and I'm wondering if The Sims 3 happens to work on Steam through Steam Play as I found playing through Origin to be a little finicky and actually lost a save file on it. Thank you.,2020-01-06 13:11:17
thesims,2020,1,"Currently €7.72 instead of €9.99

I checked the US origin as well but i see them listed at regular $9.99 -don’t know whether other European/international stores are currently offering sales.

Anyways, using a vpn set on Italy should let you purchase them at the reduced price. Not the greatest offer but stuff packs hardly ever go on sale.",2020-01-06 13:28:27
thesims,2020,1,"I'm an Idiot. I'm new to the sims, And I decided to reboot my computer. My dumbass thought that all of my saves including sims and lots would be included in the Save folder so that folder is the only thing I backed up along with my mods. And I just found out that you also needed the Tray files and I deleted it...",2020-01-06 13:47:31
thesims,2020,1,"Hey :-) I'm new here and don't really know anyone! I post most of my builds on my instagram @supremesimqueen, please feel free to check them out. Hope you like them! Happy simming 💚",2020-01-06 14:20:08
thesims,2020,1,"I made my sim get a Language and Literature degree, a normal one, from Foxbury. She graduated with an A-. I got her a job in law as it said the degree was good for being a private attorney. However, she started at level 1 of the career. What was the point of the degree?",2020-01-06 14:33:45
thesims,2020,1,"With your help, my buddy and I made a Sims podcast! Link is for iTunes but you can listen anywhere, hope you dig it!",2020-01-06 15:20:10
thesims,2020,1,Made my own version of the Powerpuff Girls (TS3),2020-01-06 15:31:16
thesims,2020,1,I built some kind of family cottage in Windenburg :),2020-01-06 15:38:06
thesims,2020,1,"This is the mansion I have been working on for a couple of days. I finally finished it. Thought I would share. Lot value is around 553,000. I used a lot building stuff from Get Famous, Moschino and Get together. It’s my first really detailed build. Opinions?",2020-01-06 15:42:03
thesims,2020,1,Gave some of the townies a quick makeover,2020-01-06 15:48:35
thesims,2020,1,Accidental mermaid-vampire Sims be like,2020-01-06 15:49:06
thesims,2020,1,"If you were the president of EA, what features would you implement on The Sims 6?",2020-01-06 16:05:15
thesims,2020,1,Draw the squad,2020-01-06 16:21:55
thesims,2020,1,The best Sim I've ever made. Bob Ross.,2020-01-06 16:24:54
thesims,2020,1,i don't like this edit but ???? I really like how this sim turned out,2020-01-06 17:16:44
thesims,2020,1,So...he's married to his step-mother and he's a step-father to his step-siblings? Getting some PH vibes here.,2020-01-06 17:21:58
thesims,2020,1,The OG Tinder,2020-01-06 17:24:44
thesims,2020,1,I got a new WiFi router and I wanted to change my network name into something sims related. So far the only thing I can think of is “The Sims WiFi Pack” but I was wondering if anyone had any good ideas for other names.,2020-01-06 17:27:37
thesims,2020,1,"Hello! Hoping I can get some insight - I’m
Thinking about buying another EP but wondering which one has the best world !? Bigger w bigger lots maybe .. I have DU - city living and get together already! TIA everyone !",2020-01-06 17:27:58
thesims,2020,1,"Hello everyone? 

I am a Sims fan since the first game, I use to play the sims 1-3 all on PC so I know about Mods and CC downloads online. But as time went by i never got a new PC or laptop and when i saw the console version come out i grab it for Xbox. Now i have bought a lot of expansion packs from the xbox store and i just recently got a new laptop to do graphic design and i saw that the sims 4 is on sale so my question to everyone is how many people on here play the sims 4 on console as i am sure mostly everyone plays it on the PC?",2020-01-06 17:29:11
thesims,2020,1,WHY IS THIS BOOSTING LUST CURTIS THAT’S YOUR CHILD,2020-01-06 17:32:09
thesims,2020,1,"I made a cemetery for my legacy sims and sims in general since they drop like flies around my sims. It's under the name ""Fledermaus Bend Cemetery"".",2020-01-06 17:38:26
thesims,2020,1,I've been really enjoying these laptop-mode safe lashes by picky pikachu. Finally I can get on the 3d lashes train!,2020-01-06 17:39:58
thesims,2020,1,I used a cheat to get my child into University just for fun and I tried to move him into the dorms. Now I’m stuck on the transfer screen and there is no way to close out of it. Help! I can’t move anyone and can’t close out of it and I didn’t save!!!,2020-01-06 17:49:00
thesims,2020,1,I recently found out the terrain tools are actually a pretty good drawing tool 👀 Still can't put a decent shadow underneath a tree though..,2020-01-06 18:04:03
thesims,2020,1,"I'll start. 100 babies challenge. I had to give up as I just lost all attachment to the babies, and I do like to actually care about the sims I play. Didn't make it further than 12 babies.",2020-01-06 18:09:02
thesims,2020,1,Thanks in advance for you help,2020-01-06 18:26:54
thesims,2020,1,"So, after not being able to play since the big update in November I’ve been at a loss. Uninstalled it and tried sims 3 but I just can’t seem to stick with it. On New Year’s Eve I reinstalled sims 4 to see if I could get it lol working. After changing something in the compatibility I’m now able to play it! Yay!!!",2020-01-06 18:28:31
thesims,2020,1,Then WHY can she?,2020-01-06 18:40:14
thesims,2020,1,So I am building a boujee kitchen in this mansion and discover my sim can still use this ottoman. She looks so cute sleeping under the table.,2020-01-06 18:44:05
thesims,2020,1,"Hello! 

Just as the title states, do you guys know any sort of software that can scan for broken/conflicting mods? My GF seems to be getting some sort of bug where her Sim won't do anything she tells it to do, so figured it might have anything to do with her mods since she has quite a few downloaded and loaded into the game.

Any suggestions/ideas?",2020-01-06 18:59:15
thesims,2020,1,"I've had this game running about 4 sim weeks and my dreams of her becoming a Floral Designer, founding a long and successful alphabet dynasty are looking shaky if she keeps setting light to things she's supposed to be repairing....",2020-01-06 19:11:23
thesims,2020,1,"Damn, Morgyn...you were supposed to teach her, not snuggle up to her while she's trying to learn",2020-01-06 19:11:55
thesims,2020,1,"&amp;#x200B;

[And everything was unlocked for some reason which was nice. How do you think I did?](https://preview.redd.it/lewno2sjk7941.png?width=1024&amp;format=png&amp;auto=webp&amp;s=5dc410ba1b8ab41d147395048d8001df07816c15)",2020-01-06 19:19:37
thesims,2020,1,"Hey everyone,

Ever since I downloaded the new patch, there’s been these annoying fast forward functions that happen around the middle of the simday. It’s usually when the needs are somewhat good and there are several sims at work/school. Basically, the game will continuously unpause itself even after I try pausing it, and will use the fast forward function.

However, it’s become not only an annoyance, but gamebreaking. I tried to get my sim to go somewhere with her new puppy during the day (she goes to work in the late afternoon, whereas the teens come home from school in the late afternoon) but the fast forwarding glitch happened right as they were about to go somewhere. This left an indefinite loading screen and I had to use control panel to exit the game without saving. 

The only mods I have are the Life Tragedies mod and the MCC Master Controller. The rest is just custom content. Please could you tell me what’s going on with this, how I might fix this, and/or if anyone else is having this issue? Thanks.",2020-01-06 19:57:59
thesims,2020,1,"Just downloaded the Slice of Life mod and within like 5 mins my sim has already done the wonderland drug twice. I can't find which part of the mod to delete to remove this interaction, does anyone else know?",2020-01-06 20:04:54
thesims,2020,1,"I can't see anyone else having this issue. I'm tearing my hair out.

I had Sims 2 installed on this computer before but, for some reason, I decided to uninstall it at some point despite knowing how much of a pain it is to set up on windows 10.

Anyway, I've tried every solution under the sun but no matter what whenever I try to launch the game it simply does not want to work. It isn't a black screen, the window just isn't showing up. I am trying to run it in windowed mode, when I was trying to run it in fullscreen before I had done resolution fixes on it it would change the resolution and the icon would pop up on the task bar.

Does anyone have any idea what the hell could be wrong with this?

EDIT: it is now opening and closing right away, it was showing up in task manager as a background process, now it is just closing immediately.",2020-01-06 20:25:58
thesims,2020,1,Hey anyone got any tips for someone that plays on console?????,2020-01-06 20:26:49
thesims,2020,1,The most appropriate outfit for a substitute teacher.,2020-01-06 20:31:37
thesims,2020,1,"I'm pretty new, any suggestions?",2020-01-06 20:40:01
thesims,2020,1,can you live in fuckin sulani and go to stop go to university,2020-01-06 20:48:32
thesims,2020,1,College life just be like that (?),2020-01-06 20:49:10
thesims,2020,1,I’m doing a black widow challenge and it’s really hard to get flirty with her next victim if she’s sad over the last man she killed,2020-01-06 20:58:08
thesims,2020,1,Look what game I found in a drawer at IKEA today!,2020-01-06 21:12:50
thesims,2020,1,It’s triggering migraines,2020-01-06 21:26:24
thesims,2020,1,sometimes the lighting in this game makes for a real chef's kiss when you're looking at a fresh build (based on old westbury gardens with a martha's vineyard twist),2020-01-06 21:34:57
